surah,ayah,arabic_text,translation,footnotes
114,1,قُلۡ أَعُوذُ بِرَبِّ ٱلنَّاسِ,"Dis : ""Je cherche protection auprès du Seigneur des hommes.",
114,2,مَلِكِ ٱلنَّاسِ,"Le Souverain des hommes,",
114,3,إِلَٰهِ ٱلنَّاسِ,"Dieu des hommes,",
114,4,مِن شَرِّ ٱلۡوَسۡوَاسِ ٱلۡخَنَّاسِ,"contre le mal du mauvais conseiller, furtif,",
114,5,ٱلَّذِي يُوَسۡوِسُ فِي صُدُورِ ٱلنَّاسِ,"qui insuffle des mauvaises pensées dans les poitrines des hommes,",
114,6,مِنَ ٱلۡجِنَّةِ وَٱلنَّاسِ,"qu’il (le conseiller) soit un djinn, ou un être humain"".",
