surah,ayah,arabic_text,translation,footnotes
104,1,وَيۡلٞ لِّكُلِّ هُمَزَةٖ لُّمَزَةٍ,"Woe to every backbiter and slanderer,",
104,2,ٱلَّذِي جَمَعَ مَالٗا وَعَدَّدَهُۥ,"who amasses wealth and counts it over and again[1],",[1] Instead of spending in the way of Allah.
104,3,يَحۡسَبُ أَنَّ مَالَهُۥٓ أَخۡلَدَهُۥ,thinking that his wealth will make him live forever.,
104,4,كَلَّاۖ لَيُنۢبَذَنَّ فِي ٱلۡحُطَمَةِ,"No indeed! He will surely be cast into the Crushing Fire[2],","[2] i.e., Hellfire, as it crushes and destroys all that is thrown in it."
104,5,وَمَآ أَدۡرَىٰكَ مَا ٱلۡحُطَمَةُ,and how do you know what the Crushing Fire is?,
104,6,نَارُ ٱللَّهِ ٱلۡمُوقَدَةُ,"It is the kindled Fire of Allah,",
104,7,ٱلَّتِي تَطَّلِعُ عَلَى ٱلۡأَفۡـِٔدَةِ,which reaches the hearts[3].,[3] Penetrating through bodies and reaching the hearts.
104,8,إِنَّهَا عَلَيۡهِم مُّؤۡصَدَةٞ,"It will be closed down upon them,",
104,9,فِي عَمَدٖ مُّمَدَّدَةِۭ,locked with towering columns[4].,"[4] i.e., columns of fire or columns of iron to which the inmates of Hell are chained."
