surah,ayah,arabic_text,translation,footnotes
114,1,قُلۡ أَعُوذُ بِرَبِّ ٱلنَّاسِ,"Say, “I seek refuge with the Lord of mankind,",
114,2,مَلِكِ ٱلنَّاسِ,"the Sovereign of mankind[1],","[1] i.e., the King of mankind."
114,3,إِلَٰهِ ٱلنَّاسِ,"the God of mankind,",
114,4,مِن شَرِّ ٱلۡوَسۡوَاسِ ٱلۡخَنَّاسِ,"from the harm of the lurking whisperer[2],",[2] Which disappears when one remembers Allah.
114,5,ٱلَّذِي يُوَسۡوِسُ فِي صُدُورِ ٱلنَّاسِ,"who whispers into the hearts of mankind,",
114,6,مِنَ ٱلۡجِنَّةِ وَٱلنَّاسِ,from among jinn and mankind[3].”,[3] Evil prompters and whisperers can be from jinn or from men.
