surah,ayah,arabic_text,translation,footnotes
26,1,طسٓمٓ,Tâ. Sîn. Mîm.,
26,2,تِلۡكَ ءَايَٰتُ ٱلۡكِتَٰبِ ٱلۡمُبِينِ,"Bunlar, apaçık Kitab’ın âyetleridir.",
26,3,لَعَلَّكَ بَٰخِعٞ نَّفۡسَكَ أَلَّا يَكُونُواْ مُؤۡمِنِينَ,(Rasûlüm!) Onlar iman etmiyorlar diye neredeyse kendine kıyacaksın!,
26,4,إِن نَّشَأۡ نُنَزِّلۡ عَلَيۡهِم مِّنَ ٱلسَّمَآءِ ءَايَةٗ فَظَلَّتۡ أَعۡنَٰقُهُمۡ لَهَا خَٰضِعِينَ,"Biz dilesek, onların üzerine gökten bir mucize indiririz de, ona boyunları eğilip kalır.",
26,5,وَمَا يَأۡتِيهِم مِّن ذِكۡرٖ مِّنَ ٱلرَّحۡمَٰنِ مُحۡدَثٍ إِلَّا كَانُواْ عَنۡهُ مُعۡرِضِينَ,"Kendilerine, Rahmân (o çok esirgeyici Allah) dan hiçbir yeni öğüt gelmez ki, ondan yüz çevirmesinler.",
26,6,فَقَدۡ كَذَّبُواْ فَسَيَأۡتِيهِمۡ أَنۢبَٰٓؤُاْ مَا كَانُواْ بِهِۦ يَسۡتَهۡزِءُونَ,"Üstelik (ona) «yalandır» derler, fakat alay edip durdukları şeylerin haberleri yakında onlara gelecektir.",
26,7,أَوَلَمۡ يَرَوۡاْ إِلَى ٱلۡأَرۡضِ كَمۡ أَنۢبَتۡنَا فِيهَا مِن كُلِّ زَوۡجٖ كَرِيمٍ,Yeryüzüne bir bakmazlar mı! Orada her güzel çiftten nice bitkiler yetiştirdik.,
26,8,إِنَّ فِي ذَٰلِكَ لَأٓيَةٗۖ وَمَا كَانَ أَكۡثَرُهُم مُّؤۡمِنِينَ,Şüphesiz bunlarda (Allah'ın kudretine) bir nişâne vardır; ama çoğu iman etmezler.,
26,9,وَإِنَّ رَبَّكَ لَهُوَ ٱلۡعَزِيزُ ٱلرَّحِيمُ,"Şüphe yok ki Rabbin, mutlak galip ve engin merhamet sahibidir.",
26,10,وَإِذۡ نَادَىٰ رَبُّكَ مُوسَىٰٓ أَنِ ٱئۡتِ ٱلۡقَوۡمَ ٱلظَّٰلِمِينَ,"Hani Rabbin Musa'ya: O zalimler güruhuna,  git diye seslenmişti.",
26,11,قَوۡمَ فِرۡعَوۡنَۚ أَلَا يَتَّقُونَ,Firavun'un kavmine. Hâlâ (başlarına gelecekten) sakınmayacaklar mı onlar?,
26,12,قَالَ رَبِّ إِنِّيٓ أَخَافُ أَن يُكَذِّبُونِ,"Musa şöyle dedi: Rabbim! Doğrusu, beni yalancılıkla suçlamalarından korkuyorum.",
26,13,وَيَضِيقُ صَدۡرِي وَلَا يَنطَلِقُ لِسَانِي فَأَرۡسِلۡ إِلَىٰ هَٰرُونَ,"""Göğsüm daralıyor; dilim çözülmüyor; onun için Harun'a da elçilik ver.",
26,14,وَلَهُمۡ عَلَيَّ ذَنۢبٞ فَأَخَافُ أَن يَقۡتُلُونِ,Onların bana isnad ettikleri bir suç da var. Bundan ötürü beni öldürmelerinden korkuyorum.,
26,15,قَالَ كَلَّاۖ فَٱذۡهَبَا بِـَٔايَٰتِنَآۖ إِنَّا مَعَكُم مُّسۡتَمِعُونَ,"Allah buyurdu: Hayır (seni asla öldüremezler)! İkiniz mucizelerimizle gidin. Şüphesiz ki, biz sizinle beraberiz, (her şeyi) işitmekteyiz.",
26,16,فَأۡتِيَا فِرۡعَوۡنَ فَقُولَآ إِنَّا رَسُولُ رَبِّ ٱلۡعَٰلَمِينَ,"Haydi Firavun’a gidip deyin ki: Gerçekten biz, âlemlerin Rabbi'nin elçisiyiz;",
26,17,أَنۡ أَرۡسِلۡ مَعَنَا بَنِيٓ إِسۡرَٰٓءِيلَ,İsrailoğullarını bizimle beraber gönder.,
26,18,قَالَ أَلَمۡ نُرَبِّكَ فِينَا وَلِيدٗا وَلَبِثۡتَ فِينَا مِنۡ عُمُرِكَ سِنِينَ,(Kendisine Allah'ın emri tebliğ edilince Firavun) dedi ki: Biz seni çocukken himayemize alıp büyütmedik mi? Hayatının birçok yıllarını aramızda geçirmedin mi?,
26,19,وَفَعَلۡتَ فَعۡلَتَكَ ٱلَّتِي فَعَلۡتَ وَأَنتَ مِنَ ٱلۡكَٰفِرِينَ,Sonunda o yaptığın (kötü) işi de yaptın. Sen nankörün birisin!,
26,20,قَالَ فَعَلۡتُهَآ إِذٗا وَأَنَا۠ مِنَ ٱلضَّآلِّينَ,"Mûsâ da demişti ki: ""Ben onu o zaman cahillerden biri olarak, bilmeyerek yapmıştım."" ",
26,21,فَفَرَرۡتُ مِنكُمۡ لَمَّا خِفۡتُكُمۡ فَوَهَبَ لِي رَبِّي حُكۡمٗا وَجَعَلَنِي مِنَ ٱلۡمُرۡسَلِينَ,Sizden korkunca da hemen aranızdan kaçtım. Sonra Rabbim bana hikmet bahşetti ve beni peygamberlerden kıldı.,
26,22,وَتِلۡكَ نِعۡمَةٞ تَمُنُّهَا عَلَيَّ أَنۡ عَبَّدتَّ بَنِيٓ إِسۡرَٰٓءِيلَ,"O nimet diye başıma kaktığın ise, (aslında) İsrailoğullarını kendine kul köle etmendir.",
26,23,قَالَ فِرۡعَوۡنُ وَمَا رَبُّ ٱلۡعَٰلَمِينَ,Firavun şöyle dedi: Alemlerin Rabbi dediğin de nedir?,
26,24,قَالَ رَبُّ ٱلسَّمَٰوَٰتِ وَٱلۡأَرۡضِ وَمَا بَيۡنَهُمَآۖ إِن كُنتُم مُّوقِنِينَ,"Musa cevap verdi: Eğer işin gerçeğini düşünüp anlayan kişiler olsanız, (itiraf edersiniz ki) O, göklerin, yerin ve ikisi arasında bulunan her şeyin Rabbidir.",
26,25,قَالَ لِمَنۡ حَوۡلَهُۥٓ أَلَا تَسۡتَمِعُونَ,(Firavun) etrafında bulunanlara: İşitiyor musunuz? dedi.,
26,26,قَالَ رَبُّكُمۡ وَرَبُّ ءَابَآئِكُمُ ٱلۡأَوَّلِينَ,"Musa dedi ki: O, sizin de Rabbiniz, daha önceki atalarınızın da Rabbidir.",
26,27,قَالَ إِنَّ رَسُولَكُمُ ٱلَّذِيٓ أُرۡسِلَ إِلَيۡكُمۡ لَمَجۡنُونٞ,"Firavun: Size gönderilen bu elçiniz mutlaka delidir, dedi.",
26,28,قَالَ رَبُّ ٱلۡمَشۡرِقِ وَٱلۡمَغۡرِبِ وَمَا بَيۡنَهُمَآۖ إِن كُنتُمۡ تَعۡقِلُونَ,"Musa devamla şunu söyledi: Şayet aklınızı kullansanız (anlarsınız ki), O, doğunun, batının ve ikisinin arasında bulunanların Rabbidir .",
26,29,قَالَ لَئِنِ ٱتَّخَذۡتَ إِلَٰهًا غَيۡرِي لَأَجۡعَلَنَّكَ مِنَ ٱلۡمَسۡجُونِينَ,"Firavun: Benden başkasını tanrı edinirsen, andolsun ki seni zindanlıklardan ederim! dedi.",
26,30,قَالَ أَوَلَوۡ جِئۡتُكَ بِشَيۡءٖ مُّبِينٖ,Musa: Sana apaçık bir şey getirmiş olsam da mı? dedi.,
26,31,قَالَ فَأۡتِ بِهِۦٓ إِن كُنتَ مِنَ ٱلصَّٰدِقِينَ,"Firavun: Doğru söyleyenlerden isen, haydi getir onu! diye karşılık verdi.",
26,32,فَأَلۡقَىٰ عَصَاهُ فَإِذَا هِيَ ثُعۡبَانٞ مُّبِينٞ,"Bunun üzerine Musa asâsını atıverdi; bir de ne görsünler, asâ apaçık koca bir yılan (oluvermiş).",
26,33,وَنَزَعَ يَدَهُۥ فَإِذَا هِيَ بَيۡضَآءُ لِلنَّٰظِرِينَ,Elini de (koynundan) çıkardı; o da seyredenlere bembeyaz görünen (nur saçan bir şey oluvermiş)!,
26,34,قَالَ لِلۡمَلَإِ حَوۡلَهُۥٓ إِنَّ هَٰذَا لَسَٰحِرٌ عَلِيمٞ,"Firavun, çevresindeki ileri gelenlere: Bu, dedi, doğrusu çok bilgili bir sihirbaz!",
26,35,يُرِيدُ أَن يُخۡرِجَكُم مِّنۡ أَرۡضِكُم بِسِحۡرِهِۦ فَمَاذَا تَأۡمُرُونَ,Sizi sihriyle yurdunuzdan çıkarmak istiyor. Şimdi ne buyurursunuz?,
26,36,قَالُوٓاْ أَرۡجِهۡ وَأَخَاهُ وَٱبۡعَثۡ فِي ٱلۡمَدَآئِنِ حَٰشِرِينَ,"Etrafındakiler de ona şöyle demişlerdi: ""Onu ve kardeşini alıkoy ve şehirlere toplayıcı görevliler gönder.",
26,37,يَأۡتُوكَ بِكُلِّ سَحَّارٍ عَلِيمٖ,Ne kadar bilgisi derin sihirbaz varsa sana getirsinler.,
26,38,فَجُمِعَ ٱلسَّحَرَةُ لِمِيقَٰتِ يَوۡمٖ مَّعۡلُومٖ,Böylece sihirbazlar belli bir günün tayin edilen vaktinde biraraya getirildi.,
26,39,وَقِيلَ لِلنَّاسِ هَلۡ أَنتُم مُّجۡتَمِعُونَ,"Halka: Siz de toplanıyor musunuz (haydi hemen toplanın), denildi. ",
26,40,لَعَلَّنَا نَتَّبِعُ ٱلسَّحَرَةَ إِن كَانُواْ هُمُ ٱلۡغَٰلِبِينَ,"(Firavunun adamları:) Eğer üstün gelirlerse, herhalde sihirbazlara uyarız, dediler.",
26,41,فَلَمَّا جَآءَ ٱلسَّحَرَةُ قَالُواْ لِفِرۡعَوۡنَ أَئِنَّ لَنَا لَأَجۡرًا إِن كُنَّا نَحۡنُ ٱلۡغَٰلِبِينَ,"Sihirbazlar geldiklerinde Firavun'a: Şayet biz üstün gelirsek, muhakkak bize bir ücret vardır değil mi? dediler.",
26,42,قَالَ نَعَمۡ وَإِنَّكُمۡ إِذٗا لَّمِنَ ٱلۡمُقَرَّبِينَ,"Firavun cevap verdi: Evet, o takdirde hiç şüphe etmeyin, gözde kimselerden de olacaksınız.",
26,43,قَالَ لَهُم مُّوسَىٰٓ أَلۡقُواْ مَآ أَنتُم مُّلۡقُونَ,Musa onlara: Ne atacaksanız atın! dedi.,
26,44,فَأَلۡقَوۡاْ حِبَالَهُمۡ وَعِصِيَّهُمۡ وَقَالُواْ بِعِزَّةِ فِرۡعَوۡنَ إِنَّا لَنَحۡنُ ٱلۡغَٰلِبُونَ,"Bunun üzerine iplerini ve değneklerini attılar ve: Firavun'un kudreti hakkı için elbette bizler galip geleceğiz, dediler.",
26,45,فَأَلۡقَىٰ مُوسَىٰ عَصَاهُ فَإِذَا هِيَ تَلۡقَفُ مَا يَأۡفِكُونَ,"Sonra Musa asâsını attı; bir de ne görsünler, onların uydurduklarını yutuveriyor!",
26,46,فَأُلۡقِيَ ٱلسَّحَرَةُ سَٰجِدِينَ,(Bunu görünce) sihirbazlar derhal secdeye kapandılar.,
26,47,قَالُوٓاْ ءَامَنَّا بِرَبِّ ٱلۡعَٰلَمِينَ,"«Âlemlerin Rabbine, iman ettik» dediler.",
26,48,رَبِّ مُوسَىٰ وَهَٰرُونَ,Musa ve Harun'un Rabbi.,
26,49,قَالَ ءَامَنتُمۡ لَهُۥ قَبۡلَ أَنۡ ءَاذَنَ لَكُمۡۖ إِنَّهُۥ لَكَبِيرُكُمُ ٱلَّذِي عَلَّمَكُمُ ٱلسِّحۡرَ فَلَسَوۡفَ تَعۡلَمُونَۚ لَأُقَطِّعَنَّ أَيۡدِيَكُمۡ وَأَرۡجُلَكُم مِّنۡ خِلَٰفٖ وَلَأُصَلِّبَنَّكُمۡ أَجۡمَعِينَ,"Firavun, (kızgınlık içinde) dedi ki: Ben size izin vermeden ona iman ettiniz ha! Demek ki size sihri öğreten büyüğünüzmüş o! Ama şimdi (size yapacağımı görecek ve) bileceksiniz. Andolsun, ellerinizi ve ayaklarınızı çaprazlama kestireceğim, hepinizi astıracağım!",
26,50,قَالُواْ لَا ضَيۡرَۖ إِنَّآ إِلَىٰ رَبِّنَا مُنقَلِبُونَ,"«Zararı yok, dediler, (nasıl olsa) biz şüphesiz Rabbimize döneceğiz.»",
26,51,إِنَّا نَطۡمَعُ أَن يَغۡفِرَ لَنَا رَبُّنَا خَطَٰيَٰنَآ أَن كُنَّآ أَوَّلَ ٱلۡمُؤۡمِنِينَ,"«Biz, ilk iman edenler olduğumuz için Rabbimizin hatalarımızı bağışlayacağını umarız.»",
26,52,۞ وَأَوۡحَيۡنَآ إِلَىٰ مُوسَىٰٓ أَنۡ أَسۡرِ بِعِبَادِيٓ إِنَّكُم مُّتَّبَعُونَ,"Musa’ya: Kullarımı geceleyin yola çıkar; çünkü takip edileceksiniz, diye vahyettik.",
26,53,فَأَرۡسَلَ فِرۡعَوۡنُ فِي ٱلۡمَدَآئِنِ حَٰشِرِينَ,Firavun da şehirlere (asker) toplayıcılar gönderdi:,
26,54,إِنَّ هَٰٓؤُلَآءِ لَشِرۡذِمَةٞ قَلِيلُونَ,"«Esasen bunlar, sayıları az, bölük pörçük bir cemaattır.»",
26,55,وَإِنَّهُمۡ لَنَا لَغَآئِظُونَ,«(Böyle iken) kesinkes bizi öfkelendirmişlerdir.»,
26,56,وَإِنَّا لَجَمِيعٌ حَٰذِرُونَ,"«Biz ise, elbette uyanık (ve yek vücut) bir cemaatız.» (diyor ve dedirtiyordu).",
26,57,فَأَخۡرَجۡنَٰهُم مِّن جَنَّٰتٖ وَعُيُونٖ,"Ama (sonunda) biz onları (Firavun ve kavmini), bahçelerden, pınarlardan, çıkardık.",
26,58,وَكُنُوزٖ وَمَقَامٖ كَرِيمٖ,Hâzinelerden ve değerli bir yerden çıkardık.,
26,59,كَذَٰلِكَۖ وَأَوۡرَثۡنَٰهَا بَنِيٓ إِسۡرَٰٓءِيلَ,"Böylece, bunlara İsrailoğullarını mirasçı yaptık.",
26,60,فَأَتۡبَعُوهُم مُّشۡرِقِينَ,Derken (Firavun ve adamları) gün doğumunda onların ardına düştüler. ,
26,61,فَلَمَّا تَرَٰٓءَا ٱلۡجَمۡعَانِ قَالَ أَصۡحَٰبُ مُوسَىٰٓ إِنَّا لَمُدۡرَكُونَ,"İki topluluk birbirini görünce, Musa'nın adamları: ""İşte yakalandık!"" dediler.",
26,62,قَالَ كَلَّآۖ إِنَّ مَعِيَ رَبِّي سَيَهۡدِينِ,"Musa: Asla! dedi, Rabbim şüphesiz benimledir, bana yol gösterecektir.",
26,63,فَأَوۡحَيۡنَآ إِلَىٰ مُوسَىٰٓ أَنِ ٱضۡرِب بِّعَصَاكَ ٱلۡبَحۡرَۖ فَٱنفَلَقَ فَكَانَ كُلُّ فِرۡقٖ كَٱلطَّوۡدِ ٱلۡعَظِيمِ,"Bunun üzerine Musa'ya: Asân ile denize vur! diye vahyettik. (Vurunca deniz) derhal yarıldı (on iki yol açıldı), her bölük koca bir dağ gibi oldu.",
26,64,وَأَزۡلَفۡنَا ثَمَّ ٱلۡأٓخَرِينَ,Ötekilerini de oraya yaklaştırdık.,
26,65,وَأَنجَيۡنَا مُوسَىٰ وَمَن مَّعَهُۥٓ أَجۡمَعِينَ,Musa ve beraberinde bulunanların hepsini kurtardık.,
26,66,ثُمَّ أَغۡرَقۡنَا ٱلۡأٓخَرِينَ,Sonra ötekilerini suda boğduk.,
26,67,إِنَّ فِي ذَٰلِكَ لَأٓيَةٗۖ وَمَا كَانَ أَكۡثَرُهُم مُّؤۡمِنِينَ,Şüphesiz bunda bir ibret vardır; ama çokları iman etmiş değillerdir.,
26,68,وَإِنَّ رَبَّكَ لَهُوَ ٱلۡعَزِيزُ ٱلرَّحِيمُ,"Şüphesiz Rabbin, işte O, mutlak galip ve engin merhamet sahibidir.",
26,69,وَٱتۡلُ عَلَيۡهِمۡ نَبَأَ إِبۡرَٰهِيمَ,(Rasûlüm!) Onlara İbrahim’in haberini de naklet.,
26,70,إِذۡ قَالَ لِأَبِيهِ وَقَوۡمِهِۦ مَا تَعۡبُدُونَ,"Hani o, babasına ve kavmine: Neye tapıyorsunuz? demişti.",
26,71,قَالُواْ نَعۡبُدُ أَصۡنَامٗا فَنَظَلُّ لَهَا عَٰكِفِينَ,«Putlara tapıyoruz ve onlara tapmaya devam edeceğiz» diye cevap verdiler.,
26,72,قَالَ هَلۡ يَسۡمَعُونَكُمۡ إِذۡ تَدۡعُونَ,"İbrahim: Peki, dedi, yalvardığınızda onlar sizi işitiyorlar mı?",
26,73,أَوۡ يَنفَعُونَكُمۡ أَوۡ يَضُرُّونَ,Yahut size fayda ya da zarar verebiliyorlar mı?,
26,74,قَالُواْ بَلۡ وَجَدۡنَآ ءَابَآءَنَا كَذَٰلِكَ يَفۡعَلُونَ,"Şöyle cevap verdiler: Hayır, ama biz babalarımızı böyle yapar bulduk.",
26,75,قَالَ أَفَرَءَيۡتُم مَّا كُنتُمۡ تَعۡبُدُونَ,"İbrahim dedi ki: İyi ama,neye taptığınızı (biraz olsun) düşündünüz mü?",
26,76,أَنتُمۡ وَءَابَآؤُكُمُ ٱلۡأَقۡدَمُونَ," İster sizin, ister önceki atalarınızın.",
26,77,فَإِنَّهُمۡ عَدُوّٞ لِّيٓ إِلَّا رَبَّ ٱلۡعَٰلَمِينَ,İyi bilin ki onlar benim düşmanımdır; ancak âlemlerin Rabbi (benim dostumdur);,
26,78,ٱلَّذِي خَلَقَنِي فَهُوَ يَهۡدِينِ,Beni yaratan ve bana doğru yolu gösteren O'dur.,
26,79,وَٱلَّذِي هُوَ يُطۡعِمُنِي وَيَسۡقِينِ,"Beni yediren, içiren O’dur.",
26,80,وَإِذَا مَرِضۡتُ فَهُوَ يَشۡفِينِ,Hastalandığım zaman bana şifa veren O'dur.,
26,81,وَٱلَّذِي يُمِيتُنِي ثُمَّ يُحۡيِينِ,"Benim canımı alacak, sonra beni diriltecek O’dur.",
26,82,وَٱلَّذِيٓ أَطۡمَعُ أَن يَغۡفِرَ لِي خَطِيٓـَٔتِي يَوۡمَ ٱلدِّينِ,Ve hesap günü hatalarımı bağışlayacağını umduğum O'dur.,
26,83,رَبِّ هَبۡ لِي حُكۡمٗا وَأَلۡحِقۡنِي بِٱلصَّٰلِحِينَ,Rabbim! Bana hikmet ver ve beni iyiler arasına kat. ,
26,84,وَٱجۡعَل لِّي لِسَانَ صِدۡقٖ فِي ٱلۡأٓخِرِينَ,"  ""Benden sonrakiler içinde, beni iyi dille anılanlardan eyle."" ",
26,85,وَٱجۡعَلۡنِي مِن وَرَثَةِ جَنَّةِ ٱلنَّعِيمِ,"Beni, Naîm cennetinin vârislerinden kıl.",
26,86,وَٱغۡفِرۡ لِأَبِيٓ إِنَّهُۥ كَانَ مِنَ ٱلضَّآلِّينَ,Babamı da bağışla (ona tevbe ve iman nasip et). Çünkü o sapıklardandır.,
26,87,وَلَا تُخۡزِنِي يَوۡمَ يُبۡعَثُونَ,"(İnsanların) dirilecekleri gün, beni mahcup etme.",
26,88,يَوۡمَ لَا يَنفَعُ مَالٞ وَلَا بَنُونَ,"O gün, ne mal fayda verir ne de evlât.",
26,89,إِلَّا مَنۡ أَتَى ٱللَّهَ بِقَلۡبٖ سَلِيمٖ,Ancak Allah'a kalbi selîm (temiz bir kalp) ile gelenler (o günde fayda bulur).,
26,90,وَأُزۡلِفَتِ ٱلۡجَنَّةُ لِلۡمُتَّقِينَ,"(O gün) cennet, takvâ sahiplerine yaklaştırılır.",
26,91,وَبُرِّزَتِ ٱلۡجَحِيمُ لِلۡغَاوِينَ,Cehennem de azgınlara apaçık gösterilir.,
26,92,وَقِيلَ لَهُمۡ أَيۡنَ مَا كُنتُمۡ تَعۡبُدُونَ,Onlara: Allah’tan gayrı taptıklarınız hani nerede? ,
26,93,مِن دُونِ ٱللَّهِ هَلۡ يَنصُرُونَكُمۡ أَوۡ يَنتَصِرُونَ,Size yardım edebiliyorlar mı veya kendilerine (olsun) yardımları dokunuyor mu? denilir.,
26,94,فَكُبۡكِبُواْ فِيهَا هُمۡ وَٱلۡغَاوُۥنَ,"Artık onlar, o azgınlar toptan oraya tepetaklak (cehenneme) atılırlar",
26,95,وَجُنُودُ إِبۡلِيسَ أَجۡمَعُونَ,"ve İblis orduları, ",
26,96,قَالُواْ وَهُمۡ فِيهَا يَخۡتَصِمُونَ,orada birbirleriyle çekişerek şöyle derler:,
26,97,تَٱللَّهِ إِن كُنَّا لَفِي ضَلَٰلٖ مُّبِينٍ,"Vallahi, biz gerçekten apaçık bir sapıklık içindeymişiz.",
26,98,إِذۡ نُسَوِّيكُم بِرَبِّ ٱلۡعَٰلَمِينَ,Çünkü biz sizi âlemlerin Rabbi ile eşit tutuyorduk.,
26,99,وَمَآ أَضَلَّنَآ إِلَّا ٱلۡمُجۡرِمُونَ,Bizi ancak o günahkârlar saptırdı.,
26,100,فَمَا لَنَا مِن شَٰفِعِينَ,"Şimdi artık bizim ne şefaatçilerimiz var, ",
26,101,وَلَا صَدِيقٍ حَمِيمٖ,ne de yakın bir dostumuz.,
26,102,فَلَوۡ أَنَّ لَنَا كَرَّةٗ فَنَكُونَ مِنَ ٱلۡمُؤۡمِنِينَ,"Ah keşke bizim için (dünyaya) bir dönüş daha olsa da, müminlerden olsak!",
26,103,إِنَّ فِي ذَٰلِكَ لَأٓيَةٗۖ وَمَا كَانَ أَكۡثَرُهُم مُّؤۡمِنِينَ,"Bunda elbet (alınacak) büyük bir ders vardır, ama çokları iman etmezler.",
26,104,وَإِنَّ رَبَّكَ لَهُوَ ٱلۡعَزِيزُ ٱلرَّحِيمُ,"Şüphesiz Rabbin, işte O, mutlak galip ve engin merhamet sahibidir.",
26,105,كَذَّبَتۡ قَوۡمُ نُوحٍ ٱلۡمُرۡسَلِينَ,Nuh kavmi de peygamberleri yalancılıkla suçladılar.,
26,106,إِذۡ قَالَ لَهُمۡ أَخُوهُمۡ نُوحٌ أَلَا تَتَّقُونَ,Kardeşleri Nuh onlara şöyle demişti: (Allah'a karşı gelmekten) sakınmaz mısınız?,
26,107,إِنِّي لَكُمۡ رَسُولٌ أَمِينٞ,"Bilin ki ben, size gönderilmiş güvenilir bir elçiyim.",
26,108,فَٱتَّقُواْ ٱللَّهَ وَأَطِيعُونِ,Artık Allah’a karşı gelmekten sakının ve bana itaat edin.,
26,109,وَمَآ أَسۡـَٔلُكُمۡ عَلَيۡهِ مِنۡ أَجۡرٍۖ إِنۡ أَجۡرِيَ إِلَّا عَلَىٰ رَبِّ ٱلۡعَٰلَمِينَ,"Buna karşı sizden hiçbir ücret istemiyorum. Benim ecrimi verecek olan, ancak âlemlerin Rabbidir.",
26,110,فَٱتَّقُواْ ٱللَّهَ وَأَطِيعُونِ,"Onun için, Allah'tan korkun ve bana itaat edin.",
26,111,۞ قَالُوٓاْ أَنُؤۡمِنُ لَكَ وَٱتَّبَعَكَ ٱلۡأَرۡذَلُونَ,"Onlar şöyle cevap verdiler. Sana düşük seviyeli kimseler tâbi olup dururken, biz sana iman eder miyiz hiç! ",
26,112,قَالَ وَمَا عِلۡمِي بِمَا كَانُواْ يَعۡمَلُونَ,Nuh dedi ki: Onların yaptıkları hakkında bilgim yoktur.,
26,113,إِنۡ حِسَابُهُمۡ إِلَّا عَلَىٰ رَبِّيۖ لَوۡ تَشۡعُرُونَ,Onların hesabı ancak Rabbime aittir. Bir düşünseniz!,
26,114,وَمَآ أَنَا۠ بِطَارِدِ ٱلۡمُؤۡمِنِينَ,Ben iman eden kimseleri kovacak değilim.,
26,115,إِنۡ أَنَا۠ إِلَّا نَذِيرٞ مُّبِينٞ,Ben ancak apaçık bir uyarıcıyım.,
26,116,قَالُواْ لَئِن لَّمۡ تَنتَهِ يَٰنُوحُ لَتَكُونَنَّ مِنَ ٱلۡمَرۡجُومِينَ,"Dediler ki: Ey Nuh! (Bu davadan) vazgeçmezsen, iyi bil ki, taşlanmışlardan olacaksın!",
26,117,قَالَ رَبِّ إِنَّ قَوۡمِي كَذَّبُونِ,"Nuh: Rabbim! dedi, kavmim beni yalancılıkla suçladı.",
26,118,فَٱفۡتَحۡ بَيۡنِي وَبَيۡنَهُمۡ فَتۡحٗا وَنَجِّنِي وَمَن مَّعِيَ مِنَ ٱلۡمُؤۡمِنِينَ,Artık benimle onların arasında sen hükmünü ver. Beni ve beraberimdeki müminleri kurtar.,
26,119,فَأَنجَيۡنَٰهُ وَمَن مَّعَهُۥ فِي ٱلۡفُلۡكِ ٱلۡمَشۡحُونِ,"Bunun üzerine biz onu ve beraberindekileri, o dolu geminin içinde (taşıyarak) kurtardık.",
26,120,ثُمَّ أَغۡرَقۡنَا بَعۡدُ ٱلۡبَاقِينَ,Sonra da geri kalanları suda boğduk.,
26,121,إِنَّ فِي ذَٰلِكَ لَأٓيَةٗۖ وَمَا كَانَ أَكۡثَرُهُم مُّؤۡمِنِينَ,Doğrusu bunda büyük bir ders vardır; ama çokları iman etmezler.,
26,122,وَإِنَّ رَبَّكَ لَهُوَ ٱلۡعَزِيزُ ٱلرَّحِيمُ,"Şüphesiz Rabbin, işte O, mutlak galip ve engin merhamet sahibidir.",
26,123,كَذَّبَتۡ عَادٌ ٱلۡمُرۡسَلِينَ,Âd (kavmi) de peygamberleri yalancılıkla suçladı.,
26,124,إِذۡ قَالَ لَهُمۡ أَخُوهُمۡ هُودٌ أَلَا تَتَّقُونَ,Kardeşleri Hûd onlara şöyle demişti: (Allah'a karşı gelmekten) sakınmaz mısınız?,
26,125,إِنِّي لَكُمۡ رَسُولٌ أَمِينٞ,"Bilin ki, ben size gönderilmiş güvenilir bir elçiyim.",
26,126,فَٱتَّقُواْ ٱللَّهَ وَأَطِيعُونِ,Artık Allah'a karşı gelmekten sakının ve bana itaat edin.,
26,127,وَمَآ أَسۡـَٔلُكُمۡ عَلَيۡهِ مِنۡ أَجۡرٍۖ إِنۡ أَجۡرِيَ إِلَّا عَلَىٰ رَبِّ ٱلۡعَٰلَمِينَ,"Buna karşı sizden hiçbir ücret istemiyorum. Benim ecrimi verecek olan, ancak âlemlerin Rabbidir.",
26,128,أَتَبۡنُونَ بِكُلِّ رِيعٍ ءَايَةٗ تَعۡبَثُونَ,Siz her yüksek yere bir alâmet (köşk) dikerek eğleniyor musunuz?,
26,129,وَتَتَّخِذُونَ مَصَانِعَ لَعَلَّكُمۡ تَخۡلُدُونَ,Temelli kalacağınızı umarak sağlam yapılar mı ediniyorsunuz?,
26,130,وَإِذَا بَطَشۡتُم بَطَشۡتُمۡ جَبَّارِينَ,"Yakaladığınız zaman, zorbalar gibi mi yakalıyorsunuz?",
26,131,فَٱتَّقُواْ ٱللَّهَ وَأَطِيعُونِ,Artık Allah’tan korkun ve bana itaat edin.,
26,132,وَٱتَّقُواْ ٱلَّذِيٓ أَمَدَّكُم بِمَا تَعۡلَمُونَ,"Bildiğiniz şeyleri size veren, (Allah'a karşı gelmek) den sakının.",
26,133,أَمَدَّكُم بِأَنۡعَٰمٖ وَبَنِينَ,"Size nimetler (davarlar), oğullar, ihsan eden ",
26,134,وَجَنَّٰتٖ وَعُيُونٍ,"bağlar, pınarlar…",
26,135,إِنِّيٓ أَخَافُ عَلَيۡكُمۡ عَذَابَ يَوۡمٍ عَظِيمٖ,Doğrusu sizin hakkınızda muazzam bir günün azabından endişe ediyorum.,
26,136,قَالُواْ سَوَآءٌ عَلَيۡنَآ أَوَعَظۡتَ أَمۡ لَمۡ تَكُن مِّنَ ٱلۡوَٰعِظِينَ,"(Onlar) şöyle dediler: Sen öğüt versen de, vermesen de bizce birdir. ",
26,137,إِنۡ هَٰذَآ إِلَّا خُلُقُ ٱلۡأَوَّلِينَ,"Bu, öncekilerin geleneğinden (masallarından) başka bir şey değildir.",
26,138,وَمَا نَحۡنُ بِمُعَذَّبِينَ,Biz azaba uğratılacak da değiliz.,
26,139,فَكَذَّبُوهُ فَأَهۡلَكۡنَٰهُمۡۚ إِنَّ فِي ذَٰلِكَ لَأٓيَةٗۖ وَمَا كَانَ أَكۡثَرُهُم مُّؤۡمِنِينَ,Böylece onu yalancılıkla suçladılar; biz de kendilerini helâk ettik. Doğrusu bunda büyük bir ibret vardır; ama çokları iman etmezler.,
26,140,وَإِنَّ رَبَّكَ لَهُوَ ٱلۡعَزِيزُ ٱلرَّحِيمُ,"Şüphesiz Rabbin, işte O, mutlak galip ve engin merhamet sahibidir.",
26,141,كَذَّبَتۡ ثَمُودُ ٱلۡمُرۡسَلِينَ,Semûd (kavmi) de peygamberleri yalancılıkla suçladı.,
