surah,ayah,arabic_text,translation,footnotes
19,1,كٓهيعٓصٓ,Kâf. Hâ. Yâ. Ayn. Sâd.,
19,2,ذِكۡرُ رَحۡمَتِ رَبِّكَ عَبۡدَهُۥ زَكَرِيَّآ,"(Bu) Rabbinin, Zekeriyya kuluna rahmetinin anılmasıdır.",
19,3,إِذۡ نَادَىٰ رَبَّهُۥ نِدَآءً خَفِيّٗا,"Hani o, gizli bir sesle Rabbine niyaz etmişti:",
19,4,قَالَ رَبِّ إِنِّي وَهَنَ ٱلۡعَظۡمُ مِنِّي وَٱشۡتَعَلَ ٱلرَّأۡسُ شَيۡبٗا وَلَمۡ أَكُنۢ بِدُعَآئِكَ رَبِّ شَقِيّٗا,"Rabbim! dedi, benden (vücudumdan), kemiklerim zayıfladı, saçım başım ağardı ve ben, Rabbim, sana (ettiğim) dua sayesinde hiç bedbaht olmadım.",
19,5,وَإِنِّي خِفۡتُ ٱلۡمَوَٰلِيَ مِن وَرَآءِي وَكَانَتِ ٱمۡرَأَتِي عَاقِرٗا فَهَبۡ لِي مِن لَّدُنكَ وَلِيّٗا," ""Doğrusu ben, (din hususunda üzerlerine düşeni yapmayacaklarından) arkamdan gelecek ve işin başına geçecek olan yakınlarımdan  korkuyorum. Karım da kısırlaştı. Sen kendi katından bana (yerime geçecek) bir oğul ver.",
19,6,يَرِثُنِي وَيَرِثُ مِنۡ ءَالِ يَعۡقُوبَۖ وَٱجۡعَلۡهُ رَبِّ رَضِيّٗا,"Ki o bana vâris olsun; Ya’kub hanedanına da vâris olsun. Rabbim, onu rızana lâyık kıl!",
19,7,يَٰزَكَرِيَّآ إِنَّا نُبَشِّرُكَ بِغُلَٰمٍ ٱسۡمُهُۥ يَحۡيَىٰ لَمۡ نَجۡعَل لَّهُۥ مِن قَبۡلُ سَمِيّٗا,"(Allah şöyle buyurdu:) Ey Zekeriyya! Biz sana bir oğul müjdeleriz ki, onun adı Yahya’dır. Daha önce ona kimseyi adaş yapmadık.",
19,8,قَالَ رَبِّ أَنَّىٰ يَكُونُ لِي غُلَٰمٞ وَكَانَتِ ٱمۡرَأَتِي عَاقِرٗا وَقَدۡ بَلَغۡتُ مِنَ ٱلۡكِبَرِ عِتِيّٗا,"Zekeriyya: Rabbim! dedi, karım kısır olduğu, ben de ihtiyarlığın son sınırına vardığım halde, benim nasıl oğlum olabilir?",
19,9,قَالَ كَذَٰلِكَ قَالَ رَبُّكَ هُوَ عَلَيَّ هَيِّنٞ وَقَدۡ خَلَقۡتُكَ مِن قَبۡلُ وَلَمۡ تَكُ شَيۡـٔٗا,"Allah: Öyledir, dedi; Rabbin: O bana kolaydır. Daha önce, sen hiçbir şey değilken seni de yaratmıştım, buyurdu.",
19,10,قَالَ رَبِّ ٱجۡعَل لِّيٓ ءَايَةٗۖ قَالَ ءَايَتُكَ أَلَّا تُكَلِّمَ ٱلنَّاسَ ثَلَٰثَ لَيَالٖ سَوِيّٗا,"O: Rabbim! dedi, (çocuğum olacağına dair) bana bir işaret ver. Allah: Sana işaret, sapasağlam olduğun halde üç gün insanlarla konuşamamandır, buyurdu.",
19,11,فَخَرَجَ عَلَىٰ قَوۡمِهِۦ مِنَ ٱلۡمِحۡرَابِ فَأَوۡحَىٰٓ إِلَيۡهِمۡ أَن سَبِّحُواْ بُكۡرَةٗ وَعَشِيّٗا,"Bunun üzerine Zekeriyya, mabetten kavminin karşısına çıkarak onlara: «Sabah akşam tesbihte bulunun» diye işaret verdi.",
19,12,يَٰيَحۡيَىٰ خُذِ ٱلۡكِتَٰبَ بِقُوَّةٖۖ وَءَاتَيۡنَٰهُ ٱلۡحُكۡمَ صَبِيّٗا,«Ey Yahya! Kitab'a (Tevrat'a) vargücünle sarıl!» (dedik) ve henüz çocuk iken ona (ilim ve) hikmet verdik.,
19,13,وَحَنَانٗا مِّن لَّدُنَّا وَزَكَوٰةٗۖ وَكَانَ تَقِيّٗا,"Tarafımızdan ona kalp yumuşaklığı ve temizlik de (verdik). O, çok sakınan bir kimse idi.",
19,14,وَبَرَّۢا بِوَٰلِدَيۡهِ وَلَمۡ يَكُن جَبَّارًا عَصِيّٗا,"Anababasına çok iyi davranırdı; o, isyankar bir zorba değildi .",
19,15,وَسَلَٰمٌ عَلَيۡهِ يَوۡمَ وُلِدَ وَيَوۡمَ يَمُوتُ وَيَوۡمَ يُبۡعَثُ حَيّٗا,"Doğduğu gün, öleceği gün ve diri olarak kabirden kaldırılacağı gün ona selam olsun!",
19,16,وَٱذۡكُرۡ فِي ٱلۡكِتَٰبِ مَرۡيَمَ إِذِ ٱنتَبَذَتۡ مِنۡ أَهۡلِهَا مَكَانٗا شَرۡقِيّٗا,"(Rasûlüm!) Kitapta Meryem'i de an. Hani o, ailesinden ayrılarak doğu tarafında bir yere çekilmişti.",
19,17,فَٱتَّخَذَتۡ مِن دُونِهِمۡ حِجَابٗا فَأَرۡسَلۡنَآ إِلَيۡهَا رُوحَنَا فَتَمَثَّلَ لَهَا بَشَرٗا سَوِيّٗا,"Meryem, onlarla kendi arasına bir perde çekmişti. Derken, biz ona ruhumuzu gönderdik de o, kendisine tastamam bir insan şeklinde göründü.",
19,18,قَالَتۡ إِنِّيٓ أَعُوذُ بِٱلرَّحۡمَٰنِ مِنكَ إِن كُنتَ تَقِيّٗا,"Meryem ona şöyle demişti: Eğer Allah'tan sakınan bir kimse isen, senden Rahmân'a sığınırım.",
19,19,قَالَ إِنَّمَآ أَنَا۠ رَسُولُ رَبِّكِ لِأَهَبَ لَكِ غُلَٰمٗا زَكِيّٗا,"Melek: Ben, yalnızca, sana tertemiz bir erkek çocuk bağışlamam için Rabbinin bir elçisiyim, dedi.",
19,20,قَالَتۡ أَنَّىٰ يَكُونُ لِي غُلَٰمٞ وَلَمۡ يَمۡسَسۡنِي بَشَرٞ وَلَمۡ أَكُ بَغِيّٗا,"Meryem: Bana bir insan eli değmediği, iffetsiz de olmadığım halde benim nasıl çocuğum olabilir? dedi.",
19,21,قَالَ كَذَٰلِكِ قَالَ رَبُّكِ هُوَ عَلَيَّ هَيِّنٞۖ وَلِنَجۡعَلَهُۥٓ ءَايَةٗ لِّلنَّاسِ وَرَحۡمَةٗ مِّنَّاۚ وَكَانَ أَمۡرٗا مَّقۡضِيّٗا,"Melek: Öyledir, dedi; (zira) Rabbin buyurdu ki: Bu bana kolaydır. Çünkü biz, onu insanlara bir delil ve kendimizden bir rahmet kılacağız. Bu, hüküm ve karara bağlanmış (ezelde olup bitmiş) bir iş idi.",
19,22,۞ فَحَمَلَتۡهُ فَٱنتَبَذَتۡ بِهِۦ مَكَانٗا قَصِيّٗا,Meryem ona hamile kaldı. Bunun üzerine onunla (karnındaki çocukla) uzak bir yere çekildi.,
19,23,فَأَجَآءَهَا ٱلۡمَخَاضُ إِلَىٰ جِذۡعِ ٱلنَّخۡلَةِ قَالَتۡ يَٰلَيۡتَنِي مِتُّ قَبۡلَ هَٰذَا وَكُنتُ نَسۡيٗا مَّنسِيّٗا,"Doğum sancısı onu bir hurma ağacına (dayanmaya) sevketti. «Keşke, dedi, bundan önce ölseydim de unutulup gitseydim!»",
19,24,فَنَادَىٰهَا مِن تَحۡتِهَآ أَلَّا تَحۡزَنِي قَدۡ جَعَلَ رَبُّكِ تَحۡتَكِ سَرِيّٗا,Aşağısından (İsa yahut melek) ona şöyle seslendi: «Tasalanma! Rabbin senin alt yanında bir su arkı vücuda getirmiştir.»,
19,25,وَهُزِّيٓ إِلَيۡكِ بِجِذۡعِ ٱلنَّخۡلَةِ تُسَٰقِطۡ عَلَيۡكِ رُطَبٗا جَنِيّٗا,"«Hurma dalını kendine doğru silkele ki, üzerine taze, olgun hurma dökülsün.» ",
19,26,فَكُلِي وَٱشۡرَبِي وَقَرِّي عَيۡنٗاۖ فَإِمَّا تَرَيِنَّ مِنَ ٱلۡبَشَرِ أَحَدٗا فَقُولِيٓ إِنِّي نَذَرۡتُ لِلرَّحۡمَٰنِ صَوۡمٗا فَلَنۡ أُكَلِّمَ ٱلۡيَوۡمَ إِنسِيّٗا,"«Ye, iç. Gözün aydın olsun! Eğer insanlardan birini görürsen de ki: Ben, Rahmân'a oruç adadım; artık bugün hiçbir insanla konuşmayacağım.»",
19,27,فَأَتَتۡ بِهِۦ قَوۡمَهَا تَحۡمِلُهُۥۖ قَالُواْ يَٰمَرۡيَمُ لَقَدۡ جِئۡتِ شَيۡـٔٗا فَرِيّٗا,Nihayet onu (kucağında) taşıyarak kavmine getirdi. Dediler ki: Ey Meryem! Hakikaten sen iğrenç bir şey yaptın!,
19,28,يَٰٓأُخۡتَ هَٰرُونَ مَا كَانَ أَبُوكِ ٱمۡرَأَ سَوۡءٖ وَمَا كَانَتۡ أُمُّكِ بَغِيّٗا,Ey Harun'un kız kardeşi! Senin baban kötü bir insan değildi; annen de iffetsiz değildi.,
19,29,فَأَشَارَتۡ إِلَيۡهِۖ قَالُواْ كَيۡفَ نُكَلِّمُ مَن كَانَ فِي ٱلۡمَهۡدِ صَبِيّٗا,"Bunun üzerine Meryem çocuğu gösterdi. «Biz, dediler, beşikteki bir çocuk ile nasıl konuşuruz?»",
19,30,قَالَ إِنِّي عَبۡدُ ٱللَّهِ ءَاتَىٰنِيَ ٱلۡكِتَٰبَ وَجَعَلَنِي نَبِيّٗا,"Çocuk şöyle dedi: «Ben, Allah'ın kuluyum. O, bana Kitab'ı verdi ve beni peygamber yaptı.»",
19,31,وَجَعَلَنِي مُبَارَكًا أَيۡنَ مَا كُنتُ وَأَوۡصَٰنِي بِٱلصَّلَوٰةِ وَٱلزَّكَوٰةِ مَا دُمۡتُ حَيّٗا,"«Nerede olursam olayım, O beni mübarek kıldı; yaşadığım sürece bana namazı ve zekâtı emretti.»",
19,32,وَبَرَّۢا بِوَٰلِدَتِي وَلَمۡ يَجۡعَلۡنِي جَبَّارٗا شَقِيّٗا,«Beni anneme saygılı kıldı; beni bedbaht bir zorba yapmadı.»,
19,33,وَٱلسَّلَٰمُ عَلَيَّ يَوۡمَ وُلِدتُّ وَيَوۡمَ أَمُوتُ وَيَوۡمَ أُبۡعَثُ حَيّٗا,"«Doğduğum gün, öleceğim gün ve diri olarak kabirden kaldırılacağım gün selâmet (esenlik) banadır.»",
19,34,ذَٰلِكَ عِيسَى ٱبۡنُ مَرۡيَمَۖ قَوۡلَ ٱلۡحَقِّ ٱلَّذِي فِيهِ يَمۡتَرُونَ, İşte Meryem oğlu İsa budur; şüphe ettikleri hususta biz bunu gerçek bir söz olarak söylüyoruz.,
19,35,مَا كَانَ لِلَّهِ أَن يَتَّخِذَ مِن وَلَدٖۖ سُبۡحَٰنَهُۥٓۚ إِذَا قَضَىٰٓ أَمۡرٗا فَإِنَّمَا يَقُولُ لَهُۥ كُن فَيَكُونُ,"Allah'ın bir evlât edinmesi, olur şey değildir. O, bundan münezzehtir. Bir işe hükmettiği zaman, ona sadece «Ol!» der ve hemen olur.",
19,36,وَإِنَّ ٱللَّهَ رَبِّي وَرَبُّكُمۡ فَٱعۡبُدُوهُۚ هَٰذَا صِرَٰطٞ مُّسۡتَقِيمٞ,"(İsa şunu da söyledi:) Muhakkak ki Allah, benim de Rabbim, sizin de Rabbinizdir. Öyle ise O'na kulluk ediniz. İşte doğru yol budur.",
19,37,فَٱخۡتَلَفَ ٱلۡأَحۡزَابُ مِنۢ بَيۡنِهِمۡۖ فَوَيۡلٞ لِّلَّذِينَ كَفَرُواْ مِن مَّشۡهَدِ يَوۡمٍ عَظِيمٍ,Sonra gruplar kendi aralarında ayrılığa düştüler. Büyük güne şahit olunduğu zamanda vay o kâfirlerin haline!,
19,38,أَسۡمِعۡ بِهِمۡ وَأَبۡصِرۡ يَوۡمَ يَأۡتُونَنَا لَٰكِنِ ٱلظَّٰلِمُونَ ٱلۡيَوۡمَ فِي ضَلَٰلٖ مُّبِينٖ,"Onlar, bizim huzurumuza çıkacakları gün (başlarına gelecek olanları) ne iyi duyarlar ve ne iyi görürler (bir görsen)! Fakat o zalimler bugün açık bir sapıklık içindedirler. ",
19,39,وَأَنذِرۡهُمۡ يَوۡمَ ٱلۡحَسۡرَةِ إِذۡ قُضِيَ ٱلۡأَمۡرُ وَهُمۡ فِي غَفۡلَةٖ وَهُمۡ لَا يُؤۡمِنُونَ,(Rasûlüm!) Sen onları pişmanlık ve üzüntü günü hakkında uyar. Çünkü onlar bir gafletin içine dalmış oldukları halde ve henüz iman etmemişken (bakarsın) iş olup bilmiştir.,
19,40,إِنَّا نَحۡنُ نَرِثُ ٱلۡأَرۡضَ وَمَنۡ عَلَيۡهَا وَإِلَيۡنَا يُرۡجَعُونَ,"Yeryüzüne ve onun üzerindekilere ancak biz vâris oluruz (her şey gider, biz kalırız) ve onlar ancak bize döndürülürler.",
19,41,وَٱذۡكُرۡ فِي ٱلۡكِتَٰبِ إِبۡرَٰهِيمَۚ إِنَّهُۥ كَانَ صِدِّيقٗا نَّبِيًّا,"Kitap'ta İbrahim'i an. Zira o, sıdkı bütün bir peygamberdi.",
19,42,إِذۡ قَالَ لِأَبِيهِ يَٰٓأَبَتِ لِمَ تَعۡبُدُ مَا لَا يَسۡمَعُ وَلَا يُبۡصِرُ وَلَا يُغۡنِي عَنكَ شَيۡـٔٗا,"Bir zaman o babasına dedi ki: Babacığım! Duymayan, görmeyen ve sana hiçbir fayda sağlamayan bir şeye niçin taparsın?",
19,43,يَٰٓأَبَتِ إِنِّي قَدۡ جَآءَنِي مِنَ ٱلۡعِلۡمِ مَا لَمۡ يَأۡتِكَ فَٱتَّبِعۡنِيٓ أَهۡدِكَ صِرَٰطٗا سَوِيّٗا,"Babacığım! Hakikaten sana gelmeyen bir ilim bana geldi. Öyle ise bana uy ki, seni doğru yola çıkarayım.",
19,44,يَٰٓأَبَتِ لَا تَعۡبُدِ ٱلشَّيۡطَٰنَۖ إِنَّ ٱلشَّيۡطَٰنَ كَانَ لِلرَّحۡمَٰنِ عَصِيّٗا,"Babacığım! Şeytana kulluk etme! Çünkü şeytan, Rahmân'a (çok merhametli olan Allah'a) âsi oldu.",
19,45,يَٰٓأَبَتِ إِنِّيٓ أَخَافُ أَن يَمَسَّكَ عَذَابٞ مِّنَ ٱلرَّحۡمَٰنِ فَتَكُونَ لِلشَّيۡطَٰنِ وَلِيّٗا,"""Ey babacığım! Ben, Rahmân'dan gelecek bir azabın sana da dokunmasından korkuyorum. Bu takdirde Cehennem'de de şeytana dost olursun.",
19,46,قَالَ أَرَاغِبٌ أَنتَ عَنۡ ءَالِهَتِي يَٰٓإِبۡرَٰهِيمُۖ لَئِن لَّمۡ تَنتَهِ لَأَرۡجُمَنَّكَۖ وَٱهۡجُرۡنِي مَلِيّٗا,"Babası ise, ona şöyle demişti: ""Ey İbrâhim! Benim ilâhlarımdan yüz mü çeviriyorsun? Eğer bundan vazgeçmezsen seni muhakkak taşlarım. Benden uzun bir müddet uzaklaş."" ",
19,47,قَالَ سَلَٰمٌ عَلَيۡكَۖ سَأَسۡتَغۡفِرُ لَكَ رَبِّيٓۖ إِنَّهُۥ كَانَ بِي حَفِيّٗا,"İbrahim: Selâm sana (esen kal) dedi, Rabbimden senin için mağfiret dileyeceğim. Çünkü O bana karşı çok lütufkârdır.",
19,48,وَأَعۡتَزِلُكُمۡ وَمَا تَدۡعُونَ مِن دُونِ ٱللَّهِ وَأَدۡعُواْ رَبِّي عَسَىٰٓ أَلَّآ أَكُونَ بِدُعَآءِ رَبِّي شَقِيّٗا,"Sizden de, Allah'ın dışında taptığınız şeylerden de uzaklaşıyor ve Rabbime yalvarıyorum. Umulur ki (senin için) Rabbime dua etmemle bedbaht (emeği boşa gitmiş) olmam.",
19,49,فَلَمَّا ٱعۡتَزَلَهُمۡ وَمَا يَعۡبُدُونَ مِن دُونِ ٱللَّهِ وَهَبۡنَا لَهُۥٓ إِسۡحَٰقَ وَيَعۡقُوبَۖ وَكُلّٗا جَعَلۡنَا نَبِيّٗا,Nihayet İbrahim onlardan ve Allah'tan başka taptıkları şeylerden uzaklaşıp bir tarafa çekildiği zaman biz ona İshak ve Yâ’kub’u bağışladık ve her birini peygamber yaptık.,
19,50,وَوَهَبۡنَا لَهُم مِّن رَّحۡمَتِنَا وَجَعَلۡنَا لَهُمۡ لِسَانَ صِدۡقٍ عَلِيّٗا,Onlara rahmetimizden bağışta bulunduk ve onlar için üstün güzel övgüler kıldık. ,
19,51,وَٱذۡكُرۡ فِي ٱلۡكِتَٰبِ مُوسَىٰٓۚ إِنَّهُۥ كَانَ مُخۡلَصٗا وَكَانَ رَسُولٗا نَّبِيّٗا,"(Rasûlüm!) Kitap'ta Musa'yı da an. Gerçekten o ihlâs sahibi idi ve hem rasûl, hem de nebî idi.",
19,52,وَنَٰدَيۡنَٰهُ مِن جَانِبِ ٱلطُّورِ ٱلۡأَيۡمَنِ وَقَرَّبۡنَٰهُ نَجِيّٗا,"Ona Tûr'un sağ tarafından seslendik ve onu, fısıldaşan kimse kadar (kendimize) yaklaştırdık.",
19,53,وَوَهَبۡنَا لَهُۥ مِن رَّحۡمَتِنَآ أَخَاهُ هَٰرُونَ نَبِيّٗا,Rahmetimizin bir sonucu olarak ona kardeşi Harun'u bir peygamber olarak armağan ettik.,
19,54,وَٱذۡكُرۡ فِي ٱلۡكِتَٰبِ إِسۡمَٰعِيلَۚ إِنَّهُۥ كَانَ صَادِقَ ٱلۡوَعۡدِ وَكَانَ رَسُولٗا نَّبِيّٗا,"(Rasûlüm!) Kitap'ta İsmail'i de an. Gerçekten o, sözüne sâdıktı, rasûl ve nebî idi.",
19,55,وَكَانَ يَأۡمُرُ أَهۡلَهُۥ بِٱلصَّلَوٰةِ وَٱلزَّكَوٰةِ وَكَانَ عِندَ رَبِّهِۦ مَرۡضِيّٗا,Ailesine namazı ve zekâtı emrederdi; Rabbi nezdinde de hoşnutluk kazanmış bir kimse idi.,
19,56,وَٱذۡكُرۡ فِي ٱلۡكِتَٰبِ إِدۡرِيسَۚ إِنَّهُۥ كَانَ صِدِّيقٗا نَّبِيّٗا,"Kitapta İdris’i de an. Hakikaten o, pek doğru bir insan, bir peygamberdi.",
19,57,وَرَفَعۡنَٰهُ مَكَانًا عَلِيًّا,"Biz, onu üstün bir makama yükseltmiştik. ",
19,58,أُوْلَٰٓئِكَ ٱلَّذِينَ أَنۡعَمَ ٱللَّهُ عَلَيۡهِم مِّنَ ٱلنَّبِيِّـۧنَ مِن ذُرِّيَّةِ ءَادَمَ وَمِمَّنۡ حَمَلۡنَا مَعَ نُوحٖ وَمِن ذُرِّيَّةِ إِبۡرَٰهِيمَ وَإِسۡرَٰٓءِيلَ وَمِمَّنۡ هَدَيۡنَا وَٱجۡتَبَيۡنَآۚ إِذَا تُتۡلَىٰ عَلَيۡهِمۡ ءَايَٰتُ ٱلرَّحۡمَٰنِ خَرُّواْۤ سُجَّدٗاۤ وَبُكِيّٗا۩,"İşte bunlar, Allah'ın kendilerine nimetler verdiği peygamberlerden, Âdem'in soyundan, Nuh ile birlikte (gemide) taşıdıklarımızdan, İbrahim ve İsrail (Ya'kub) 'in soyundan, doğruya ulaştırdığımız ve seçkin kıldığımız kimselendendir. Onlara, çok merhametli olan Allah'ın âyetleri okunduğunda ağlayarak secdeye kapanırlardı.",
19,59,۞ فَخَلَفَ مِنۢ بَعۡدِهِمۡ خَلۡفٌ أَضَاعُواْ ٱلصَّلَوٰةَ وَٱتَّبَعُواْ ٱلشَّهَوَٰتِۖ فَسَوۡفَ يَلۡقَوۡنَ غَيًّا,"Nihayet onların peşinden öyle bir nesil geldi ki, bunlar namazı bıraktılar; nefislerinin arzularına uydular. Bu yüzden ileride sapıklıklarının cezasını çekecekler.",
19,60,إِلَّا مَن تَابَ وَءَامَنَ وَعَمِلَ صَٰلِحٗا فَأُوْلَٰٓئِكَ يَدۡخُلُونَ ٱلۡجَنَّةَ وَلَا يُظۡلَمُونَ شَيۡـٔٗا,"Ancak tevbe eden, iman eden ve iyi davranışta bulunan kimseler hariçtir. Bunlar, hiçbir haksızlığa uğratılmaksızın cennete,",
19,61,جَنَّٰتِ عَدۡنٍ ٱلَّتِي وَعَدَ ٱلرَّحۡمَٰنُ عِبَادَهُۥ بِٱلۡغَيۡبِۚ إِنَّهُۥ كَانَ وَعۡدُهُۥ مَأۡتِيّٗا,"çok merhametli olan Allah'ın, kullarına gıyaben vâdettiği Adn cennetlerine girecekler. Şüphesiz O'nun vaadi yerini bulacaktır.",
19,62,لَّا يَسۡمَعُونَ فِيهَا لَغۡوًا إِلَّا سَلَٰمٗاۖ وَلَهُمۡ رِزۡقُهُمۡ فِيهَا بُكۡرَةٗ وَعَشِيّٗا,"Orada boş söz değil, hoş söz duyarlar. Ve orada, sabah akşam kendilerine ait rızıkları vardır.",
19,63,تِلۡكَ ٱلۡجَنَّةُ ٱلَّتِي نُورِثُ مِنۡ عِبَادِنَا مَن كَانَ تَقِيّٗا,"Kullarımızdan, takvâ sahibi kimseleri mirasçı kıldığımız cennet işte budur.",
19,64,وَمَا نَتَنَزَّلُ إِلَّا بِأَمۡرِ رَبِّكَۖ لَهُۥ مَا بَيۡنَ أَيۡدِينَا وَمَا خَلۡفَنَا وَمَا بَيۡنَ ذَٰلِكَۚ وَمَا كَانَ رَبُّكَ نَسِيّٗا,"Biz ancak Rabbinin emri ile ineriz. Önümüzde, arkamızda ve bunlar arasında olan her şey O'na aittir. Senin Rabbin unutkan değildir. ",
19,65,رَّبُّ ٱلسَّمَٰوَٰتِ وَٱلۡأَرۡضِ وَمَا بَيۡنَهُمَا فَٱعۡبُدۡهُ وَٱصۡطَبِرۡ لِعِبَٰدَتِهِۦۚ هَلۡ تَعۡلَمُ لَهُۥ سَمِيّٗا,"(O) göklerin, yerin ve ikisi arasındaki şeylerin Rabbidir. Şu halde O'na kulluk et; O’na kulluk etmek için sabırlı ve metânetli ol. O'nun bir adaşı (benzeri) olduğunu biliyor musun? (Asla benzeri yoktur).",
19,66,وَيَقُولُ ٱلۡإِنسَٰنُ أَءِذَا مَا مِتُّ لَسَوۡفَ أُخۡرَجُ حَيًّا,İnsan der ki: «Öldüğüm zaman sahi diri olarak (kabrimden) çıkarılacak mıyım?»,
19,67,أَوَلَا يَذۡكُرُ ٱلۡإِنسَٰنُ أَنَّا خَلَقۡنَٰهُ مِن قَبۡلُ وَلَمۡ يَكُ شَيۡـٔٗا,"İnsan düşünmez mi ki, daha önce o hiçbir şey olmadığı halde biz kendisini yaratmışızdır ?",
19,68,فَوَرَبِّكَ لَنَحۡشُرَنَّهُمۡ وَٱلشَّيَٰطِينَ ثُمَّ لَنُحۡضِرَنَّهُمۡ حَوۡلَ جَهَنَّمَ جِثِيّٗا,"Öyle ise, Rabbine andolsun ki, muhakkak surette onları şeytanlarla birlikte mahşerde toplayacağız; sonra onları diz üstü çökmüş vaziyette cehennemin çevresinde hazır bulunduracağız.",
19,69,ثُمَّ لَنَنزِعَنَّ مِن كُلِّ شِيعَةٍ أَيُّهُمۡ أَشَدُّ عَلَى ٱلرَّحۡمَٰنِ عِتِيّٗا,"Sonra her milletten, Rahman olan Allah'a en çok âsi olanlar hangileri ise çekip ayıracağız.",
19,70,ثُمَّ لَنَحۡنُ أَعۡلَمُ بِٱلَّذِينَ هُمۡ أَوۡلَىٰ بِهَا صِلِيّٗا,"Sonra, orayı boylamaya daha çok müstahak olanları elbette biz daha iyi biliriz.",
19,71,وَإِن مِّنكُمۡ إِلَّا وَارِدُهَاۚ كَانَ عَلَىٰ رَبِّكَ حَتۡمٗا مَّقۡضِيّٗا,"İçinizden, oraya uğramayacak hiçbir kimse yoktur. Bu, Rabbin için kesinleşmiş bir hükümdür.",
19,72,ثُمَّ نُنَجِّي ٱلَّذِينَ ٱتَّقَواْ وَّنَذَرُ ٱلظَّٰلِمِينَ فِيهَا جِثِيّٗا,"Sonra biz, Allah'tan sakınanları kurtarırız; zalimleri de diz üstü çökmüş olarak orada bırakırız .",
19,73,وَإِذَا تُتۡلَىٰ عَلَيۡهِمۡ ءَايَٰتُنَا بَيِّنَٰتٖ قَالَ ٱلَّذِينَ كَفَرُواْ لِلَّذِينَ ءَامَنُوٓاْ أَيُّ ٱلۡفَرِيقَيۡنِ خَيۡرٞ مَّقَامٗا وَأَحۡسَنُ نَدِيّٗا,"Kendilerine âyetlerimiz ayan beyan okunduğu zaman inkâr edenler, iman edenlere: İki topluluktan hangisinin (hangimizin) mevki ve makamı daha iyi, meclis ve topluluğu daha güzeldir? dediler.",
19,74,وَكَمۡ أَهۡلَكۡنَا قَبۡلَهُم مِّن قَرۡنٍ هُمۡ أَحۡسَنُ أَثَٰثٗا وَرِءۡيٗا,"Onlardan önce de, eşya ve görünüş bakımından daha güzel olan nice nesiller helâk ettik.",
19,75,قُلۡ مَن كَانَ فِي ٱلضَّلَٰلَةِ فَلۡيَمۡدُدۡ لَهُ ٱلرَّحۡمَٰنُ مَدًّاۚ حَتَّىٰٓ إِذَا رَأَوۡاْ مَا يُوعَدُونَ إِمَّا ٱلۡعَذَابَ وَإِمَّا ٱلسَّاعَةَ فَسَيَعۡلَمُونَ مَنۡ هُوَ شَرّٞ مَّكَانٗا وَأَضۡعَفُ جُندٗا,"  (Ey Muhammed!) De ki: ""Sapıklık içinde olan bir kimseye, Rahman, belirli bir süre tanısa bile, kendilerine vadolunanı ya azâp, ya da kıyamet olarak gördükleri zaman, kimin yerinin daha kötü ve kimin taraftarının daha zayıf olduğunu öğreneceklerdir.""",
19,76,وَيَزِيدُ ٱللَّهُ ٱلَّذِينَ ٱهۡتَدَوۡاْ هُدٗىۗ وَٱلۡبَٰقِيَٰتُ ٱلصَّٰلِحَٰتُ خَيۡرٌ عِندَ رَبِّكَ ثَوَابٗا وَخَيۡرٞ مَّرَدًّا,"Oysa doğru yolda olanların hidayetini Allah daha da artıracaktır. Sevabı kalacak olan iyi ameller, Rabbın katında sevâb yönünden daha hayırlıdır; netice olarak da daha iyidir.",
19,77,أَفَرَءَيۡتَ ٱلَّذِي كَفَرَ بِـَٔايَٰتِنَا وَقَالَ لَأُوتَيَنَّ مَالٗا وَوَلَدًا,(Rasûlüm!) Âyetlerimizi inkâr eden ve «Muhakkak suretle bana mal ve evlât verilecek» diyen adamı gördün mü?,
19,78,أَطَّلَعَ ٱلۡغَيۡبَ أَمِ ٱتَّخَذَ عِندَ ٱلرَّحۡمَٰنِ عَهۡدٗا,"O, gaybı mı bildi, yoksa Allah’ın katından bir söz mü aldı?",
19,79,كَلَّاۚ سَنَكۡتُبُ مَا يَقُولُ وَنَمُدُّ لَهُۥ مِنَ ٱلۡعَذَابِ مَدّٗا,Kesinlikle hayır! Biz onun söylediğini yazacağız ve azabını uzattıkça uzatacağız.,
19,80,وَنَرِثُهُۥ مَا يَقُولُ وَيَأۡتِينَا فَرۡدٗا,"Onun dediğine biz vâris oluruz, (malı ve evlâdı bize kalır); kendisi de bize yapayalnız gelir.",
19,81,وَٱتَّخَذُواْ مِن دُونِ ٱللَّهِ ءَالِهَةٗ لِّيَكُونُواْ لَهُمۡ عِزّٗا,"Onlar, kendilerine bir itibar ve kuvvet (vesilesi) olsun diye Allah’tan başka tanrılar edindiler.",
19,82,كَلَّاۚ سَيَكۡفُرُونَ بِعِبَادَتِهِمۡ وَيَكُونُونَ عَلَيۡهِمۡ ضِدًّا,"Hayır, hayır! (Taptıkları), onların ibadetlerini tanımayacaklar ve onlara hasım olacaklar.",
19,83,أَلَمۡ تَرَ أَنَّآ أَرۡسَلۡنَا ٱلشَّيَٰطِينَ عَلَى ٱلۡكَٰفِرِينَ تَؤُزُّهُمۡ أَزّٗا,"(Rasûlüm!) Görmedin mi? Biz, kâfirlerin üzerine, kendilerini iyice (isyankârlığa) sevkeden şeytanları gönderdik.",
19,84,فَلَا تَعۡجَلۡ عَلَيۡهِمۡۖ إِنَّمَا نَعُدُّ لَهُمۡ عَدّٗا,Öyle ise onlar hakkında acele etme. Biz onlar için (günlerini) teker teker sayıyoruz.,
19,85,يَوۡمَ نَحۡشُرُ ٱلۡمُتَّقِينَ إِلَى ٱلرَّحۡمَٰنِ وَفۡدٗا,"Takvâ sahiplerini heyet halinde çok merhametli olan Allah’ın huzurunda topladığımız, ",
19,86,وَنَسُوقُ ٱلۡمُجۡرِمِينَ إِلَىٰ جَهَنَّمَ وِرۡدٗا,"günahkârları da susuz olarak cehenneme sürdüğümüz gün,",
