surah,ayah,arabic_text,translation,footnotes
26,1,طسٓمٓ,Ta. Sin. Mim.[1],[1] Xem lại phần chú thích ở câu 1 của chương Al-Baqarah.
26,2,تِلۡكَ ءَايَٰتُ ٱلۡكِتَٰبِ ٱلۡمُبِينِ,Đó là những Câu Kinh của một Kinh Sách minh bạch (không mơ hồ và thần bí).,
26,3,لَعَلَّكَ بَٰخِعٞ نَّفۡسَكَ أَلَّا يَكُونُواْ مُؤۡمِنِينَ,"Có lẽ Ngươi (Thiên Sứ Muhammad) khổ tâm, đau buồn khiến bản thân chết dần chết mòn về việc họ không có đức tin.",
26,4,إِن نَّشَأۡ نُنَزِّلۡ عَلَيۡهِم مِّنَ ٱلسَّمَآءِ ءَايَةٗ فَظَلَّتۡ أَعۡنَٰقُهُمۡ لَهَا خَٰضِعِينَ,"Nếu muốn, TA (Allah) có thể ban một phép lạ từ trên trời xuống khiến họ cúi cổ thần phục, (nhưng TA không làm thế vì để thử thách họ xem họ có tin vào điều vô hình hay không).",
26,5,وَمَا يَأۡتِيهِم مِّن ذِكۡرٖ مِّنَ ٱلرَّحۡمَٰنِ مُحۡدَثٍ إِلَّا كَانُواْ عَنۡهُ مُعۡرِضِينَ,"Bất cứ điều nhắc nhở nào được ban xuống cho họ từ Đấng Độ Lượng, họ đều quay lưng bỏ đi.",
26,6,فَقَدۡ كَذَّبُواْ فَسَيَأۡتِيهِمۡ أَنۢبَٰٓؤُاْ مَا كَانُواْ بِهِۦ يَسۡتَهۡزِءُونَ,"Quả thật, họ đã phủ nhận (những điều mà Thiên Sứ của họ đã mang đến), rồi đây họ sẽ nhận được tin về những điều mà họ đã từng chế giễu.",
26,7,أَوَلَمۡ يَرَوۡاْ إِلَى ٱلۡأَرۡضِ كَمۡ أَنۢبَتۡنَا فِيهَا مِن كُلِّ زَوۡجٖ كَرِيمٍ,"Lẽ nào họ đã không quan sát trái đất, nơi mà TA đã làm mọc ra biết bao cây cối tốt lành?",
26,8,إِنَّ فِي ذَٰلِكَ لَأٓيَةٗۖ وَمَا كَانَ أَكۡثَرُهُم مُّؤۡمِنِينَ,"Quả thật, trong đó là một bằng chứng (cho việc TA thừa khả năng làm người chết sống lại), tuy nhiên, đa số bọn họ không có đức tin.",
26,9,وَإِنَّ رَبَّكَ لَهُوَ ٱلۡعَزِيزُ ٱلرَّحِيمُ,"Quả thật, Thượng Đế của Ngươi (hỡi Thiên Sứ Muhammad) là Đấng Quyền Lực, Nhân Từ.",
26,10,وَإِذۡ نَادَىٰ رَبُّكَ مُوسَىٰٓ أَنِ ٱئۡتِ ٱلۡقَوۡمَ ٱلظَّٰلِمِينَ,(Ngươi hãy nhớ lại) khi Thượng Đế của Ngươi gọi Musa phán bảo: “Ngươi hãy đi gặp một đám người làm điều sai quấy.”,
26,11,قَوۡمَ فِرۡعَوۡنَۚ أَلَا يَتَّقُونَ,“Đó là đám người của Pha-ra-ông. (Ngươi hãy bảo) họ sợ (Allah).”,
26,12,قَالَ رَبِّ إِنِّيٓ أَخَافُ أَن يُكَذِّبُونِ,"(Musa) thưa: “Lạy Thượng Đế của bề tôi, bề tôi thực sự lo sợ rằng họ sẽ cho bề tôi nói dối.”",
26,13,وَيَضِيقُ صَدۡرِي وَلَا يَنطَلِقُ لِسَانِي فَأَرۡسِلۡ إِلَىٰ هَٰرُونَ,"“Và lồng ngực của bề tôi thì chật hẹp, chiếc lưỡi của bề tôi thì nói không lưu loát, xin Ngài cử thêm Harun làm phò tá cho bề tôi.”",
26,14,وَلَهُمۡ عَلَيَّ ذَنۢبٞ فَأَخَافُ أَن يَقۡتُلُونِ,“Bề tôi đã phạm tội với họ (vì đã lỡ tay giết chết một người của họ) nên bề tôi sợ họ sẽ giết bề tôi.”,
26,15,قَالَ كَلَّاۖ فَٱذۡهَبَا بِـَٔايَٰتِنَآۖ إِنَّا مَعَكُم مُّسۡتَمِعُونَ,"(Allah) phán bảo (Musa và Harun): “Sẽ không sao, hai ngươi cứ lên đường với những Phép Lạ của TA. Quả thật TA sẽ ở cùng với hai ngươi, TA luôn nghe thấy tất cả.”",
26,16,فَأۡتِيَا فِرۡعَوۡنَ فَقُولَآ إِنَّا رَسُولُ رَبِّ ٱلۡعَٰلَمِينَ,"“Hai Ngươi cứ đi gặp Pha-ra-ông, hai ngươi hãy nói với y: Chúng tôi là Thiên Sứ của Thượng Đế của vũ trụ và vạn vật.”",
26,17,أَنۡ أَرۡسِلۡ مَعَنَا بَنِيٓ إِسۡرَٰٓءِيلَ,“Xin ngài hãy để con cháu Israel ra đi với chúng tôi.”,
26,18,قَالَ أَلَمۡ نُرَبِّكَ فِينَا وَلِيدٗا وَلَبِثۡتَ فِينَا مِنۡ عُمُرِكَ سِنِينَ,(Pha-ra-ông) bảo (Musa): “Há ta đã không thương yêu và nuôi nấng Ngươi như con cái hay sao? Chẳng phải Ngươi đã ở với ta nhiều năm trong đời Ngươi hay sao?”,
26,19,وَفَعَلۡتَ فَعۡلَتَكَ ٱلَّتِي فَعَلۡتَ وَأَنتَ مِنَ ٱلۡكَٰفِرِينَ,"“Vậy mà Ngươi đã nhẫn tâm làm một việc đáng lẽ ra Ngươi không nên làm, Ngươi là một tên vong ơn bội nghĩa.”",
26,20,قَالَ فَعَلۡتُهَآ إِذٗا وَأَنَا۠ مِنَ ٱلضَّآلِّينَ,(Musa) nói (với Pha-ra-ông): “Tôi đã làm điều đó lúc tôi là kẻ không biết gì (vì chưa nhận được sự mặc khải của Allah).”,
26,21,فَفَرَرۡتُ مِنكُمۡ لَمَّا خِفۡتُكُمۡ فَوَهَبَ لِي رَبِّي حُكۡمٗا وَجَعَلَنِي مِنَ ٱلۡمُرۡسَلِينَ,“Vì sợ ngài nên Tôi đã bỏ trốn đi xa và Thượng Đế của Tôi đã ban cho Tôi sự khôn ngoan và cử Tôi làm Thiên Sứ (của Ngài).”,
26,22,وَتِلۡكَ نِعۡمَةٞ تَمُنُّهَا عَلَيَّ أَنۡ عَبَّدتَّ بَنِيٓ إِسۡرَٰٓءِيلَ,“Đấy là ân xưa mà ngài đã nại ra để khiển trách Tôi rồi đã bắt người dân Israel làm nô lệ.”,
26,23,قَالَ فِرۡعَوۡنُ وَمَا رَبُّ ٱلۡعَٰلَمِينَ,Pha-ra-ông hỏi (Musa): “Thế Thượng Đế của vũ trụ và vạn vật là gì?”,
26,24,قَالَ رَبُّ ٱلسَّمَٰوَٰتِ وَٱلۡأَرۡضِ وَمَا بَيۡنَهُمَآۖ إِن كُنتُم مُّوقِنِينَ,"(Musa) đáp: “Là Thượng Đế của các tầng trời, trái đất và vạn vật giữa trời đất, nếu quí ngài muốn có đức tin vững chắc (nơi Ngài thì quí ngài hãy chỉ thờ phượng một mình Ngài thôi).”",
26,25,قَالَ لِمَنۡ حَوۡلَهُۥٓ أَلَا تَسۡتَمِعُونَ,(Pha-ra-ông) nói với các cận thần: “Các khanh có nghe rõ (lời bịa đặt của Musa) chăng?”,
26,26,قَالَ رَبُّكُمۡ وَرَبُّ ءَابَآئِكُمُ ٱلۡأَوَّلِينَ,(Musa) nói tiếp: “Đó là Thượng Đế của quí ngài và cả tổ tiên của quí ngài nữa.”,
26,27,قَالَ إِنَّ رَسُولَكُمُ ٱلَّذِيٓ أُرۡسِلَ إِلَيۡكُمۡ لَمَجۡنُونٞ,(Pha-ra-ông) bảo: “Chắc chắn Thiên Sứ được gởi đến cho các ngươi là một tên điên!”,
26,28,قَالَ رَبُّ ٱلۡمَشۡرِقِ وَٱلۡمَغۡرِبِ وَمَا بَيۡنَهُمَآۖ إِن كُنتُمۡ تَعۡقِلُونَ,"(Musa) nói tiếp: “Đó là Thượng Đế của hướng đông, hướng tây và vạn vật giữa hai hướng đó, nếu quí ngài nhận thức được.”",
26,29,قَالَ لَئِنِ ٱتَّخَذۡتَ إِلَٰهًا غَيۡرِي لَأَجۡعَلَنَّكَ مِنَ ٱلۡمَسۡجُونِينَ,(Pha-ra-ông) nói với (Musa): “Nếu nhà Ngươi quyết tôn thờ một Thượng Đế khác ngoài ta thì chắc chắn ta sẽ cho nhà Ngươi bị tù đày.”,
26,30,قَالَ أَوَلَوۡ جِئۡتُكَ بِشَيۡءٖ مُّبِينٖ,(Musa) nói với (Pha-ra-ông): “Ngay cả khi tôi mang đến cho ngài một điều gì đó chứng minh rõ ràng ư?”,
26,31,قَالَ فَأۡتِ بِهِۦٓ إِن كُنتَ مِنَ ٱلصَّٰدِقِينَ,(Pha-ra-ông) nói: “Vậy nhà Ngươi hãy trình nó ra xem nếu nhà Ngươi đúng là một người nói thật.”,
26,32,فَأَلۡقَىٰ عَصَاهُ فَإِذَا هِيَ ثُعۡبَانٞ مُّبِينٞ,"Thế là Musa ném chiếc gậy của Y xuống, nó lập tức biến thành một con rắn hiển hiện.",
26,33,وَنَزَعَ يَدَهُۥ فَإِذَا هِيَ بَيۡضَآءُ لِلنَّٰظِرِينَ,"Và khi Y rút bàn tay của Y ra (sau khi áp nó vào ba sườn), bàn tay của Y trở nên trắng sáng trước những người chứng kiến.",
26,34,قَالَ لِلۡمَلَإِ حَوۡلَهُۥٓ إِنَّ هَٰذَا لَسَٰحِرٌ عَلِيمٞ,(Pha-ra-ông) quay sang bảo các cận thần: “Tên này quả nhiên là một phù thủy tài giỏi.”,
26,35,يُرِيدُ أَن يُخۡرِجَكُم مِّنۡ أَرۡضِكُم بِسِحۡرِهِۦ فَمَاذَا تَأۡمُرُونَ,“Hắn định dùng pháp thuật để đánh đuổi các khanh ra khỏi lãnh thổ của các khanh. Vậy các khanh có ý xử trí hắn ra sao?”,
26,36,قَالُوٓاْ أَرۡجِهۡ وَأَخَاهُ وَٱبۡعَثۡ فِي ٱلۡمَدَآئِنِ حَٰشِرِينَ,"(Các cận thần của Pha-ra-ông) thưa: “Hãy tạm tha cho hắn và người anh em của hắn, chúng ta sẽ tập hợp các pháp sư trong các thành phố lại.”",
26,37,يَأۡتُوكَ بِكُلِّ سَحَّارٍ عَلِيمٖ,“Tất cả những nhà phù thủy tài giỏi sẽ đến trình diện bệ hạ.”,
26,38,فَجُمِعَ ٱلسَّحَرَةُ لِمِيقَٰتِ يَوۡمٖ مَّعۡلُومٖ,Vậy là các phù thủy được triệu tập tại một nơi hẹn vào một ngày đã được công bố rõ ràng.,
26,39,وَقِيلَ لِلنَّاسِ هَلۡ أَنتُم مُّجۡتَمِعُونَ,Và mọi người bảo nhau: “Các người không đi dự đại hội (để xem ai thắng trong cuộc so tài giữa Musa và các phù thủy) sao?”,
26,40,لَعَلَّنَا نَتَّبِعُ ٱلسَّحَرَةَ إِن كَانُواْ هُمُ ٱلۡغَٰلِبِينَ,“Có lẽ chúng ta sẽ theo các nhà phù thủy nếu họ thắng cuộc.”,
26,41,فَلَمَّا جَآءَ ٱلسَّحَرَةُ قَالُواْ لِفِرۡعَوۡنَ أَئِنَّ لَنَا لَأَجۡرًا إِن كُنَّا نَحۡنُ ٱلۡغَٰلِبِينَ,"Khi đến nơi, những nhà phù thủy thưa với Pha-ra-ông: “Nếu chúng tôi thắng thì chúng tôi có được ban thưởng không?”",
26,42,قَالَ نَعَمۡ وَإِنَّكُمۡ إِذٗا لَّمِنَ ٱلۡمُقَرَّبِينَ,"(Pha-ra-ông) bảo: “Chắc chắn có, nhất định lúc đó các ngươi sẽ trở thành các cận thần của ta.”",
26,43,قَالَ لَهُم مُّوسَىٰٓ أَلۡقُواْ مَآ أَنتُم مُّلۡقُونَ,Musa bảo (các phù thủy): “Quí ngài hãy ném bảo bối của quí ngài xuống.”,
26,44,فَأَلۡقَوۡاْ حِبَالَهُمۡ وَعِصِيَّهُمۡ وَقَالُواْ بِعِزَّةِ فِرۡعَوۡنَ إِنَّا لَنَحۡنُ ٱلۡغَٰلِبُونَ,"Thế là, họ ném những sợi dây và chiếc gậy của họ xuống, nói: “Với quyền lực của Pha-ra-ông, chúng tôi chắc chắn sẽ chiến thắng.”",
26,45,فَأَلۡقَىٰ مُوسَىٰ عَصَاهُ فَإِذَا هِيَ تَلۡقَفُ مَا يَأۡفِكُونَ,"Nhưng khi Musa ném chiếc gậy của Y xuống, nó nuốt mất những món vật mà họ đã làm giả.",
26,46,فَأُلۡقِيَ ٱلسَّحَرَةُ سَٰجِدِينَ,"Lúc đó, những tên phù thủy liền cúi xuống quỳ lạy.",
26,47,قَالُوٓاْ ءَامَنَّا بِرَبِّ ٱلۡعَٰلَمِينَ,Họ nói: “Chúng tôi đã có đức tin nơi Thượng Đế của vũ trụ và vạn vật.”,
26,48,رَبِّ مُوسَىٰ وَهَٰرُونَ,“Thượng Đế của Musa và Harun.”,
26,49,قَالَ ءَامَنتُمۡ لَهُۥ قَبۡلَ أَنۡ ءَاذَنَ لَكُمۡۖ إِنَّهُۥ لَكَبِيرُكُمُ ٱلَّذِي عَلَّمَكُمُ ٱلسِّحۡرَ فَلَسَوۡفَ تَعۡلَمُونَۚ لَأُقَطِّعَنَّ أَيۡدِيَكُمۡ وَأَرۡجُلَكُم مِّنۡ خِلَٰفٖ وَلَأُصَلِّبَنَّكُمۡ أَجۡمَعِينَ,"(Thấy thế), Pha-ra-ông quát (các nhà phù thủy): “Các ngươi dám tin hắn trước khi ta cho phép các ngươi ư? Hắn quả nhiên là tên cầm đầu của các ngươi; hắn đã dạy các ngươi pháp thuật; rồi các ngươi sẽ sớm biết hậu quả. Chắc chắn, ta sẽ cho chặt tay này và chân kia của các ngươi và sẽ cho đóng đinh toàn bộ các ngươi trên thập tự giá.”",
26,50,قَالُواْ لَا ضَيۡرَۖ إِنَّآ إِلَىٰ رَبِّنَا مُنقَلِبُونَ,"(Các nhà phù thủy) trả lời (Pha-ra-ông): “Chẳng có gì thiệt hại cả, bởi vì rồi đây chúng tôi sẽ quay về gặp Thượng Đế của chúng tôi mà thôi.”",
26,51,إِنَّا نَطۡمَعُ أَن يَغۡفِرَ لَنَا رَبُّنَا خَطَٰيَٰنَآ أَن كُنَّآ أَوَّلَ ٱلۡمُؤۡمِنِينَ,“Chúng tôi kỳ vọng Thượng Đế của chúng tôi sẽ tha thứ cho chúng tôi những lỗi lầm của chúng tôi bởi vì chúng tôi là những người có đức tin đầu tiên.”,
26,52,۞ وَأَوۡحَيۡنَآ إِلَىٰ مُوسَىٰٓ أَنۡ أَسۡرِ بِعِبَادِيٓ إِنَّكُم مُّتَّبَعُونَ,"TA đã mặc khải cho Musa, phán: “Ngươi hãy dẫn hết đám bề tôi của TA rời đi ban đêm, quả thật các ngươi sẽ bị truy sát.”",
26,53,فَأَرۡسَلَ فِرۡعَوۡنُ فِي ٱلۡمَدَآئِنِ حَٰشِرِينَ,Rồi Pha-ra-ông cho quân lính loan tin đi khắp các thành phố.,
26,54,إِنَّ هَٰٓؤُلَآءِ لَشِرۡذِمَةٞ قَلِيلُونَ,"“Quả thật, đám dân (Israel) này chỉ là một nhóm nhỏ bé.”",
26,55,وَإِنَّهُمۡ لَنَا لَغَآئِظُونَ,“Chúng thực sự đã phạm tội khi quân vì đã chọc giận ta.”,
26,56,وَإِنَّا لَجَمِيعٌ حَٰذِرُونَ,“Nhưng ta đã luôn cảnh giác đề phòng chúng.”,
26,57,فَأَخۡرَجۡنَٰهُم مِّن جَنَّٰتٖ وَعُيُونٖ,"Bởi thế, TA (Allah) đã tống bọn chúng (Pha-ra-ông và quân lính của hắn) ra khỏi hoa viên và suối nước.",
26,58,وَكُنُوزٖ وَمَقَامٖ كَرِيمٖ,Khỏi những kho tàng châu báu và địa vị cao sang.,
26,59,كَذَٰلِكَۖ وَأَوۡرَثۡنَٰهَا بَنِيٓ إِسۡرَٰٓءِيلَ,"Giống như thế, TA đã cho dân Israel thừa kế (những thứ tốt đẹp đó).",
26,60,فَأَتۡبَعُوهُم مُّشۡرِقِينَ,Rồi (Pha-ra-ông và quân lính của hắn) truy đuổi họ (dân Israel) vào lúc hừng đông.,
26,61,فَلَمَّا تَرَٰٓءَا ٱلۡجَمۡعَانِ قَالَ أَصۡحَٰبُ مُوسَىٰٓ إِنَّا لَمُدۡرَكُونَ,"Khi hai đoàn người đối diện nhau, các tông đồ của Musa nói: “Chắc chắn chúng ta sẽ bị đuổi kịp.”",
26,62,قَالَ كَلَّآۖ إِنَّ مَعِيَ رَبِّي سَيَهۡدِينِ,"(Musa) bảo: “Không đâu, Thượng Đế của Ta luôn sát cánh bên Ta, Ngài sẽ hướng dẫn Ta thôi.”",
26,63,فَأَوۡحَيۡنَآ إِلَىٰ مُوسَىٰٓ أَنِ ٱضۡرِب بِّعَصَاكَ ٱلۡبَحۡرَۖ فَٱنفَلَقَ فَكَانَ كُلُّ فِرۡقٖ كَٱلطَّوۡدِ ٱلۡعَظِيمِ,"Ngay lúc đó, TA mặc khải cho Musa, phán: “Ngươi hãy đánh cây gậy của Ngươi xuống mặt biển.” (Y làm theo), tức khắc biển tách ra làm đôi thành những tảng nước hai bên như hai ngọn núi khổng lồ.",
26,64,وَأَزۡلَفۡنَا ثَمَّ ٱلۡأٓخَرِينَ,TA đẩy đám người kia (Pha-ra-ông và quân lính của hắn) đến gần nơi đó.,
26,65,وَأَنجَيۡنَا مُوسَىٰ وَمَن مَّعَهُۥٓ أَجۡمَعِينَ,Và TA đã cứu nguy Musa và toàn bộ những ai theo Y.,
26,66,ثُمَّ أَغۡرَقۡنَا ٱلۡأٓخَرِينَ,Rồi TA nhấn chìm đám người kia.,
26,67,إِنَّ فِي ذَٰلِكَ لَأٓيَةٗۖ وَمَا كَانَ أَكۡثَرُهُم مُّؤۡمِنِينَ,"Quả thật, trong sự việc đó là một bằng chứng (cho sự trung thực của Musa) nhưng đa số bọn họ không có đức tin.",
26,68,وَإِنَّ رَبَّكَ لَهُوَ ٱلۡعَزِيزُ ٱلرَّحِيمُ,"Và Thượng Đế của Ngươi đích thực là Đấng Quyền Lực, Nhân Từ.",
26,69,وَٱتۡلُ عَلَيۡهِمۡ نَبَأَ إِبۡرَٰهِيمَ,Ngươi (hỡi Thiên Sứ Muhammad) hãy đọc cho họ nghe về câu chuyện của Ibrahim.,
26,70,إِذۡ قَالَ لِأَبِيهِ وَقَوۡمِهِۦ مَا تَعۡبُدُونَ,Khi (Ibrahim) thưa với phụ thân và người dân của mình: “Các người đang thờ phượng gì thế kia?”,
26,71,قَالُواْ نَعۡبُدُ أَصۡنَامٗا فَنَظَلُّ لَهَا عَٰكِفِينَ,"Họ đáp: “Bọn ta đang thờ các bục tượng, bọn ta rất sùng kính các thần linh này.”",
26,72,قَالَ هَلۡ يَسۡمَعُونَكُمۡ إِذۡ تَدۡعُونَ,(Ibrahim) hỏi: “Các bục tượng đó có nghe được các người khi các người cầu xin chúng không?”,
26,73,أَوۡ يَنفَعُونَكُمۡ أَوۡ يَضُرُّونَ,“Hoặc chúng có giúp ích hay hãm hại được các người không?”,
26,74,قَالُواْ بَلۡ وَجَدۡنَآ ءَابَآءَنَا كَذَٰلِكَ يَفۡعَلُونَ,"Họ đáp: “Không, nhưng bọn ta thấy cha mẹ của bọn ta đã làm như vậy.”",
26,75,قَالَ أَفَرَءَيۡتُم مَّا كُنتُمۡ تَعۡبُدُونَ,(Ibrahim) bảo: “Những thứ mà các người đang tôn thờ”,
26,76,أَنتُمۡ وَءَابَآؤُكُمُ ٱلۡأَقۡدَمُونَ,“Và cả những thứ mà tổ tiên xa xưa của các người đã tôn thờ”,
26,77,فَإِنَّهُمۡ عَدُوّٞ لِّيٓ إِلَّا رَبَّ ٱلۡعَٰلَمِينَ,“Đều là kẻ thù của Ta ngoại trừ Thượng Đế của vũ trụ và vạn vật.”,
26,78,ٱلَّذِي خَلَقَنِي فَهُوَ يَهۡدِينِ,“Ngài là Đấng đã tạo ra Ta rồi hướng dẫn Ta.”,
26,79,وَٱلَّذِي هُوَ يُطۡعِمُنِي وَيَسۡقِينِ,“Ngài là Đấng đã cho Ta ăn và cho Ta uống.”,
26,80,وَإِذَا مَرِضۡتُ فَهُوَ يَشۡفِينِ,“Khi Ta bệnh thì Ngài là Đấng cho Ta khỏi bệnh.”,
26,81,وَٱلَّذِي يُمِيتُنِي ثُمَّ يُحۡيِينِ,“Ngài là Đấng làm cho Ta chết rồi làm cho Ta sống lại.”,
26,82,وَٱلَّذِيٓ أَطۡمَعُ أَن يَغۡفِرَ لِي خَطِيٓـَٔتِي يَوۡمَ ٱلدِّينِ,“Ngài là Đấng mà Ta hy vọng sẽ được tha thứ về những tội lỗi của Ta vào Ngày Phán Xét.”,
26,83,رَبِّ هَبۡ لِي حُكۡمٗا وَأَلۡحِقۡنِي بِٱلصَّٰلِحِينَ,"“Lạy Thượng Đế của bề tôi, xin Ngài ban cho bề tôi sự khôn ngoan và xin Ngài nhập bề tôi cùng với những người đức hạnh.”",
26,84,وَٱجۡعَل لِّي لِسَانَ صِدۡقٖ فِي ٱلۡأٓخِرِينَ,“Xin Ngài vinh danh bề tôi trên chiếc lưỡi của những thế hệ mai sau.”,
26,85,وَٱجۡعَلۡنِي مِن وَرَثَةِ جَنَّةِ ٱلنَّعِيمِ,“Xin Ngài làm cho bề tôi thành một người thừa kế Thiên Đàng Hạnh phúc.”,
26,86,وَٱغۡفِرۡ لِأَبِيٓ إِنَّهُۥ كَانَ مِنَ ٱلضَّآلِّينَ,“Xin Ngài tha thứ cho phụ thân của bề tôi bởi ông ấy là một người lầm lạc.”,
26,87,وَلَا تُخۡزِنِي يَوۡمَ يُبۡعَثُونَ,“Xin Ngài đừng hạ nhục bề tôi vào Ngày nhân loại được phục sinh.”,
26,88,يَوۡمَ لَا يَنفَعُ مَالٞ وَلَا بَنُونَ,“Đó là Ngày mà của cải cũng như con cái sẽ không giúp ích được gì.”,
26,89,إِلَّا مَنۡ أَتَى ٱللَّهَ بِقَلۡبٖ سَلِيمٖ,“Ngoại trừ những ai đến với Allah bằng một tấm lòng trong sạch.”,
26,90,وَأُزۡلِفَتِ ٱلۡجَنَّةُ لِلۡمُتَّقِينَ,Thiên Đàng sẽ được mang đến gần những người ngoan đạo.,
26,91,وَبُرِّزَتِ ٱلۡجَحِيمُ لِلۡغَاوِينَ,Hỏa Ngục sẽ được mang đến trước mặt những kẻ lầm lạc.,
26,92,وَقِيلَ لَهُمۡ أَيۡنَ مَا كُنتُمۡ تَعۡبُدُونَ,Có lời bảo họ: “Đâu là những thứ mà các ngươi đã tôn thờ”,
26,93,مِن دُونِ ٱللَّهِ هَلۡ يَنصُرُونَكُمۡ أَوۡ يَنتَصِرُونَ,“Thay vì Allah? Liệu chúng có khả năng giải cứu các ngươi hoặc tự cứu lấy bản thân chúng được không?”,
26,94,فَكُبۡكِبُواْ فِيهَا هُمۡ وَٱلۡغَاوُۥنَ,"Bởi thế, chúng cùng với đám quỷ quái sẽ bị lùa vào Hỏa Ngục.",
26,95,وَجُنُودُ إِبۡلِيسَ أَجۡمَعُونَ,Và toàn bộ binh tướng của Iblis cũng thế.,
26,96,قَالُواْ وَهُمۡ فِيهَا يَخۡتَصِمُونَ,"Và trong lúc cãi vã nhau trong (Hỏa Ngục), họ sẽ nói:",
26,97,تَٱللَّهِ إِن كُنَّا لَفِي ضَلَٰلٖ مُّبِينٍ,"“Thề với Allah, chúng tôi rõ ràng là nhóm người lầm lạc.”",
26,98,إِذۡ نُسَوِّيكُم بِرَبِّ ٱلۡعَٰلَمِينَ,“Khi mà chúng tôi đã suy tôn các ngươi ngang vai với Thượng Đế của vũ trụ và vạn vật.”,
26,99,وَمَآ أَضَلَّنَآ إِلَّا ٱلۡمُجۡرِمُونَ,“Và chỉ những tên tội lỗi mới dắt chúng tôi đi lạc.”,
26,100,فَمَا لَنَا مِن شَٰفِعِينَ,“Thế là chúng tôi chẳng có ai can thiệp.”,
26,101,وَلَا صَدِيقٍ حَمِيمٖ,“Chúng tôi cũng chẳng có một người bạn chân tình nào cả.”,
26,102,فَلَوۡ أَنَّ لَنَا كَرَّةٗ فَنَكُونَ مِنَ ٱلۡمُؤۡمِنِينَ,“Nếu có cơ hội trở lại (trần thế) lần nữa thì chúng tôi sẽ là những người có đức tin.”,
26,103,إِنَّ فِي ذَٰلِكَ لَأٓيَةٗۖ وَمَا كَانَ أَكۡثَرُهُم مُّؤۡمِنِينَ,"Quả thật, trong sự việc đó là một dấu hiệu, nhưng đa số bọn họ không có đức tin.",
26,104,وَإِنَّ رَبَّكَ لَهُوَ ٱلۡعَزِيزُ ٱلرَّحِيمُ,"Quả thật, Thượng Đế của Ngươi là Đấng Quyền Lực, Nhân Từ.",
26,105,كَذَّبَتۡ قَوۡمُ نُوحٍ ٱلۡمُرۡسَلِينَ,Người dân của Nuh đã chối bỏ tất cả Thiên Sứ (của Allah).,
26,106,إِذۡ قَالَ لَهُمۡ أَخُوهُمۡ نُوحٌ أَلَا تَتَّقُونَ,"Khi Nuh, người anh em của họ bảo họ: “Các người không sợ (Allah) sao?”",
26,107,إِنِّي لَكُمۡ رَسُولٌ أَمِينٞ,“Ta đúng thực là Thiên Sứ đáng tin được (Allah) phái đến cho các người.”,
26,108,فَٱتَّقُواْ ٱللَّهَ وَأَطِيعُونِ,"“Thế nên, các người hãy kính sợ Allah và vâng lời Ta.”",
26,109,وَمَآ أَسۡـَٔلُكُمۡ عَلَيۡهِ مِنۡ أَجۡرٍۖ إِنۡ أَجۡرِيَ إِلَّا عَلَىٰ رَبِّ ٱلۡعَٰلَمِينَ,“Ta không đòi các người trả thù lao cho việc đó mà chính Thượng Đế của vũ trụ và vạn vật sẽ ân thưởng cho Ta.”,
26,110,فَٱتَّقُواْ ٱللَّهَ وَأَطِيعُونِ,"“Thế nên, các người hãy kính sợ Allah và vâng lời Ta.”",
26,111,۞ قَالُوٓاْ أَنُؤۡمِنُ لَكَ وَٱتَّبَعَكَ ٱلۡأَرۡذَلُونَ,"Họ (đáp lại lời kêu gọi của Nuh), nói : “Lẽ nào bọn ta lại phải tin ngươi trong khi những kẻ đi theo ngươi toàn là những tên bần cùng?!”",
