surah,ayah,arabic_text,translation,footnotes
97,1,إِنَّآ أَنزَلۡنَٰهُ فِي لَيۡلَةِ ٱلۡقَدۡرِ,"Quả thật, TA (Allah) đã ban (Qur’an) xuống vào một Đêm Định Mệnh.",
97,2,وَمَآ أَدۡرَىٰكَ مَا لَيۡلَةُ ٱلۡقَدۡرِ,Ngươi (Thiên Sứ Muhammad) biết Đêm Định Mệnh là gì không?,
97,3,لَيۡلَةُ ٱلۡقَدۡرِ خَيۡرٞ مِّنۡ أَلۡفِ شَهۡرٖ,Đêm Định Mệnh tốt hơn cả một ngàn tháng.,
97,4,تَنَزَّلُ ٱلۡمَلَٰٓئِكَةُ وَٱلرُّوحُ فِيهَا بِإِذۡنِ رَبِّهِم مِّن كُلِّ أَمۡرٖ,"Trong đêm đó, dưới sự cho phép của Thượng Đế, các Thiên Thần và Ruh (Đại Thiên thần Jibril) xuống trần mang theo Quyết định của Ngài về tất cả mọi vấn đề.",
97,5,سَلَٰمٌ هِيَ حَتَّىٰ مَطۡلَعِ ٱلۡفَجۡرِ,"(Trong đêm đó), sự bằng an kéo dài cho đến hừng đông.",
