surah,ayah,arabic_text,translation,footnotes
105,1,أَلَمۡ تَرَ كَيۡفَ فَعَلَ رَبُّكَ بِأَصۡحَٰبِ ٱلۡفِيلِ,(Này hỡi Muhammad!) Ngươi đã không thấy cách Thượng Đế của Ngươi đối xử với đoàn quân cưỡi voi ư?,
105,2,أَلَمۡ يَجۡعَلۡ كَيۡدَهُمۡ فِي تَضۡلِيلٖ,Chẳng phải Ngài đã phá hỏng kế hoạch của bọn chúng?,
105,3,وَأَرۡسَلَ عَلَيۡهِمۡ طَيۡرًا أَبَابِيلَ,Chẳng phải Ngài đã gửi đàn chim bay đến thành từng đoàn đến tiêu diệt chúng?,
105,4,تَرۡمِيهِم بِحِجَارَةٖ مِّن سِجِّيلٖ,(Đàn chim) đã ném chúng với những viên đá Sijjil.,
105,5,فَجَعَلَهُمۡ كَعَصۡفٖ مَّأۡكُولِۭ,Làm chúng chết la liệt như những cọng rạ khô sau mùa gặt hái.,
