surah,ayah,arabic_text,translation,footnotes
23,79,وَهُوَ ٱلَّذِي ذَرَأَكُمۡ فِي ٱلۡأَرۡضِ وَإِلَيۡهِ تُحۡشَرُونَ,"79. Тој на Земјата ве создава, и пред Него ќе се соберете,",
23,80,وَهُوَ ٱلَّذِي يُحۡيِۦ وَيُمِيتُ وَلَهُ ٱخۡتِلَٰفُ ٱلَّيۡلِ وَٱلنَّهَارِۚ أَفَلَا تَعۡقِلُونَ,"80. Тој живот и смрт дава и само од Него зависи менувањето на ноќта и денот, па зошто не сфатите?",
23,81,بَلۡ قَالُواْ مِثۡلَ مَا قَالَ ٱلۡأَوَّلُونَ,"81. Но, тие зборуваат како што зборуваа тие пред нив.",
23,82,قَالُوٓاْ أَءِذَا مِتۡنَا وَكُنَّا تُرَابٗا وَعِظَٰمًا أَءِنَّا لَمَبۡعُوثُونَ,"82. Велеа: „Зарем кога ќе испоумираме и кога прав и коски ќе станеме, зарем навистина оживеани ќе бидеме?",
23,83,لَقَدۡ وُعِدۡنَا نَحۡنُ وَءَابَآؤُنَا هَٰذَا مِن قَبۡلُ إِنۡ هَٰذَآ إِلَّآ أَسَٰطِيرُ ٱلۡأَوَّلِينَ,"83. И нам и одамна на предците наши тоа ни е ветувано, но, тоа се само измислици на древните народи.",
23,84,قُل لِّمَنِ ٱلۡأَرۡضُ وَمَن فِيهَآ إِن كُنتُمۡ تَعۡلَمُونَ,"84. Запрашај: „Чија е Земјата и сето тоа што е на неа, знаете ли?“",
23,85,سَيَقُولُونَ لِلَّهِۚ قُلۡ أَفَلَا تَذَكَّرُونَ,"85. „На Аллах!“ – ќе одговорат, а ти кажи: „Па зошто тогаш не доаѓате при себе?“",
23,86,قُلۡ مَن رَّبُّ ٱلسَّمَٰوَٰتِ ٱلسَّبۡعِ وَرَبُّ ٱلۡعَرۡشِ ٱلۡعَظِيمِ,86. Запрашај: „Кој е Господарот на седумте небеса и кој е Господарот на Аршот величествен?,
23,87,سَيَقُولُونَ لِلَّهِۚ قُلۡ أَفَلَا تَتَّقُونَ,"87. „Аллах!“ – ќе одговорат, а ти кажи: „Па зошто тогаш не се плашите?“",
23,88,قُلۡ مَنۢ بِيَدِهِۦ مَلَكُوتُ كُلِّ شَيۡءٖ وَهُوَ يُجِيرُ وَلَا يُجَارُ عَلَيۡهِ إِن كُنتُمۡ تَعۡلَمُونَ,"88. Запрашај: „Во чија рака е власта над сè, а Тој зема во заштита, и од кого никој не може да биде заштитен, знаете ли?",
23,89,سَيَقُولُونَ لِلَّهِۚ قُلۡ فَأَنَّىٰ تُسۡحَرُونَ,"89. „Тоа е Аллахово!“ – ќе одговорат, а ти кажи: „Па зошто тогаш дозволувате да бидете заведени?“",
23,90,بَلۡ أَتَيۡنَٰهُم بِٱلۡحَقِّ وَإِنَّهُمۡ لَكَٰذِبُونَ,"90. Да, Ние вистината им ја доставуваме, а тие се навистина лажговци.",
23,91,مَا ٱتَّخَذَ ٱللَّهُ مِن وَلَدٖ وَمَا كَانَ مَعَهُۥ مِنۡ إِلَٰهٍۚ إِذٗا لَّذَهَبَ كُلُّ إِلَٰهِۭ بِمَا خَلَقَ وَلَعَلَا بَعۡضُهُمۡ عَلَىٰ بَعۡضٖۚ سُبۡحَٰنَ ٱللَّهِ عَمَّا يَصِفُونَ,"91. Аллах не си зел Себеси син, и со Него нема друг бог! Инаку, секој бог, со тоа што го создал ќе правел што сака, и еден со друг ќе се победувале. – Возвишен нека е Аллах Кој е далеку од тоа што тие го изнесуваат;",
23,92,عَٰلِمِ ٱلۡغَيۡبِ وَٱلشَّهَٰدَةِ فَتَعَٰلَىٰ عَمَّا يُشۡرِكُونَ,"92. Кој го знае и невидливиот и видливиот свет, и Тој е многу високо над тие кои Му ги здружуваат!",
23,93,قُل رَّبِّ إِمَّا تُرِيَنِّي مَا يُوعَدُونَ,"93. Кажи: „Господару мој, ако сакаш да ми го покажеш тоа со што на нив им се заканува,",
23,94,رَبِّ فَلَا تَجۡعَلۡنِي فِي ٱلۡقَوۡمِ ٱلظَّٰلِمِينَ,"94. тогаш, Господару мој, не оставај ме со народот насилнички!“",
23,95,وَإِنَّا عَلَىٰٓ أَن نُّرِيَكَ مَا نَعِدُهُمۡ لَقَٰدِرُونَ,"95. А Ние, навистина можеме да ти го покажеме тоа со што им се закануваме.",
23,96,ٱدۡفَعۡ بِٱلَّتِي هِيَ أَحۡسَنُ ٱلسَّيِّئَةَۚ نَحۡنُ أَعۡلَمُ بِمَا يَصِفُونَ,"96. Ти со добро возврати му на злото, Ние добро знаеме што изнесуваат тие,",
23,97,وَقُل رَّبِّ أَعُوذُ بِكَ مِنۡ هَمَزَٰتِ ٱلشَّيَٰطِينِ,"97. и кажи: „Јас Тебе, Господару мој, Ти се обраќам за заштита од шејтанските дошепнувања,",
23,98,وَأَعُوذُ بِكَ رَبِّ أَن يَحۡضُرُونِ,"98. и Тебе, Господару мој, Ти се обраќам да ме заштитиш од нивното присуство.“",
23,99,حَتَّىٰٓ إِذَا جَآءَ أَحَدَهُمُ ٱلۡمَوۡتُ قَالَ رَبِّ ٱرۡجِعُونِ,"99. Кога на некој од нив смртта ќе му дојде, тој извикува: „Господару мој, поврати ме",
23,100,لَعَلِّيٓ أَعۡمَلُ صَٰلِحٗا فِيمَا تَرَكۡتُۚ كَلَّآۚ إِنَّهَا كَلِمَةٌ هُوَ قَآئِلُهَاۖ وَمِن وَرَآئِهِم بَرۡزَخٌ إِلَىٰ يَوۡمِ يُبۡعَثُونَ,100. да направам некакво добро во тоа што го пропуштив!“ – Никогаш! Тоа се зборови кои тој ќе ги говори – пред нив препрека ќе има сè до Денот кога ќе бидат оживеани.,
23,101,فَإِذَا نُفِخَ فِي ٱلصُّورِ فَلَآ أَنسَابَ بَيۡنَهُمۡ يَوۡمَئِذٖ وَلَا يَتَسَآءَلُونَ,"101. Па кога во Рогот ќе се дувне, тогаш роднински врски меѓу нив нема да има и меѓусебно нема ништо да се прашаат.",
23,102,فَمَن ثَقُلَتۡ مَوَٰزِينُهُۥ فَأُوْلَٰٓئِكَ هُمُ ٱلۡمُفۡلِحُونَ,"102. Тие чиишто добри дела ќе бидат потешки, тие ќе се спасат,",
23,103,وَمَنۡ خَفَّتۡ مَوَٰزِينُهُۥ فَأُوْلَٰٓئِكَ ٱلَّذِينَ خَسِرُوٓاْ أَنفُسَهُمۡ فِي جَهَنَّمَ خَٰلِدُونَ,"103. а тие чиишто добри дела ќе бидат лесни, тие сосема ќе бидат изгубени, во Џехенемот вечно ќе престојуваат,",
23,104,تَلۡفَحُ وُجُوهَهُمُ ٱلنَّارُ وَهُمۡ فِيهَا كَٰلِحُونَ,104. Огнот лицата ќе им ги гори и со исклештени заби во него ќе бидат.,
23,105,أَلَمۡ تَكُنۡ ءَايَٰتِي تُتۡلَىٰ عَلَيۡكُمۡ فَكُنتُم بِهَا تُكَذِّبُونَ,"105. Зарем Моите ајети не ви се кажувани, а вие ги негиравте?",
23,106,قَالُواْ رَبَّنَا غَلَبَتۡ عَلَيۡنَا شِقۡوَتُنَا وَكُنَّا قَوۡمٗا ضَآلِّينَ,"106. „Господару наш,“ – ќе речат – „нашите страсти беа посилни од нас, па станавме заталкан народ.",
23,107,رَبَّنَآ أَخۡرِجۡنَا مِنۡهَا فَإِنۡ عُدۡنَا فَإِنَّا ظَٰلِمُونَ,"107. Господару наш, извади нè од неа; ако повторно зло направиме, ќе бидеме насилници.“",
23,108,قَالَ ٱخۡسَـُٔواْ فِيهَا وَلَا تُكَلِّمُونِ,"108. „Останете во неа понижени, и ништо не Ми зборувајте!“ – ќе рече Тој.",
23,109,إِنَّهُۥ كَانَ فَرِيقٞ مِّنۡ عِبَادِي يَقُولُونَ رَبَّنَآ ءَامَنَّا فَٱغۡفِرۡ لَنَا وَٱرۡحَمۡنَا وَأَنتَ خَيۡرُ ٱلرَّٰحِمِينَ,"109. Кога некои робови Мои велеа: „Господару мој, ние веруваме, затоа прости ни и смилувај ни се, бидејќи Ти си Најмилостивиот!“",
23,110,فَٱتَّخَذۡتُمُوهُمۡ سِخۡرِيًّا حَتَّىٰٓ أَنسَوۡكُمۡ ذِكۡرِي وَكُنتُم مِّنۡهُمۡ تَضۡحَكُونَ,"110. Вие толку ги исмејувате, што поради тоа на Мене заборавивте и секогаш им се потсмевате.",
23,111,إِنِّي جَزَيۡتُهُمُ ٱلۡيَوۡمَ بِمَا صَبَرُوٓاْ أَنَّهُمۡ هُمُ ٱلۡفَآئِزُونَ,"111. Нив денес Јас ги наградив за тоа што трпеа, тие навистина успеаја.",
23,112,قَٰلَ كَمۡ لَبِثۡتُمۡ فِي ٱلۡأَرۡضِ عَدَدَ سِنِينَ,112. „А колку години поминавте на Земјата?“ – ќе запраша Тој.,
23,113,قَالُواْ لَبِثۡنَا يَوۡمًا أَوۡ بَعۡضَ يَوۡمٖ فَسۡـَٔلِ ٱلۡعَآدِّينَ,"113. „Поминавме само ден или само дел од денот,“ – ќе одговорат – „прашај ги тие што броеја.“",
23,114,قَٰلَ إِن لَّبِثۡتُمۡ إِلَّا قَلِيلٗاۖ لَّوۡ أَنَّكُمۡ كُنتُمۡ تَعۡلَمُونَ,"114. „Па да, кратко поминавте,“ – ќе рече Тој – „само да знаевте!“",
23,115,أَفَحَسِبۡتُمۡ أَنَّمَا خَلَقۡنَٰكُمۡ عَبَثٗا وَأَنَّكُمۡ إِلَيۡنَا لَا تُرۡجَعُونَ,115. „Зарем мислите дека залудно ве создадовме и дека нема да Ни се вратите?“,
23,116,فَتَعَٰلَى ٱللَّهُ ٱلۡمَلِكُ ٱلۡحَقُّۖ لَآ إِلَٰهَ إِلَّا هُوَ رَبُّ ٱلۡعَرۡشِ ٱلۡكَرِيمِ,"116. И нека е Возвишен Аллах, Вистинскиот Владетел, нема друг бог освен Него, Господарот на Аршот величествен!",
23,117,وَمَن يَدۡعُ مَعَ ٱللَّهِ إِلَٰهًا ءَاخَرَ لَا بُرۡهَٰنَ لَهُۥ بِهِۦ فَإِنَّمَا حِسَابُهُۥ عِندَ رَبِّهِۦٓۚ إِنَّهُۥ لَا يُفۡلِحُ ٱلۡكَٰفِرُونَ,"117. А тој што, покрај Аллах, му се моли на друг бог, без никаков доказ за него, пред Господарот свој сметка ќе полага, и неверниците нема да се спасат.",
23,118,وَقُل رَّبِّ ٱغۡفِرۡ وَٱرۡحَمۡ وَأَنتَ خَيۡرُ ٱلرَّٰحِمِينَ,"118. и кажи: „Господару мој, прости и смилувај се, Ти си најдобриот Семилосник!",
