surah,ayah,arabic_text,translation,footnotes
15,94,فَٱصۡدَعۡ بِمَا تُؤۡمَرُ وَأَعۡرِضۡ عَنِ ٱلۡمُشۡرِكِينَ,"Nítorí náà, kéde n̄ǹkan tí A pa láṣẹ fún ọ. Kí o sì ṣẹ́rí kúrò lọ́dọ̀ àwọn ọ̀ṣẹbọ.",
15,95,إِنَّا كَفَيۡنَٰكَ ٱلۡمُسۡتَهۡزِءِينَ,"Dájúdájú Àwa yóò tó ọ (níbi aburú) àwọn oníyẹ̀yẹ́,",
15,96,ٱلَّذِينَ يَجۡعَلُونَ مَعَ ٱللَّهِ إِلَٰهًا ءَاخَرَۚ فَسَوۡفَ يَعۡلَمُونَ,àwọn tó ń mú ọlọ́hun mìíràn mọ́ Allāhu. Láìpẹ́ wọ́n máa mọ̀.,
15,97,وَلَقَدۡ نَعۡلَمُ أَنَّكَ يَضِيقُ صَدۡرُكَ بِمَا يَقُولُونَ,Àwa kúkú ti mọ̀ pé dájúdájú ohun tí wọ́n ń wí ń kó ìnira bá ọ.,
15,98,فَسَبِّحۡ بِحَمۡدِ رَبِّكَ وَكُن مِّنَ ٱلسَّٰجِدِينَ,"Nítorí náà, ṣe àfọ̀mọ́ pẹ̀lú ẹyìn fún Olúwa rẹ.[1] Kí o sì wà nínú àwọn olùforíkanlẹ̀ (fún Un).","1. Ìyẹn ni pé, ṣe àfọ̀mọ́ Allāhu kúrò níbi gbogbo àdínkù àti àbùkù, kí o sì yìn Ín lógo pé, O pé tán pátápátá."
15,99,وَٱعۡبُدۡ رَبَّكَ حَتَّىٰ يَأۡتِيَكَ ٱلۡيَقِينُ,"Jọ́sìn fún Olúwa rẹ títí àmọ̀dájú (ìyẹn, ikú) yóò fi dé bá ọ.",
