surah,ayah,arabic_text,translation,footnotes
113,1,قُلۡ أَعُوذُ بِرَبِّ ٱلۡفَلَقِ,Sọ pé: “Mo sá di Olúwa òwúrọ̀ kùtùkùtù,
113,2,مِن شَرِّ مَا خَلَقَ,"níbi aburú ohun tí Ó dá,[1]","1. Allāhu ni Ẹlẹ́dàá gbogbo n̄ǹkan, ohun rere àti ohun burúkú."
113,3,وَمِن شَرِّ غَاسِقٍ إِذَا وَقَبَ,"àti níbi aburú òru nígbà tí ó bá ṣóòkùn,",
113,4,وَمِن شَرِّ ٱلنَّفَّٰثَٰتِ فِي ٱلۡعُقَدِ,"àti níbi aburú àwọn (òpìdán) tó ń fẹnu fátẹ́gùn túẹ́túẹ́ sínú àwọn ońdè,",
113,5,وَمِن شَرِّ حَاسِدٍ إِذَا حَسَدَ,àti níbi aburú onílara nígbà tí ó bá ṣe ìlara.”,
