surah,ayah,arabic_text,translation,footnotes
1,1,بِسۡمِ ٱللَّهِ ٱلرَّحۡمَٰنِ ٱلرَّحِيمِ,"S imenom Allaha, Svemilosnog, Milostivog!",
1,2,ٱلۡحَمۡدُ لِلَّهِ رَبِّ ٱلۡعَٰلَمِينَ,"Svaka hvala neka je Allahu, Gospodaru svjetova.",
1,3,ٱلرَّحۡمَٰنِ ٱلرَّحِيمِ,"Svemilosnom, Milostivom. ",
1,4,مَٰلِكِ يَوۡمِ ٱلدِّينِ,Vladaru Dana sudnjeg.,
1,5,إِيَّاكَ نَعۡبُدُ وَإِيَّاكَ نَسۡتَعِينُ,Samo Tebi ibadet činimo i samo od Tebe pomoć molimo.,
1,6,ٱهۡدِنَا ٱلصِّرَٰطَ ٱلۡمُسۡتَقِيمَ,Uputi nas na Pravi put.,
1,7,صِرَٰطَ ٱلَّذِينَ أَنۡعَمۡتَ عَلَيۡهِمۡ غَيۡرِ ٱلۡمَغۡضُوبِ عَلَيۡهِمۡ وَلَا ٱلضَّآلِّينَ,"Na put onih kojima si blagodati podario. A ne na put onih na koje se srdžba izlila, niti na put onih koji su zalutali. ",
