surah,ayah,arabic_text,translation,footnotes
95,1,وَٱلتِّينِ وَٱلزَّيۡتُونِ,Савганд ба анҷир ва зайтун [ва ба Фаластин сарзамини рӯиши онҳо],
95,2,وَطُورِ سِينِينَ,Ва савганд ба Тӯри Сино,
95,3,وَهَٰذَا ٱلۡبَلَدِ ٱلۡأَمِينِ,Ва савганд ба ин шаҳри амн [Макка],
95,4,لَقَدۡ خَلَقۡنَا ٱلۡإِنسَٰنَ فِيٓ أَحۡسَنِ تَقۡوِيمٖ,"[Ки] Яқинан, Мо инсонро дар беҳтарин сурат [ва бо фитрати пок] офаридем",
95,5,ثُمَّ رَدَدۡنَٰهُ أَسۡفَلَ سَٰفِلِينَ,Сипас ӯро [ки инҳироф ёфт] ба пасттарин [мароҳили] пастӣ баргардонидем.,
95,6,إِلَّا ٱلَّذِينَ ءَامَنُواْ وَعَمِلُواْ ٱلصَّٰلِحَٰتِ فَلَهُمۡ أَجۡرٌ غَيۡرُ مَمۡنُونٖ,"Магар касоне, ки имон оварданд ва корҳои шоиста анҷом доданд; пас, барои онон подоше пойдор [дар пеш] аст",
95,7,فَمَا يُكَذِّبُكَ بَعۡدُ بِٱلدِّينِ,"Пас, [эй инсон] чи чизе баъд [аз ин ҳама далоили равшан] туро ба такзиби [рӯзи] ҷазо во медорад?",
95,8,أَلَيۡسَ ٱللَّهُ بِأَحۡكَمِ ٱلۡحَٰكِمِينَ,Оё Аллоҳ таоло беҳтарин довар [ва ҳокими мутлақ] нест?,
