surah,ayah,arabic_text,translation,footnotes
52,1,وَٱلطُّورِ,Савганд ба кӯҳи Тур,
52,2,وَكِتَٰبٖ مَّسۡطُورٖ,ва савганд ба китоби навишташуда,
52,3,فِي رَقّٖ مَّنشُورٖ,Дар саҳифаҳои кушуда,
52,4,وَٱلۡبَيۡتِ ٱلۡمَعۡمُورِ,Ва савганд ба «Байту-л-маъмур» [ки фариштагон дар он ба ибодати Парвардигор машғуланд],
52,5,وَٱلسَّقۡفِ ٱلۡمَرۡفُوعِ,Ва савганд ба [осмони баланд ҳамон] сақфи барафрошта [бар замин],
52,6,وَٱلۡبَحۡرِ ٱلۡمَسۡجُورِ,Ва савганд ба дарёи оганда [аз об],
52,7,إِنَّ عَذَابَ رَبِّكَ لَوَٰقِعٞ,"Ки бе тардид, азоби Парвардигорат ба вуқуъ хоҳад пайваст",
52,8,مَّا لَهُۥ مِن دَافِعٖ,Ва ҳеҷ боздорандае онро бознадорад,
52,9,يَوۡمَ تَمُورُ ٱلسَّمَآءُ مَوۡرٗا,"Рӯзе, ки осмон ба сахтӣ дар ҷунбиш ва изтироб афтад",
52,10,وَتَسِيرُ ٱلۡجِبَالُ سَيۡرٗا,Ва кӯҳҳо ба ҳаракате шадид равон шаванд,
52,11,فَوَيۡلٞ يَوۡمَئِذٖ لِّلۡمُكَذِّبِينَ,Дар он рӯз вой ба ҳоли такзибкунандагон,
52,12,ٱلَّذِينَ هُمۡ فِي خَوۡضٖ يَلۡعَبُونَ,"Ҳамон касоне, ки дар беҳудагӯӣ саргарми бозианд",
52,13,يَوۡمَ يُدَعُّونَ إِلَىٰ نَارِ جَهَنَّمَ دَعًّا,"Рӯзе, ки бо хушунат ба сӯйи оташи дузах ронда мешаванд",
52,14,هَٰذِهِ ٱلنَّارُ ٱلَّتِي كُنتُم بِهَا تُكَذِّبُونَ,"[Ба онон гуфта мешавад] «Ин [ҳамон] оташест, ки онро дурӯғ мепиндоштед",
52,15,أَفَسِحۡرٌ هَٰذَآ أَمۡ أَنتُمۡ لَا تُبۡصِرُونَ,Оё ин [оташу азоби] ҷодуст ё [ҳанӯз ҳам онро] намебинед?,
52,16,ٱصۡلَوۡهَا فَٱصۡبِرُوٓاْ أَوۡ لَا تَصۡبِرُواْ سَوَآءٌ عَلَيۡكُمۡۖ إِنَّمَا تُجۡزَوۡنَ مَا كُنتُمۡ تَعۡمَلُونَ,"Ба оташ дароед [ва бисӯзед], ки шикебоӣ ва ношикебоии шумо [дар баробари шуълаҳои сӯзонаш] бароятон яксон аст; танҳо дар баробари он чи кардаед, муҷозот мешавед»",
52,17,إِنَّ ٱلۡمُتَّقِينَ فِي جَنَّٰتٖ وَنَعِيمٖ,"Ба ростӣ, ки парҳезкорон дар боғҳои биҳишт дар нозу неъматанд",
52,18,فَٰكِهِينَ بِمَآ ءَاتَىٰهُمۡ رَبُّهُمۡ وَوَقَىٰهُمۡ رَبُّهُمۡ عَذَابَ ٱلۡجَحِيمِ,"Ва аз бахшишҳои [бедареғи] Парвардигорашон ва аз ин ки аз азоби дузах нигоҳашон доштааст, шодмонанд",
52,19,كُلُواْ وَٱشۡرَبُواْ هَنِيٓـَٔۢا بِمَا كُنتُمۡ تَعۡمَلُونَ,[Ба онон гуфта мешавад] «Ба подоши кирдоратон [дар дунё инак] гуворо бихӯред ва биошомед»,
52,20,مُتَّكِـِٔينَ عَلَىٰ سُرُرٖ مَّصۡفُوفَةٖۖ وَزَوَّجۡنَٰهُم بِحُورٍ عِينٖ,Дар ҳоле ки бар тахтҳое радифшуда такя задаанд ва ҳурони ғизолчашмро ба ҳамсарии онон дармеоварем,
52,21,وَٱلَّذِينَ ءَامَنُواْ وَٱتَّبَعَتۡهُمۡ ذُرِّيَّتُهُم بِإِيمَٰنٍ أَلۡحَقۡنَا بِهِمۡ ذُرِّيَّتَهُمۡ وَمَآ أَلَتۡنَٰهُم مِّنۡ عَمَلِهِم مِّن شَيۡءٖۚ كُلُّ ٱمۡرِيِٕۭ بِمَا كَسَبَ رَهِينٞ,"Муъминоне, ки фарзандонашон дар имон пайрави онон буданд, фарзандонашонро [низ дар биҳишт] ба онон мулҳақ хоҳем кард ва аз [подоши] амалашон заррае намекоҳем; чаро ки [сарнавишти] ҳар кас дар гарави дастоварди худи ӯст",
52,22,وَأَمۡدَدۡنَٰهُم بِفَٰكِهَةٖ وَلَحۡمٖ مِّمَّا يَشۡتَهُونَ,"[Дар биҳишт аз] Ҳар навъ мева ва гӯште, ки бихоҳанд, пайдарпай дар дастрасашон қарор медиҳем.",
52,23,يَتَنَٰزَعُونَ فِيهَا كَأۡسٗا لَّا لَغۡوٞ فِيهَا وَلَا تَأۡثِيمٞ,"Дар он ҷо ҷомҳои шаробе аз дасти якдигар мегиранд, ки на муҷиби беҳудагӯӣ аст ва на гуноҳ;",
52,24,۞ وَيَطُوفُ عَلَيۡهِمۡ غِلۡمَانٞ لَّهُمۡ كَأَنَّهُمۡ لُؤۡلُؤٞ مَّكۡنُونٞ,"Ва навҷавононе [ки барои хидмат] перомунашон дар рафту омаданд, гӯӣ [аз зебоӣ ва сапедрӯӣ] ҳамчун марвориде дар садаф ҳастанд",
52,25,وَأَقۡبَلَ بَعۡضُهُمۡ عَلَىٰ بَعۡضٖ يَتَسَآءَلُونَ,[Биҳиштиён] Ба якдигар рӯ меоваранд ва аз [дунё ва аҳволи гузаштаи] худ суол мекунанд,
52,26,قَالُوٓاْ إِنَّا كُنَّا قَبۡلُ فِيٓ أَهۡلِنَا مُشۡفِقِينَ,Мегӯянд: «Мо дар дунё дар хонаводаи худ [аз азоби илоҳӣ] метарсидем,
52,27,فَمَنَّ ٱللَّهُ عَلَيۡنَا وَوَقَىٰنَا عَذَابَ ٱلسَّمُومِ,Аллоҳ таоло [бо неъмти ислом] бар мо миннат ниҳод ва аз азоби сӯзон [-и дузах] ҳифзамон кард,
52,28,إِنَّا كُنَّا مِن قَبۡلُ نَدۡعُوهُۖ إِنَّهُۥ هُوَ ٱلۡبَرُّ ٱلرَّحِيمُ,"Мо дар зиндагии дунё ҳамвора Ӯро [парастиш мекардем ва ба рубубият] мехондем. Бе тардид, Ӯ накукору меҳрубон аст",
52,29,فَذَكِّرۡ فَمَآ أَنتَ بِنِعۡمَتِ رَبِّكَ بِكَاهِنٖ وَلَا مَجۡنُونٍ,"Пас, [эй Паёмбар, бо оёти Қуръон ба мардум] андарз бидеҳ, ки ба лутфи Парвардигорат [ту бар хилофи иддаои кофирон] на коҳинӣ ва на маҷнун",
52,30,أَمۡ يَقُولُونَ شَاعِرٞ نَّتَرَبَّصُ بِهِۦ رَيۡبَ ٱلۡمَنُونِ,"Оё мегӯянд: «[Муҳаммад] Шоирест, ки мунтазирем, то маргаш фаро расад [ва аз суханонаш раҳоӣ ёбем]?»",
52,31,قُلۡ تَرَبَّصُواْ فَإِنِّي مَعَكُم مِّنَ ٱلۡمُتَرَبِّصِينَ,Бигӯ: «Мунтазир [-и марги ман] бошед; ман низ бо шумо мунтазир хоҳам монд [то азобатонро ба чашм бинам]»,
52,32,أَمۡ تَأۡمُرُهُمۡ أَحۡلَٰمُهُم بِهَٰذَآۚ أَمۡ هُمۡ قَوۡمٞ طَاغُونَ,"Оё ақлҳояшон ба [баёни] ин [суханони ботил] ҳукм мекунад, ё [асосан] мардуме саркаш ҳастанд?",
52,33,أَمۡ يَقُولُونَ تَقَوَّلَهُۥۚ بَل لَّا يُؤۡمِنُونَ,"Оё мегӯянд: «[Муҳаммад] Қуръонро ҷаъл кардааст?». [Ҳаргиз чунин нест] Балки [ғарқ дар такаббуранд, ки] имон намеоваранд",
52,34,فَلۡيَأۡتُواْ بِحَدِيثٖ مِّثۡلِهِۦٓ إِن كَانُواْ صَٰدِقِينَ,"Агар рост мегӯянд, сухане монанди он биёваранд",
52,35,أَمۡ خُلِقُواْ مِنۡ غَيۡرِ شَيۡءٍ أَمۡ هُمُ ٱلۡخَٰلِقُونَ,Оё онон аз ҳеҷ офарида шудаанд ё худ офаринандаи хешанд?,
52,36,أَمۡ خَلَقُواْ ٱلسَّمَٰوَٰتِ وَٱلۡأَرۡضَۚ بَل لَّا يُوقِنُونَ,Оё онон осмонҳо ва заминро офаридаанд? [На] Балки онон яқин надоранд [ки Аллоҳ таоло офаринандаи мутлақ аст],
52,37,أَمۡ عِندَهُمۡ خَزَآئِنُ رَبِّكَ أَمۡ هُمُ ٱلۡمُصَۜيۡطِرُونَ,Оё ганҷинаҳои [неъмат ва ҳидояти] Парвардигорат назди эшон аст? Оё [бар ҳама чиз] тасаллут доранд?,
52,38,أَمۡ لَهُمۡ سُلَّمٞ يَسۡتَمِعُونَ فِيهِۖ فَلۡيَأۡتِ مُسۡتَمِعُهُم بِسُلۡطَٰنٖ مُّبِينٍ,"Оё нардбоне доранд, ки ба василаи он [гуфтори фариштагони ваҳйро] мешунаванд? Пас, ҳар ки шунидааст, бояд далеле равшан биёварад",
52,39,أَمۡ لَهُ ٱلۡبَنَٰتُ وَلَكُمُ ٱلۡبَنُونَ,Оё Аллоҳ таоло фарзандони духтар дорад ва шумо писар?,
52,40,أَمۡ تَسۡـَٔلُهُمۡ أَجۡرٗا فَهُم مِّن مَّغۡرَمٖ مُّثۡقَلُونَ,"[Эй Паёмбар] Оё аз онон подоше дархост мекунӣ, ки [аз пардохташ дар ранҷанд ва харҷаш] барояшон [гарону] сангин аст?",
52,41,أَمۡ عِندَهُمُ ٱلۡغَيۡبُ فَهُمۡ يَكۡتُبُونَ,Оё аз илми ғайб огоҳанд ва [хабарҳои ниҳонро] менависанд?,
52,42,أَمۡ يُرِيدُونَ كَيۡدٗاۖ فَٱلَّذِينَ كَفَرُواْ هُمُ ٱلۡمَكِيدُونَ,Оё қасди найранг[ва нақшаи палиде бароят] доранд? Вале кофирон худ гирифтори найранг [ва тадбири илоҳӣ] ҳастанд,
52,43,أَمۡ لَهُمۡ إِلَٰهٌ غَيۡرُ ٱللَّهِۚ سُبۡحَٰنَ ٱللَّهِ عَمَّا يُشۡرِكُونَ,"Оё онон маъбуде ғайр аз Аллоҳ таоло доранд? Аллоҳ таоло аз он чи бо Ӯ шарик қарор медиҳанд, поку муназзаҳ аст",
52,44,وَإِن يَرَوۡاْ كِسۡفٗا مِّنَ ٱلسَّمَآءِ سَاقِطٗا يَقُولُواْ سَحَابٞ مَّرۡكُومٞ,"[Ин кофирон, ҳатто] Агар порае аз осмонро низ дар ҳоли суқут бубинанд, [боз ҳам имон намеоваранд ва] мегӯянд: «Абре мутароким аст»",
52,45,فَذَرۡهُمۡ حَتَّىٰ يُلَٰقُواْ يَوۡمَهُمُ ٱلَّذِي فِيهِ يُصۡعَقُونَ,"Пас, ононро [ба ҳоли худ] раҳо кун, то бо рӯзи мавъудашон, ки [бо нахустин дамидани сур] мадҳуши марг мегарданд, мувоҷеҳ шаванд",
52,46,يَوۡمَ لَا يُغۡنِي عَنۡهُمۡ كَيۡدُهُمۡ شَيۡـٔٗا وَلَا هُمۡ يُنصَرُونَ,"Рӯзе, ки найрангашон судманд нахоҳад буд ва [аз ҳеҷ сӯ] ёрӣ намешаванд",
52,47,وَإِنَّ لِلَّذِينَ ظَلَمُواْ عَذَابٗا دُونَ ذَٰلِكَ وَلَٰكِنَّ أَكۡثَرَهُمۡ لَا يَعۡلَمُونَ,Ситамгорон [дар дунё низ ба дасти муъминон] ба азоби дигаре гирифтор хоҳанд шуд; вале бештарашон намедонанд,
52,48,وَٱصۡبِرۡ لِحُكۡمِ رَبِّكَ فَإِنَّكَ بِأَعۡيُنِنَاۖ وَسَبِّحۡ بِحَمۡدِ رَبِّكَ حِينَ تَقُومُ,"[Эй Паёмбар] Дар баробари ҳукми Парвардигорат шикебо бош; зеро ту таҳти назар ва ҳифозати Моӣ; ва ҳангоме ки [аз хоб ё ба қасди ибодат] бармехезӣ, Парвардигоратро ба покӣ ситоиш кун",
52,49,وَمِنَ ٱلَّيۡلِ فَسَبِّحۡهُ وَإِدۡبَٰرَ ٱلنُّجُومِ,Ва низ [дар посе] аз шаб Ӯро ситоиш кун [ва намоз бигузор] ва ба ҳангоми нопадид шудани ситорагон [дар сапедадам низ намози субҳ бигузор],
