surah,ayah,arabic_text,translation,footnotes
95,1,وَٱلتِّينِ وَٱلزَّيۡتُونِ,ئەنجۈر بىلەن ۋە زەيتۇن بىلەن قەسەمكى[1]،,
95,2,وَطُورِ سِينِينَ, سىنا تېغى بىلەن قەسەمكى[2]،,
95,3,وَهَٰذَا ٱلۡبَلَدِ ٱلۡأَمِينِ,بۇ تىنچ شەھەر (يەنى مەككە مۇكەررەمە) بىلەن قەسەمكى[3]،,
95,4,لَقَدۡ خَلَقۡنَا ٱلۡإِنسَٰنَ فِيٓ أَحۡسَنِ تَقۡوِيمٖ,بىز ئىنساننى شەك ـ شۈبھىسىز ئەڭ چىرايلىق شەكىلدە ياراتتۇق[4].,
95,5,ثُمَّ رَدَدۡنَٰهُ أَسۡفَلَ سَٰفِلِينَ,ئاندىن ئۇنى (چىرايلىق ياراتقانلىق نېمىتىمىزگە شۈكۈر قىلماي ئاسىيلىق قىلغانلىقتىن) دوزاخقا قايتۇردۇق[5]. ,
95,6,إِلَّا ٱلَّذِينَ ءَامَنُواْ وَعَمِلُواْ ٱلصَّٰلِحَٰتِ فَلَهُمۡ أَجۡرٌ غَيۡرُ مَمۡنُونٖ,پەقەت ئىمان ئېيتقان، ياخشى ئەمەللەرنى قىلغانلار بۇنىڭدىن مۇستەسنا. بۇلارغا ئۈزۈلمەس ساۋاب بېرىلىدۇ[6].,
95,7,فَمَا يُكَذِّبُكَ بَعۡدُ بِٱلدِّينِ,(ئى ئىنسان!) بۇنىڭدىن كېيىن (يەنى روشەن دەلىللەر بايان قىلىنغاندىن كېيىن) يەنە نېمىشقا قىيامەتنى ئىنكار قىلىسەن؟[7],
95,8,أَلَيۡسَ ٱللَّهُ بِأَحۡكَمِ ٱلۡحَٰكِمِينَ,ئاللاھ ئەڭ ئادىل ھۆكۈم قىلغۇچى ئەمەسمۇ؟[8],
