surah,ayah,arabic_text,translation,footnotes
109,1,قُلۡ يَٰٓأَيُّهَا ٱلۡكَٰفِرُونَ,(ئى مۇھەممەد! سېنى بۇتلارغا چوقۇنۇشقا ئۈندىگۈچى كۇففارلارغا) ئېيتقىنكى، «ئى كاپىرلار![1] ,
109,2,لَآ أَعۡبُدُ مَا تَعۡبُدُونَ,سىلەر چوقۇنۇۋاتقان بۇتلارغا مەن چوقۇنمايمەن[2].,
109,3,وَلَآ أَنتُمۡ عَٰبِدُونَ مَآ أَعۡبُدُ,سىلەرمۇ مەن ئىبادەت قىلىۋاتقان ئاللاھقا ئىبادەت قىلمايسىلەر[3].,
109,4,وَلَآ أَنَا۠ عَابِدٞ مَّا عَبَدتُّمۡ,سىلەر چوقۇنغان بۇتلارغا مېنىڭ چوقۇنغىنىم يوق[4].,
109,5,وَلَآ أَنتُمۡ عَٰبِدُونَ مَآ أَعۡبُدُ, سىلەرنىڭمۇ مەن ئىبادەت قىلغان ئاللاھقا ئىبادەت قىلغىنىڭلار يوق[5].,
109,6,لَكُمۡ دِينُكُمۡ وَلِيَ دِينِ, سىلەرنىڭ دىنىڭلار ئۆزۈڭلار ئۈچۈن، مېنىڭ دىنىممۇ ئۆزۈم ئۈچۈن»[6].,
