surah,ayah,arabic_text,translation,footnotes
37,1,وَٱلصَّٰٓفَّٰتِ صَفّٗا,"Demi (rombongan malaikat) yang berbaris bersaf-saf,",
37,2,فَٱلزَّٰجِرَٰتِ زَجۡرٗا,"demi (rombongan) yang mencegah dengan sungguh-sungguh,",
37,3,فَٱلتَّٰلِيَٰتِ ذِكۡرًا,"demi (rombongan) yang membacakan peringatan,",
37,4,إِنَّ إِلَٰهَكُمۡ لَوَٰحِدٞ,"sungguh, Tuhanmu benar-benar Esa.",
37,5,رَّبُّ ٱلسَّمَٰوَٰتِ وَٱلۡأَرۡضِ وَمَا بَيۡنَهُمَا وَرَبُّ ٱلۡمَشَٰرِقِ,"Tuhan langit dan bumi serta apa yang berada di antara keduanya, dan Tuhan tempat-tempat terbitnya matahari.",
37,6,إِنَّا زَيَّنَّا ٱلسَّمَآءَ ٱلدُّنۡيَا بِزِينَةٍ ٱلۡكَوَاكِبِ,Sesungguhnya Kami telah menghias langit dunia (yang terdekat) dengan hiasan bintang-bintang.,
37,7,وَحِفۡظٗا مِّن كُلِّ شَيۡطَٰنٖ مَّارِدٖ,Dan (Kami) telah menjaganya dari setiap setan yang durhaka.,
37,8,لَّا يَسَّمَّعُونَ إِلَى ٱلۡمَلَإِ ٱلۡأَعۡلَىٰ وَيُقۡذَفُونَ مِن كُلِّ جَانِبٖ,"Mereka (setan-setan itu) tidak dapat mendengar (pembicaraan) para malaikat dan mereka dilempari dari segala penjuru,",
37,9,دُحُورٗاۖ وَلَهُمۡ عَذَابٞ وَاصِبٌ,"untuk mengusir mereka, dan mereka akan mendapat azab yang kekal,",
37,10,إِلَّا مَنۡ خَطِفَ ٱلۡخَطۡفَةَ فَأَتۡبَعَهُۥ شِهَابٞ ثَاقِبٞ,kecuali (setan) yang mencuri (pembicaraan); maka ia dikejar oleh bintang yang menyala.,
37,11,فَٱسۡتَفۡتِهِمۡ أَهُمۡ أَشَدُّ خَلۡقًا أَم مَّنۡ خَلَقۡنَآۚ إِنَّا خَلَقۡنَٰهُم مِّن طِينٖ لَّازِبِۭ,"Maka tanyakanlah kepada mereka (musyrik Mekkah), ""Apakah penciptaan mereka yang lebih sulit ataukah apa726) yang telah Kami ciptakan?"" Sesungguhnya Kami telah menciptakan mereka dari tanah liat.","*726) Malaikat, langit, bumi dan lain-lain."
37,12,بَلۡ عَجِبۡتَ وَيَسۡخَرُونَ,Bahkan engkau (Muhammad) menjadi heran (terhadap keingkaran mereka) dan mereka menghinakan (engkau).,
37,13,وَإِذَا ذُكِّرُواْ لَا يَذۡكُرُونَ,"Dan apabila mereka diberi peringatan, mereka tidak mengindahkannya.",
37,14,وَإِذَا رَأَوۡاْ ءَايَةٗ يَسۡتَسۡخِرُونَ,"Dan apabila mereka melihat suatu tanda (kebesaran) Allah, mereka memperolok-olokan.",
37,15,وَقَالُوٓاْ إِنۡ هَٰذَآ إِلَّا سِحۡرٞ مُّبِينٌ,"Dan mereka berkata, ""Ini tidak lain hanyalah sihir yang nyata.""",
37,16,أَءِذَا مِتۡنَا وَكُنَّا تُرَابٗا وَعِظَٰمًا أَءِنَّا لَمَبۡعُوثُونَ,"Apabila kami telah mati dan telah menjadi tanah dan tulang-belulang, apakah benar kami akan dibangkitkan (kembali)?",
37,17,أَوَءَابَآؤُنَا ٱلۡأَوَّلُونَ,"Dan apakah nenek moyang kami yang telah terdahulu (akan dibangkitkan pula)?""",
37,18,قُلۡ نَعَمۡ وَأَنتُمۡ دَٰخِرُونَ,"Katakanlah (Muhammad), ""Ya, dan kamu akan terhina.""",
37,19,فَإِنَّمَا هِيَ زَجۡرَةٞ وَٰحِدَةٞ فَإِذَا هُمۡ يَنظُرُونَ,Maka sesungguhnya kebangkitan itu hanya dengan satu teriakan saja; maka seketika itu mereka melihatnya.,
37,20,وَقَالُواْ يَٰوَيۡلَنَا هَٰذَا يَوۡمُ ٱلدِّينِ,"Dan mereka berkata, ""Alangkah celaka kami! (Kiranya) inilah hari pembalasan itu.""",
37,21,هَٰذَا يَوۡمُ ٱلۡفَصۡلِ ٱلَّذِي كُنتُم بِهِۦ تُكَذِّبُونَ,Inilah hari keputusan727) yang dahulu kamu dustakan.,*727) Hari ketika Allah memberi keputusan dan balasan kepada hamba-hamba-Nya.
37,22,۞ ٱحۡشُرُواْ ٱلَّذِينَ ظَلَمُواْ وَأَزۡوَٰجَهُمۡ وَمَا كَانُواْ يَعۡبُدُونَ,"(Diperintahkan kepada malaikat), ""Kumpulkanlah orang-orang yang zalim beserta teman sejawat mereka dan apa yang dahulu mereka sembah,",
37,23,مِن دُونِ ٱللَّهِ فَٱهۡدُوهُمۡ إِلَىٰ صِرَٰطِ ٱلۡجَحِيمِ,"selain Allah, lalu tunjukkanlah kepada mereka jalan ke nereka.",
37,24,وَقِفُوهُمۡۖ إِنَّهُم مَّسۡـُٔولُونَ,"Tahanlah mereka (di tempat perhentian), sesungguhnya mereka akan ditanya,",
37,25,مَا لَكُمۡ لَا تَنَاصَرُونَ,"""Mengapa kamu tidak tolong-menolong?""",
37,26,بَلۡ هُمُ ٱلۡيَوۡمَ مُسۡتَسۡلِمُونَ,Bahkan mereka pada hari itu menyerah (kepada keputusan Allah).,
37,27,وَأَقۡبَلَ بَعۡضُهُمۡ عَلَىٰ بَعۡضٖ يَتَسَآءَلُونَ,Dan sebagian mereka menghadap kepada sebagian yang lain saling berbantah-bantahan.,
37,28,قَالُوٓاْ إِنَّكُمۡ كُنتُمۡ تَأۡتُونَنَا عَنِ ٱلۡيَمِينِ,"Sesungguhnya (pengikut-pengikut) mereka berkata (kepada pemimpin-pemimpin mereka), ""Kamulah yang dahulu datang kepada kami dari kanan.""728)",*728) Pemimpin-pemimpin itu mendatangi pengikut-pengikutnya dengan membawa tipu muslihat yang memikat hati.
37,29,قَالُواْ بَل لَّمۡ تَكُونُواْ مُؤۡمِنِينَ,"(Pemimpin-pemimpin) mereka menjawab, ""(Tidak), bahkan kamulah yang tidak (mau) menjadi orang mukmin,",
37,30,وَمَا كَانَ لَنَا عَلَيۡكُم مِّن سُلۡطَٰنِۭۖ بَلۡ كُنتُمۡ قَوۡمٗا طَٰغِينَ,"sedangkan kami tidak berkuasa terhadapmu, bahkan kamu menjadi kaum yang melampaui batas.",
37,31,فَحَقَّ عَلَيۡنَا قَوۡلُ رَبِّنَآۖ إِنَّا لَذَآئِقُونَ,Maka pantas putusan (azab) Tuhan menimpa kita; pasti kita akan merasakan (azab itu).,
37,32,فَأَغۡوَيۡنَٰكُمۡ إِنَّا كُنَّا غَٰوِينَ,"Maka kami telah menyesatkan kamu, sesungguhnya kami sendiri, orang-orang yang sesat.""",
37,33,فَإِنَّهُمۡ يَوۡمَئِذٖ فِي ٱلۡعَذَابِ مُشۡتَرِكُونَ,Maka sesunguhnya mereka pada hari itu bersama-sama merasakan azab.,
37,34,إِنَّا كَذَٰلِكَ نَفۡعَلُ بِٱلۡمُجۡرِمِينَ,"Sungguh, demikianlah Kami memperlakukan terhadap orang-orang yang berbuat dosa.",
37,35,إِنَّهُمۡ كَانُوٓاْ إِذَا قِيلَ لَهُمۡ لَآ إِلَٰهَ إِلَّا ٱللَّهُ يَسۡتَكۡبِرُونَ,"Sungguh, dahulu apabila dikatakan kepada mereka, ""Lā ilāha illallāh"" (Tidak ada tuhan yang berhak disembah selain Allah), mereka menyombongkan diri,",
37,36,وَيَقُولُونَ أَئِنَّا لَتَارِكُوٓاْ ءَالِهَتِنَا لِشَاعِرٖ مَّجۡنُونِۭ,"dan mereka berkata, ""Apakah kami harus meninggalkan sesembahan kami karena seorang penyair gila?""",
37,37,بَلۡ جَآءَ بِٱلۡحَقِّ وَصَدَّقَ ٱلۡمُرۡسَلِينَ,Padahal dia (Muhammad) datang dengan membawa kebenaran dan membenarkan rasul-rasul (sebelumnya).,
37,38,إِنَّكُمۡ لَذَآئِقُواْ ٱلۡعَذَابِ ٱلۡأَلِيمِ,"Sungguh, kamu pasti akan merasakan azab yang pedih.",
37,39,وَمَا تُجۡزَوۡنَ إِلَّا مَا كُنتُمۡ تَعۡمَلُونَ,"Dan kamu tidak diberi balasan melainkan terhadap apa yang telah kamu kerjakan,",
37,40,إِلَّا عِبَادَ ٱللَّهِ ٱلۡمُخۡلَصِينَ,"tetapi hamba-hamba Allah yang dibersihkan (dari dosa),",
37,41,أُوْلَٰٓئِكَ لَهُمۡ رِزۡقٞ مَّعۡلُومٞ,"mereka itu memperoleh rezeki yang sudah ditentukan,",
37,42,فَوَٰكِهُ وَهُم مُّكۡرَمُونَ,"(yaitu) buah-buahan. Dan mereka orang yang dimuliakan,",
37,43,فِي جَنَّٰتِ ٱلنَّعِيمِ,"di dalam surga-surga yang penuh kenikmatan,",
37,44,عَلَىٰ سُرُرٖ مُّتَقَٰبِلِينَ,(mereka duduk) berhadap-hadapan di atas dipan-dipan.,
37,45,يُطَافُ عَلَيۡهِم بِكَأۡسٖ مِّن مَّعِينِۭ,"Kepada mereka diedarkan gelas (yang berisi air) dari mata air (surga),",
37,46,بَيۡضَآءَ لَذَّةٖ لِّلشَّٰرِبِينَ,"(warnanya) putih bersih, sedap rasanya bagi orang-orang yang minum.",
37,47,لَا فِيهَا غَوۡلٞ وَلَا هُمۡ عَنۡهَا يُنزَفُونَ,Tidak ada di dalamnya (unsur) yang memabukkan dan mereka tidak mabuk karenanya.,
37,48,وَعِندَهُمۡ قَٰصِرَٰتُ ٱلطَّرۡفِ عِينٞ,"Dan di sisi mereka ada (bidadari-bidadari) yang bermata indah, dan membatasi pandangannya,",
37,49,كَأَنَّهُنَّ بَيۡضٞ مَّكۡنُونٞ,seakan-akan mereka adalah telur yang tersimpan dengan baik.,
37,50,فَأَقۡبَلَ بَعۡضُهُمۡ عَلَىٰ بَعۡضٖ يَتَسَآءَلُونَ,Lalu mereka berhadap-hadapan satu sama lain sambil bercakap-cakap.,
37,51,قَالَ قَآئِلٞ مِّنۡهُمۡ إِنِّي كَانَ لِي قَرِينٞ,"Berkatalah salah seorang di antara mereka, ""Sesungguhnya aku dahulu (di dunia) pernah mempunyai seorang teman,",
37,52,يَقُولُ أَءِنَّكَ لَمِنَ ٱلۡمُصَدِّقِينَ,"yang berkata, ""Apakah sesungguhnya kamu termasuk orang-orang yang membenarkan (hari berbangkit)?",
37,53,أَءِذَا مِتۡنَا وَكُنَّا تُرَابٗا وَعِظَٰمًا أَءِنَّا لَمَدِينُونَ,"Apabila kita telah mati dan telah menjadi tanah dan tulang-belulang, apakah kita benar-benar (akan dibangkitkan) untuk diberi pembalasan?""",
37,54,قَالَ هَلۡ أَنتُم مُّطَّلِعُونَ,"Dia berkata, ""Maukah kamu meninjau (temanku itu)?""",
37,55,فَٱطَّلَعَ فَرَءَاهُ فِي سَوَآءِ ٱلۡجَحِيمِ,"Maka dia meninjaunya, lalu dia melihat (teman)nya itu di tengah-tengah neraka yang menyala-nyala.",
37,56,قَالَ تَٱللَّهِ إِن كِدتَّ لَتُرۡدِينِ,"Dia berkata, ""Demi Allah, engkau hampir saja mencelakakanku,",
37,57,وَلَوۡلَا نِعۡمَةُ رَبِّي لَكُنتُ مِنَ ٱلۡمُحۡضَرِينَ,"dan sekiranya bukan karena nikmat Tuhanku pastilah aku termasuk orang-orang yang diseret (ke neraka).""",
37,58,أَفَمَا نَحۡنُ بِمَيِّتِينَ,Maka apakah kita tidak akan mati?,
37,59,إِلَّا مَوۡتَتَنَا ٱلۡأُولَىٰ وَمَا نَحۡنُ بِمُعَذَّبِينَ,"Kecuali kematian kita yang pertama saja (di dunia), dan kita tidak akan diazab (di akhirat ini)?""",
37,60,إِنَّ هَٰذَا لَهُوَ ٱلۡفَوۡزُ ٱلۡعَظِيمُ,"Sungguh, ini benar-benar kemenangan yang agung.",
37,61,لِمِثۡلِ هَٰذَا فَلۡيَعۡمَلِ ٱلۡعَٰمِلُونَ,"Untuk (kemenangan) serupa ini, hendaklah beramal orang-orang yang mampu beramal.",
37,62,أَذَٰلِكَ خَيۡرٞ نُّزُلًا أَمۡ شَجَرَةُ ٱلزَّقُّومِ,Apakah (makanan surga) itu hidangan yang lebih baik ataukah pohon zaqqum.,
37,63,إِنَّا جَعَلۡنَٰهَا فِتۡنَةٗ لِّلظَّٰلِمِينَ,"Sungguh, Kami menjadikannya (pohon zaqqum) sebagai azab bagi orang-orang zalim.",
37,64,إِنَّهَا شَجَرَةٞ تَخۡرُجُ فِيٓ أَصۡلِ ٱلۡجَحِيمِ,"Sungguh, itu adalah pohon yang keluar dari dasar neraka Jahim,",
37,65,طَلۡعُهَا كَأَنَّهُۥ رُءُوسُ ٱلشَّيَٰطِينِ,mayangnya seperti kepala-kepala setan.,
37,66,فَإِنَّهُمۡ لَأٓكِلُونَ مِنۡهَا فَمَالِـُٔونَ مِنۡهَا ٱلۡبُطُونَ,"Maka sungguh, mereka benar-benar memakan sebagian darinya (buah pohon itu), dan mereka memenuhi perutnya dengan buahnya (zaqqum).",
37,67,ثُمَّ إِنَّ لَهُمۡ عَلَيۡهَا لَشَوۡبٗا مِّنۡ حَمِيمٖ,"Kemudian sungguh, setelah makan (buah zaqqum) mereka mendapat minuman yang dicampur dengan air yang sangat panas.",
37,68,ثُمَّ إِنَّ مَرۡجِعَهُمۡ لَإِلَى ٱلۡجَحِيمِ,Kemudian pasti tempat kembali mereka ke neraka Jahim.,
37,69,إِنَّهُمۡ أَلۡفَوۡاْ ءَابَآءَهُمۡ ضَآلِّينَ,"Sesungguhnya mereka mendapati nenek moyang mereka dalam keadaan sesat,",
37,70,فَهُمۡ عَلَىٰٓ ءَاثَٰرِهِمۡ يُهۡرَعُونَ,lalu mereka tergesa-gesa mengikuti jejak (nenek moyang) mereka.,
37,71,وَلَقَدۡ ضَلَّ قَبۡلَهُمۡ أَكۡثَرُ ٱلۡأَوَّلِينَ,"Dan sungguh, sebelum mereka (suku Quraisy), telah sesat sebagian besar dari orang-orang yang dahulu.",
37,72,وَلَقَدۡ أَرۡسَلۡنَا فِيهِم مُّنذِرِينَ,"Dan sungguh, Kami telah mengutus (rasul) pemberi peringatan di kalangan mereka.",
37,73,فَٱنظُرۡ كَيۡفَ كَانَ عَٰقِبَةُ ٱلۡمُنذَرِينَ,"Maka perhatikanlah bagaimana kesudahan orang-orang yang diberi peringatan itu,",
37,74,إِلَّا عِبَادَ ٱللَّهِ ٱلۡمُخۡلَصِينَ,kecuali hamba-hamba Allah yang disucikan (dari dosa).,
37,75,وَلَقَدۡ نَادَىٰنَا نُوحٞ فَلَنِعۡمَ ٱلۡمُجِيبُونَ,"Dan sungguh, Nuh telah berdoa kepada Kami, maka sungguh, Kamilah sebaik-baik yang memperkenankan doa.",
37,76,وَنَجَّيۡنَٰهُ وَأَهۡلَهُۥ مِنَ ٱلۡكَرۡبِ ٱلۡعَظِيمِ,Kami telah menyelamatkan dia dan pengikutnya dari bencana yang besar.,
37,77,وَجَعَلۡنَا ذُرِّيَّتَهُۥ هُمُ ٱلۡبَاقِينَ,Dan Kami jadikan anak cucunya orang-orang yang melanjutkan keturunan.,
37,78,وَتَرَكۡنَا عَلَيۡهِ فِي ٱلۡأٓخِرِينَ,Dan Kami abadikan untuk Nuh (pujian) di kalangan orang-orang yang datang kemudian;,
37,79,سَلَٰمٌ عَلَىٰ نُوحٖ فِي ٱلۡعَٰلَمِينَ,"""Kesejahteraan (Kami limpahkan) atas Nuh di seluruh alam.""",
37,80,إِنَّا كَذَٰلِكَ نَجۡزِي ٱلۡمُحۡسِنِينَ,"Sungguh, demikianlah Kami memberi balasan kepada orang-orang yang berbuat baik.",
37,81,إِنَّهُۥ مِنۡ عِبَادِنَا ٱلۡمُؤۡمِنِينَ,"Sungguh, dia termasuk hamba-hamba Kami yang beriman.",
37,82,ثُمَّ أَغۡرَقۡنَا ٱلۡأٓخَرِينَ,Kemudian Kami tenggelamkan yang lain.,
37,83,۞ وَإِنَّ مِن شِيعَتِهِۦ لَإِبۡرَٰهِيمَ,"Dan sungguh, Ibrahim termasuk golongannya (Nuh).729)",*729) Nabi Ibrahim -'alaihissalām- termasuk golongan Nabi Nuh -'alaihissalām- dalam keimanan kepada Allah dan pokok-pokok ajaran agama.
37,84,إِذۡ جَآءَ رَبَّهُۥ بِقَلۡبٖ سَلِيمٍ,"(Ingatlah) ketika dia datang kepada Tuhannya dengan hati yang suci,730)",*730) Mengikhlaskan hatinya kepada Allah dengan sepenuhnya.
37,85,إِذۡ قَالَ لِأَبِيهِ وَقَوۡمِهِۦ مَاذَا تَعۡبُدُونَ,"(ingatlah) ketika dia berkata kepada ayahnya dan kaumnya, ""Apakah yang kamu sembah itu?",
37,86,أَئِفۡكًا ءَالِهَةٗ دُونَ ٱللَّهِ تُرِيدُونَ,Apakah kamu menghendaki kebohongan dengan sesembahan selain Allah itu?,
37,87,فَمَا ظَنُّكُم بِرَبِّ ٱلۡعَٰلَمِينَ,"Maka bagaimana anggapanmu terhadap Tuhan seluruh alam?""",
37,88,فَنَظَرَ نَظۡرَةٗ فِي ٱلنُّجُومِ,"Lalu dia memandang sekilas ke bintang-bintang,",
37,89,فَقَالَ إِنِّي سَقِيمٞ,"kemudian dia (Ibrahim) berkata, ""Sesungguhnya aku sakit.""",
37,90,فَتَوَلَّوۡاْ عَنۡهُ مُدۡبِرِينَ,Lalu mereka berpaling darinya dan pergi meninggalkannya.,
37,91,فَرَاغَ إِلَىٰٓ ءَالِهَتِهِمۡ فَقَالَ أَلَا تَأۡكُلُونَ,"Kemudian dia (Ibrahim) pergi dengan diam-diam kepada berhala-berhala mereka; lalu dia berkata, ""Mengapa kamu tidak makan?731)","*731) Mengejek berhala-berhala itu, karena dekat berhala itu banyak diletakkan makanan-makanan yang baik sebagai sajian-sajian."
37,92,مَا لَكُمۡ لَا تَنطِقُونَ,"Mengapa kamu tidak menjawab?""",
37,93,فَرَاغَ عَلَيۡهِمۡ ضَرۡبَۢا بِٱلۡيَمِينِ,Lalu dihadapinya (berhala-berhala) itu sambil memukulnya dengan tangan kanannya.,
37,94,فَأَقۡبَلُوٓاْ إِلَيۡهِ يَزِفُّونَ,Kemudian mereka (kaumnya) datang bergegas kepadanya.,
37,95,قَالَ أَتَعۡبُدُونَ مَا تَنۡحِتُونَ,"Dia (Ibrahim) berkata, ""Apakah kamu menyembah patung-patung yang kamu pahat itu?",
37,96,وَٱللَّهُ خَلَقَكُمۡ وَمَا تَعۡمَلُونَ,"Padahal Allah lah yang menciptakan kamu dan apa yang kamu perbuat.""",
37,97,قَالُواْ ٱبۡنُواْ لَهُۥ بُنۡيَٰنٗا فَأَلۡقُوهُ فِي ٱلۡجَحِيمِ,"Mereka berkata, ""Buatlah bangunan (perapian) untuknya (membakar Ibrahim); lalu lemparkan dia ke dalam api yang menyala-nyala itu.""",
37,98,فَأَرَادُواْ بِهِۦ كَيۡدٗا فَجَعَلۡنَٰهُمُ ٱلۡأَسۡفَلِينَ,"Maka mereka bermaksud memperdayainya dengan (membakar)nya, (namun Allah menyelamatkannya), lalu Kami jadikan mereka orang-orang yang hina.",
37,99,وَقَالَ إِنِّي ذَاهِبٌ إِلَىٰ رَبِّي سَيَهۡدِينِ,"Dan dia (Ibrahim) berkata, ""Sesungguhnya aku harus pergi (menghadap) kepada Tuhanku, Dia akan memberi petunjuk kepadaku.732)",*732) Nabi Ibrahim -'alaihissalām- pergi ke suatu negeri untuk dapat menyembah Allah dan berdakwah.
37,100,رَبِّ هَبۡ لِي مِنَ ٱلصَّٰلِحِينَ,"Ya Tuhanku, anugerahkanlah kepadaku (seorang anak) yang saleh.""",
37,101,فَبَشَّرۡنَٰهُ بِغُلَٰمٍ حَلِيمٖ,Maka Kami beri kabar gembira kepadanya dengan (kelahiran) seorang anak yang sangat sabar (Ismail).,
37,102,فَلَمَّا بَلَغَ مَعَهُ ٱلسَّعۡيَ قَالَ يَٰبُنَيَّ إِنِّيٓ أَرَىٰ فِي ٱلۡمَنَامِ أَنِّيٓ أَذۡبَحُكَ فَٱنظُرۡ مَاذَا تَرَىٰۚ قَالَ يَٰٓأَبَتِ ٱفۡعَلۡ مَا تُؤۡمَرُۖ سَتَجِدُنِيٓ إِن شَآءَ ٱللَّهُ مِنَ ٱلصَّٰبِرِينَ,"Maka ketika anak itu sampai (pada umur) sanggup berusaha bersamanya, (Ibrahim) berkata, ""Wahai anakku! Sesungguhnya aku bermimpi bahwa aku menyembelihmu. Maka bagaimanakah pendapatmu?"" Dia (Ismail) menjawab, ""Wahai ayahku! Lakukanlah apa yang diperintahkan (Allah) kepadamu; insyā Allah engkau akan mendapatiku termasuk orang yang sabar.""",
37,103,فَلَمَّآ أَسۡلَمَا وَتَلَّهُۥ لِلۡجَبِينِ,"Maka ketika keduanya telah berserah diri dan dia (Ibrahim) membaringkan anaknya atas pelipisnya, (untuk melaksanakan perintah Allah).",
37,104,وَنَٰدَيۡنَٰهُ أَن يَٰٓإِبۡرَٰهِيمُ,"Lalu Kami panggil dia, ""Wahai Ibrahim!",
37,105,قَدۡ صَدَّقۡتَ ٱلرُّءۡيَآۚ إِنَّا كَذَٰلِكَ نَجۡزِي ٱلۡمُحۡسِنِينَ,"Sungguh, engkau telah membenarkan mimpi itu.""733) Sungguh, demikianlah Kami memberi balasan kepada orang-orang yang berbuat baik.",*733) Mempercayai bahwa mimpi itu benar dari Allah -ṣallallāhu 'alaihi wa sallam- dan wajib dilaksanakan.
37,106,إِنَّ هَٰذَا لَهُوَ ٱلۡبَلَٰٓؤُاْ ٱلۡمُبِينُ,Sesungguhnya ini benar-benar suatu ujian yang nyata.,
37,107,وَفَدَيۡنَٰهُ بِذِبۡحٍ عَظِيمٖ,Dan Kami tebus anak itu dengan seekor sembelihan yang besar.734),"*734) Setelah nyata kesabaran dan ketaatan Nabi Ibrahim dan Nabi Ismail -'alaihimassalām- maka Allah melarang menyembelih Nabi Ismail -'alaihissalām- untuk meneruskan kurban, Allah menggantinya dengan seekor sembelihan (kambing). Peristiwa ini menjadi dasar disyariatkannya kurban yang dilakukan pada Hari Raya Haji."
37,108,وَتَرَكۡنَا عَلَيۡهِ فِي ٱلۡأٓخِرِينَ,"Dan Kami abadikan untuk Ibrahim (pujian) di kalangan orang-orang yang datang kemudian,",
37,109,سَلَٰمٌ عَلَىٰٓ إِبۡرَٰهِيمَ,"""Selamat sejahtera bagi Ibrahim.""",
37,110,كَذَٰلِكَ نَجۡزِي ٱلۡمُحۡسِنِينَ,Demikianlah Kami memberi balasan kepada orang-orang yang berbuat baik.,
37,111,إِنَّهُۥ مِنۡ عِبَادِنَا ٱلۡمُؤۡمِنِينَ,"Sungguh, dia termasuk hamba-hamba Kami yang beriman.",
37,112,وَبَشَّرۡنَٰهُ بِإِسۡحَٰقَ نَبِيّٗا مِّنَ ٱلصَّٰلِحِينَ,Dan Kami beri dia kabar gembira dengan (kelahiran) Ishak seorang nabi yang termasuk orang-orang yang saleh.,
37,113,وَبَٰرَكۡنَا عَلَيۡهِ وَعَلَىٰٓ إِسۡحَٰقَۚ وَمِن ذُرِّيَّتِهِمَا مُحۡسِنٞ وَظَالِمٞ لِّنَفۡسِهِۦ مُبِينٞ,Dan Kami limpahkan keberkahan kepadanya dan kepada Ishak. Dan di antara keturunan keduanya ada yang berbuat baik dan ada (pula) yang terang-terangan berbuat zalim terhadap dirinya sendiri.,
37,114,وَلَقَدۡ مَنَنَّا عَلَىٰ مُوسَىٰ وَهَٰرُونَ,"Dan sungguh, Kami telah melimpahkan nikmat kepada Musa dan Harun.",
37,115,وَنَجَّيۡنَٰهُمَا وَقَوۡمَهُمَا مِنَ ٱلۡكَرۡبِ ٱلۡعَظِيمِ,Dan Kami selamatkan keduanya dan kaumnya dari bencana yang besar.,
37,116,وَنَصَرۡنَٰهُمۡ فَكَانُواْ هُمُ ٱلۡغَٰلِبِينَ,"Dan Kami tolong mereka, sehingga jadilah mereka orang-orang yang menang.",
37,117,وَءَاتَيۡنَٰهُمَا ٱلۡكِتَٰبَ ٱلۡمُسۡتَبِينَ,Dan Kami berikan kepada keduanya Kitab yang sangat jelas.,
37,118,وَهَدَيۡنَٰهُمَا ٱلصِّرَٰطَ ٱلۡمُسۡتَقِيمَ,Dan Kami tunjukkan keduanya jalan yang lurus.,
37,119,وَتَرَكۡنَا عَلَيۡهِمَا فِي ٱلۡأٓخِرِينَ,"Dan Kami abadikan untuk keduanya (pujian) di kalangan orang-orang yang datang kemudian,",
37,120,سَلَٰمٌ عَلَىٰ مُوسَىٰ وَهَٰرُونَ,"""Selamat sejahtera bagi Musa dan Harun.""",
37,121,إِنَّا كَذَٰلِكَ نَجۡزِي ٱلۡمُحۡسِنِينَ,Demikianlah Kami memberi balasan kepada orang-orang yang berbuat baik.,
37,122,إِنَّهُمَا مِنۡ عِبَادِنَا ٱلۡمُؤۡمِنِينَ,"Sungguh, keduanya termasuk hamba-hamba Kami yang beriman.",
37,123,وَإِنَّ إِلۡيَاسَ لَمِنَ ٱلۡمُرۡسَلِينَ,"Dan sungguh, Ilyas benar-benar termasuk salah seorang rasul.",
37,124,إِذۡ قَالَ لِقَوۡمِهِۦٓ أَلَا تَتَّقُونَ,"(Ingatlah) ketika dia berkata kepada kaumnya, ""Mengapa kamu tidak bertakwa?",
37,125,أَتَدۡعُونَ بَعۡلٗا وَتَذَرُونَ أَحۡسَنَ ٱلۡخَٰلِقِينَ,"Patutkah kamu menyembah Ba'l 735) dan kamu tinggalkan (Allah) sebaik-baik Pencipta,",*735) Ba'l adalah nama salah satu berhala dari orang Phunicia.
37,126,ٱللَّهَ رَبَّكُمۡ وَرَبَّ ءَابَآئِكُمُ ٱلۡأَوَّلِينَ,"(yaitu) Allah Tuhanmu dan Tuhan nenek moyangmu yang terdahulu?""",
37,127,فَكَذَّبُوهُ فَإِنَّهُمۡ لَمُحۡضَرُونَ,"Tetapi mereka mendustakannya (Ilyas), maka sungguh, mereka akan diseret (ke neraka),",
37,128,إِلَّا عِبَادَ ٱللَّهِ ٱلۡمُخۡلَصِينَ,kecuali hamba-hamba Allah yang disucikan (dari dosa).,
37,129,وَتَرَكۡنَا عَلَيۡهِ فِي ٱلۡأٓخِرِينَ,"Dan Kami abadikan untuk Ilyas (pujian) di kalangan orang-orang yang datang kemudian,",
37,130,سَلَٰمٌ عَلَىٰٓ إِلۡ يَاسِينَ,"""Selamat sejahtera bagi Ilyas.""",
37,131,إِنَّا كَذَٰلِكَ نَجۡزِي ٱلۡمُحۡسِنِينَ,Demikianlah Kami memberi balasan kepada orang-orang yang berbuat baik.,
37,132,إِنَّهُۥ مِنۡ عِبَادِنَا ٱلۡمُؤۡمِنِينَ,"Sungguh, dia termasuk hamba-hamba Kami yang beriman.",
37,133,وَإِنَّ لُوطٗا لَّمِنَ ٱلۡمُرۡسَلِينَ,"Dan sungguh, Luṭ benar-benar termasuk salah seorang rasul.",
37,134,إِذۡ نَجَّيۡنَٰهُ وَأَهۡلَهُۥٓ أَجۡمَعِينَ,"(Ingatlah) ketika Kami telah menyelamatkan dia dan pengikutnya semua,",
37,135,إِلَّا عَجُوزٗا فِي ٱلۡغَٰبِرِينَ,kecuali seorang perempuan tua (istrinya) bersama-sama orang yang tinggal (di kota).,
37,136,ثُمَّ دَمَّرۡنَا ٱلۡأٓخَرِينَ,Kemudian Kami binasakan orang-orang yang lain.736),*736) Mereka yang tinggal di kota yang tidak ikut bersama Nabi Luṭ -'alaihissalām-.
37,137,وَإِنَّكُمۡ لَتَمُرُّونَ عَلَيۡهِم مُّصۡبِحِينَ,"Dan sesungguhnya kamu (penduduk Mekkah) benar-benar akan melalui (bekas-bekas) mereka pada waktu pagi,",
37,138,وَبِٱلَّيۡلِۚ أَفَلَا تَعۡقِلُونَ,dan pada waktu malam. Maka mengapa kamu tidak mengerti?,
37,139,وَإِنَّ يُونُسَ لَمِنَ ٱلۡمُرۡسَلِينَ,"Dan sungguh, Yunus benar-benar termasuk salah seorang rasul,",
37,140,إِذۡ أَبَقَ إِلَى ٱلۡفُلۡكِ ٱلۡمَشۡحُونِ,"(ingatlah) ketika dia lari,737) ke kapal yang penuh muatan,",*737) Pergi meninggalkan kewajiban.
