surah,ayah,arabic_text,translation,footnotes
1,1,بِسۡمِ ٱللَّهِ ٱلرَّحۡمَٰنِ ٱلرَّحِيمِ,Меҳрибон ва Раҳмли Аллоҳ номи билан (бошлайман).,
1,2,ٱلۡحَمۡدُ لِلَّهِ رَبِّ ٱلۡعَٰلَمِينَ,Ҳамд оламлар Парвардигори Аллоҳникидир.,
1,3,ٱلرَّحۡمَٰنِ ٱلرَّحِيمِ,Меҳрибон ва Раҳмли.,
1,4,مَٰلِكِ يَوۡمِ ٱلدِّينِ,Қиёмат кунининг Эгаси.,
1,5,إِيَّاكَ نَعۡبُدُ وَإِيَّاكَ نَسۡتَعِينُ,Сенгагина ибодат қиламиз ва Сендангина ёрдам сўраймиз.,
1,6,ٱهۡدِنَا ٱلصِّرَٰطَ ٱلۡمُسۡتَقِيمَ,Бизни тўғри йўлга йўллагин.,
1,7,صِرَٰطَ ٱلَّذِينَ أَنۡعَمۡتَ عَلَيۡهِمۡ غَيۡرِ ٱلۡمَغۡضُوبِ عَلَيۡهِمۡ وَلَا ٱلضَّآلِّينَ,Ўзинг неъмат берганларинг йўлига. Ғазабга учраганлар ва адашганларнинг (йўлига) эмас.,
