surah,ayah,arabic_text,translation,footnotes
37,133,وَإِنَّ لُوطٗا لَّمِنَ ٱلۡمُرۡسَلِينَ,"Лут ҳам, шак-шубҳасиз, пайғамбарлардандир.",
37,134,إِذۡ نَجَّيۡنَٰهُ وَأَهۡلَهُۥٓ أَجۡمَعِينَ,Ўшанда Биз унга ва унинг барча аҳлига нажот бердик.,
37,135,إِلَّا عَجُوزٗا فِي ٱلۡغَٰبِرِينَ,Фақат азобда қолгувчилар орасидаги бир кампиргина бундан мустасно.,
37,136,ثُمَّ دَمَّرۡنَا ٱلۡأٓخَرِينَ,Кейин бошқаларни ҳам ҳалок қилдик.,
37,137,وَإِنَّكُمۡ لَتَمُرُّونَ عَلَيۡهِم مُّصۡبِحِينَ,"Шак-шубҳасиз, сизлар тонг чоғида уларнинг устидан ўтиб турасизлар.",
37,138,وَبِٱلَّيۡلِۚ أَفَلَا تَعۡقِلُونَ,Кечаси ҳам. Ақл юритмайсизларми?!,
37,139,وَإِنَّ يُونُسَ لَمِنَ ٱلۡمُرۡسَلِينَ,"Юнус ҳам, шак-шубҳасиз, пайғамбарлардандир.",
37,140,إِذۡ أَبَقَ إِلَى ٱلۡفُلۡكِ ٱلۡمَشۡحُونِ,Ўшанда у ичи тўла кемага қочганди.,
37,141,فَسَاهَمَ فَكَانَ مِنَ ٱلۡمُدۡحَضِينَ,"Бас, қуръа ташлашди ва у мағлублардан бўлди.",
37,142,فَٱلۡتَقَمَهُ ٱلۡحُوتُ وَهُوَ مُلِيمٞ,"Бас, уни маломатга лойиқ бўлган ҳолида наҳанг балиқ ютди.",
37,143,فَلَوۡلَآ أَنَّهُۥ كَانَ مِنَ ٱلۡمُسَبِّحِينَ,"Агар у кўп тасбеҳ айтгувчилардан бўлмаганида эди,",
37,144,لَلَبِثَ فِي بَطۡنِهِۦٓ إِلَىٰ يَوۡمِ يُبۡعَثُونَ,Унинг қорнида қайта тириладиган кунгача қолиб кетган бўларди.,
37,145,۞ فَنَبَذۡنَٰهُ بِٱلۡعَرَآءِ وَهُوَ سَقِيمٞ,"Бас, уни хаста ҳолида қуруқликка отдик.",
37,146,وَأَنۢبَتۡنَا عَلَيۡهِ شَجَرَةٗ مِّن يَقۡطِينٖ,Ва унинг устига қовоқ дарахтини ўстириб қўйдик.,
37,147,وَأَرۡسَلۡنَٰهُ إِلَىٰ مِاْئَةِ أَلۡفٍ أَوۡ يَزِيدُونَ,Уни юз минг ёки ундан-да кўпроққа пайғамбар қилдик.,
37,148,فَـَٔامَنُواْ فَمَتَّعۡنَٰهُمۡ إِلَىٰ حِينٖ,"Иймон келтирдилар. Бас, уларни маълум муддат баҳраманд этдик.",
37,149,فَٱسۡتَفۡتِهِمۡ أَلِرَبِّكَ ٱلۡبَنَاتُ وَلَهُمُ ٱلۡبَنُونَ,"Энди улардан сўранг-чи, Парвардигорингизники қизлар-у, уларники ўғиллар эканми?",
37,150,أَمۡ خَلَقۡنَا ٱلۡمَلَٰٓئِكَةَ إِنَٰثٗا وَهُمۡ شَٰهِدُونَ,"Ёки фаришталарни қиз қилиб яратганмиз-у, улар эса гувоҳ бўлиб туришганми?",
37,151,أَلَآ إِنَّهُم مِّنۡ إِفۡكِهِمۡ لَيَقُولُونَ,"Огоҳ бўлингизки, улар ўз уйдирмаларида шундай дейдилар:",
37,152,وَلَدَ ٱللَّهُ وَإِنَّهُمۡ لَكَٰذِبُونَ,"«Аллоҳ бола кўрди». Ва, албатта, улар ёлғончилардир.",
37,153,أَصۡطَفَى ٱلۡبَنَاتِ عَلَى ٱلۡبَنِينَ,"Ўғилларни қўйиб, қизларни танлаб олган эмишми?!",
37,154,مَا لَكُمۡ كَيۡفَ تَحۡكُمُونَ,"(Эй мушриклар), сизларга нима бўлди? Қандай ҳукм чиқармоқдасизлар?",
37,155,أَفَلَا تَذَكَّرُونَ,Эс-ҳушингизни йиғиб олмайсизларми?!,
37,156,أَمۡ لَكُمۡ سُلۡطَٰنٞ مُّبِينٞ,Ёки сизларда очиқ-ойдин бир ҳужжат борми?!,
37,157,فَأۡتُواْ بِكِتَٰبِكُمۡ إِن كُنتُمۡ صَٰدِقِينَ,"Ростгўйлардан бўлсангиз, китобингизни келтиринглар-чи!",
37,158,وَجَعَلُواْ بَيۡنَهُۥ وَبَيۡنَ ٱلۡجِنَّةِ نَسَبٗاۚ وَلَقَدۡ عَلِمَتِ ٱلۡجِنَّةُ إِنَّهُمۡ لَمُحۡضَرُونَ,"У билан жинлар орасида насаб риштаси бор, дедилар. Ҳолбуки, жинлар аниқ билдиларки, улар ҳозирлангувчилардир.",
37,159,سُبۡحَٰنَ ٱللَّهِ عَمَّا يَصِفُونَ,Аллоҳ улар васф қилган нарсадан покдир.,
37,160,إِلَّا عِبَادَ ٱللَّهِ ٱلۡمُخۡلَصِينَ,Аллоҳнинг покиза бандаларигина бундан мустасно.,
37,161,فَإِنَّكُمۡ وَمَا تَعۡبُدُونَ,"Албатта, сизлар ҳам, сиғинаётган бутларингиз ҳам",
37,162,مَآ أَنتُمۡ عَلَيۡهِ بِفَٰتِنِينَ,У Зотга қарши фитнага солгувчи бўла олмассиз.,
37,163,إِلَّا مَنۡ هُوَ صَالِ ٱلۡجَحِيمِ,Жаҳаннамга киргувчи бўлганлар бундан мустасно.,
37,164,وَمَا مِنَّآ إِلَّا لَهُۥ مَقَامٞ مَّعۡلُومٞ,Биздан ҳар биримиз учун маълум бир мақом бор.,
37,165,وَإِنَّا لَنَحۡنُ ٱلصَّآفُّونَ,"Албатта, бизлар саф тортиб тургувчилармиз.",
37,166,وَإِنَّا لَنَحۡنُ ٱلۡمُسَبِّحُونَ,"Ва, албатта, бизлар тасбеҳ айтгувчилармиз.",
37,167,وَإِن كَانُواْ لَيَقُولُونَ,"Ҳолбуки, улар дер эдилар:",
37,168,لَوۡ أَنَّ عِندَنَا ذِكۡرٗا مِّنَ ٱلۡأَوَّلِينَ,«Бизда ҳам олдингилардан бир эслатма бўлганида эди.,
37,169,لَكُنَّا عِبَادَ ٱللَّهِ ٱلۡمُخۡلَصِينَ,Биз ҳам сўзсиз Аллоҳнинг покиза бандалари бўлар эдик».,
37,170,فَكَفَرُواْ بِهِۦۖ فَسَوۡفَ يَعۡلَمُونَ,"Бас, унга куфр келтирдилар. Энди яқинда билурлар.",
37,171,وَلَقَدۡ سَبَقَتۡ كَلِمَتُنَا لِعِبَادِنَا ٱلۡمُرۡسَلِينَ,"Дарҳақиқат, пайғамбар қилиб юборилган бандаларимизга Сўзимиз ўтган.",
37,172,إِنَّهُمۡ لَهُمُ ٱلۡمَنصُورُونَ,"Шак-шубҳасиз, аниқ улар қўллаб-қувватлангувчилардир.",
37,173,وَإِنَّ جُندَنَا لَهُمُ ٱلۡغَٰلِبُونَ,"Ва, албатта, Бизнинг қўшинимиз ғолиблардир.",
37,174,فَتَوَلَّ عَنۡهُمۡ حَتَّىٰ حِينٖ,"Бас, сиз улардан бироз муддат юз ўгириб туринг.",
37,175,وَأَبۡصِرۡهُمۡ فَسَوۡفَ يُبۡصِرُونَ,Ўшанда уларни кўринг. Улар ҳам сизни кўрадилар.,
37,176,أَفَبِعَذَابِنَا يَسۡتَعۡجِلُونَ,Ҳали улар Бизнинг азобимизни шоширяптиларми?!,
37,177,فَإِذَا نَزَلَ بِسَاحَتِهِمۡ فَسَآءَ صَبَاحُ ٱلۡمُنذَرِينَ,Азоб уларнинг ҳовлисига тушганида огоҳлантирилганларнинг тонги жуда ёмон бўлади.,
37,178,وَتَوَلَّ عَنۡهُمۡ حَتَّىٰ حِينٖ,"Бас, улардан бироз муддат юз ўгириб туринг.",
37,179,وَأَبۡصِرۡ فَسَوۡفَ يُبۡصِرُونَ,Кўринг. Улар ҳам яқинда кўрадилар.,
37,180,سُبۡحَٰنَ رَبِّكَ رَبِّ ٱلۡعِزَّةِ عَمَّا يَصِفُونَ,Қудрат эгаси бўлмиш Парвардигорингиз улар васф этаётган сифатлардан Покдир.,
37,181,وَسَلَٰمٌ عَلَى ٱلۡمُرۡسَلِينَ,Пайғамбарларга салом бўлсин!,
37,182,وَٱلۡحَمۡدُ لِلَّهِ رَبِّ ٱلۡعَٰلَمِينَ,Оламлар Парвардигори Аллоҳга ҳамд бўлсин!,
