surah,ayah,arabic_text,translation,footnotes
16,55,لِيَكۡفُرُواْ بِمَآ ءَاتَيۡنَٰهُمۡۚ فَتَمَتَّعُواْ فَسَوۡفَ تَعۡلَمُونَ,"Берган нарсаларимизга нонкўрлик қилаверсинлар. Бас, фойдаланаверинглар-чи. Яқинда билиб оласизлар.",
16,56,وَيَجۡعَلُونَ لِمَا لَا يَعۡلَمُونَ نَصِيبٗا مِّمَّا رَزَقۡنَٰهُمۡۗ تَٱللَّهِ لَتُسۡـَٔلُنَّ عَمَّا كُنتُمۡ تَفۡتَرُونَ,"Билмайдиган нарсалари учун Биз ризқ қилиб берган нарсалардан бир насиба ажратадилар. Аллоҳга қасамки, ўзларингиз тўқиган уйдирмаларингиз ҳақида, албатта, сўраласизлар.",
16,57,وَيَجۡعَلُونَ لِلَّهِ ٱلۡبَنَٰتِ سُبۡحَٰنَهُۥ وَلَهُم مَّا يَشۡتَهُونَ,Улар қизларни Аллоҳники қиладилар. У Зот (бундан) Покдир. Ўзларига эса кўнгиллари тусагани (эмиш).,
16,58,وَإِذَا بُشِّرَ أَحَدُهُم بِٱلۡأُنثَىٰ ظَلَّ وَجۡهُهُۥ مُسۡوَدّٗا وَهُوَ كَظِيمٞ,"Биронтасига қиз (кўргани ҳақида) хушхабар берилса, қайғуга ботиб, юзлари қорайиб кетади.",
16,59,يَتَوَٰرَىٰ مِنَ ٱلۡقَوۡمِ مِن سُوٓءِ مَا بُشِّرَ بِهِۦٓۚ أَيُمۡسِكُهُۥ عَلَىٰ هُونٍ أَمۡ يَدُسُّهُۥ فِي ٱلتُّرَابِۗ أَلَا سَآءَ مَا يَحۡكُمُونَ,"Келган хушхабарнинг ёмонлигидан (номус қилиб) одамлардан беркиниб олади. Хор бўлиб уни олиб қолсами ёки тупроққа кўмиб қўя қолсами? (Унинг ўйи шу бўлади). Огоҳ бўлингизким, улар қилаётган ҳукм нақадар ёмон.",
16,60,لِلَّذِينَ لَا يُؤۡمِنُونَ بِٱلۡأٓخِرَةِ مَثَلُ ٱلسَّوۡءِۖ وَلِلَّهِ ٱلۡمَثَلُ ٱلۡأَعۡلَىٰۚ وَهُوَ ٱلۡعَزِيزُ ٱلۡحَكِيمُ,Энг ёмон сифатлар охиратга иймон келтирмайдиган кимсаларники. Аллоҳники эса энг олий хислатлардир. У Ғолиб ва Ҳаким Зотдир.,
16,61,وَلَوۡ يُؤَاخِذُ ٱللَّهُ ٱلنَّاسَ بِظُلۡمِهِم مَّا تَرَكَ عَلَيۡهَا مِن دَآبَّةٖ وَلَٰكِن يُؤَخِّرُهُمۡ إِلَىٰٓ أَجَلٖ مُّسَمّٗىۖ فَإِذَا جَآءَ أَجَلُهُمۡ لَا يَسۡتَـٔۡخِرُونَ سَاعَةٗ وَلَا يَسۡتَقۡدِمُونَ,"Агар Аллоҳ одамларни зулмларига яраша тутганида (жазолаганида), ер юзида биронта жонзотни қўймаган бўларди. Лекин уларни белгиланган бир муддатга қадар кечиктирди. Ўша муддатлари келганда бир соат ҳам ортга ё олдга ўзгартира олмаслар.",
16,62,وَيَجۡعَلُونَ لِلَّهِ مَا يَكۡرَهُونَۚ وَتَصِفُ أَلۡسِنَتُهُمُ ٱلۡكَذِبَ أَنَّ لَهُمُ ٱلۡحُسۡنَىٰۚ لَا جَرَمَ أَنَّ لَهُمُ ٱلنَّارَ وَأَنَّهُم مُّفۡرَطُونَ,"Ёқтирмаган нарсаларини Аллоҳники қилурлар. Тиллари эса, ёлғондан ўзларига гўзал (оқибат) бўлишини васф қилур. Шак-шубҳа йўқки, уларга дўзах бўлур ва унга ташланурлар.",
16,63,تَٱللَّهِ لَقَدۡ أَرۡسَلۡنَآ إِلَىٰٓ أُمَمٖ مِّن قَبۡلِكَ فَزَيَّنَ لَهُمُ ٱلشَّيۡطَٰنُ أَعۡمَٰلَهُمۡ فَهُوَ وَلِيُّهُمُ ٱلۡيَوۡمَ وَلَهُمۡ عَذَابٌ أَلِيمٞ,"Аллоҳга қасамки, сиздан олдинги умматларга ҳам пайғамбарлар юборганмиз. Бас, шайтон уларга амалларини чиройли қилиб кўрсатди. У бугун уларнинг дўстидир. Улар учун аламли азоб бордир.",
16,64,وَمَآ أَنزَلۡنَا عَلَيۡكَ ٱلۡكِتَٰبَ إِلَّا لِتُبَيِّنَ لَهُمُ ٱلَّذِي ٱخۡتَلَفُواْ فِيهِ وَهُدٗى وَرَحۡمَةٗ لِّقَوۡمٖ يُؤۡمِنُونَ,Биз сизга Китобни уларга ихтилоф қилган нарсаларини баён қилишингиз учунгина ҳамда иймон келтирган қавм учун ҳидоят ва раҳмат қилибгина туширдик.,
16,65,وَٱللَّهُ أَنزَلَ مِنَ ٱلسَّمَآءِ مَآءٗ فَأَحۡيَا بِهِ ٱلۡأَرۡضَ بَعۡدَ مَوۡتِهَآۚ إِنَّ فِي ذَٰلِكَ لَأٓيَةٗ لِّقَوۡمٖ يَسۡمَعُونَ,"Аллоҳ осмондан ёмғир ёғдириб, қуриб-қақшаб ётган ерни тирилтирди. Албатта, бу ишда қулоқ соладиган қавм учун оят-аломат бор.",
16,66,وَإِنَّ لَكُمۡ فِي ٱلۡأَنۡعَٰمِ لَعِبۡرَةٗۖ نُّسۡقِيكُم مِّمَّا فِي بُطُونِهِۦ مِنۢ بَيۡنِ فَرۡثٖ وَدَمٖ لَّبَنًا خَالِصٗا سَآئِغٗا لِّلشَّٰرِبِينَ,"Сизларга чорва ҳайвонларида ҳам ибрат бор. Сизларни уларнинг қоринларидаги гўнг ва қон орасидан (ажралиб чиқадиган), ичувчилар (томоғидан) осон ўтадиган тоза сут билан суғорамиз.",
16,67,وَمِن ثَمَرَٰتِ ٱلنَّخِيلِ وَٱلۡأَعۡنَٰبِ تَتَّخِذُونَ مِنۡهُ سَكَرٗا وَرِزۡقًا حَسَنًاۚ إِنَّ فِي ذَٰلِكَ لَأٓيَةٗ لِّقَوۡمٖ يَعۡقِلُونَ,"Хурмо ва узумларнинг меваларидан маст қилувчи ичимлик ва гўзал ризқ оласизлар. Албатта, бу ишда ақлини юритадиган қавм учун оят-аломат бор.",
16,68,وَأَوۡحَىٰ رَبُّكَ إِلَى ٱلنَّحۡلِ أَنِ ٱتَّخِذِي مِنَ ٱلۡجِبَالِ بُيُوتٗا وَمِنَ ٱلشَّجَرِ وَمِمَّا يَعۡرِشُونَ,"Парвардигорингиз асаларига шундай ваҳий қилди: «Тоғларга, дарахтларга ва (одамлар) соладиган уйларга ин қур.",
16,69,ثُمَّ كُلِي مِن كُلِّ ٱلثَّمَرَٰتِ فَٱسۡلُكِي سُبُلَ رَبِّكِ ذُلُلٗاۚ يَخۡرُجُ مِنۢ بُطُونِهَا شَرَابٞ مُّخۡتَلِفٌ أَلۡوَٰنُهُۥ فِيهِ شِفَآءٞ لِّلنَّاسِۚ إِنَّ فِي ذَٰلِكَ لَأٓيَةٗ لِّقَوۡمٖ يَتَفَكَّرُونَ,"Кейин ҳамма мевалардан егин ва Парвардигоринг қулай қилиб қўйган йўллардан юргин». Унинг қорнидан ҳар хил рангдаги ичимликлар чиқади. Унда одамлар учун шифо бор. Албатта, бу ишда фикр юритадиган қавм учун оят-аломат бор.",
16,70,وَٱللَّهُ خَلَقَكُمۡ ثُمَّ يَتَوَفَّىٰكُمۡۚ وَمِنكُم مَّن يُرَدُّ إِلَىٰٓ أَرۡذَلِ ٱلۡعُمُرِ لِكَيۡ لَا يَعۡلَمَ بَعۡدَ عِلۡمٖ شَيۡـًٔاۚ إِنَّ ٱللَّهَ عَلِيمٞ قَدِيرٞ,"Аллоҳ сизларни яратди. Кейин яна жонингизни олади. Орангиздан кимдир умрнинг энг тубан қисмига қайтарилади-да, олдин билганларидан ҳеч нарсани билмай қолади. Аллоҳ Билгувчи ва Қодир Зотдир.",
16,71,وَٱللَّهُ فَضَّلَ بَعۡضَكُمۡ عَلَىٰ بَعۡضٖ فِي ٱلرِّزۡقِۚ فَمَا ٱلَّذِينَ فُضِّلُواْ بِرَآدِّي رِزۡقِهِمۡ عَلَىٰ مَا مَلَكَتۡ أَيۡمَٰنُهُمۡ فَهُمۡ فِيهِ سَوَآءٌۚ أَفَبِنِعۡمَةِ ٱللَّهِ يَجۡحَدُونَ,"Аллоҳ ризқ борасида айримларингизни айримларингиздан устун қилди. Устун қилинганлар ўз ризқларини қўл остидаги одамларга қайтариб, ҳаммаси баробар бўлиб қолмайди-ку. Аллоҳнинг неъматига нонкўрлик қиладиларми?",
16,72,وَٱللَّهُ جَعَلَ لَكُم مِّنۡ أَنفُسِكُمۡ أَزۡوَٰجٗا وَجَعَلَ لَكُم مِّنۡ أَزۡوَٰجِكُم بَنِينَ وَحَفَدَةٗ وَرَزَقَكُم مِّنَ ٱلطَّيِّبَٰتِۚ أَفَبِٱلۡبَٰطِلِ يُؤۡمِنُونَ وَبِنِعۡمَتِ ٱللَّهِ هُمۡ يَكۡفُرُونَ,"Аллоҳ сизларга ўзларингиздан жуфтлар яратиб, жуфтларингиздан болалар, набираларни дунёга келтирди ва сизларга покиза ризқлар ато этди. Ботилга иймон келтириб, Аллоҳнинг неъматига нонкўрлик қиладиларми?",
16,73,وَيَعۡبُدُونَ مِن دُونِ ٱللَّهِ مَا لَا يَمۡلِكُ لَهُمۡ رِزۡقٗا مِّنَ ٱلسَّمَٰوَٰتِ وَٱلۡأَرۡضِ شَيۡـٔٗا وَلَا يَسۡتَطِيعُونَ,"Аллоҳни қўйиб, уларга осмонлару ердан ҳеч нарсани ризқ қилиб бера олмайдиган, ҳеч иш қўлидан келмайдиган нарсаларга бандалик қиладилар.",
16,74,فَلَا تَضۡرِبُواْ لِلَّهِ ٱلۡأَمۡثَالَۚ إِنَّ ٱللَّهَ يَعۡلَمُ وَأَنتُمۡ لَا تَعۡلَمُونَ,"Бас, Аллоҳнинг ўхшашини қидирманглар! Шубҳасиз, Аллоҳ билади, сизлар эса билмайсизлар.",
16,75,۞ ضَرَبَ ٱللَّهُ مَثَلًا عَبۡدٗا مَّمۡلُوكٗا لَّا يَقۡدِرُ عَلَىٰ شَيۡءٖ وَمَن رَّزَقۡنَٰهُ مِنَّا رِزۡقًا حَسَنٗا فَهُوَ يُنفِقُ مِنۡهُ سِرّٗا وَجَهۡرًاۖ هَلۡ يَسۡتَوُۥنَۚ ٱلۡحَمۡدُ لِلَّهِۚ بَلۡ أَكۡثَرُهُمۡ لَا يَعۡلَمُونَ,Аллоҳ бир мисол зарб этди. Ҳеч иш қўлидан келмайдиган мамлук - қул ва Биз унга мўл ризқ берган ва у ўша ризқдан яширин ва ошкора сарфлайдиган кимса. Шу иккиси баробарми? Аллоҳга ҳамд бўлсин. Лекин уларнинг кўплари билмайдилар.,
16,76,وَضَرَبَ ٱللَّهُ مَثَلٗا رَّجُلَيۡنِ أَحَدُهُمَآ أَبۡكَمُ لَا يَقۡدِرُ عَلَىٰ شَيۡءٖ وَهُوَ كَلٌّ عَلَىٰ مَوۡلَىٰهُ أَيۡنَمَا يُوَجِّههُّ لَا يَأۡتِ بِخَيۡرٍ هَلۡ يَسۡتَوِي هُوَ وَمَن يَأۡمُرُ بِٱلۡعَدۡلِ وَهُوَ عَلَىٰ صِرَٰطٖ مُّسۡتَقِيمٖ,"Аллоҳ икки кишини мисол қилиб келтирди. Улардан бири ҳеч иш қўлидан келмайдиган бир гунг-соқовдир. У эгасига бир юк бўлиб, уни қаерга юборса ҳам бирон яхшилик билан қайтмайди. Шу одам билан адолатга буюрадиган, ўзи эса тўғри йўлини топиб олган киши баробарми?",
16,77,وَلِلَّهِ غَيۡبُ ٱلسَّمَٰوَٰتِ وَٱلۡأَرۡضِۚ وَمَآ أَمۡرُ ٱلسَّاعَةِ إِلَّا كَلَمۡحِ ٱلۡبَصَرِ أَوۡ هُوَ أَقۡرَبُۚ إِنَّ ٱللَّهَ عَلَىٰ كُلِّ شَيۡءٖ قَدِيرٞ,"Осмонлару ернинг ғайби Аллоҳникидир. Соат – Қиёмат иши бир кўз юмиб очгунча ёки ундан ҳам яқинроқдир. Албатта, Аллоҳ ҳар нарсага Қодирдир.",
16,78,وَٱللَّهُ أَخۡرَجَكُم مِّنۢ بُطُونِ أُمَّهَٰتِكُمۡ لَا تَعۡلَمُونَ شَيۡـٔٗا وَجَعَلَ لَكُمُ ٱلسَّمۡعَ وَٱلۡأَبۡصَٰرَ وَٱلۡأَفۡـِٔدَةَ لَعَلَّكُمۡ تَشۡكُرُونَ,"Аллоҳ сизларни оналарингизнинг қоринларидан чиқарди. (Ўша пайтда) ҳеч нарсани билмас эдингизлар. (Кейин) сизларга қулоқ, кўзлар ва дилларни берди. Шоядки, шукр қилсангиз!",
16,79,أَلَمۡ يَرَوۡاْ إِلَى ٱلطَّيۡرِ مُسَخَّرَٰتٖ فِي جَوِّ ٱلسَّمَآءِ مَا يُمۡسِكُهُنَّ إِلَّا ٱللَّهُۚ إِنَّ فِي ذَٰلِكَ لَأٓيَٰتٖ لِّقَوۡمٖ يُؤۡمِنُونَ,"Осмони фалакда бўйсундирилган қушларга боқмайдиларми? Уларни фақат Аллоҳ ушлаб турибди. Албатта, бу ишда иймон келтирган қавм учун оят-аломатлар бор.",
16,80,وَٱللَّهُ جَعَلَ لَكُم مِّنۢ بُيُوتِكُمۡ سَكَنٗا وَجَعَلَ لَكُم مِّن جُلُودِ ٱلۡأَنۡعَٰمِ بُيُوتٗا تَسۡتَخِفُّونَهَا يَوۡمَ ظَعۡنِكُمۡ وَيَوۡمَ إِقَامَتِكُمۡ وَمِنۡ أَصۡوَافِهَا وَأَوۡبَارِهَا وَأَشۡعَارِهَآ أَثَٰثٗا وَمَتَٰعًا إِلَىٰ حِينٖ,"Аллоҳ сизларга уйларингизни оромгоҳ қилиб берди. Яна сизларга чорва ҳайвонларининг териларидан кўчадиган кунингизда ҳам, қўнадиган кунингизда ҳам енгил кўтариладиган уйларни, уларнинг юнглари, жунлари ва қилларидан эса маълум вақтгача жиҳоз ва матолар қилиб берди.",
16,81,وَٱللَّهُ جَعَلَ لَكُم مِّمَّا خَلَقَ ظِلَٰلٗا وَجَعَلَ لَكُم مِّنَ ٱلۡجِبَالِ أَكۡنَٰنٗا وَجَعَلَ لَكُمۡ سَرَٰبِيلَ تَقِيكُمُ ٱلۡحَرَّ وَسَرَٰبِيلَ تَقِيكُم بَأۡسَكُمۡۚ كَذَٰلِكَ يُتِمُّ نِعۡمَتَهُۥ عَلَيۡكُمۡ لَعَلَّكُمۡ تُسۡلِمُونَ,"Аллоҳ Ўзи яратган нарсалардан сизларга соялар қилиб берди. Сизларга тоғлардан бошпаналар қилиб берди. Сизларга сизларни иссиқдан асрайдиган, зарбадан ҳимоя қиладиган кийимлар қилиб берди. Сизларга Ўз неъматини мана шундай тўла қилиб беради. Шоядки, мусулмон бўлсангизлар.",
16,82,فَإِن تَوَلَّوۡاْ فَإِنَّمَا عَلَيۡكَ ٱلۡبَلَٰغُ ٱلۡمُبِينُ,"Бас, агар юз ўгирсалар, сизнинг вазифангиз очиқ етказиб қўйиш, холос.",
16,83,يَعۡرِفُونَ نِعۡمَتَ ٱللَّهِ ثُمَّ يُنكِرُونَهَا وَأَكۡثَرُهُمُ ٱلۡكَٰفِرُونَ,Аллоҳнинг неъматини танийдилар. Кейин эса уни инкор қиладилар. Уларнинг кўплари кофирлардир.,
16,84,وَيَوۡمَ نَبۡعَثُ مِن كُلِّ أُمَّةٖ شَهِيدٗا ثُمَّ لَا يُؤۡذَنُ لِلَّذِينَ كَفَرُواْ وَلَا هُمۡ يُسۡتَعۡتَبُونَ,"У кунда ҳар бир умматдан бир гувоҳни келтирамиз. Кейин куфр келтирган кимсаларга изн ҳам берилмайди, улардан тавба ҳам талаб қилинмайди.",
16,85,وَإِذَا رَءَا ٱلَّذِينَ ظَلَمُواْ ٱلۡعَذَابَ فَلَا يُخَفَّفُ عَنۡهُمۡ وَلَا هُمۡ يُنظَرُونَ,"Зулм қилганлар азобни кўргач, улардан енгиллатилмайди, уларга муҳлат ҳам берилмайди.",
16,86,وَإِذَا رَءَا ٱلَّذِينَ أَشۡرَكُواْ شُرَكَآءَهُمۡ قَالُواْ رَبَّنَا هَٰٓؤُلَآءِ شُرَكَآؤُنَا ٱلَّذِينَ كُنَّا نَدۡعُواْ مِن دُونِكَۖ فَأَلۡقَوۡاْ إِلَيۡهِمُ ٱلۡقَوۡلَ إِنَّكُمۡ لَكَٰذِبُونَ,"Ширк келтирганлар ўзларининг бутларини кўриб: «Парвардигоро, анавилар бутларимиз эди, Сени қўйиб, ўшаларга ибодат қилардик», дейдилар. (Бунга жавобан бутлари): «Сизлар ёлғончиларсиз», дея гап қотадилар.",
16,87,وَأَلۡقَوۡاْ إِلَى ٱللَّهِ يَوۡمَئِذٍ ٱلسَّلَمَۖ وَضَلَّ عَنۡهُم مَّا كَانُواْ يَفۡتَرُونَ,У кунда улар Аллоҳга таслим бўлдилар. Ўзлари тўқиб олган (худолари) эса гумдон бўлди.,
16,88,ٱلَّذِينَ كَفَرُواْ وَصَدُّواْ عَن سَبِيلِ ٱللَّهِ زِدۡنَٰهُمۡ عَذَابٗا فَوۡقَ ٱلۡعَذَابِ بِمَا كَانُواْ يُفۡسِدُونَ,"Куфр келтириб, Аллоҳнинг йўлидан тўсган кимсаларга фисқ-фасод қилиб юрганлари учун азоб устига азобни зиёда қилдик.",
16,89,وَيَوۡمَ نَبۡعَثُ فِي كُلِّ أُمَّةٖ شَهِيدًا عَلَيۡهِم مِّنۡ أَنفُسِهِمۡۖ وَجِئۡنَا بِكَ شَهِيدًا عَلَىٰ هَٰٓؤُلَآءِۚ وَنَزَّلۡنَا عَلَيۡكَ ٱلۡكِتَٰبَ تِبۡيَٰنٗا لِّكُلِّ شَيۡءٖ وَهُدٗى وَرَحۡمَةٗ وَبُشۡرَىٰ لِلۡمُسۡلِمِينَ,"Ҳар бир умматга ўзларидан бир гувоҳни келтирган ва сизни анавиларга гувоҳ қилиб келтирган кунимизни (эсланг). Сизга Китобни ҳар бир нарсанинг баёни, мусулмонларга ҳидоят, раҳмат ва хушхабар этиб нозил қилдик.",
16,90,۞ إِنَّ ٱللَّهَ يَأۡمُرُ بِٱلۡعَدۡلِ وَٱلۡإِحۡسَٰنِ وَإِيتَآيِٕ ذِي ٱلۡقُرۡبَىٰ وَيَنۡهَىٰ عَنِ ٱلۡفَحۡشَآءِ وَٱلۡمُنكَرِ وَٱلۡبَغۡيِۚ يَعِظُكُمۡ لَعَلَّكُمۡ تَذَكَّرُونَ,"Албатта, Аллоҳ адолатга, эзгуликка, қариндошларга яхшилик қилишга буюради. Бузуқликдан, гуноҳдан ва зулмдан эса қайтаради. Сизларга насиҳат қилади. Шоядки, эслатма-ибрат олсангизлар.",
16,91,وَأَوۡفُواْ بِعَهۡدِ ٱللَّهِ إِذَا عَٰهَدتُّمۡ وَلَا تَنقُضُواْ ٱلۡأَيۡمَٰنَ بَعۡدَ تَوۡكِيدِهَا وَقَدۡ جَعَلۡتُمُ ٱللَّهَ عَلَيۡكُمۡ كَفِيلًاۚ إِنَّ ٱللَّهَ يَعۡلَمُ مَا تَفۡعَلُونَ,"Аҳдлашганингизда Аллоҳга берган аҳдингизга вафо қилингиз. Қасамлар ичилганидан кейин уларни бузмангиз. Аллоҳни ўзингизга кафил қилдингиз. Албатта, Аллоҳ қилаётган ишларингизни билур.",
16,92,وَلَا تَكُونُواْ كَٱلَّتِي نَقَضَتۡ غَزۡلَهَا مِنۢ بَعۡدِ قُوَّةٍ أَنكَٰثٗا تَتَّخِذُونَ أَيۡمَٰنَكُمۡ دَخَلَۢا بَيۡنَكُمۡ أَن تَكُونَ أُمَّةٌ هِيَ أَرۡبَىٰ مِنۡ أُمَّةٍۚ إِنَّمَا يَبۡلُوكُمُ ٱللَّهُ بِهِۦۚ وَلَيُبَيِّنَنَّ لَكُمۡ يَوۡمَ ٱلۡقِيَٰمَةِ مَا كُنتُمۡ فِيهِ تَخۡتَلِفُونَ,"Нарсасини пишиқ-пухта тўқиганидан кейин уни сўкиб-чуваб юборган хотинга ўхшаб, бир уммат бошқа умматдан ортиқроқ бўлгани учун қасамларингизни ўзаро алдов воситаси қилиб олманг. Албатта, бу билан Аллоҳ сизни синаяпти, холос. Албатта, У Зот сизларга Қиёмат куни ихтилоф қилган нарсаларингизни баён қилиб берур.",
16,93,وَلَوۡ شَآءَ ٱللَّهُ لَجَعَلَكُمۡ أُمَّةٗ وَٰحِدَةٗ وَلَٰكِن يُضِلُّ مَن يَشَآءُ وَيَهۡدِي مَن يَشَآءُۚ وَلَتُسۡـَٔلُنَّ عَمَّا كُنتُمۡ تَعۡمَلُونَ,Агар Аллоҳ истаганида сизларни битта уммат қилиб қўйган бўларди. Лекин У Зот хоҳлаган одамини адаштиради ва хоҳлаган одамини ҳидоят қилади. Қилиб ўтган ишларингиздан албатта сўралурсизлар.,
16,94,وَلَا تَتَّخِذُوٓاْ أَيۡمَٰنَكُمۡ دَخَلَۢا بَيۡنَكُمۡ فَتَزِلَّ قَدَمُۢ بَعۡدَ ثُبُوتِهَا وَتَذُوقُواْ ٱلسُّوٓءَ بِمَا صَدَدتُّمۡ عَن سَبِيلِ ٱللَّهِ وَلَكُمۡ عَذَابٌ عَظِيمٞ,"Қасамларингизни ўзаро алдов воситаси қилиб олмангиз. (Акс ҳолда) маҳкам ўрнашган оёқ тойиб кетиб, Аллоҳнинг йўлидан тўсганингиз туфайли ёмон (оқибат)ни тотиб қоласиз ва сизларга улкан азоб бўлгай.",
16,95,وَلَا تَشۡتَرُواْ بِعَهۡدِ ٱللَّهِ ثَمَنٗا قَلِيلًاۚ إِنَّمَا عِندَ ٱللَّهِ هُوَ خَيۡرٞ لَّكُمۡ إِن كُنتُمۡ تَعۡلَمُونَ,"Аллоҳга берган аҳдингизни оз баҳога сотмангизлар. Агар биладиган бўлсангизлар, сизлар учун Аллоҳ ҳузуридаги (мукофот) яхшироқдир.",
16,96,مَا عِندَكُمۡ يَنفَدُ وَمَا عِندَ ٱللَّهِ بَاقٖۗ وَلَنَجۡزِيَنَّ ٱلَّذِينَ صَبَرُوٓاْ أَجۡرَهُم بِأَحۡسَنِ مَا كَانُواْ يَعۡمَلُونَ,"Сиздаги нарса фонийдир. Аллоҳнинг ҳузуридаги эса боқийдир. Сабр қилганларни, албатта, қилган амалларининг энг яхшиси билан мукофотлаймиз.",
16,97,مَنۡ عَمِلَ صَٰلِحٗا مِّن ذَكَرٍ أَوۡ أُنثَىٰ وَهُوَ مُؤۡمِنٞ فَلَنُحۡيِيَنَّهُۥ حَيَوٰةٗ طَيِّبَةٗۖ وَلَنَجۡزِيَنَّهُمۡ أَجۡرَهُم بِأَحۡسَنِ مَا كَانُواْ يَعۡمَلُونَ,"Эркак бўлсин, аёл бўлсин, мўмин бўлгани ҳолда яхши амал қилган одамга ёқимли ҳаёт бахш этамиз ва, албатта, уларнинг савобларини қилган амалларининг энг яхшисига қараб берурмиз.",
