surah,ayah,arabic_text,translation,footnotes
16,1,أَتَىٰٓ أَمۡرُ ٱللَّهِ فَلَا تَسۡتَعۡجِلُوهُۚ سُبۡحَٰنَهُۥ وَتَعَٰلَىٰ عَمَّا يُشۡرِكُونَ,"Аллоҳнинг фармони келди. Бас, уни шошилтирманглар. Аллоҳ улар келтираётган ширклардан пок ва олийдир.",
16,2,يُنَزِّلُ ٱلۡمَلَٰٓئِكَةَ بِٱلرُّوحِ مِنۡ أَمۡرِهِۦ عَلَىٰ مَن يَشَآءُ مِنۡ عِبَادِهِۦٓ أَنۡ أَنذِرُوٓاْ أَنَّهُۥ لَآ إِلَٰهَ إِلَّآ أَنَا۠ فَٱتَّقُونِ,"Ўзи истаган бандаларига Ўз амри ила фаришталарни ваҳий билан туширади. «Огоҳлантиринглар! Мендан ўзга илоҳ йўқдир. Бас, Мендангина қўрқинглар».",
16,3,خَلَقَ ٱلسَّمَٰوَٰتِ وَٱلۡأَرۡضَ بِٱلۡحَقِّۚ تَعَٰلَىٰ عَمَّا يُشۡرِكُونَ,Осмонлару ерни ҳақ билан яратди. Улар келтираётган ширклардан олий бўлди.,
16,4,خَلَقَ ٱلۡإِنسَٰنَ مِن نُّطۡفَةٖ فَإِذَا هُوَ خَصِيمٞ مُّبِينٞ,Инсонни бир нутфадан яратди. Энди эса у очиқ рақиб.,
16,5,وَٱلۡأَنۡعَٰمَ خَلَقَهَاۖ لَكُمۡ فِيهَا دِفۡءٞ وَمَنَٰفِعُ وَمِنۡهَا تَأۡكُلُونَ,Сизлар учун чорва молларини яратди. Уларда сиз учун исиниш ва бошқа манфаатлар бор ва улардан озуқаланасизлар.,
16,6,وَلَكُمۡ فِيهَا جَمَالٌ حِينَ تُرِيحُونَ وَحِينَ تَسۡرَحُونَ,Сизлар учун уларнинг кечқурун ўтлаб қайтаётганларида ва эрталаб ўтлаш учун кетаётганларида бир гўзаллик бор.,
16,7,وَتَحۡمِلُ أَثۡقَالَكُمۡ إِلَىٰ بَلَدٖ لَّمۡ تَكُونُواْ بَٰلِغِيهِ إِلَّا بِشِقِّ ٱلۡأَنفُسِۚ إِنَّ رَبَّكُمۡ لَرَءُوفٞ رَّحِيمٞ,"Юкларингизни ўзларингиз жонларингизни қийнабгина олиб борадиган юртга элтиб беради. Албатта, Парвардигорингиз Меҳрибон ва Раҳмлидир.",
16,8,وَٱلۡخَيۡلَ وَٱلۡبِغَالَ وَٱلۡحَمِيرَ لِتَرۡكَبُوهَا وَزِينَةٗۚ وَيَخۡلُقُ مَا لَا تَعۡلَمُونَ,"От, хачир ва эшаклар уларни минишингиз ва безак учун. Сизлар билмаган нарсаларни ҳам яратур.",
16,9,وَعَلَى ٱللَّهِ قَصۡدُ ٱلسَّبِيلِ وَمِنۡهَا جَآئِرٞۚ وَلَوۡ شَآءَ لَهَدَىٰكُمۡ أَجۡمَعِينَ,Тўғри йўлга (ҳидоят қилиш) ёлғиз Аллоҳ измидадир. (Йўллар) орасида эгриси ҳам бор. Агар истаганида сизларнинг ҳаммангизни ҳидоят қилган бўлар эди.,
16,10,هُوَ ٱلَّذِيٓ أَنزَلَ مِنَ ٱلسَّمَآءِ مَآءٗۖ لَّكُم مِّنۡهُ شَرَابٞ وَمِنۡهُ شَجَرٞ فِيهِ تُسِيمُونَ,"У сизларга осмондан сув (ёмғир) ёғдирган Зотдир. Ичимлигингиз ҳам ундан, ҳайвонларингизни боқадиган дов-дарахт (ўт-ўланлар) ҳам ундан.",
16,11,يُنۢبِتُ لَكُم بِهِ ٱلزَّرۡعَ وَٱلزَّيۡتُونَ وَٱلنَّخِيلَ وَٱلۡأَعۡنَٰبَ وَمِن كُلِّ ٱلثَّمَرَٰتِۚ إِنَّ فِي ذَٰلِكَ لَأٓيَةٗ لِّقَوۡمٖ يَتَفَكَّرُونَ,"Сизларга у орқали экин, зайтун, хурмо, узумлар ва ҳамма мевалардан ўстириб беради. Албатта, бу ишда фикр юритадиган қавм учун оят-аломат бордир.",
16,12,وَسَخَّرَ لَكُمُ ٱلَّيۡلَ وَٱلنَّهَارَ وَٱلشَّمۡسَ وَٱلۡقَمَرَۖ وَٱلنُّجُومُ مُسَخَّرَٰتُۢ بِأَمۡرِهِۦٓۚ إِنَّ فِي ذَٰلِكَ لَأٓيَٰتٖ لِّقَوۡمٖ يَعۡقِلُونَ,"Сизларга кечаю кундузни, қуёшу ойни бўйсундириб берди. Юлдузлар ҳам Унинг фармони ила бўйсундирилгандир. Албатта, бу ишда ақл юритадиганлар учун оят-аломатлар бор.",
16,13,وَمَا ذَرَأَ لَكُمۡ فِي ٱلۡأَرۡضِ مُخۡتَلِفًا أَلۡوَٰنُهُۥٓۚ إِنَّ فِي ذَٰلِكَ لَأٓيَةٗ لِّقَوۡمٖ يَذَّكَّرُونَ,"Сизлар учун ер юзида яратиб қўйган алвон турли нарсаларни (ҳам бўйсундириб берди). Албатта, бу ишда эслатма-ибрат оладиган қавм учун оят-аломат бор.",
16,14,وَهُوَ ٱلَّذِي سَخَّرَ ٱلۡبَحۡرَ لِتَأۡكُلُواْ مِنۡهُ لَحۡمٗا طَرِيّٗا وَتَسۡتَخۡرِجُواْ مِنۡهُ حِلۡيَةٗ تَلۡبَسُونَهَاۖ وَتَرَى ٱلۡفُلۡكَ مَوَاخِرَ فِيهِ وَلِتَبۡتَغُواْ مِن فَضۡلِهِۦ وَلَعَلَّكُمۡ تَشۡكُرُونَ,"У шундай Зотки, денгизни бўйсундириб берди. Токи ундан янги гўшт (балиқни тутиб) ейсиз, яна ундан ўзингиз тақадиган тақинчоқларни чиқариб оласиз. Кўрасизки, кема сувни ёриб юради. У Зотнинг фазлидан умид қилишингиз учун ҳам (шундай қилди). Шоядки, шукр қилсангизлар.",
16,15,وَأَلۡقَىٰ فِي ٱلۡأَرۡضِ رَوَٰسِيَ أَن تَمِيدَ بِكُمۡ وَأَنۡهَٰرٗا وَسُبُلٗا لَّعَلَّكُمۡ تَهۡتَدُونَ,Ер сизларни тебратиб юбормаслиги учун унинг устига тоғларни ташлаб қўйди. Дарёларни ва тўғри йўлингизни топиб юришингиз учун йўлларни (яратди).,
16,16,وَعَلَٰمَٰتٖۚ وَبِٱلنَّجۡمِ هُمۡ يَهۡتَدُونَ,Белгилар (қўйди). Юлдузлар билан йўлларини топиб оладилар.,
16,17,أَفَمَن يَخۡلُقُ كَمَن لَّا يَخۡلُقُۚ أَفَلَا تَذَكَّرُونَ,Яратадиган Зот билан яратмайдиган нарса тенгми? Ўйламайсизларми?,
16,18,وَإِن تَعُدُّواْ نِعۡمَةَ ٱللَّهِ لَا تُحۡصُوهَآۗ إِنَّ ٱللَّهَ لَغَفُورٞ رَّحِيمٞ,"Агар Аллоҳнинг неъматларини санасангизлар, саноғига ета олмайсизлар. Албатта, Аллоҳ Мағфиратли ва Меҳрибон Зотдир.",
16,19,وَٱللَّهُ يَعۡلَمُ مَا تُسِرُّونَ وَمَا تُعۡلِنُونَ,Аллоҳ нимани сир тутаётганингизни ва нимани ошкор қилаётганингизни билади.,
16,20,وَٱلَّذِينَ يَدۡعُونَ مِن دُونِ ٱللَّهِ لَا يَخۡلُقُونَ شَيۡـٔٗا وَهُمۡ يُخۡلَقُونَ,"Аллоҳни қўйиб, илтижо қилаётган бутлари бирон нарсани ярата олмайди. Уларнинг ўзлари яратиладилар.",
16,21,أَمۡوَٰتٌ غَيۡرُ أَحۡيَآءٖۖ وَمَا يَشۡعُرُونَ أَيَّانَ يُبۡعَثُونَ,Жонсиз ўликлардир. Қачон қайта тирилишларини ҳам сеза олмайдилар.,
16,22,إِلَٰهُكُمۡ إِلَٰهٞ وَٰحِدٞۚ فَٱلَّذِينَ لَا يُؤۡمِنُونَ بِٱلۡأٓخِرَةِ قُلُوبُهُم مُّنكِرَةٞ وَهُم مُّسۡتَكۡبِرُونَ,"Илоҳингиз ягона илоҳдир. Охиратга ишонмайдиганларнинг қалблари мункирдир, ўзлари эса мутакаббирдирлар.",
16,23,لَا جَرَمَ أَنَّ ٱللَّهَ يَعۡلَمُ مَا يُسِرُّونَ وَمَا يُعۡلِنُونَۚ إِنَّهُۥ لَا يُحِبُّ ٱلۡمُسۡتَكۡبِرِينَ,"Шак-шубҳа йўқки, Аллоҳ нимани сир тутаётганларини ҳам, нимани ошкор этаётганларини ҳам билади. Албатта, У Зот мутакаббирларни ёқтирмайди.",
16,24,وَإِذَا قِيلَ لَهُم مَّاذَآ أَنزَلَ رَبُّكُمۡ قَالُوٓاْ أَسَٰطِيرُ ٱلۡأَوَّلِينَ,"Қачон уларга: «Парвардигорингиз нимани нозил қилди?» - дейилса: «Аввалгиларнинг афсоналарини», дедилар.",
16,25,لِيَحۡمِلُوٓاْ أَوۡزَارَهُمۡ كَامِلَةٗ يَوۡمَ ٱلۡقِيَٰمَةِ وَمِنۡ أَوۡزَارِ ٱلَّذِينَ يُضِلُّونَهُم بِغَيۡرِ عِلۡمٍۗ أَلَا سَآءَ مَا يَزِرُونَ,"Қиёмат куни ўзларининг гуноҳларини тўлалигича, билимсизларча ўзлари йўлдан оздирганларининг гуноҳларидан ҳам қўшиб кўтариб олишлари учун. Огоҳ бўлингизким, улар орқалаб олган юк нақадар ёмон!",
16,26,قَدۡ مَكَرَ ٱلَّذِينَ مِن قَبۡلِهِمۡ فَأَتَى ٱللَّهُ بُنۡيَٰنَهُم مِّنَ ٱلۡقَوَاعِدِ فَخَرَّ عَلَيۡهِمُ ٱلسَّقۡفُ مِن فَوۡقِهِمۡ وَأَتَىٰهُمُ ٱلۡعَذَابُ مِنۡ حَيۡثُ لَا يَشۡعُرُونَ,Улардан олдин ўтганлар ҳам макр қилдилар. Аллоҳ уларнинг биноларини пойдеворидан қулатди. Шу билан том уларнинг устига қулади. Уларга азоб ўзлари сезмаган тарафдан келди.,
16,27,ثُمَّ يَوۡمَ ٱلۡقِيَٰمَةِ يُخۡزِيهِمۡ وَيَقُولُ أَيۡنَ شُرَكَآءِيَ ٱلَّذِينَ كُنتُمۡ تُشَٰٓقُّونَ فِيهِمۡۚ قَالَ ٱلَّذِينَ أُوتُواْ ٱلۡعِلۡمَ إِنَّ ٱلۡخِزۡيَ ٱلۡيَوۡمَ وَٱلسُّوٓءَ عَلَى ٱلۡكَٰفِرِينَ,Кейин Қиёмат куни уларни хор қилиб дейди: «Ўша сизлар талашиб-тортишган «шерикларим» қани?» Илм берилган зотлар дедилар: «Бугун хорлик ва ёмонлик кофирлар устигадир».,
16,28,ٱلَّذِينَ تَتَوَفَّىٰهُمُ ٱلۡمَلَٰٓئِكَةُ ظَالِمِيٓ أَنفُسِهِمۡۖ فَأَلۡقَوُاْ ٱلسَّلَمَ مَا كُنَّا نَعۡمَلُ مِن سُوٓءِۭۚ بَلَىٰٓۚ إِنَّ ٱللَّهَ عَلِيمُۢ بِمَا كُنتُمۡ تَعۡمَلُونَ,"Улар ўзларига ўзлари зулм қилиб турган ҳолларида фаришталар уларнинг жонини олади. Улар таслим бўлиб: «Ҳеч бир ёмонлик қилмаган эдик» (дейдилар). Йўқ! Албатта, Аллоҳ қилиб ўтган ишларингиздан Хабардордир.",
16,29,فَٱدۡخُلُوٓاْ أَبۡوَٰبَ جَهَنَّمَ خَٰلِدِينَ فِيهَاۖ فَلَبِئۡسَ مَثۡوَى ٱلۡمُتَكَبِّرِينَ,"Бас, жаҳаннам эшикларидан у ерда абадий қоладиган бўлиб киринглар. Мутакаббирларнинг борар жойи нақадар ёмон!",
16,30,۞ وَقِيلَ لِلَّذِينَ ٱتَّقَوۡاْ مَاذَآ أَنزَلَ رَبُّكُمۡۚ قَالُواْ خَيۡرٗاۗ لِّلَّذِينَ أَحۡسَنُواْ فِي هَٰذِهِ ٱلدُّنۡيَا حَسَنَةٞۚ وَلَدَارُ ٱلۡأٓخِرَةِ خَيۡرٞۚ وَلَنِعۡمَ دَارُ ٱلۡمُتَّقِينَ,"Тақво қилган зотларга: «Парвардигорингиз нимани нозил қилди?» - дейилади. «Яхшиликни», дейдилар улар. Яхшилик қилганларга бу дунёда ҳам яхшилик бордир. Албатта, охират диёри янада яхшироқдир.Тақводорларнинг маскани нақадар яхши!",
16,31,جَنَّٰتُ عَدۡنٖ يَدۡخُلُونَهَا تَجۡرِي مِن تَحۡتِهَا ٱلۡأَنۡهَٰرُۖ لَهُمۡ فِيهَا مَا يَشَآءُونَۚ كَذَٰلِكَ يَجۡزِي ٱللَّهُ ٱلۡمُتَّقِينَ,Адн жаннатлари. Уларга кирадилар. Остидан анҳорлар оқиб ўтади. Жаннатларда уларга истаган нарсалари (муҳайё қилинади). Аллоҳ тақводорларни мана шундай мукофотлайди.,
16,32,ٱلَّذِينَ تَتَوَفَّىٰهُمُ ٱلۡمَلَٰٓئِكَةُ طَيِّبِينَ يَقُولُونَ سَلَٰمٌ عَلَيۡكُمُ ٱدۡخُلُواْ ٱلۡجَنَّةَ بِمَا كُنتُمۡ تَعۡمَلُونَ,"Фаришталар уларнинг жонларини пок (бегуноҳ) ҳолларида ола туриб: «Сизларга салом бўлсин. Қилиб ўтган амалларингиз учун жаннатга киринглар», дейдилар.",
16,33,هَلۡ يَنظُرُونَ إِلَّآ أَن تَأۡتِيَهُمُ ٱلۡمَلَٰٓئِكَةُ أَوۡ يَأۡتِيَ أَمۡرُ رَبِّكَۚ كَذَٰلِكَ فَعَلَ ٱلَّذِينَ مِن قَبۡلِهِمۡۚ وَمَا ظَلَمَهُمُ ٱللَّهُ وَلَٰكِن كَانُوٓاْ أَنفُسَهُمۡ يَظۡلِمُونَ,Фаришталар келишидан ёки Парвардигорингизнинг амри келишидан бошқа нарсани кутмаяптилар. Улардан олдингилар ҳам шундай қилгандилар. Аллоҳ уларга зулм қилмаганди. Лекин улар ўзларига ўзлари зулм қилгандилар.,
16,34,فَأَصَابَهُمۡ سَيِّـَٔاتُ مَا عَمِلُواْ وَحَاقَ بِهِم مَّا كَانُواْ بِهِۦ يَسۡتَهۡزِءُونَ,"Бас, қилган ишларининг ёмонлиги ўзларига уриб, масхара қилиб юрганлари ўзларини ўраб олди.",
16,35,وَقَالَ ٱلَّذِينَ أَشۡرَكُواْ لَوۡ شَآءَ ٱللَّهُ مَا عَبَدۡنَا مِن دُونِهِۦ مِن شَيۡءٖ نَّحۡنُ وَلَآ ءَابَآؤُنَا وَلَا حَرَّمۡنَا مِن دُونِهِۦ مِن شَيۡءٖۚ كَذَٰلِكَ فَعَلَ ٱلَّذِينَ مِن قَبۡلِهِمۡۚ فَهَلۡ عَلَى ٱلرُّسُلِ إِلَّا ٱلۡبَلَٰغُ ٱلۡمُبِينُ,"Ширк келтирганлар: «Агар Аллоҳ хоҳлаганида биз ҳам, ота-боболаримиз ҳам Ундан бошқасига ибодат қилмаган, Усиз бирон нарсани ҳаромга айлантирмаган бўлар эдик», дедилар. Улардан олдингилар ҳам худди шундай қилганлар. Пайғамбарларнинг зиммасида очиқ етказиб қўйиш бор, холос.",
16,36,وَلَقَدۡ بَعَثۡنَا فِي كُلِّ أُمَّةٖ رَّسُولًا أَنِ ٱعۡبُدُواْ ٱللَّهَ وَٱجۡتَنِبُواْ ٱلطَّٰغُوتَۖ فَمِنۡهُم مَّنۡ هَدَى ٱللَّهُ وَمِنۡهُم مَّنۡ حَقَّتۡ عَلَيۡهِ ٱلضَّلَٰلَةُۚ فَسِيرُواْ فِي ٱلۡأَرۡضِ فَٱنظُرُواْ كَيۡفَ كَانَ عَٰقِبَةُ ٱلۡمُكَذِّبِينَ,"Биз ҳар бир умматга бир пайғамбар юбордик. «Аллоҳга бандалик қилинглар, шайтондан четланинглар». Улардан кимларигадир Аллоҳ ҳидоят берди. Кимларинингдир пешонасига залолат битилди. Бас, ер юзини кезиб юринглар. Ҳақни тан олмаганларнинг оқибати нима бўлганига қаранглар.",
16,37,إِن تَحۡرِصۡ عَلَىٰ هُدَىٰهُمۡ فَإِنَّ ٱللَّهَ لَا يَهۡدِي مَن يُضِلُّۖ وَمَا لَهُم مِّن نَّٰصِرِينَ,"Уларнинг ҳидоят топишларига (ҳар қанча) ҳарис бўлманг, Аллоҳ Ўзи адаштирадиган кимсани ҳидоят қилмайди. Улар учун (ҳеч қандай) ёрдам берувчилар ҳам бўлмайди.",
16,38,وَأَقۡسَمُواْ بِٱللَّهِ جَهۡدَ أَيۡمَٰنِهِمۡ لَا يَبۡعَثُ ٱللَّهُ مَن يَمُوتُۚ بَلَىٰ وَعۡدًا عَلَيۡهِ حَقّٗا وَلَٰكِنَّ أَكۡثَرَ ٱلنَّاسِ لَا يَعۡلَمُونَ,"Жон-жаҳдлари билан: «Аллоҳ ўлганларни қайта тирилтирмайди», деб Аллоҳ номига қасам ичдилар. Асло! Бу У Зотнинг зиммасидаги ҳақ ваъдадир. Лекин одамларнинг кўплари билмайдилар.",
16,39,لِيُبَيِّنَ لَهُمُ ٱلَّذِي يَخۡتَلِفُونَ فِيهِ وَلِيَعۡلَمَ ٱلَّذِينَ كَفَرُوٓاْ أَنَّهُمۡ كَانُواْ كَٰذِبِينَ,Уларга ихтилоф қилган нарсаларини очиқлаб бериш учун. Куфр келтирганлар ўзларининг ёлғончи эканликларини билишлари учун.,
16,40,إِنَّمَا قَوۡلُنَا لِشَيۡءٍ إِذَآ أَرَدۡنَٰهُ أَن نَّقُولَ لَهُۥ كُن فَيَكُونُ,"Бир нарсани истасак, унга «Бўл», дейишимиз кифоя, тамом, у бўлади.",
16,41,وَٱلَّذِينَ هَاجَرُواْ فِي ٱللَّهِ مِنۢ بَعۡدِ مَا ظُلِمُواْ لَنُبَوِّئَنَّهُمۡ فِي ٱلدُّنۡيَا حَسَنَةٗۖ وَلَأَجۡرُ ٱلۡأٓخِرَةِ أَكۡبَرُۚ لَوۡ كَانُواْ يَعۡلَمُونَ,"Зулмга учраганларидан кейин Аллоҳ йўлида ҳижрат қилганларга бу дунёда ҳам гўзал жойлар ато этамиз. Охират савоби эса каттароқдир, агар биладиган бўлсалар.",
16,42,ٱلَّذِينَ صَبَرُواْ وَعَلَىٰ رَبِّهِمۡ يَتَوَكَّلُونَ,Улар сабр қилган ва Парвардигорларигагина таянадиган зотлардир.,
16,43,وَمَآ أَرۡسَلۡنَا مِن قَبۡلِكَ إِلَّا رِجَالٗا نُّوحِيٓ إِلَيۡهِمۡۖ فَسۡـَٔلُوٓاْ أَهۡلَ ٱلذِّكۡرِ إِن كُنتُمۡ لَا تَعۡلَمُونَ,"Сиздан олдин ҳам фақат эркакларни пайғамбар қилиб юборганмиз ва уларга ваҳий қилганмиз. Агар билмайдиган бўлсангизлар, аҳли илмлардан сўранглар.",
16,44,بِٱلۡبَيِّنَٰتِ وَٱلزُّبُرِۗ وَأَنزَلۡنَآ إِلَيۡكَ ٱلذِّكۡرَ لِتُبَيِّنَ لِلنَّاسِ مَا نُزِّلَ إِلَيۡهِمۡ وَلَعَلَّهُمۡ يَتَفَكَّرُونَ,"Ҳужжатлар ва китоблар билан юбордик. Одамларга уларга нозил қилинган нарсани баён қилиб беришингиз учун сизга Зикрни нозил қилдик. Шоядки, улар фикр юритсалар.",
16,45,أَفَأَمِنَ ٱلَّذِينَ مَكَرُواْ ٱلسَّيِّـَٔاتِ أَن يَخۡسِفَ ٱللَّهُ بِهِمُ ٱلۡأَرۡضَ أَوۡ يَأۡتِيَهُمُ ٱلۡعَذَابُ مِنۡ حَيۡثُ لَا يَشۡعُرُونَ,Ёвуз найрангларни қилганлар Аллоҳнинг амри ила уларни ер ютиб юборишидан ёки уларга кутмаган тарафларидан азоб келишидан (қўрқмай) хотиржам юрибдиларми?,
16,46,أَوۡ يَأۡخُذَهُمۡ فِي تَقَلُّبِهِمۡ فَمَا هُم بِمُعۡجِزِينَ,"Ёки ҳаракат қилиб юрганларида (тўсатдан) тутиб қолишидан, кейин эса ўзларини ҳимоя қилолмай қолишларидан (қўрқмай, хотиржам юрибдиларми?)",
16,47,أَوۡ يَأۡخُذَهُمۡ عَلَىٰ تَخَوُّفٖ فَإِنَّ رَبَّكُمۡ لَرَءُوفٞ رَّحِيمٌ,"Ёки У Зот уларни қўрқиб турган пайтларида олишидан ҳам (хотиржаммилар)? Албатта, Парвардигорингиз Меҳрибон ва Раҳмли Зотдир.",
16,48,أَوَلَمۡ يَرَوۡاْ إِلَىٰ مَا خَلَقَ ٱللَّهُ مِن شَيۡءٖ يَتَفَيَّؤُاْ ظِلَٰلُهُۥ عَنِ ٱلۡيَمِينِ وَٱلشَّمَآئِلِ سُجَّدٗا لِّلَّهِ وَهُمۡ دَٰخِرُونَ,"Аллоҳ яратган ҳар бир нарсанинг соялари ўнгу сўлларга мойил бўлиб, эгилган ҳолларида Аллоҳга сажда қилаётганларини кўрмадиларми?",
16,49,وَلِلَّهِۤ يَسۡجُدُۤ مَا فِي ٱلسَّمَٰوَٰتِ وَمَا فِي ٱلۡأَرۡضِ مِن دَآبَّةٖ وَٱلۡمَلَٰٓئِكَةُ وَهُمۡ لَا يَسۡتَكۡبِرُونَ,Осмонлару ердаги ҳар бир жонзот ва фаришталар кибр қилмаган ҳолларида Аллоҳга сажда қиладилар.,
16,50,يَخَافُونَ رَبَّهُم مِّن فَوۡقِهِمۡ وَيَفۡعَلُونَ مَا يُؤۡمَرُونَ۩,Улар устиларидаги Парвардигорларидан қўрқадилар ва ўзларига буюрилган ишларнигина бажарадилар.,
16,51,۞ وَقَالَ ٱللَّهُ لَا تَتَّخِذُوٓاْ إِلَٰهَيۡنِ ٱثۡنَيۡنِۖ إِنَّمَا هُوَ إِلَٰهٞ وَٰحِدٞ فَإِيَّٰيَ فَٱرۡهَبُونِ,"Аллоҳ деди: «Икки илоҳ тутмангиз. Биргина илоҳ бор. Бас, Мендангина қўрқингиз».",
16,52,وَلَهُۥ مَا فِي ٱلسَّمَٰوَٰتِ وَٱلۡأَرۡضِ وَلَهُ ٱلدِّينُ وَاصِبًاۚ أَفَغَيۡرَ ٱللَّهِ تَتَّقُونَ,Осмонлару ердаги нарсалар Уникидир. Дин ҳам ҳар доим ёлғиз Уникидир. Аллоҳдан бошқасидан қўрқасизларми?,
16,53,وَمَا بِكُم مِّن نِّعۡمَةٖ فَمِنَ ٱللَّهِۖ ثُمَّ إِذَا مَسَّكُمُ ٱلضُّرُّ فَإِلَيۡهِ تَجۡـَٔرُونَ,"Сизларда қайси бир неъмат бўлса, (ҳаммаси) Аллоҳдандир. Кейин қачон сизларга бир мусибат етса, Унгагина илтижо қиласизлар.",
16,54,ثُمَّ إِذَا كَشَفَ ٱلضُّرَّ عَنكُمۡ إِذَا فَرِيقٞ مِّنكُم بِرَبِّهِمۡ يُشۡرِكُونَ,"Энди қачон сизлардан балони аритса, сизлардан бир гуруҳингиз яна Парвардигорларига ширк келтираверадилар.",
