surah,ayah,arabic_text,translation,footnotes
37,1,وَٱلصَّٰٓفَّٰتِ صَفّٗا,Саф тортиб турган (фаришта)ларга қасам.,
37,2,فَٱلزَّٰجِرَٰتِ زَجۡرٗا,Зажр қилгувчи (фаришта)ларга қасам.,
37,3,فَٱلتَّٰلِيَٰتِ ذِكۡرًا,Зикрни тиловат қилгувчи (фаришта)ларга қасам.,
37,4,إِنَّ إِلَٰهَكُمۡ لَوَٰحِدٞ,"Дарҳақиқат, илоҳингиз биттадир.",
37,5,رَّبُّ ٱلسَّمَٰوَٰتِ وَٱلۡأَرۡضِ وَمَا بَيۡنَهُمَا وَرَبُّ ٱلۡمَشَٰرِقِ,Осмонлару ернинг ва улар орасидаги нарсаларнинг Парвардигоридир. Машриқларнинг Парвардигоридир.,
37,6,إِنَّا زَيَّنَّا ٱلسَّمَآءَ ٱلدُّنۡيَا بِزِينَةٍ ٱلۡكَوَاكِبِ,"Дарҳақиқат, Биз дунё осмонини юлдузлар безаги ила безадик.",
37,7,وَحِفۡظٗا مِّن كُلِّ شَيۡطَٰنٖ مَّارِدٖ,Ҳар бир итоатсиз шайтондан сақладик.,
37,8,لَّا يَسَّمَّعُونَ إِلَى ٱلۡمَلَإِ ٱلۡأَعۡلَىٰ وَيُقۡذَفُونَ مِن كُلِّ جَانِبٖ,Улар олий мавжудотни эшита олмаслар ва ҳар тарафдан отилурлар.,
37,9,دُحُورٗاۖ وَلَهُمۡ عَذَابٞ وَاصِبٌ,Ҳайдалурлар! Улар учун доимий азоб бордир.,
37,10,إِلَّا مَنۡ خَطِفَ ٱلۡخَطۡفَةَ فَأَتۡبَعَهُۥ شِهَابٞ ثَاقِبٞ,"Илло биронтаси бир хабарни ўғирлаб олса, бас, уни учар юлдуз қувиб етар (ва ҳалок қилар).",
37,11,فَٱسۡتَفۡتِهِمۡ أَهُمۡ أَشَدُّ خَلۡقًا أَم مَّنۡ خَلَقۡنَآۚ إِنَّا خَلَقۡنَٰهُم مِّن طِينٖ لَّازِبِۭ,"Бас, сиз улардан сўранг-чи, улар кучлироқ яратилганмикинлар ёки Биз яратганларми? Дарҳақиқат, Биз уларни бир ёпишқоқ лойдан яратганмиз.",
37,12,بَلۡ عَجِبۡتَ وَيَسۡخَرُونَ,Сиз таажжубдасиз. Улар эса масхара қилурлар.,
37,13,وَإِذَا ذُكِّرُواْ لَا يَذۡكُرُونَ,"Уларга насиҳат қилинса, насихатни олмайдилар.",
37,14,وَإِذَا رَأَوۡاْ ءَايَةٗ يَسۡتَسۡخِرُونَ,"Бирон белгини кўрсалар, масхара қиладилар.",
37,15,وَقَالُوٓاْ إِنۡ هَٰذَآ إِلَّا سِحۡرٞ مُّبِينٌ,"«Бу очиқ сеҳрдан бошқа нарса эмас», дейдилар.",
37,16,أَءِذَا مِتۡنَا وَكُنَّا تُرَابٗا وَعِظَٰمًا أَءِنَّا لَمَبۡعُوثُونَ,"Ўлиб тупроққа, суякка айланиб кетганимиздан кейин қайта тирилар эканмизми?",
37,17,أَوَءَابَآؤُنَا ٱلۡأَوَّلُونَ,Олдинги ота-боболаримиз ҳам-а?,
37,18,قُلۡ نَعَمۡ وَأَنتُمۡ دَٰخِرُونَ,"Айтинг: «Ҳа, хор бўлган ҳолингизда».",
37,19,فَإِنَّمَا هِيَ زَجۡرَةٞ وَٰحِدَةٞ فَإِذَا هُمۡ يَنظُرُونَ,"Бас, у биргина қичқириқ, холос. Қарабсизки, улар қараб турибдилар.",
37,20,وَقَالُواْ يَٰوَيۡلَنَا هَٰذَا يَوۡمُ ٱلدِّينِ,"«Шўримиз қурсин! Бу Қиёмат куни-ку», деб қоладилар.",
37,21,هَٰذَا يَوۡمُ ٱلۡفَصۡلِ ٱلَّذِي كُنتُم بِهِۦ تُكَذِّبُونَ,Мана шу сизлар ёлғонга чиқариб юрган ажрим кунидир.,
37,22,۞ ٱحۡشُرُواْ ٱلَّذِينَ ظَلَمُواْ وَأَزۡوَٰجَهُمۡ وَمَا كَانُواْ يَعۡبُدُونَ,Зулм қилганларни ва уларнинг ҳамтовоқларини ҳамда улар ибодат қилиб ўтган нарсаларини тўпланглар!,
37,23,مِن دُونِ ٱللَّهِ فَٱهۡدُوهُمۡ إِلَىٰ صِرَٰطِ ٱلۡجَحِيمِ,"Аллоҳни қўйиб. Бас, уларни дўзах йўлига бошланглар.",
37,24,وَقِفُوهُمۡۖ إِنَّهُم مَّسۡـُٔولُونَ,"Ва уларни тўхтатинглар! Албатта, улар сўралгувчидирлар.",
37,25,مَا لَكُمۡ لَا تَنَاصَرُونَ,"Сизларга нима бўлдики, бир-бирингизга ёрдам бермаяпсизлар?",
37,26,بَلۡ هُمُ ٱلۡيَوۡمَ مُسۡتَسۡلِمُونَ,Йўқ! Улар бугун таслим бўлгувчилардир.,
37,27,وَأَقۡبَلَ بَعۡضُهُمۡ عَلَىٰ بَعۡضٖ يَتَسَآءَلُونَ,"Улар бир-бирларига қараб, бир-бирларидан сўрайдилар.",
37,28,قَالُوٓاْ إِنَّكُمۡ كُنتُمۡ تَأۡتُونَنَا عَنِ ٱلۡيَمِينِ,"Дедилар: «Дарҳақиқат, сизлар бизга ўнг томондан келар эдингизлар».",
37,29,قَالُواْ بَل لَّمۡ تَكُونُواْ مُؤۡمِنِينَ,"Дедилар: «Аксинча, ўзларингиз мўмин бўлмагансизлар».",
37,30,وَمَا كَانَ لَنَا عَلَيۡكُم مِّن سُلۡطَٰنِۭۖ بَلۡ كُنتُمۡ قَوۡمٗا طَٰغِينَ,Биз учун сизларнинг устингиздан ҳеч қандай ҳукмронлик бўлмаган. Балки ўзингиз ҳаддан ошган қавм бўлгансиз.,
37,31,فَحَقَّ عَلَيۡنَا قَوۡلُ رَبِّنَآۖ إِنَّا لَذَآئِقُونَ,"Бас, бизга Парвардигоримизнинг сўзи ҳақ бўлди. Энди биз аниқ тотгувчилармиз.",
37,32,فَأَغۡوَيۡنَٰكُمۡ إِنَّا كُنَّا غَٰوِينَ,"Сизларни йўлдан оздирдик. Дарҳақиқат, биз ўзимиз йўлдан озгувчилар эдик.",
37,33,فَإِنَّهُمۡ يَوۡمَئِذٖ فِي ٱلۡعَذَابِ مُشۡتَرِكُونَ,"Бас, албатта, улар у кунда азобда шерик бўлгувчилардир.",
37,34,إِنَّا كَذَٰلِكَ نَفۡعَلُ بِٱلۡمُجۡرِمِينَ,"Дарҳақиқат, Биз жиноятчиларни шундай қилурмиз.",
37,35,إِنَّهُمۡ كَانُوٓاْ إِذَا قِيلَ لَهُمۡ لَآ إِلَٰهَ إِلَّا ٱللَّهُ يَسۡتَكۡبِرُونَ,"Дарҳақиқат, уларга «Аллоҳдан ўзга илоҳ йўқ», дейилса, ўзларини катта олгандилар.",
37,36,وَيَقُولُونَ أَئِنَّا لَتَارِكُوٓاْ ءَالِهَتِنَا لِشَاعِرٖ مَّجۡنُونِۭ,«Бир мажнун шоирни деб худоларимизни тарк қилар эканмизми?» - дейдилар.,
37,37,بَلۡ جَآءَ بِٱلۡحَقِّ وَصَدَّقَ ٱلۡمُرۡسَلِينَ,Асло! У ҳақни олиб келди ва пайғамбарларни тасдиқ этди.,
37,38,إِنَّكُمۡ لَذَآئِقُواْ ٱلۡعَذَابِ ٱلۡأَلِيمِ,"Албатта, сиз аламли азобни тотгувчидирсиз.",
37,39,وَمَا تُجۡزَوۡنَ إِلَّا مَا كُنتُمۡ تَعۡمَلُونَ,Қилиб ўтган ишларингизнинггина жазосини олурсизлар.,
37,40,إِلَّا عِبَادَ ٱللَّهِ ٱلۡمُخۡلَصِينَ,Аллоҳнинг покиза бандаларигина бундан мустасно.,
37,41,أُوْلَٰٓئِكَ لَهُمۡ رِزۡقٞ مَّعۡلُومٞ,Ана ўшалар учун маълум ризқ бордир.,
37,42,فَوَٰكِهُ وَهُم مُّكۡرَمُونَ,Мевалар. Уларга иззат-икром кўрсатилур.,
37,43,فِي جَنَّٰتِ ٱلنَّعِيمِ,Ноз-неъмат боғларида.,
37,44,عَلَىٰ سُرُرٖ مُّتَقَٰبِلِينَ,Сўриларда бир-бирларига қараб.,
37,45,يُطَافُ عَلَيۡهِم بِكَأۡسٖ مِّن مَّعِينِۭ,Уларга оқар чашмадан қадаҳлар айлантириб турилур.,
37,46,بَيۡضَآءَ لَذَّةٖ لِّلشَّٰرِبِينَ,"Оппоқ, ичгувчига лаззатбахш.",
37,47,لَا فِيهَا غَوۡلٞ وَلَا هُمۡ عَنۡهَا يُنزَفُونَ,Унда маст қиладиган ҳеч нарса йўқ ва улар ундан маст бўлмаслар.,
37,48,وَعِندَهُمۡ قَٰصِرَٰتُ ٱلطَّرۡفِ عِينٞ,Уларнинг ҳузурида кўзларини тийгувчилар бор.,
37,49,كَأَنَّهُنَّ بَيۡضٞ مَّكۡنُونٞ,Бамисоли яшириб қўйилган тухумлардек.,
37,50,فَأَقۡبَلَ بَعۡضُهُمۡ عَلَىٰ بَعۡضٖ يَتَسَآءَلُونَ,"Бир-бирларига қараб, бир-бирларидан сўрайдилар.",
37,51,قَالَ قَآئِلٞ مِّنۡهُمۡ إِنِّي كَانَ لِي قَرِينٞ,Улардан бири дейди: «Менинг бир дўстим бор эди».,
37,52,يَقُولُ أَءِنَّكَ لَمِنَ ٱلۡمُصَدِّقِينَ,У айтар эдики: «Сен ростдан ҳам тасдиқловчиларданмисан?!,
37,53,أَءِذَا مِتۡنَا وَكُنَّا تُرَابٗا وَعِظَٰمًا أَءِنَّا لَمَدِينُونَ,Ўлиб тупроқ ва суякка айланиб кетганимиздан кейин жазолангувчилармизми?,
37,54,قَالَ هَلۡ أَنتُم مُّطَّلِعُونَ,Сизлар ҳам қарагувчилармисиз?»,
37,55,فَٱطَّلَعَ فَرَءَاهُ فِي سَوَآءِ ٱلۡجَحِيمِ,"Бас, ўзи қараб, уни дўзахнинг ўртасида кўрди.",
37,56,قَالَ تَٱللَّهِ إِن كِدتَّ لَتُرۡدِينِ,"Деди: «Аллоҳга қасамки, мени ҳам ҳалок қилишингга оз қолган экан».",
37,57,وَلَوۡلَا نِعۡمَةُ رَبِّي لَكُنتُ مِنَ ٱلۡمُحۡضَرِينَ,Парвардигоримнинг неъмати бўлмаганида ҳозирланувчилардан бўлиб қолардим.,
37,58,أَفَمَا نَحۡنُ بِمَيِّتِينَ,Биз ўлгувчи эмас эканмизми?!,
37,59,إِلَّا مَوۡتَتَنَا ٱلۡأُولَىٰ وَمَا نَحۡنُ بِمُعَذَّبِينَ,Биринчи марта ўлганимиз бундан мустасно. Биз азоблангувчилар эмасмиз.,
37,60,إِنَّ هَٰذَا لَهُوَ ٱلۡفَوۡزُ ٱلۡعَظِيمُ,Буюк зафар мана шу.,
37,61,لِمِثۡلِ هَٰذَا فَلۡيَعۡمَلِ ٱلۡعَٰمِلُونَ,"Бас, амал қилгувчилар мана шундай зафар учун амал этсинлар.",
37,62,أَذَٰلِكَ خَيۡرٞ نُّزُلًا أَمۡ شَجَرَةُ ٱلزَّقُّومِ,Мана шу яхшироқ зиёфатми ёки заққум дарахтими?,
37,63,إِنَّا جَعَلۡنَٰهَا فِتۡنَةٗ لِّلظَّٰلِمِينَ,"Дарҳақиқат, Биз уни золимлар учун фитна қилдик.",
37,64,إِنَّهَا شَجَرَةٞ تَخۡرُجُ فِيٓ أَصۡلِ ٱلۡجَحِيمِ,"Дарҳақиқат, у дўзах қаърида ўсадиган бир дарахтдир.",
37,65,طَلۡعُهَا كَأَنَّهُۥ رُءُوسُ ٱلشَّيَٰطِينِ,Унинг мевалари шайтонларнинг бошларига ўхшайди.,
37,66,فَإِنَّهُمۡ لَأٓكِلُونَ مِنۡهَا فَمَالِـُٔونَ مِنۡهَا ٱلۡبُطُونَ,"Бас, улар ундан егувчилардир. Ундан қоринларни тўлдиргувчилардир.",
37,67,ثُمَّ إِنَّ لَهُمۡ عَلَيۡهَا لَشَوۡبٗا مِّنۡ حَمِيمٖ,Бунинг устига улар учун ўта қайноқ сувдан аралаштирилур.,
37,68,ثُمَّ إِنَّ مَرۡجِعَهُمۡ لَإِلَى ٱلۡجَحِيمِ,Кейин уларнинг қайтиш жойи жаҳаннамга бўлур.,
37,69,إِنَّهُمۡ أَلۡفَوۡاْ ءَابَآءَهُمۡ ضَآلِّينَ,Улар ота-боболарини адашган ҳолда топдилар.,
37,70,فَهُمۡ عَلَىٰٓ ءَاثَٰرِهِمۡ يُهۡرَعُونَ,Энди ўзлари ҳам уларнинг изларидан чопмоқдалар.,
37,71,وَلَقَدۡ ضَلَّ قَبۡلَهُمۡ أَكۡثَرُ ٱلۡأَوَّلِينَ,Улардан олдин ўтганларнинг кўплари аниқ адашганлар.,
37,72,وَلَقَدۡ أَرۡسَلۡنَا فِيهِم مُّنذِرِينَ,"Дарҳақиқат, уларнинг ичларига огоҳлантиргувчилар юбордик.",
37,73,فَٱنظُرۡ كَيۡفَ كَانَ عَٰقِبَةُ ٱلۡمُنذَرِينَ,"Бас, огоҳлантирилганларнинг оқибати қандай бўлганига қаранг.",
37,74,إِلَّا عِبَادَ ٱللَّهِ ٱلۡمُخۡلَصِينَ,Аллоҳнинг покиза бандаларигина бундан мустасно.,
37,75,وَلَقَدۡ نَادَىٰنَا نُوحٞ فَلَنِعۡمَ ٱلۡمُجِيبُونَ,"Бизга Нуҳ нидо қилди. Бас, Биз нақадар яхши ижобат қилгувчилармиз.",
37,76,وَنَجَّيۡنَٰهُ وَأَهۡلَهُۥ مِنَ ٱلۡكَرۡبِ ٱلۡعَظِيمِ,Уни ва унинг аҳлини буюк қайғудан қутқардик.,
37,77,وَجَعَلۡنَا ذُرِّيَّتَهُۥ هُمُ ٱلۡبَاقِينَ,Айнан унинг зурриётини боқий қолгувчилар қилиб қўйдик.,
37,78,وَتَرَكۡنَا عَلَيۡهِ فِي ٱلۡأٓخِرِينَ,Кейингилар орасида унинг учун (олқишлар) қолдирдик.,
37,79,سَلَٰمٌ عَلَىٰ نُوحٖ فِي ٱلۡعَٰلَمِينَ,Барча оламларда Нуҳга салом бўлсин!,
37,80,إِنَّا كَذَٰلِكَ نَجۡزِي ٱلۡمُحۡسِنِينَ,"Дарҳақиқат, Биз чиройли амал қилгувчиларни мана шундай мукофотлаймиз.",
37,81,إِنَّهُۥ مِنۡ عِبَادِنَا ٱلۡمُؤۡمِنِينَ,"Дарҳақиқат, у мўмин бандаларимиздандир.",
37,82,ثُمَّ أَغۡرَقۡنَا ٱلۡأٓخَرِينَ,Кейин бошқаларни ғарқ айладик.,
37,83,۞ وَإِنَّ مِن شِيعَتِهِۦ لَإِبۡرَٰهِيمَ,"Албатта, Иброҳим ҳам унинг гуруҳидандир.",
37,84,إِذۡ جَآءَ رَبَّهُۥ بِقَلۡبٖ سَلِيمٍ,Ўшанда у Парвардигорига соф дил билан келганди.,
37,85,إِذۡ قَالَ لِأَبِيهِ وَقَوۡمِهِۦ مَاذَا تَعۡبُدُونَ,Ўшанда отаси ва қавмига: «Нимага ибодат қилмоқдасизлар?» - деганди.,
37,86,أَئِفۡكًا ءَالِهَةٗ دُونَ ٱللَّهِ تُرِيدُونَ,"Аллоҳни қўйиб, сохта худоларни истаб қолдингларми?",
37,87,فَمَا ظَنُّكُم بِرَبِّ ٱلۡعَٰلَمِينَ,Оламлар Парвардигори ҳақида қандай гумондасиз?,
37,88,فَنَظَرَ نَظۡرَةٗ فِي ٱلنُّجُومِ,Кейин у юлдузларга тикилиб қаради.,
37,89,فَقَالَ إِنِّي سَقِيمٞ,"«Мен аниқ касалман», деди.",
37,90,فَتَوَلَّوۡاْ عَنۡهُ مُدۡبِرِينَ,"Бас, ундан юз ўгириб кетдилар.",
37,91,فَرَاغَ إِلَىٰٓ ءَالِهَتِهِمۡ فَقَالَ أَلَا تَأۡكُلُونَ,"Бас, уларнинг худолари ёнига келиб деди: «Қани, емайсизларми?!",
37,92,مَا لَكُمۡ لَا تَنطِقُونَ,Нега гапирмаяпсизлар?»,
37,93,فَرَاغَ عَلَيۡهِمۡ ضَرۡبَۢا بِٱلۡيَمِينِ,"Бас, улар ёнига бориб, ўнг қўли билан урди.",
37,94,فَأَقۡبَلُوٓاْ إِلَيۡهِ يَزِفُّونَ,"Бас, унинг олдига шошиб келдилар.",
37,95,قَالَ أَتَعۡبُدُونَ مَا تَنۡحِتُونَ,Деди: «Ўзингиз йўниб ясаган нарсага ибодат қиласизларми?!,
37,96,وَٱللَّهُ خَلَقَكُمۡ وَمَا تَعۡمَلُونَ,"Ҳолбуки, сизларни ҳам, қилиб олган нарсаларингизни ҳам Аллоҳ яратган-ку?!»",
37,97,قَالُواْ ٱبۡنُواْ لَهُۥ بُنۡيَٰنٗا فَأَلۡقُوهُ فِي ٱلۡجَحِيمِ,"Дедилар: «Унинг учун бир бино қуриб, уни оловга отинглар».",
37,98,فَأَرَادُواْ بِهِۦ كَيۡدٗا فَجَعَلۡنَٰهُمُ ٱلۡأَسۡفَلِينَ,Унга бир макрни қасд қилгандилар. Ўзларини паст айладик.,
37,99,وَقَالَ إِنِّي ذَاهِبٌ إِلَىٰ رَبِّي سَيَهۡدِينِ,"Деди: «Мен, албатта, Парвардигорим сари боргувчиман. У мени ҳидоят қилур».",
37,100,رَبِّ هَبۡ لِي مِنَ ٱلصَّٰلِحِينَ,"Парвардигорим, менга солиҳлардан ато эт.",
37,101,فَبَشَّرۡنَٰهُ بِغُلَٰمٍ حَلِيمٖ,"Бас, Биз унга бир ҳалим ўғил ҳақида хушхабар бердик.",
37,102,فَلَمَّا بَلَغَ مَعَهُ ٱلسَّعۡيَ قَالَ يَٰبُنَيَّ إِنِّيٓ أَرَىٰ فِي ٱلۡمَنَامِ أَنِّيٓ أَذۡبَحُكَ فَٱنظُرۡ مَاذَا تَرَىٰۚ قَالَ يَٰٓأَبَتِ ٱفۡعَلۡ مَا تُؤۡمَرُۖ سَتَجِدُنِيٓ إِن شَآءَ ٱللَّهُ مِنَ ٱلصَّٰبِرِينَ,"У билан бирга юрадиган бўлгач: «Эй ўғилчам, мен тушимда сени сўяётганимни кўрмоқдаман. Нима фикр билдиришингни бир ўйлаб кўр», деди. Деди: «Эй отажон, сизга буюрилган ишни қилаверинг. Иншооллоҳ, мени сабр қилгувчилардан топурсиз».",
37,103,فَلَمَّآ أَسۡلَمَا وَتَلَّهُۥ لِلۡجَبِينِ,"Иккиси ҳам (Аллоҳнинг амрига) таслим бўлиб, (отаси) уни пешонаси билан ётқизган пайтда",
37,104,وَنَٰدَيۡنَٰهُ أَن يَٰٓإِبۡرَٰهِيمُ,Унга нидо қилдик: «Иброҳим!,
37,105,قَدۡ صَدَّقۡتَ ٱلرُّءۡيَآۚ إِنَّا كَذَٰلِكَ نَجۡزِي ٱلۡمُحۡسِنِينَ,"Дарҳақиқат, сен тушни тасдиқ этдинг». Албатта, Биз муҳсинларни мана шундай мукофотлаймиз.",
37,106,إِنَّ هَٰذَا لَهُوَ ٱلۡبَلَٰٓؤُاْ ٱلۡمُبِينُ,"Албатта, бу очиқ-ойдин синовнинг айни ўзидир.",
37,107,وَفَدَيۡنَٰهُ بِذِبۡحٍ عَظِيمٖ,Унинг ўрнига бир катта қурбонликни эваз қилиб бердик.,
37,108,وَتَرَكۡنَا عَلَيۡهِ فِي ٱلۡأٓخِرِينَ,Кейингилар орасида унинг учун (олқишлар) қолдирдик.,
37,109,سَلَٰمٌ عَلَىٰٓ إِبۡرَٰهِيمَ,Иброҳимга салом бўлсин!,
37,110,كَذَٰلِكَ نَجۡزِي ٱلۡمُحۡسِنِينَ,Биз гўзал амал қилгувчиларни шундай мукофотлармиз.,
37,111,إِنَّهُۥ مِنۡ عِبَادِنَا ٱلۡمُؤۡمِنِينَ,"Дарҳақиқат, у мўмин бандаларимиздандир.",
37,112,وَبَشَّرۡنَٰهُ بِإِسۡحَٰقَ نَبِيّٗا مِّنَ ٱلصَّٰلِحِينَ,Унга бир пайғамбар ва солиҳлардан бўлажак Исҳоқ ҳақида хушхабар бердик.,
37,113,وَبَٰرَكۡنَا عَلَيۡهِ وَعَلَىٰٓ إِسۡحَٰقَۚ وَمِن ذُرِّيَّتِهِمَا مُحۡسِنٞ وَظَالِمٞ لِّنَفۡسِهِۦ مُبِينٞ,"Унинг ўзига ҳам, Исҳоққа ҳам барака бердик. Ҳар иккисининг зурриётидан гўзал амал қилгувчи ҳам, ўз жонига очиқ жабр қилгувчи ҳам бўлур.",
37,114,وَلَقَدۡ مَنَنَّا عَلَىٰ مُوسَىٰ وَهَٰرُونَ,"Дарҳақиқат, Биз Мусо ва Ҳорунга инъом қилдик.",
37,115,وَنَجَّيۡنَٰهُمَا وَقَوۡمَهُمَا مِنَ ٱلۡكَرۡبِ ٱلۡعَظِيمِ,"Иккисига ҳам, қавмига ҳам улуғ ғамдан нажот бердик.",
37,116,وَنَصَرۡنَٰهُمۡ فَكَانُواْ هُمُ ٱلۡغَٰلِبِينَ,"Уларни қўлладик, бас, улар ғолиб бўлдилар.",
37,117,وَءَاتَيۡنَٰهُمَا ٱلۡكِتَٰبَ ٱلۡمُسۡتَبِينَ,Иккисига равшан Китобни бердик.,
37,118,وَهَدَيۡنَٰهُمَا ٱلصِّرَٰطَ ٱلۡمُسۡتَقِيمَ,Иккисини тўғри йўлга ҳидоят қилдик.,
37,119,وَتَرَكۡنَا عَلَيۡهِمَا فِي ٱلۡأٓخِرِينَ,Кейингилар орасида иккиси учун (мақтовлар) қолдирдик.,
37,120,سَلَٰمٌ عَلَىٰ مُوسَىٰ وَهَٰرُونَ,Мусо ва Ҳорунга салом бўлсин!,
37,121,إِنَّا كَذَٰلِكَ نَجۡزِي ٱلۡمُحۡسِنِينَ,"Дарҳақиқат, Биз чиройли амал қилгувчиларни мана шундай мукофотлаймиз.",
37,122,إِنَّهُمَا مِنۡ عِبَادِنَا ٱلۡمُؤۡمِنِينَ,Улар мўмин бандаларимиздандирлар.,
37,123,وَإِنَّ إِلۡيَاسَ لَمِنَ ٱلۡمُرۡسَلِينَ,"Илёс ҳам, шак-шубҳасиз, пайғамбарлардандир.",
37,124,إِذۡ قَالَ لِقَوۡمِهِۦٓ أَلَا تَتَّقُونَ,Ўшанда у қавмига деди: «Тақво қилмайсизларми?!,
37,125,أَتَدۡعُونَ بَعۡلٗا وَتَذَرُونَ أَحۡسَنَ ٱلۡخَٰلِقِينَ,"Баълга (бутга) ибодат қилиб, энг гўзал Яратгувчини тарк қиласизларми?!",
37,126,ٱللَّهَ رَبَّكُمۡ وَرَبَّ ءَابَآئِكُمُ ٱلۡأَوَّلِينَ,"Сизларнинг ҳам, аввалги ота-боболарингизнинг ҳам Парвардигори Аллоҳни (тарк қиласизларми)?!»",
37,127,فَكَذَّبُوهُ فَإِنَّهُمۡ لَمُحۡضَرُونَ,"Бас, уни ёлғончига чиқардилар. Энди, албатта, улар (азобга) ҳозир қилингувчилардир.",
37,128,إِلَّا عِبَادَ ٱللَّهِ ٱلۡمُخۡلَصِينَ,Аллоҳнинг покиза бандаларигина бундан мустасно.,
37,129,وَتَرَكۡنَا عَلَيۡهِ فِي ٱلۡأٓخِرِينَ,Кейингилар орасида унинг учун (олқишлар) қолдирдик.,
37,130,سَلَٰمٌ عَلَىٰٓ إِلۡ يَاسِينَ,Илёсга салом бўлсин.,
37,131,إِنَّا كَذَٰلِكَ نَجۡزِي ٱلۡمُحۡسِنِينَ,"Дарҳақиқат, Биз чиройли амал қилгувчиларни мана шундай мукофотлаймиз.",
37,132,إِنَّهُۥ مِنۡ عِبَادِنَا ٱلۡمُؤۡمِنِينَ,"Дарҳақиқат, у мўмин бандаларимиздандир.",
