surah,ayah,arabic_text,translation,footnotes
16,98,فَإِذَا قَرَأۡتَ ٱلۡقُرۡءَانَ فَٱسۡتَعِذۡ بِٱللَّهِ مِنَ ٱلشَّيۡطَٰنِ ٱلرَّجِيمِ,Қуръон ўқиган пайтингизда лаънатга учраган шайтондан паноҳ беришини Аллоҳдан сўранг.,
16,99,إِنَّهُۥ لَيۡسَ لَهُۥ سُلۡطَٰنٌ عَلَى ٱلَّذِينَ ءَامَنُواْ وَعَلَىٰ رَبِّهِمۡ يَتَوَكَّلُونَ,Иймон келтирган ва Парвардигорларига таянган зотларга қарши унинг учун ҳеч қандай ҳукмронлик йўқ.,
16,100,إِنَّمَا سُلۡطَٰنُهُۥ عَلَى ٱلَّذِينَ يَتَوَلَّوۡنَهُۥ وَٱلَّذِينَ هُم بِهِۦ مُشۡرِكُونَ,"Унинг ҳукми уни дўст тутадиганлар ва у туфайли мушрик бўладиганларгагина ўтади, холос.",
16,101,وَإِذَا بَدَّلۡنَآ ءَايَةٗ مَّكَانَ ءَايَةٖ وَٱللَّهُ أَعۡلَمُ بِمَا يُنَزِّلُ قَالُوٓاْ إِنَّمَآ أَنتَ مُفۡتَرِۭۚ بَلۡ أَكۡثَرُهُمۡ لَا يَعۡلَمُونَ,"Қачон бир оят ўрнига бошқа бир оятни алмаштирсак - Аллоҳнинг Ўзи нимани нозил қилишини билгувчироқ - «Сен ғирт уйдирмачисан», дедилар. Асло! Аксинча, уларнинг кўплари билмайдилар.",
16,102,قُلۡ نَزَّلَهُۥ رُوحُ ٱلۡقُدُسِ مِن رَّبِّكَ بِٱلۡحَقِّ لِيُثَبِّتَ ٱلَّذِينَ ءَامَنُواْ وَهُدٗى وَبُشۡرَىٰ لِلۡمُسۡلِمِينَ,Айтинг: «Уни Руҳул-қудс (Жаброил) Парвардигорингиз тарафидан иймон келтирганларни собитқадам қилиш учун ҳамда мусулмонларга ҳидоят ва хушхабар этиб ҳақ билан нозил қилди».,
16,103,وَلَقَدۡ نَعۡلَمُ أَنَّهُمۡ يَقُولُونَ إِنَّمَا يُعَلِّمُهُۥ بَشَرٞۗ لِّسَانُ ٱلَّذِي يُلۡحِدُونَ إِلَيۡهِ أَعۡجَمِيّٞ وَهَٰذَا لِسَانٌ عَرَبِيّٞ مُّبِينٌ,"Биз уларнинг: «Унга бир одам ўргатиб турибди», деяётганларини биламиз. Улар айтаётган одамнинг тили ажамийдир. Бу эса очиқ араб тилидадир.",
16,104,إِنَّ ٱلَّذِينَ لَا يُؤۡمِنُونَ بِـَٔايَٰتِ ٱللَّهِ لَا يَهۡدِيهِمُ ٱللَّهُ وَلَهُمۡ عَذَابٌ أَلِيمٌ,Аллоҳнинг оятларига иймон келтирмайдиган кимсаларни Аллоҳ ҳидоят қилмайди. Улар учун аламли азоб бордир.,
16,105,إِنَّمَا يَفۡتَرِي ٱلۡكَذِبَ ٱلَّذِينَ لَا يُؤۡمِنُونَ بِـَٔايَٰتِ ٱللَّهِۖ وَأُوْلَٰٓئِكَ هُمُ ٱلۡكَٰذِبُونَ,Ёлғонни Аллоҳнинг оятларига иймон келтирмайдиган кимсаларгина тўқийдилар. Ана ўшалар ёлғончилардир.,
16,106,مَن كَفَرَ بِٱللَّهِ مِنۢ بَعۡدِ إِيمَٰنِهِۦٓ إِلَّا مَنۡ أُكۡرِهَ وَقَلۡبُهُۥ مُطۡمَئِنُّۢ بِٱلۡإِيمَٰنِ وَلَٰكِن مَّن شَرَحَ بِٱلۡكُفۡرِ صَدۡرٗا فَعَلَيۡهِمۡ غَضَبٞ مِّنَ ٱللَّهِ وَلَهُمۡ عَذَابٌ عَظِيمٞ,"Ким иймон келтирганидан кейин яна кофир бўлса (Аллоҳнинг ғазабига йўлиқади). Фақат мажбур қилинган, қалби эса иймон билан ором олиб турган кимса бундан мустасно. Лекин кимлар қалбини куфрга очиб берсалар, уларнинг устига Аллоҳ тарафидан бир ғазаб (ёғилур) ва улар учун улкан азоб бордир.",
16,107,ذَٰلِكَ بِأَنَّهُمُ ٱسۡتَحَبُّواْ ٱلۡحَيَوٰةَ ٱلدُّنۡيَا عَلَى ٱلۡأٓخِرَةِ وَأَنَّ ٱللَّهَ لَا يَهۡدِي ٱلۡقَوۡمَ ٱلۡكَٰفِرِينَ,"Бунга сабаб улар дунё ҳаётини охиратдан кўра кўпроқ яхши кўрдилар. Албатта, Аллоҳ кофир қавмни ҳидоят қилмайди.",
16,108,أُوْلَٰٓئِكَ ٱلَّذِينَ طَبَعَ ٱللَّهُ عَلَىٰ قُلُوبِهِمۡ وَسَمۡعِهِمۡ وَأَبۡصَٰرِهِمۡۖ وَأُوْلَٰٓئِكَ هُمُ ٱلۡغَٰفِلُونَ,"Улар шундай кимсаларки, Аллоҳ уларнинг дилларини ҳам, қулоқларини ҳам, кўзларини ҳам муҳрлаб қўйган ва улар ғофиллардир.",
16,109,لَا جَرَمَ أَنَّهُمۡ فِي ٱلۡأٓخِرَةِ هُمُ ٱلۡخَٰسِرُونَ,"Шак-шубҳа йўқки, охиратда зиён кўрадиганлар ана ўшалардир.",
16,110,ثُمَّ إِنَّ رَبَّكَ لِلَّذِينَ هَاجَرُواْ مِنۢ بَعۡدِ مَا فُتِنُواْ ثُمَّ جَٰهَدُواْ وَصَبَرُوٓاْ إِنَّ رَبَّكَ مِنۢ بَعۡدِهَا لَغَفُورٞ رَّحِيمٞ,"Сўнгра Парвардигорингиз фитналарга йўлиққанларидан кейин ҳижрат қилган, сўнг жиҳод қилган ва сабр қилган кимсалар учун (мададкордир). Албатта, Парвардигорингиз шундан кейин Кечиримли ва Меҳрибон Зотдир.",
16,111,۞ يَوۡمَ تَأۡتِي كُلُّ نَفۡسٖ تُجَٰدِلُ عَن نَّفۡسِهَا وَتُوَفَّىٰ كُلُّ نَفۡسٖ مَّا عَمِلَتۡ وَهُمۡ لَا يُظۡلَمُونَ,Ҳар бир жон фақат ўзини оқлашга уриниб қоладиган ва ҳар бир жонга қилган ишига яраша (жазо ё мукофоти) тўла қилиб бериладиган ҳамда уларга зулм қилинмайдиган кунни (эсланг).,
16,112,وَضَرَبَ ٱللَّهُ مَثَلٗا قَرۡيَةٗ كَانَتۡ ءَامِنَةٗ مُّطۡمَئِنَّةٗ يَأۡتِيهَا رِزۡقُهَا رَغَدٗا مِّن كُلِّ مَكَانٖ فَكَفَرَتۡ بِأَنۡعُمِ ٱللَّهِ فَأَذَٰقَهَا ٱللَّهُ لِبَاسَ ٱلۡجُوعِ وَٱلۡخَوۡفِ بِمَا كَانُواْ يَصۡنَعُونَ,"Аллоҳ бир шаҳарни мисол қилиб келтирди. Тинч, хотиржам эди. Ҳар тарафдан ризқи мўл келиб турарди. Кейин Аллоҳнинг неъматларига нонкўрлик қилди. Натижада Аллоҳ унга қилган қилмишлари туфайли очлик ва хавф либосини кийдириб қўйди.",
16,113,وَلَقَدۡ جَآءَهُمۡ رَسُولٞ مِّنۡهُمۡ فَكَذَّبُوهُ فَأَخَذَهُمُ ٱلۡعَذَابُ وَهُمۡ ظَٰلِمُونَ,"Уларга ўзларидан бир пайғамбар келди. Уни ёлғончига чиқардилар. Бас, улар золим бўлиб турган ҳолларида уларни азоб ушлади.",
16,114,فَكُلُواْ مِمَّا رَزَقَكُمُ ٱللَّهُ حَلَٰلٗا طَيِّبٗا وَٱشۡكُرُواْ نِعۡمَتَ ٱللَّهِ إِن كُنتُمۡ إِيَّاهُ تَعۡبُدُونَ,"Аллоҳ сизларга берган ризқларнинг ҳалол-покидан енглар. Аллоҳнинг неъматига шукр қилинглар, агар Унгагина бандалик қиладиган бўлсангизлар.",
16,115,إِنَّمَا حَرَّمَ عَلَيۡكُمُ ٱلۡمَيۡتَةَ وَٱلدَّمَ وَلَحۡمَ ٱلۡخِنزِيرِ وَمَآ أُهِلَّ لِغَيۡرِ ٱللَّهِ بِهِۦۖ فَمَنِ ٱضۡطُرَّ غَيۡرَ بَاغٖ وَلَا عَادٖ فَإِنَّ ٱللَّهَ غَفُورٞ رَّحِيمٞ,"Сизларга ўлимтик, қон, тўнғиз гўшти ва Аллоҳдан бошқанинг номига сўйилган ҳайвоннигина ҳаром қилди. Энди ким мажбур бўлиб қолса ва золимлик қилиб, ҳаддидан ошмаса, бас, албатта, Аллоҳ Кечиримли, Меҳрибон Зотдир.",
16,116,وَلَا تَقُولُواْ لِمَا تَصِفُ أَلۡسِنَتُكُمُ ٱلۡكَذِبَ هَٰذَا حَلَٰلٞ وَهَٰذَا حَرَامٞ لِّتَفۡتَرُواْ عَلَى ٱللَّهِ ٱلۡكَذِبَۚ إِنَّ ٱلَّذِينَ يَفۡتَرُونَ عَلَى ٱللَّهِ ٱلۡكَذِبَ لَا يُفۡلِحُونَ,"Бу ҳалол ва бу ҳаром, дея тилларингизга келганини гапираверманглар ва (бу билан) Аллоҳ шаънига ёлғон тўқиманглар. Аллоҳ шаънига ёлғон тўқиганлар нажот топмайдилар.",
16,117,مَتَٰعٞ قَلِيلٞ وَلَهُمۡ عَذَابٌ أَلِيمٞ,Озгина фойда. (Кейин эса) улар учун аламли азоб бордир.,
16,118,وَعَلَى ٱلَّذِينَ هَادُواْ حَرَّمۡنَا مَا قَصَصۡنَا عَلَيۡكَ مِن قَبۡلُۖ وَمَا ظَلَمۡنَٰهُمۡ وَلَٰكِن كَانُوٓاْ أَنفُسَهُمۡ يَظۡلِمُونَ,Яҳудий бўлганларга сизга олдин Биз айтиб берган нарсаларни ҳаром қилдик. Биз уларга зулм қилмадик. Улар ўзларига ўзлари зулм қилдилар.,
16,119,ثُمَّ إِنَّ رَبَّكَ لِلَّذِينَ عَمِلُواْ ٱلسُّوٓءَ بِجَهَٰلَةٖ ثُمَّ تَابُواْ مِنۢ بَعۡدِ ذَٰلِكَ وَأَصۡلَحُوٓاْ إِنَّ رَبَّكَ مِنۢ بَعۡدِهَا لَغَفُورٞ رَّحِيمٌ,"Кейин билмасдан ёмонлик қилиб қўйиб, ортидан тавба қилган ва ўзини ўнглаб олган кимсалар учун, албатта, Парвардигорингиз Кечиримли, Меҳрибон Зотдир.",
16,120,إِنَّ إِبۡرَٰهِيمَ كَانَ أُمَّةٗ قَانِتٗا لِّلَّهِ حَنِيفٗا وَلَمۡ يَكُ مِنَ ٱلۡمُشۡرِكِينَ,"Албатта, Иброҳим Аллоҳга итоатгўй, ҳақда барқарор бир уммат эди. У мушриклардан бўлмаган.",
16,121,شَاكِرٗا لِّأَنۡعُمِهِۚ ٱجۡتَبَىٰهُ وَهَدَىٰهُ إِلَىٰ صِرَٰطٖ مُّسۡتَقِيمٖ,"Неъматларига шукр қилгувчи ҳам эди. (Аллоҳ) уни танлаб олиб, тўғри йўлга ҳидоят қилганди.",
16,122,وَءَاتَيۡنَٰهُ فِي ٱلدُّنۡيَا حَسَنَةٗۖ وَإِنَّهُۥ فِي ٱلۡأٓخِرَةِ لَمِنَ ٱلصَّٰلِحِينَ,"Унга шу дунёда ҳам яхшиликни бердик ва, албатта, у охиратда ҳам солиҳлардандир.",
16,123,ثُمَّ أَوۡحَيۡنَآ إِلَيۡكَ أَنِ ٱتَّبِعۡ مِلَّةَ إِبۡرَٰهِيمَ حَنِيفٗاۖ وَمَا كَانَ مِنَ ٱلۡمُشۡرِكِينَ,"Кейин сизга: «Иброҳимнинг ҳақ устида барқарор динига эргашинг. У мушриклардан бўлмаган», деб ваҳий қилдик.",
16,124,إِنَّمَا جُعِلَ ٱلسَّبۡتُ عَلَى ٱلَّذِينَ ٱخۡتَلَفُواْ فِيهِۚ وَإِنَّ رَبَّكَ لَيَحۡكُمُ بَيۡنَهُمۡ يَوۡمَ ٱلۡقِيَٰمَةِ فِيمَا كَانُواْ فِيهِ يَخۡتَلِفُونَ,"Шанба(ни улуғлаш) у ҳақда ихтилоф қилган кимсаларнинг зиммасига юклатилган. Албатта, Парвардигорингиз Қиёмат куни улар орасида қилиб ўтган ихтилофлари борасида ҳукм қилур.",
16,125,ٱدۡعُ إِلَىٰ سَبِيلِ رَبِّكَ بِٱلۡحِكۡمَةِ وَٱلۡمَوۡعِظَةِ ٱلۡحَسَنَةِۖ وَجَٰدِلۡهُم بِٱلَّتِي هِيَ أَحۡسَنُۚ إِنَّ رَبَّكَ هُوَ أَعۡلَمُ بِمَن ضَلَّ عَن سَبِيلِهِۦ وَهُوَ أَعۡلَمُ بِٱلۡمُهۡتَدِينَ,"Парвардигорингиз йўлига ҳикмат ва чиройли насиҳат ила даъват этинг. Улар билан энг гўзал тарзда мужодала қилинг. Албатта, Парвардигорингиз Ўзининг йўлидан адашганни ҳам билгувчироқ, ҳидоят топганларни ҳам билгувчироқ Зотдир.",
16,126,وَإِنۡ عَاقَبۡتُمۡ فَعَاقِبُواْ بِمِثۡلِ مَا عُوقِبۡتُم بِهِۦۖ وَلَئِن صَبَرۡتُمۡ لَهُوَ خَيۡرٞ لِّلصَّٰبِرِينَ,"Жазоламоқчи бўлсангиз, ўзингиз қанча зарар кўрган бўлсангиз, ўшанча миқдорда жазолангиз. Агар сабр қилсангиз, шу иш сабр қилгувчилар учун албатта яхшироқдир.",
16,127,وَٱصۡبِرۡ وَمَا صَبۡرُكَ إِلَّا بِٱللَّهِۚ وَلَا تَحۡزَنۡ عَلَيۡهِمۡ وَلَا تَكُ فِي ضَيۡقٖ مِّمَّا يَمۡكُرُونَ,Сабр қилинг. Сабрингиз Аллоҳнинг мадади билангина бўлур. Уларга хафа бўлманг. Улар қилаётган макру найранглардан сиқилманг.,
16,128,إِنَّ ٱللَّهَ مَعَ ٱلَّذِينَ ٱتَّقَواْ وَّٱلَّذِينَ هُم مُّحۡسِنُونَ,"Албатта, Аллоҳ тақво қилганлар ва муҳсин бўлганлар билан биргадир.",
