surah,ayah,arabic_text,translation,footnotes
107,1,أَرَءَيۡتَ ٱلَّذِي يُكَذِّبُ بِٱلدِّينِ,Šta misliš o onome koji Sudnji dan poriče?,
107,2,فَذَٰلِكَ ٱلَّذِي يَدُعُّ ٱلۡيَتِيمَ,"Pa to je onaj koji grubo odbija siroče,",
107,3,وَلَا يَحُضُّ عَلَىٰ طَعَامِ ٱلۡمِسۡكِينِ,i koji da se nahrani siromah – ne podstiče.,
107,4,فَوَيۡلٞ لِّلۡمُصَلِّينَ,"Pa teško klanjačima,",
107,5,ٱلَّذِينَ هُمۡ عَن صَلَاتِهِمۡ سَاهُونَ,"onima koji su nemarni prema svome namazu,",
107,6,ٱلَّذِينَ هُمۡ يُرَآءُونَ,koji se samo ljudima pokazuju,
107,7,وَيَمۡنَعُونَ ٱلۡمَاعُونَ,i čak potrepštine koje se na posudbu daju oni ne daju!,
