surah,ayah,arabic_text,translation,footnotes
97,1,إِنَّآ أَنزَلۡنَٰهُ فِي لَيۡلَةِ ٱلۡقَدۡرِ,"Mi smo ga objavili u Noći Kadr,",
97,2,وَمَآ أَدۡرَىٰكَ مَا لَيۡلَةُ ٱلۡقَدۡرِ,a šta ti misliš šta je Noć Kadr?,
97,3,لَيۡلَةُ ٱلۡقَدۡرِ خَيۡرٞ مِّنۡ أَلۡفِ شَهۡرٖ,Noć Kadr bolja je od hiljadu mjeseci;,
97,4,تَنَزَّلُ ٱلۡمَلَٰٓئِكَةُ وَٱلرُّوحُ فِيهَا بِإِذۡنِ رَبِّهِم مِّن كُلِّ أَمۡرٖ,"meleci i Duh, s dozvolom Gospodara svoga, spuštaju se u njoj zbog odluke svake,",
97,5,سَلَٰمٌ هِيَ حَتَّىٰ مَطۡلَعِ ٱلۡفَجۡرِ,spas je u njoj sve dok zora ne svane.,
