surah,ayah,arabic_text,translation,footnotes
15,71,قَالَ هَٰٓؤُلَآءِ بَنَاتِيٓ إِن كُنتُمۡ فَٰعِلِينَ,"(Лут): «Эгер бул иштен кайра тартпасаңар, мына, менин кыздарым» деди.[1]","[1] Лут бул сөзү менен кыздарын аларга сунуш кылган жок. Анткени, пайгамбар – эл атасы. Коомдогу бардык аялдар, анын арасында бачабаздардын аялдары дагы Луттун кыздары болуп саналгандыктан, Луттун бул сөзүн ""өз аялдарыңар менен эле кумарыңарды кандыра бергиле, бачабаздык кылбагыла"" деген мааниде түшүнүлөт."
15,72,لَعَمۡرُكَ إِنَّهُمۡ لَفِي سَكۡرَتِهِمۡ يَعۡمَهُونَ,"(О, Мухаммад!) Өмүрүңө ант, алар (ышкы-кумардын) мастыгында көздөрүнө эч нерсе көрүнбөй калган эле![1]","[1] Ошондуктан, Луттун сөзү аларга таасир бербеди. Бирок, эки жигит-периште Лутка абалды түшүндүрүп, көздөн кайым болуп кетишти. Лут дагы үй-бүлөсүн чыгарып кетти. Аялы артта калып калган..."
15,73,فَأَخَذَتۡهُمُ ٱلصَّيۡحَةُ مُشۡرِقِينَ,"Анан, Күн чыгаар мезгилде аларды (коркунучтуу) ач айкырык кармады.[1]",[1] Кайыптан келген бул айкырык азаптын башталышы болчу.
15,74,فَجَعَلۡنَا عَٰلِيَهَا سَافِلَهَا وَأَمۡطَرۡنَا عَلَيۡهِمۡ حِجَارَةٗ مِّن سِجِّيلٍ,"Анан Биз шаардын асты жагын үстүнө көңтөрүп, алардын үстүнө чопо-таштарды жамгырдай жаадырдык!",
15,75,إِنَّ فِي ذَٰلِكَ لَأٓيَٰتٖ لِّلۡمُتَوَسِّمِينَ,Албетте бул окуяда парасаттуу адамдар үчүн (Аллахтын кудуретине) белгилер бар.,
15,76,وَإِنَّهَا لَبِسَبِيلٖ مُّقِيمٍ,Ал (ойрон болгон шаар) кан жолдун боюнда.[1],"[1] Ары-бери өткөндөр анын урандыларын көрүп, каапырлардын акыбети кандай болоорун билсин!"
15,77,إِنَّ فِي ذَٰلِكَ لَأٓيَةٗ لِّلۡمُؤۡمِنِينَ,"Албетте, мында момун адамдар үчүн (Аллахтын кудуретине) белгилер бар.",
15,78,وَإِن كَانَ أَصۡحَٰبُ ٱلۡأَيۡكَةِ لَظَٰلِمِينَ,Бак-бостон кожоюндары залым (каапыр) болушкан.[1],"[1] Булар Шуайб пайгамбардын кооз-сонун бак-бостондуу мекенде бай-бардар турмушта жашаган коому. Бирок, ушул нээматка шүгүр кылып, жалгыз Аллахка сыйынып жашоонун ордуна таш-таразадан кыянат кылуу адатын өнөкөт кылып алышкан. Шуайб аларды ак жолго кайтарууга ар канча аракет кылса да пайда бербей, кайра динге душманчылыктары күчөй бергенде Аллах аларга да ач айкырык жиберип, кыйратып салган."
15,79,فَٱنتَقَمۡنَا مِنۡهُمۡ وَإِنَّهُمَا لَبِإِمَامٖ مُّبِينٖ,"Биз алардан да өч алдык! Чынында, экөө (Лут коому менен Шуайб коому) тең кең жолдун боюнда.",
15,80,وَلَقَدۡ كَذَّبَ أَصۡحَٰبُ ٱلۡحِجۡرِ ٱلۡمُرۡسَلِينَ,«Хижр» (өрөөнүнүн) жашоочулары да пайгамбарларды «жалганчы» дешти.[1],"[1] “Хижр” бул Хижаз жериндеги бир өрөөндүн аты. Ал жерде күч кубаттуу элдер Салих пайгамбардын коому жашаган. Алар Салихтин пайгамбарчылыгын жалганга чыгарып, Жалгыз Аллахка сыйынбай коюшат. Бардык пайгамбарлар бир Аллах тарабынан жөнөтүлүп, дааваттарынын мазмуну дагы бир болгондуктан, кимде-ким бир гана пайгамбарга ишенбесе, бардык пайгамбарларга ишенбеген болуп саналат. Ошондуктан аятта бир гана Салихти жалганчыга чыгарган коом жөнүндө “Пайгамбарларды жалганчыга чыгарды” деп айтылууда."
15,81,وَءَاتَيۡنَٰهُمۡ ءَايَٰتِنَا فَكَانُواْ عَنۡهَا مُعۡرِضِينَ,"Биз аларга аят-моожизаларыбызды (жи)бергенде, андан жүз бурушту.",
15,82,وَكَانُواْ يَنۡحِتُونَ مِنَ ٱلۡجِبَالِ بُيُوتًا ءَامِنِينَ,"Алар тоолордун боорун оюп-жонуп үйлөр куруп, тынч-аман жүрүшкөн.",
15,83,فَأَخَذَتۡهُمُ ٱلصَّيۡحَةُ مُصۡبِحِينَ,"Анан, аларды да таң мезгилинде (капысынан) ач айкырык кармап, (кыйрап калышты).",
15,84,فَمَآ أَغۡنَىٰ عَنۡهُم مَّا كَانُواْ يَكۡسِبُونَ,Жасаган нерселери аларга пайда берген жок![1],"[1] Аллахтын азабы келгенде таштан жасалган үй болобу, санаксыз аскер болобу же ашып-ташкан мал-мүлкү болобу, эч бири пайда бербейт."
15,85,وَمَا خَلَقۡنَا ٱلسَّمَٰوَٰتِ وَٱلۡأَرۡضَ وَمَا بَيۡنَهُمَآ إِلَّا بِٱلۡحَقِّۗ وَإِنَّ ٱلسَّاعَةَ لَأٓتِيَةٞۖ فَٱصۡفَحِ ٱلصَّفۡحَ ٱلۡجَمِيلَ,"Биз асмандарды, Жерди жана экөөнүн арасындагы нерселерди Акыйкат менен жараттык. Саат (Кыямат) сөзсүз келүүчү. Сен (оо, Мухаммад, наадан адамдардан) сылык-сыпаа жүз үйүр.",
15,86,إِنَّ رَبَّكَ هُوَ ٱلۡخَلَّٰقُ ٱلۡعَلِيمُ,"Албетте, сенин Раббиң - Ал гана (бардык макулуктарды) Жаратуучу, Билүүчү!",
15,87,وَلَقَدۡ ءَاتَيۡنَٰكَ سَبۡعٗا مِّنَ ٱلۡمَثَانِي وَٱلۡقُرۡءَانَ ٱلۡعَظِيمَ,Биз сага кайталануучудан жетини жана Улук Куранды бердик.[1],"[1] Бул аяттагы “жети кайталаиуучу” алар: «Бакара», «Аалы Имран», «Ниса», «Маида», «Аньам», «Аьраф», «Анфал» жана «Тауба» сүрөлөрүнөн турган жети узун сүрөлөр же болбосо, жети аяттан турган жана намаздын ар бир ирекетинде кайталана турган “Фатиха” сүрөсү."
15,88,لَا تَمُدَّنَّ عَيۡنَيۡكَ إِلَىٰ مَا مَتَّعۡنَا بِهِۦٓ أَزۡوَٰجٗا مِّنۡهُمۡ وَلَا تَحۡزَنۡ عَلَيۡهِمۡ وَٱخۡفِضۡ جَنَاحَكَ لِلۡمُؤۡمِنِينَ,"Алардын (каапырлардын) арасынан бир нече тайпаларга берген Биздин нээматтарыбызга карабай (көңүл бурбай) эле кой. (Ошондой эле, эгер баштарына Аллахтын бир азабы түшсө) аларга кайгырба! (Мээримдүүлүк) канатыңды ыймандууларга жайгын!",
15,89,وَقُلۡ إِنِّيٓ أَنَا ٱلنَّذِيرُ ٱلۡمُبِينُ,Айт: «Мен (башыңарга келүүчү азап жөнүндө) анык эскертүүчүмүн!,
15,90,كَمَآ أَنزَلۡنَا عَلَى ٱلۡمُقۡتَسِمِينَ,"Ошондой эле, Биз бөлүүчүлөргө (азап) түшүрдүк.",
15,91,ٱلَّذِينَ جَعَلُواْ ٱلۡقُرۡءَانَ عِضِينَ,Алар Куранды бөлүктөргө ажыратышты![1],"[1] Мекке мушриктеринин кээ бирлери Куранды ""бул сыйкыр"" десе, башкалары ""жок, бул бакшылык"" деп, ар кандай бөлүктөргө бөлүнүшкөн. Ошондой эле, яхудилер менен христиандар дагы Куран аяттарынын арасынан өз каалоолоруна дал келгенин гана ""туура"" деп тастыктап, калганына ишенбей коюу менен Куранды ажыратышкан. Алар өздөрүнө түшүрүлгөн Тоорат менен Инжил китептериндеги көп аяттардын маанисин да ушул сыяктуу бөлүп, бурмалашкан."
15,92,فَوَرَبِّكَ لَنَسۡـَٔلَنَّهُمۡ أَجۡمَعِينَ,Раббиңе ант! Биз алардын бардыгын суракка тартабыз.,
15,93,عَمَّا كَانُواْ يَعۡمَلُونَ,жасаган иштерине жараша!,
15,94,فَٱصۡدَعۡ بِمَا تُؤۡمَرُ وَأَعۡرِضۡ عَنِ ٱلۡمُشۡرِكِينَ,(Сен аларга көңүл бурбай) буюрулган ишке умтул жана мушриктерден жүз бур!,
15,95,إِنَّا كَفَيۡنَٰكَ ٱلۡمُسۡتَهۡزِءِينَ,"Албетте, сени шылдыңдаган адамдарга Өзүбүз жетиштүүбүз.",
15,96,ٱلَّذِينَ يَجۡعَلُونَ مَعَ ٱللَّهِ إِلَٰهًا ءَاخَرَۚ فَسَوۡفَ يَعۡلَمُونَ,Алар Аллахка дагы башка «кудайларды» кошуп (шерик кылып) алышкан. Жакында (иштеринин натыйжасын) билишет.,
15,97,وَلَقَدۡ نَعۡلَمُ أَنَّكَ يَضِيقُ صَدۡرُكَ بِمَا يَقُولُونَ,"Билебиз, алардын айткандарынан көкүрөгүң кысылып турат.",
15,98,فَسَبِّحۡ بِحَمۡدِ رَبِّكَ وَكُن مِّنَ ٱلسَّٰجِدِينَ,"Эми сен (көкүрөгүң кайра кең болушу үчүн) Раббиңе (көп) тасбих (мактоо) айтып, (көбүрөөк) сажда кылуучулардан бол!",
15,99,وَٱعۡبُدۡ رَبَّكَ حَتَّىٰ يَأۡتِيَكَ ٱلۡيَقِينُ,Жана сага өлүм келгенге чейин Раббиңе гана ибадат кыл!,
