surah,ayah,arabic_text,translation,footnotes
95,1,وَٱلتِّينِ وَٱلزَّيۡتُونِ,قسم دی پر انځر او ښوون.,
95,2,وَطُورِ سِينِينَ,او پر طور سينا (غره) قسم.,
95,3,وَهَٰذَا ٱلۡبَلَدِ ٱلۡأَمِينِ,اوپه دې له امن څخه ډك ښار (مكې) باندې.,
95,4,لَقَدۡ خَلَقۡنَا ٱلۡإِنسَٰنَ فِيٓ أَحۡسَنِ تَقۡوِيمٖ,په رېښتيا موږ انسان په ډېر ښه صوررت کې پيداکړی دی.,
95,5,ثُمَّ رَدَدۡنَٰهُ أَسۡفَلَ سَٰفِلِينَ,بيا مو تر ټولو لاندېنيو لاندې وګرځولو.,
95,6,إِلَّا ٱلَّذِينَ ءَامَنُواْ وَعَمِلُواْ ٱلصَّٰلِحَٰتِ فَلَهُمۡ أَجۡرٌ غَيۡرُ مَمۡنُونٖ,مګر هغه کسان چې ايمان يې راوړی او ښه کارونه يې کړي دي، چې د هغوی لپاره نه ختمېدونکې بدله ده.,
95,7,فَمَا يُكَذِّبُكَ بَعۡدُ بِٱلدِّينِ,نو له دې وروسته دې د بدلې (د ورځې) په اړه څه شی درواغجنوي.,
95,8,أَلَيۡسَ ٱللَّهُ بِأَحۡكَمِ ٱلۡحَٰكِمِينَ,ايا الله تر ټولو حاکمانو ښه حاکم نه دی؟,
