surah,ayah,arabic_text,translation,footnotes
40,1,حمٓ,حم [1],[1] د سورت په پيل کې دغو مقطعاتو تورو کې د قرآن کريم اعجاز ته اشاره ده؛ ځکه چې په دې مشرکانو ته چلينج ورکړل شوی نو له مقابلې يې ناتوانه شول، په داسې حال کې چې دا قرآن له هماغو تورو جوړ شوی له کومو چې د عربو ژبه جوړه ده. نو د قرآن په څېر د بل کلام راوړلو څخه د عربو ناتواني - سره له دې چې د نړۍ فصيح خلک وو- په دې دلالت کوي چي دا قرآن د الله له لوري وحي شوی دی.
40,2,تَنزِيلُ ٱلۡكِتَٰبِ مِنَ ٱللَّهِ ٱلۡعَزِيزِ ٱلۡعَلِيمِ,راتلل د دی کتاب د الله له طرفه دي چې پوه او زورور دی.,
40,3,غَافِرِ ٱلذَّنۢبِ وَقَابِلِ ٱلتَّوۡبِ شَدِيدِ ٱلۡعِقَابِ ذِي ٱلطَّوۡلِۖ لَآ إِلَٰهَ إِلَّا هُوَۖ إِلَيۡهِ ٱلۡمَصِيرُ,د ګناه بخښونكى، د توبې قبلونكى او سخت عذاب والا، د فضل او قدرت څښتن دى، نشته لایق د عبادت مګر همغه یې لایق دی همغه ته ورتګ دى.,
40,4,مَا يُجَٰدِلُ فِيٓ ءَايَٰتِ ٱللَّهِ إِلَّا ٱلَّذِينَ كَفَرُواْ فَلَا يَغۡرُرۡكَ تَقَلُّبُهُمۡ فِي ٱلۡبِلَٰدِ,د الله په ايتونو كې يوازې هغه كسان جګړې كوي چې كافر شوي، نو په ښارونو كې د هغوى ګرځېدل راګرځېدل دې تا په دوكه كې وانه چوي.,
40,5,كَذَّبَتۡ قَبۡلَهُمۡ قَوۡمُ نُوحٖ وَٱلۡأَحۡزَابُ مِنۢ بَعۡدِهِمۡۖ وَهَمَّتۡ كُلُّ أُمَّةِۭ بِرَسُولِهِمۡ لِيَأۡخُذُوهُۖ وَجَٰدَلُواْ بِٱلۡبَٰطِلِ لِيُدۡحِضُواْ بِهِ ٱلۡحَقَّ فَأَخَذۡتُهُمۡۖ فَكَيۡفَ كَانَ عِقَابِ,له هغوى مخكې هم د نوح قوم او تر هغوى وروسته نورو قومونو (دا خبره) دروغ ګڼلې وه او هر ولس د خپل رسول رانيولو قصد وكړ او په باطله به يې جګړې كولې تر څو په دې سره حق بیکاره [باطل] [ثابت] كړي، بيا مې هغوى راګير كړل نو (ګوره) زما سزا څنګه وه.,
40,6,وَكَذَٰلِكَ حَقَّتۡ كَلِمَتُ رَبِّكَ عَلَى ٱلَّذِينَ كَفَرُوٓاْ أَنَّهُمۡ أَصۡحَٰبُ ٱلنَّارِ,او همدغسې ستا د پالونکي خبره پر هغو خلكو حقه (رښتيا) شوه كوم چې كافر شوي وو چې هغوى به په رېښتيا دوزخيان وي.,
40,7,ٱلَّذِينَ يَحۡمِلُونَ ٱلۡعَرۡشَ وَمَنۡ حَوۡلَهُۥ يُسَبِّحُونَ بِحَمۡدِ رَبِّهِمۡ وَيُؤۡمِنُونَ بِهِۦ وَيَسۡتَغۡفِرُونَ لِلَّذِينَ ءَامَنُواْۖ رَبَّنَا وَسِعۡتَ كُلَّ شَيۡءٖ رَّحۡمَةٗ وَعِلۡمٗا فَٱغۡفِرۡ لِلَّذِينَ تَابُواْ وَٱتَّبَعُواْ سَبِيلَكَ وَقِهِمۡ عَذَابَ ٱلۡجَحِيمِ,هغوى چې عرش (پورته كړی) او څوك چې د هغه چاپېره دي د خپل پالونکي له ستاينې سره د هغه پاکي وايي، په هغه ايمان لري او د مومنانو لپاره بخښنه غواړي، چې ای زموږ ربه! پراخه دی ستا علم او رحمت هر شی ته، نو هغو كسانو ته بخښنه وكړه چې توبه يې اېستلې او ستا د لارې متابعت يې كړى او د دوزخ له عذابه يې وساته.,
40,8,رَبَّنَا وَأَدۡخِلۡهُمۡ جَنَّٰتِ عَدۡنٍ ٱلَّتِي وَعَدتَّهُمۡ وَمَن صَلَحَ مِنۡ ءَابَآئِهِمۡ وَأَزۡوَٰجِهِمۡ وَذُرِّيَّٰتِهِمۡۚ إِنَّكَ أَنتَ ٱلۡعَزِيزُ ٱلۡحَكِيمُ,ای زموږ پالونکيه! او هغوى د تل هستوګنې هغو جنتونو ته ننباسه چې ژمنه دې ورسره كړې او (همدارنګه) د هغوى له پلرونو، مېرمنو او اولادونو چې څوک نېك عمله وي، په رېښتيا همدا ته برلاسى د حكمت والا يې.,
40,9,وَقِهِمُ ٱلسَّيِّـَٔاتِۚ وَمَن تَقِ ٱلسَّيِّـَٔاتِ يَوۡمَئِذٖ فَقَدۡ رَحِمۡتَهُۥۚ وَذَٰلِكَ هُوَ ٱلۡفَوۡزُ ٱلۡعَظِيمُ,او هغوى له بدو (حالاتو) وساته او په هغه ورځ چې ته څوک له بدو وساتې، نو په رېښتيا رحم دې پرې وكړ، او ستر برى خو همدا دى.,
40,10,إِنَّ ٱلَّذِينَ كَفَرُواْ يُنَادَوۡنَ لَمَقۡتُ ٱللَّهِ أَكۡبَرُ مِن مَّقۡتِكُمۡ أَنفُسَكُمۡ إِذۡ تُدۡعَوۡنَ إِلَى ٱلۡإِيمَٰنِ فَتَكۡفُرُونَ,له شک پرته چا چې كفر كړى هغوى ته به غږ وكړى شي چې د الله غوسه هرومرو له هغې غوسې زياته ده چې تاسو خپلو ځانونو باندې كوله، كله چې د ايمان په لور بلل كېدلئ، نو تاسو به كفر كولو.,
40,11,قَالُواْ رَبَّنَآ أَمَتَّنَا ٱثۡنَتَيۡنِ وَأَحۡيَيۡتَنَا ٱثۡنَتَيۡنِ فَٱعۡتَرَفۡنَا بِذُنُوبِنَا فَهَلۡ إِلَىٰ خُرُوجٖ مِّن سَبِيلٖ,هغوى به وايي اې زموږ ربه! دوه ځله دې مړه كړو او دوه ځله دې ژوندي كړو، موږ پر خپلو ګناهونو اقرار وكړ نو آيا (اوس) د وتلو كومه لار شته؟,
40,12,ذَٰلِكُم بِأَنَّهُۥٓ إِذَا دُعِيَ ٱللَّهُ وَحۡدَهُۥ كَفَرۡتُمۡ وَإِن يُشۡرَكۡ بِهِۦ تُؤۡمِنُواْۚ فَٱلۡحُكۡمُ لِلَّهِ ٱلۡعَلِيِّ ٱلۡكَبِيرِ,دا ستاسو (عذاب) ځكه دى چې كله به الله يوازې وبلل شو نو تاسو به انكار كولو او كه شرك به ورسره (منل) كېدو نو بيا به مو منلو نو (اوس) پرېكړه (يوازې) لوړ او ستر الله لره ده.,
40,13,هُوَ ٱلَّذِي يُرِيكُمۡ ءَايَٰتِهِۦ وَيُنَزِّلُ لَكُم مِّنَ ٱلسَّمَآءِ رِزۡقٗاۚ وَمَا يَتَذَكَّرُ إِلَّا مَن يُنِيبُ,الله هغه ذات دى چې تاسي ته خپلې نښانې درښایی او له اسمانه روزي درته رانازلوي او پند نه اخلي مګر هغه څوک چې (الله ته) ورګرځي.,
40,14,فَٱدۡعُواْ ٱللَّهَ مُخۡلِصِينَ لَهُ ٱلدِّينَ وَلَوۡ كَرِهَ ٱلۡكَٰفِرُونَ,[کله چې خبره داسې ده] نو رابلئ الله لره په دې حال کې چې اخلاص کوونکي یاستئ خاص د هغه لپاره دین (طاعت) کې، اګر که کافران دا بد ګڼي.,
40,15,رَفِيعُ ٱلدَّرَجَٰتِ ذُو ٱلۡعَرۡشِ يُلۡقِي ٱلرُّوحَ مِنۡ أَمۡرِهِۦ عَلَىٰ مَن يَشَآءُ مِنۡ عِبَادِهِۦ لِيُنذِرَ يَوۡمَ ٱلتَّلَاقِ,د اوچتو درجو والا، د عرش څښتن، رالیږي وحې په خپلو بندګانو کې چا ته یې چې وغواړي [له نبیانو] دې لپاره چې وویروي [خلک] د یو ځای کېدلو له ورځې څخه.,
40,16,يَوۡمَ هُم بَٰرِزُونَۖ لَا يَخۡفَىٰ عَلَى ٱللَّهِ مِنۡهُمۡ شَيۡءٞۚ لِّمَنِ ٱلۡمُلۡكُ ٱلۡيَوۡمَۖ لِلَّهِ ٱلۡوَٰحِدِ ٱلۡقَهَّارِ,هغه ورځ چې هغوى (ټول) به راڅرګندېدونكي وي، د هغوى هيڅ شى به له الله پټ نه وي، نن باچايي د چا ده؟ يوازې او يوازې يو برلاسي الله لره.,
40,17,ٱلۡيَوۡمَ تُجۡزَىٰ كُلُّ نَفۡسِۭ بِمَا كَسَبَتۡۚ لَا ظُلۡمَ ٱلۡيَوۡمَۚ إِنَّ ٱللَّهَ سَرِيعُ ٱلۡحِسَابِ,نن به هر چاته د خپلو كړنو بدله وركول كيږي، نن ظلم نشته، بېشكه الله چټک حساب کوونکی دى.,
40,18,وَأَنذِرۡهُمۡ يَوۡمَ ٱلۡأٓزِفَةِ إِذِ ٱلۡقُلُوبُ لَدَى ٱلۡحَنَاجِرِ كَٰظِمِينَۚ مَا لِلظَّٰلِمِينَ مِنۡ حَمِيمٖ وَلَا شَفِيعٖ يُطَاعُ,او هغوى د نږدې راتلونكې ورځې څخه ووېروه كله چې زړونه تر مرۍ راورسيږي (او هغوى) له غمه ډک وي، د ظالمانو به نه كوم دوست وي او نه څوک سپارښتونكى چې خبره يې ومنل شي.,
40,19,يَعۡلَمُ خَآئِنَةَ ٱلۡأَعۡيُنِ وَمَا تُخۡفِي ٱلصُّدُورُ,هغه ته د سترګو خيانت او څه چې زړونه يې پټوي (ښه) معلوم دي.,
40,20,وَٱللَّهُ يَقۡضِي بِٱلۡحَقِّۖ وَٱلَّذِينَ يَدۡعُونَ مِن دُونِهِۦ لَا يَقۡضُونَ بِشَيۡءٍۗ إِنَّ ٱللَّهَ هُوَ ٱلسَّمِيعُ ٱلۡبَصِيرُ,او الله په حقه پرېکړه كوي او څه چې له هغه پرته يې هغوى رابولي په هيڅ شي حكم نه شي كولاى له شک پرته همغه الله ښه اورېدونكى ليدونكى دى.,
40,21,۞ أَوَلَمۡ يَسِيرُواْ فِي ٱلۡأَرۡضِ فَيَنظُرُواْ كَيۡفَ كَانَ عَٰقِبَةُ ٱلَّذِينَ كَانُواْ مِن قَبۡلِهِمۡۚ كَانُواْ هُمۡ أَشَدَّ مِنۡهُمۡ قُوَّةٗ وَءَاثَارٗا فِي ٱلۡأَرۡضِ فَأَخَذَهُمُ ٱللَّهُ بِذُنُوبِهِمۡ وَمَا كَانَ لَهُم مِّنَ ٱللَّهِ مِن وَاقٖ,آيا پر ځمكه نه دي ګرځېدلي چې وګوري تر هغوى مخكې د خلكو پايله څنګه وه؟ هغوى خو په زور، او ځمكه كې خپلو نښو (پرېښودو) كې تر دوى ډېر زيات وو، خو بيا د دوى د ګناهونو له امله الله راګير كړل او له الله يې څوک ساتونكى نه و.,
40,22,ذَٰلِكَ بِأَنَّهُمۡ كَانَت تَّأۡتِيهِمۡ رُسُلُهُم بِٱلۡبَيِّنَٰتِ فَكَفَرُواْ فَأَخَذَهُمُ ٱللَّهُۚ إِنَّهُۥ قَوِيّٞ شَدِيدُ ٱلۡعِقَابِ,دا لدې امله چې یقینا راتلل به دوی ته رسولان په ښکاره حکمونو، نو دوی به انکار کاوه، نو ونیول الله دوی لره، یقینا الله تعالی ځواک والا، سخت عذاب ورکوونکی دی.,
40,23,وَلَقَدۡ أَرۡسَلۡنَا مُوسَىٰ بِـَٔايَٰتِنَا وَسُلۡطَٰنٖ مُّبِينٍ,او په رېښتيا موسى مو له خپلو ايتونو [معجزو] او څرګند دليل [تورات] سره لېږلى و.,
40,24,إِلَىٰ فِرۡعَوۡنَ وَهَٰمَٰنَ وَقَٰرُونَ فَقَالُواْ سَٰحِرٞ كَذَّابٞ,فرعون، هامان او قارون ته، خو هغوى وويل چې دى ډېر درواغجن كوډګر دی.,
40,25,فَلَمَّا جَآءَهُم بِٱلۡحَقِّ مِنۡ عِندِنَا قَالُواْ ٱقۡتُلُوٓاْ أَبۡنَآءَ ٱلَّذِينَ ءَامَنُواْ مَعَهُۥ وَٱسۡتَحۡيُواْ نِسَآءَهُمۡۚ وَمَا كَيۡدُ ٱلۡكَٰفِرِينَ إِلَّا فِي ضَلَٰلٖ,بيا چې هغه زموږ لخوا له حق سره ورغلو، هغوى وويل: د هغو خلكو زامن ووژنئ چې له ده سره يې ايمان راوړى او ښځې يې ژوندۍ پرېږدئ! او د كافرانو چل هيڅ نه دى مګر غلط (او خطا يا عبث).,
40,26,وَقَالَ فِرۡعَوۡنُ ذَرُونِيٓ أَقۡتُلۡ مُوسَىٰ وَلۡيَدۡعُ رَبَّهُۥٓۖ إِنِّيٓ أَخَافُ أَن يُبَدِّلَ دِينَكُمۡ أَوۡ أَن يُظۡهِرَ فِي ٱلۡأَرۡضِ ٱلۡفَسَادَ,او فرعون وويل: ما پرېږدئ چې موسى ووژنم او هغه دې خپل رب را وبولي، زه وېرېږم چې ستاسي دين به بدل كړي يا به په دې ځمكه كې فساد را ولاړ كړي.,
40,27,وَقَالَ مُوسَىٰٓ إِنِّي عُذۡتُ بِرَبِّي وَرَبِّكُم مِّن كُلِّ مُتَكَبِّرٖ لَّا يُؤۡمِنُ بِيَوۡمِ ٱلۡحِسَابِ,او موسى وويل: زه پنا غواړم په خپل رب او ستاسو رب پورې له هر هغه كبرجنه چې د حساب په ورځ ايمان نه لري.,
40,28,وَقَالَ رَجُلٞ مُّؤۡمِنٞ مِّنۡ ءَالِ فِرۡعَوۡنَ يَكۡتُمُ إِيمَٰنَهُۥٓ أَتَقۡتُلُونَ رَجُلًا أَن يَقُولَ رَبِّيَ ٱللَّهُ وَقَدۡ جَآءَكُم بِٱلۡبَيِّنَٰتِ مِن رَّبِّكُمۡۖ وَإِن يَكُ كَٰذِبٗا فَعَلَيۡهِ كَذِبُهُۥۖ وَإِن يَكُ صَادِقٗا يُصِبۡكُم بَعۡضُ ٱلَّذِي يَعِدُكُمۡۖ إِنَّ ٱللَّهَ لَا يَهۡدِي مَنۡ هُوَ مُسۡرِفٞ كَذَّابٞ,او د فرعون له كورنۍ يو مومن چې خپل ايمان يې پټولو، وويل: آيا تاسو يو داسې سړى وژنئ چې وايي زما رب الله دى، حال دا چې ستاسي د رب لخوا يې څرګند دليلونه هم درته راوړي، كه دروغجن وي نو دروغ يې پر ده دي او كه رښتينى وي څه نا څه هغه (عذاب) به در ورسيږي چې درسره ژمنه كوي، بېشكه الله هغه چاته لار نه ښايي چې زياتى كوونكى دروغجن وي.,
40,29,يَٰقَوۡمِ لَكُمُ ٱلۡمُلۡكُ ٱلۡيَوۡمَ ظَٰهِرِينَ فِي ٱلۡأَرۡضِ فَمَن يَنصُرُنَا مِنۢ بَأۡسِ ٱللَّهِ إِن جَآءَنَاۚ قَالَ فِرۡعَوۡنُ مَآ أُرِيكُمۡ إِلَّا مَآ أَرَىٰ وَمَآ أَهۡدِيكُمۡ إِلَّا سَبِيلَ ٱلرَّشَادِ,ای زما قومه! نن خو پاچايي ستاسو ده، په ځمكه كې برلاسي ياست خو كه د الله عذاب راغلو نو بيا به مو څوك بچ كړي؟ فرعون وويل: زه يوازې هغه (مصلحت) درښايم چې زه يې وينم او د ښېګڼې له لارې پرته بله نه درښايم.,
40,30,وَقَالَ ٱلَّذِيٓ ءَامَنَ يَٰقَوۡمِ إِنِّيٓ أَخَافُ عَلَيۡكُم مِّثۡلَ يَوۡمِ ٱلۡأَحۡزَابِ,(بيا) هغه (كس) چې ايمان يې راوړى و، وويل: ای قومه! زه پر تاسو د (پخوانيو) ډلو له ورځې وېرېږم.,
40,31,مِثۡلَ دَأۡبِ قَوۡمِ نُوحٖ وَعَادٖ وَثَمُودَ وَٱلَّذِينَ مِنۢ بَعۡدِهِمۡۚ وَمَا ٱللَّهُ يُرِيدُ ظُلۡمٗا لِّلۡعِبَادِ,لكه د نوح د قوم حالت، د عاد، ثمود او كوم چې له هغوى وروسته وو او الله د بندګانو لپاره د ظلم اراده نه لري.,
40,32,وَيَٰقَوۡمِ إِنِّيٓ أَخَافُ عَلَيۡكُمۡ يَوۡمَ ٱلتَّنَادِ,او ای زما قومه! زه پر تاسو (يو بل ته) د چېغو وهلو له ورځې ډارېږم.,
40,33,يَوۡمَ تُوَلُّونَ مُدۡبِرِينَ مَا لَكُم مِّنَ ٱللَّهِ مِنۡ عَاصِمٖۗ وَمَن يُضۡلِلِ ٱللَّهُ فَمَا لَهُۥ مِنۡ هَادٖ,هغه ورځ چې تاسې بېرته په شا ګرځېدونكي ياست، نه به وي ستاسو لپاره له الله نه څوك ژغورونكى، او هغه څوك چې الله يې بې لارې كړي نو بيا یې څوک لارښوونكى نشته.,
40,34,وَلَقَدۡ جَآءَكُمۡ يُوسُفُ مِن قَبۡلُ بِٱلۡبَيِّنَٰتِ فَمَا زِلۡتُمۡ فِي شَكّٖ مِّمَّا جَآءَكُم بِهِۦۖ حَتَّىٰٓ إِذَا هَلَكَ قُلۡتُمۡ لَن يَبۡعَثَ ٱللَّهُ مِنۢ بَعۡدِهِۦ رَسُولٗاۚ كَذَٰلِكَ يُضِلُّ ٱللَّهُ مَنۡ هُوَ مُسۡرِفٞ مُّرۡتَابٌ,او په رېښتيا له دې مخكې يوسف هم له څرګندو دليلونو سره درته راغلى و، خو تاسو به د هغه څه په هكله تل په شك كې وئ چې هغه درته راوړي و تر دې چې وفات شو نو تاسو ويل چې له ده وروسته به الله هيڅكله (بل) رسول را ونه ليږي، الله همدغه شان هر زياتى كوونكى شک کوونكى بې لارې كوي.,
40,35,ٱلَّذِينَ يُجَٰدِلُونَ فِيٓ ءَايَٰتِ ٱللَّهِ بِغَيۡرِ سُلۡطَٰنٍ أَتَىٰهُمۡۖ كَبُرَ مَقۡتًا عِندَ ٱللَّهِ وَعِندَ ٱلَّذِينَ ءَامَنُواْۚ كَذَٰلِكَ يَطۡبَعُ ٱللَّهُ عَلَىٰ كُلِّ قَلۡبِ مُتَكَبِّرٖ جَبَّارٖ,(شک کوونکي) هغه خلک دي چې د الله په ایتونو کې جګړې کوي چې راشي دوی ته او هیڅ دلیل ورسره نشته، د الله او مومنانو پر وړاندې په ایتونو کې جګړې کول ډېره د غوسې خبره ده، همدا رنګه الله مهر (ټاپه) وهي د هر لویي کوونکي سرغړونکي پر زړه.,
40,36,وَقَالَ فِرۡعَوۡنُ يَٰهَٰمَٰنُ ٱبۡنِ لِي صَرۡحٗا لَّعَلِّيٓ أَبۡلُغُ ٱلۡأَسۡبَٰبَ,او فرعون وويل: ای هامانه! يوه دنګه ماڼۍ راته جوړه كړه، ښايي زه هغو لارو ته ورسېږم.,
40,37,أَسۡبَٰبَ ٱلسَّمَٰوَٰتِ فَأَطَّلِعَ إِلَىٰٓ إِلَٰهِ مُوسَىٰ وَإِنِّي لَأَظُنُّهُۥ كَٰذِبٗاۚ وَكَذَٰلِكَ زُيِّنَ لِفِرۡعَوۡنَ سُوٓءُ عَمَلِهِۦ وَصُدَّ عَنِ ٱلسَّبِيلِۚ وَمَا كَيۡدُ فِرۡعَوۡنَ إِلَّا فِي تَبَابٖ,(يعنې) د اسمانو لارو ته بيا به د موسى الله ته ور وګورم او بېشكه زه ګومان كوم چې هغه (موسى) دروغجن دى. په همدې توګه فرعون ته د هغه ناوړه عمل ښكلى شو او له (سمې) لارې ايسار كړى شو. او د فرعون (دا) چل بل څه نه مګر په تاوان كې یې کړ.,
40,38,وَقَالَ ٱلَّذِيٓ ءَامَنَ يَٰقَوۡمِ ٱتَّبِعُونِ أَهۡدِكُمۡ سَبِيلَ ٱلرَّشَادِ,او چا چې ايمان راوړى و هغه وويل: ای زما قومه! زما پيروي وكړئ چې د ښې لارې ښوونه درته وكړم.,
40,39,يَٰقَوۡمِ إِنَّمَا هَٰذِهِ ٱلۡحَيَوٰةُ ٱلدُّنۡيَا مَتَٰعٞ وَإِنَّ ٱلۡأٓخِرَةَ هِيَ دَارُ ٱلۡقَرَارِ,ای زما قومه! خبره دا ده چې دغه د دنيا ژوند لږه ګټه اخيستنه ده او يقيناً آخرت د كرارۍ (تلپاتې) كور دى.,
40,40,مَنۡ عَمِلَ سَيِّئَةٗ فَلَا يُجۡزَىٰٓ إِلَّا مِثۡلَهَاۖ وَمَنۡ عَمِلَ صَٰلِحٗا مِّن ذَكَرٍ أَوۡ أُنثَىٰ وَهُوَ مُؤۡمِنٞ فَأُوْلَٰٓئِكَ يَدۡخُلُونَ ٱلۡجَنَّةَ يُرۡزَقُونَ فِيهَا بِغَيۡرِ حِسَابٖ,چا چې ناوړه كار وكړ نو همغسې برابره بدله وركول كيږي او چا چې سم كار وكړ، كه نارينه وي كه ښځينه خو چې مومن وي نو هغوى به جنت ته ننوځي هلته به بې حسابه روزي وركول كيږي.,
40,41,۞ وَيَٰقَوۡمِ مَا لِيٓ أَدۡعُوكُمۡ إِلَى ٱلنَّجَوٰةِ وَتَدۡعُونَنِيٓ إِلَى ٱلنَّارِ,او ای قومه! څه خبره ده چې زه مو د خلاصون لور ته بولم او تاسو مې اور ته بولئ؟,
40,42,تَدۡعُونَنِي لِأَكۡفُرَ بِٱللَّهِ وَأُشۡرِكَ بِهِۦ مَا لَيۡسَ لِي بِهِۦ عِلۡمٞ وَأَنَا۠ أَدۡعُوكُمۡ إِلَى ٱلۡعَزِيزِ ٱلۡغَفَّٰرِ,تاسو مې (دېته) رابولئ چې پر الله كافر شم او هغه څه ورسره شريك كړم چې مارسره يې هيڅ علم نشته او زه مو برلاسي بخښونكي (الله) ته وربولم!,
40,43,لَا جَرَمَ أَنَّمَا تَدۡعُونَنِيٓ إِلَيۡهِ لَيۡسَ لَهُۥ دَعۡوَةٞ فِي ٱلدُّنۡيَا وَلَا فِي ٱلۡأٓخِرَةِ وَأَنَّ مَرَدَّنَآ إِلَى ٱللَّهِ وَأَنَّ ٱلۡمُسۡرِفِينَ هُمۡ أَصۡحَٰبُ ٱلنَّارِ,يقيني ده چې خامخا تاسو مې كوم شي ته وربولئ هغه لره نه په دنيا كې څه بلنه شته او نه په آخرت كې او دا چې زموږ ورتګ د الله په لوري دى او بېشكه زياتى كوونكي خپله دوزخيان دي.,
40,44,فَسَتَذۡكُرُونَ مَآ أَقُولُ لَكُمۡۚ وَأُفَوِّضُ أَمۡرِيٓ إِلَى ٱللَّهِۚ إِنَّ ٱللَّهَ بَصِيرُۢ بِٱلۡعِبَادِ,پس زر دی چې یاد به کړئ هغه څه چې زه یې تاسو ته وایم، او سپارم خپل کار الله تعالی ته، یقینا الله تعالی لیدونکی دی بندګانو خپلو لره.,
40,45,فَوَقَىٰهُ ٱللَّهُ سَيِّـَٔاتِ مَا مَكَرُواْۖ وَحَاقَ بِـَٔالِ فِرۡعَوۡنَ سُوٓءُ ٱلۡعَذَابِ,نو الله د هغوى د چلونو له بديو بچ كړ او د فرعون له كورنۍ بد عذاب راچاپېر شو.,
40,46,ٱلنَّارُ يُعۡرَضُونَ عَلَيۡهَا غُدُوّٗا وَعَشِيّٗاۚ وَيَوۡمَ تَقُومُ ٱلسَّاعَةُ أَدۡخِلُوٓاْ ءَالَ فِرۡعَوۡنَ أَشَدَّ ٱلۡعَذَابِ,(يعنې) اور چې هغوى به سهار او ماښام ور وړاندې كول كيږي، او په هغه ورځ چې قيامت شي (حكم به وشي) د فرعون كورنۍ تر ټولو.سخت عذاب ته ننباسئ.,
40,47,وَإِذۡ يَتَحَآجُّونَ فِي ٱلنَّارِ فَيَقُولُ ٱلضُّعَفَٰٓؤُاْ لِلَّذِينَ ٱسۡتَكۡبَرُوٓاْ إِنَّا كُنَّا لَكُمۡ تَبَعٗا فَهَلۡ أَنتُم مُّغۡنُونَ عَنَّا نَصِيبٗا مِّنَ ٱلنَّارِ,او یاد کړه هغه وخت ای مخاطبه کله چې جګړې به کوي په اور كې [کشران او مشران] نو کمزوري به لويانو ته وايي: یقینا موږ خو ستاسو پيروان وو، آيا (اوس) تاسو له موږ څخه د اور څه برخه ايسارولاى شئ؟,
40,48,قَالَ ٱلَّذِينَ ٱسۡتَكۡبَرُوٓاْ إِنَّا كُلّٞ فِيهَآ إِنَّ ٱللَّهَ قَدۡ حَكَمَ بَيۡنَ ٱلۡعِبَادِ,چا چې لويي كړې هغوى به وايي: یقینا موږ ټول پكې يو، بېشكه الله د بندګانو ترمنځ پرېکړه كړې ده.,
40,49,وَقَالَ ٱلَّذِينَ فِي ٱلنَّارِ لِخَزَنَةِ جَهَنَّمَ ٱدۡعُواْ رَبَّكُمۡ يُخَفِّفۡ عَنَّا يَوۡمٗا مِّنَ ٱلۡعَذَابِ,او څوك چې په اور كې دي هغوى به د جهنم څوكيدارانو ته ووايي: له خپل ربه مو وغواړئ چې يوه ورځ خو له موږ عذاب سپک كړي.,
