surah,ayah,arabic_text,translation,footnotes
109,1,قُلۡ يَٰٓأَيُّهَا ٱلۡكَٰفِرُونَ,ووايه! اې کافرانو!.,
109,2,لَآ أَعۡبُدُ مَا تَعۡبُدُونَ,زه هغه نه لمانځم چې تاسي يې لمانځئ.,
109,3,وَلَآ أَنتُمۡ عَٰبِدُونَ مَآ أَعۡبُدُ,او نه تاسي د هغه څه لمانځونکي ياست چې زه يې لمانځم.,
109,4,وَلَآ أَنَا۠ عَابِدٞ مَّا عَبَدتُّمۡ,او نه زه د هغه څه لمانځونکی يم چې تاسو يې لمانځئ.,
109,5,وَلَآ أَنتُمۡ عَٰبِدُونَ مَآ أَعۡبُدُ,او نه تاسي د هغه څه لمانځونکي ياست چې زه يې لمانځم.,
109,6,لَكُمۡ دِينُكُمۡ وَلِيَ دِينِ,ستاسو لپاره خپل دين او زما لپاره خپل دين دی.,
