surah,ayah,arabic_text,translation,footnotes
56,1,إِذَا وَقَعَتِ ٱلۡوَاقِعَةُ,Yɩɩbã sã n wa yɩ (Dũni wã yikri).,
56,2,لَيۡسَ لِوَقۡعَتِهَا كَاذِبَةٌ,Yɑgsd pa nɑ n zĩnd a wakatã n kɩɩsd ɑ yɩɩbã ye.,
56,3,خَافِضَةٞ رَّافِعَةٌ,N sikdẽ (neb kẽera) la a zẽkdẽ (neb kẽere).,
56,4,إِذَا رُجَّتِ ٱلۡأَرۡضُ رَجّٗا,B sã n wa rigims Tẽngã rigimsg tεkẽ.,
56,5,وَبُسَّتِ ٱلۡجِبَالُ بَسّٗا,Tɩ tãensã sãeeg sãeegr tεkẽ.,
56,6,فَكَانَتۡ هَبَآءٗ مُّنۢبَثّٗا,N lebg wala tom sẽn sẽege.,
56,7,وَكُنتُمۡ أَزۡوَٰجٗا ثَلَٰثَةٗ,Tɩ yãmb yɩ kõbg a tãabo.,
56,8,فَأَصۡحَٰبُ ٱلۡمَيۡمَنَةِ مَآ أَصۡحَٰبُ ٱلۡمَيۡمَنَةِ,"La rɩtg zãma wã, bõe la rɩtg zãma?",
56,9,وَأَصۡحَٰبُ ٱلۡمَشۡـَٔمَةِ مَآ أَصۡحَٰبُ ٱلۡمَشۡـَٔمَةِ,"La goabg zãma wã, bõe la goabg zãma?",
56,10,وَٱلسَّٰبِقُونَ ٱلسَّٰبِقُونَ,La põsdbã sẽn yaa põsdbã.,
56,11,أُوْلَٰٓئِكَ ٱلۡمُقَرَّبُونَ,Bãmb la b sẽn pẽneg-b rãmb ne Wẽndã.,
56,12,فِي جَنَّٰتِ ٱلنَّعِيمِ,B bee neema arzãn-rãmbã pʋsẽ.,
56,13,ثُلَّةٞ مِّنَ ٱلۡأَوَّلِينَ,B yɑɑ sul wʋsg sẽn yi rãeenem rãmbẽ wã.,
56,14,وَقَلِيلٞ مِّنَ ٱلۡأٓخِرِينَ,La bilf sẽn yi yaoolem rãmbẽ.,
56,15,عَلَىٰ سُرُرٖ مَّوۡضُونَةٖ,N be gãas zut sẽn nags ne sãnem.,
56,16,مُّتَّكِـِٔينَ عَلَيۡهَا مُتَقَٰبِلِينَ,B yaa sẽn kɩl a zug n togl taaba.,
56,17,يَطُوفُ عَلَيۡهِمۡ وِلۡدَٰنٞ مُّخَلَّدُونَ,Kom-bãaneg n gilimd b zutu sẽn yaa duumdba.,
56,18,بِأَكۡوَابٖ وَأَبَارِيقَ وَكَأۡسٖ مِّن مَّعِينٖ,"Ne ko-teese sẽn tɑr yʋʋse, la ko-tees sẽn pɑ tar yʋʋse la rãɑm sẽn zoet ɑrzẽnɑ pʋgẽ.",
56,19,لَّا يُصَدَّعُونَ عَنۡهَا وَلَا يُنزِفُونَ,"B zut pa zabd a pʋgẽ, b yam pa yikd me.",
56,20,وَفَٰكِهَةٖ مِّمَّا يَتَخَيَّرُونَ,"La tɩ-biis sẽn yaa bãmb sẽn tũusdi, b sẽn rate.",
56,21,وَلَحۡمِ طَيۡرٖ مِّمَّا يَشۡتَهُونَ,La Liuuli nemd sẽn yaa bũmb ning bãmb sẽn nonge.,
56,22,وَحُورٌ عِينٞ,La Huurun ʿAyn (pʋg-nin-yalems sẽn yaa neere).,
56,23,كَأَمۡثَٰلِ ٱللُّؤۡلُوِٕ ٱلۡمَكۡنُونِ,Sẽn yaa wala lʋ'ʋlʋ'ʋ (kĩndi) sẽn be zẽeng mumd pʋgẽ.,
56,24,جَزَآءَۢ بِمَا كَانُواْ يَعۡمَلُونَ,Tɩ yaa rolb ne bũmb ning bãmb sẽn da yɩ n tʋmdẽ wã.,
56,25,لَا يَسۡمَعُونَ فِيهَا لَغۡوٗا وَلَا تَأۡثِيمًا,"B pa wʋmd gom-zaal a pʋgẽ, b pa wʋmd gom-beed me.",
56,26,إِلَّا قِيلٗا سَلَٰمٗا سَلَٰمٗا,"Sã n pa sẽn yete :""tɩlgre! Tɩlgre"".",
56,27,وَأَصۡحَٰبُ ٱلۡيَمِينِ مَآ أَصۡحَٰبُ ٱلۡيَمِينِ,"La rɩtg zãma wã, bõe la rɩtg zãma?",
56,28,فِي سِدۡرٖ مَّخۡضُودٖ,Bãmb bee mugnug tɩɩs tẽngr sẽn bale (pa tar gõose).,
56,29,وَطَلۡحٖ مَّنضُودٖ,La banand sẽn gĩni.,
56,30,وَظِلّٖ مَّمۡدُودٖ,La maasem sẽn yadge.,
56,31,وَمَآءٖ مَّسۡكُوبٖ,La koom sẽn kiigdi.,
56,32,وَفَٰكِهَةٖ كَثِيرَةٖ,La tɩ-biis wʋsgo.,
56,33,لَّا مَقۡطُوعَةٖ وَلَا مَمۡنُوعَةٖ,"Pa tar wãagre, pa mongr me.",
56,34,وَفُرُشٖ مَّرۡفُوعَةٍ,La gãt sẽn zẽke.,
56,35,إِنَّآ أَنشَأۡنَٰهُنَّ إِنشَآءٗ,Tõnd yẽbga bãmb yẽbgr tεkẽ.,
56,36,فَجَعَلۡنَٰهُنَّ أَبۡكَارًا,N maan-b tɩ b yaa pʋg-sɑdba.,
56,37,عُرُبًا أَتۡرَابٗا,N yaa rʋla n yaa reem-n-taase.,
56,38,لِّأَصۡحَٰبِ ٱلۡيَمِينِ,Tɩ yɑɑ sẽn nɑ n kõ rɩtg zãma wã.,
56,39,ثُلَّةٞ مِّنَ ٱلۡأَوَّلِينَ,B sul wʋsg sẽn yi rãeenem rãmbẽ wã.,
56,40,وَثُلَّةٞ مِّنَ ٱلۡأٓخِرِينَ,La sul wʋsg sẽn yi yaoolem rãmbẽ wã.,
56,41,وَأَصۡحَٰبُ ٱلشِّمَالِ مَآ أَصۡحَٰبُ ٱلشِّمَالِ,"La goabg zãma wã, bõe la goabg zãma?",
56,42,فِي سَمُومٖ وَحَمِيمٖ,Bãmb bee seb-tʋʋlg pʋgẽ la ko-kaeedga.,
56,43,وَظِلّٖ مِّن يَحۡمُومٖ,La maasem sẽn sobg ne bug zõose.,
56,44,لَّا بَارِدٖ وَلَا كَرِيمٍ,"Pa maase, pa nafd me.",
56,45,إِنَّهُمۡ كَانُواْ قَبۡلَ ذَٰلِكَ مُتۡرَفِينَ,"Bãmb ra yɩɩme, wãnda taoore, n yaa wʋm-noog rãmba.",
56,46,وَكَانُواْ يُصِرُّونَ عَلَى ٱلۡحِنثِ ٱلۡعَظِيمِ,B na n tigim-b lame n tʋg wakat ning b sẽn mi wã.,
56,47,وَكَانُواْ يَقُولُونَ أَئِذَا مِتۡنَا وَكُنَّا تُرَابٗا وَعِظَٰمًا أَءِنَّا لَمَبۡعُوثُونَ,"B ra yɩɩme n yetẽ: ""rẽ yĩnga tõnd sã n ki n lebg tom la kõba, rẽ yĩng tõnd yaa b sẽn na n yik-b rãmba?",
56,48,أَوَءَابَآؤُنَا ٱلۡأَوَّلُونَ,Ne tõnd saam rẽemsã fãa?,
56,49,قُلۡ إِنَّ ٱلۡأَوَّلِينَ وَٱلۡأٓخِرِينَ,"Yeele: ""ad rẽenem rãmbã la yaoolem rãmba.",
56,50,لَمَجۡمُوعُونَ إِلَىٰ مِيقَٰتِ يَوۡمٖ مَّعۡلُومٖ,B na n tigim-b lame n tʋg wakat ning b sẽn mi wã.,
56,51,ثُمَّ إِنَّكُمۡ أَيُّهَا ٱلضَّآلُّونَ ٱلۡمُكَذِّبُونَ,"Rẽ poorẽ, ad yãmba, yãmb a mẽnemdba n yaa yagsdba!",
56,52,لَأٓكِلُونَ مِن شَجَرٖ مِّن زَقُّومٖ,La tɩ yãmb na rɩ Zakʋʋm tɩɩgã (Tok sẽneg tɩɩga).,
56,53,فَمَالِـُٔونَ مِنۡهَا ٱلۡبُطُونَ,N pids pʋsã ne-a.,
56,54,فَشَٰرِبُونَ عَلَيۡهِ مِنَ ٱلۡحَمِيمِ,N yũud a zug ko-kaeedse.,
56,55,فَشَٰرِبُونَ شُرۡبَ ٱلۡهِيمِ,"N yũud-a, yʋgemd sẽn tar koyũud n pa tɩgd bãag yũubu"".",
56,56,هَٰذَا نُزُلُهُمۡ يَوۡمَ ٱلدِّينِ,Wãnde la bãmb sigb zĩig Rolbã raare.,
56,57,نَحۡنُ خَلَقۡنَٰكُمۡ فَلَوۡلَا تُصَدِّقُونَ,"Tõnd n naan yãmba, y pa na n kõ sɩda?",
56,58,أَفَرَءَيۡتُم مَّا تُمۡنُونَ,Yãmb pa yã bũmb ning y sẽn kiigd sẽn yaa mani wã?.,
56,59,ءَأَنتُمۡ تَخۡلُقُونَهُۥٓ أَمۡ نَحۡنُ ٱلۡخَٰلِقُونَ,Yaa yãmb n naand-a bɩ yaa Tõnd la Naand-a?,
56,60,نَحۡنُ قَدَّرۡنَا بَيۡنَكُمُ ٱلۡمَوۡتَ وَمَا نَحۡنُ بِمَسۡبُوقِينَ,"Tõnd korda kũumã yãmb pʋgẽ, la bũmb ka tõe n gɩdg Tõndo.",
56,61,عَلَىٰٓ أَن نُّبَدِّلَ أَمۡثَٰلَكُمۡ وَنُنشِئَكُمۡ فِي مَا لَا تَعۡلَمُونَ,"Tɩ D tedg yãmb bilgri, la D yẽbg yãmb y sẽn pa mi pʋgẽ.",
56,62,وَلَقَدۡ عَلِمۡتُمُ ٱلنَّشۡأَةَ ٱلۡأُولَىٰ فَلَوۡلَا تَذَكَّرُونَ,"La sɩd la hakɩɩka yãmb bãnga yẽbg rãeengã, yãmb pa na n tẽege?",
56,63,أَفَرَءَيۡتُم مَّا تَحۡرُثُونَ,"Yãmb pa yã bũmb ning yãmb sẽn koodã,",
56,64,ءَأَنتُمۡ تَزۡرَعُونَهُۥٓ أَمۡ نَحۡنُ ٱلزَّٰرِعُونَ,"Yaa yãmb n kood-a bɩ, bɩ yaa Tõnd la Koaadba?",
56,65,لَوۡ نَشَآءُ لَجَعَلۡنَٰهُ حُطَٰمٗا فَظَلۡتُمۡ تَفَكَّهُونَ,"La tɩ Tõnd sã n da tʋlla, D na maan-a t'a yaa sẽn zendge, tɩ yãmb kell n maan yel-soalma.",
56,66,إِنَّا لَمُغۡرَمُونَ,Ad tõnd kẽe bõn pʋgẽ.,
56,67,بَلۡ نَحۡنُ مَحۡرُومُونَ,Pa woto ye! Tõnd yaa b sẽn mong-b rãmba.,
56,68,أَفَرَءَيۡتُمُ ٱلۡمَآءَ ٱلَّذِي تَشۡرَبُونَ,Yãmb pa yã koom ning y sẽn yũudã.,
56,69,ءَأَنتُمۡ أَنزَلۡتُمُوهُ مِنَ ٱلۡمُزۡنِ أَمۡ نَحۡنُ ٱلۡمُنزِلُونَ,"Rẽ yĩnga yãmb n sik-a sawatẽ bɩ, bɩ yaa Tõnd la Sikdba?",
56,70,لَوۡ نَشَآءُ جَعَلۡنَٰهُ أُجَاجٗا فَلَوۡلَا تَشۡكُرُونَ,"La tɩ d sã n tʋlla, D na maan-a t'a yaa miisinga, yãmb pa na n pʋʋs barka?",
56,71,أَفَرَءَيۡتُمُ ٱلنَّارَ ٱلَّتِي تُورُونَ,"Yãmb pa yã bugum ning yãmb sẽn widgdã,",
56,72,ءَأَنتُمۡ أَنشَأۡتُمۡ شَجَرَتَهَآ أَمۡ نَحۡنُ ٱلۡمُنشِـُٔونَ,"Yãmb n yẽbg a tɩɩgã bɩ, bɩ yaa Tõnd la a Yẽbgdba?",
56,73,نَحۡنُ جَعَلۡنَٰهَا تَذۡكِرَةٗ وَمَتَٰعٗا لِّلۡمُقۡوِينَ,"Tõnd maan-a lame t'a yaa (Laahr Bugmã) tẽegre, n leb n yɑɑ wʋm-noogo la nɑfɑ ne kẽn-kẽndbɑ.",
56,74,فَسَبِّحۡ بِٱسۡمِ رَبِّكَ ٱلۡعَظِيمِ,Bɩ f yɩlg f Soab-zɩsgã yʋʋre.,
56,75,۞ فَلَآ أُقۡسِمُ بِمَوَٰقِعِ ٱلنُّجُومِ,M na wẽen ne ãdsã lʋɩɩs zĩisi.,
56,76,وَإِنَّهُۥ لَقَسَمٞ لَّوۡ تَعۡلَمُونَ عَظِيمٌ,La ad a yaa wẽeneg sẽn bedem tɩ yãmb sã n da miime.,
56,77,إِنَّهُۥ لَقُرۡءَانٞ كَرِيمٞ,Ad a yaa Alkʋrãan Wagelle.,
56,78,فِي كِتَٰبٖ مَّكۡنُونٖ,N be gaf sẽn tar gũub pʋgẽ.,
56,79,لَّا يَمَسُّهُۥٓ إِلَّا ٱلۡمُطَهَّرُونَ,"Pa sɩɩsd-a, rẽnd b sẽn yɩlg-b rãmba.",
56,80,تَنزِيلٞ مِّن رَّبِّ ٱلۡعَٰلَمِينَ,Yaa sẽn sig n yi bõn-naandsã Soab nengẽ.,
56,81,أَفَبِهَٰذَا ٱلۡحَدِيثِ أَنتُم مُّدۡهِنُونَ,Pɑ Gom kãeesã la yãmb yagsda?,
56,82,وَتَجۡعَلُونَ رِزۡقَكُمۡ أَنَّكُمۡ تُكَذِّبُونَ,"La y rɩk y sẽn dɑ sõmb pʋʋs bɑrkã, n maand lagem-n-taare, ne y sẽn dik yãmb rɩtlã n teesd ne bõn-nɑɑnse lɑ y yagsd Wẽnd neemã wã?.",
56,83,فَلَوۡلَآ إِذَا بَلَغَتِ ٱلۡحُلۡقُومَ,La yõor sã n wa ta koekoay-londẽ.,
56,84,وَأَنتُمۡ حِينَئِذٖ تَنظُرُونَ,Wakat kãng tɩ yãmb getẽ.,
56,85,وَنَحۡنُ أَقۡرَبُ إِلَيۡهِ مِنكُمۡ وَلَٰكِن لَّا تُبۡصِرُونَ,La Tõnd n pẽ-a n yɩɩd yãmb la yãmb pa ne ye.,
56,86,فَلَوۡلَآ إِن كُنتُمۡ غَيۡرَ مَدِينِينَ,La yãmb sã n da yɩɩme n yaa b sẽn pa tõe n yik-b rãmba(kũumɑ poorẽ).,
56,87,تَرۡجِعُونَهَآ إِن كُنتُمۡ صَٰدِقِينَ,"Y lebsd-y-yã-a lame, tɩ y sã n yaa sɩd rãmba.",
56,88,فَأَمَّآ إِن كَانَ مِنَ ٱلۡمُقَرَّبِينَ,La sã n yaa b sẽn pẽneg-b rãmba.,
56,89,فَرَوۡحٞ وَرَيۡحَانٞ وَجَنَّتُ نَعِيمٖ,Yaa vʋʋsem la Raeehaan tɩɩse (yũ-noodo) la Arzãn bʋgsgo.,
56,90,وَأَمَّآ إِن كَانَ مِنۡ أَصۡحَٰبِ ٱلۡيَمِينِ,La sã n yaa rɩtg zãma wã.,
56,91,فَسَلَٰمٞ لَّكَ مِنۡ أَصۡحَٰبِ ٱلۡيَمِينِ,"Rẽnd ""tɩlgr be ne-fo"" tɩ sã n yɑɑ rɩtɩg zãmã.",
56,92,وَأَمَّآ إِن كَانَ مِنَ ٱلۡمُكَذِّبِينَ ٱلضَّآلِّينَ,La sã n yɩɩme n yaa yagsdb n yaa menemdbã.,
56,93,فَنُزُلٞ مِّنۡ حَمِيمٖ,"Yaa sigbu, ko-tʋʋlg pʋga.",
56,94,وَتَصۡلِيَةُ جَحِيمٍ,La Gεhɩɩm kõom.,
56,95,إِنَّ هَٰذَا لَهُوَ حَقُّ ٱلۡيَقِينِ,Ad wãnde la sɩd vẽenegã.,
56,96,فَسَبِّحۡ بِٱسۡمِ رَبِّكَ ٱلۡعَظِيمِ,Bɩ f yɩlg f Soab-zɩsgã yʋʋre.,
