surah,ayah,arabic_text,translation,footnotes
37,164,وَمَا مِنَّآ إِلَّا لَهُۥ مَقَامٞ مَّعۡلُومٞ,"Yԑn (soro abͻfoͻ), yԑn mu biara wᴐ bea bi a yɛahyehyԑ ama no.",
37,165,وَإِنَّا لَنَحۡنُ ٱلصَّآفُّونَ,Nokorε sε yεto santen (frε Nyame).,
37,166,وَإِنَّا لَنَحۡنُ ٱلۡمُسَبِّحُونَ,Nokorε nso sε yεn na yεbͻ (Nyankopͻn) abodin paa.,
37,167,وَإِن كَانُواْ لَيَقُولُونَ,Na (abosomsomfoͻ no) ka sε:,
37,168,لَوۡ أَنَّ عِندَنَا ذِكۡرٗا مِّنَ ٱلۡأَوَّلِينَ,"“Sε yɛnyaa Afutusεm tesε tetefoͻ no a,",
37,169,لَكُنَّا عِبَادَ ٱللَّهِ ٱلۡمُخۡلَصِينَ,Anka yεbεyε Nyankopͻn asomfoᴐ nokorεfoͻ no mu bi “.,
37,170,فَكَفَرُواْ بِهِۦۖ فَسَوۡفَ يَعۡلَمُونَ,"Nanso (afei a Qur’aan aba wͻn hͻ no nso) wͻnnye nni, enti sεdeε εteε biara no wͻbɛhunu.",
37,171,وَلَقَدۡ سَبَقَتۡ كَلِمَتُنَا لِعِبَادِنَا ٱلۡمُرۡسَلِينَ,Nokorε sε Y’asεm adikan akͻ Yε nkoa Asomafoͻ no hͻ,
37,172,إِنَّهُمۡ لَهُمُ ٱلۡمَنصُورُونَ,"Sε, nokorε wͻbɛnya mmoa.",
37,173,وَإِنَّ جُندَنَا لَهُمُ ٱلۡغَٰلِبُونَ,Nokorε nso sε Y’asraafoͻ no na wͻbɛdi nkonim.,
37,174,فَتَوَلَّ عَنۡهُمۡ حَتَّىٰ حِينٖ,"Enti (Nkͻmhyεni), twe wo ho firi wͻn ho kͻpem εberε bi.",
37,175,وَأَبۡصِرۡهُمۡ فَسَوۡفَ يُبۡصِرُونَ,"Na wodeε hwε wͻn, na wͻbɛhunu (asotwee no).",
37,176,أَفَبِعَذَابِنَا يَسۡتَعۡجِلُونَ,Enti Y’asotwee na wͻrepε no ntεm no?,
37,177,فَإِذَا نَزَلَ بِسَاحَتِهِمۡ فَسَآءَ صَبَاحُ ٱلۡمُنذَرِينَ,"Sε esiane ba wͻn fie adihͻ a, εbεyε anͻpa bͻne ama wͻn a yɛabͻ wͻn kͻkͻ no.",
37,178,وَتَوَلَّ عَنۡهُمۡ حَتَّىٰ حِينٖ,"Enti wodeε twe wo ho firi wͻn ho kͻpem εberε bi,",
37,179,وَأَبۡصِرۡ فَسَوۡفَ يُبۡصِرُونَ,"Na wodeԑ hwε, na εnkyε koraa w’bɛhunu (asotwee no).",
37,180,سُبۡحَٰنَ رَبِّكَ رَبِّ ٱلۡعِزَّةِ عَمَّا يَصِفُونَ,"Kronkron Hene ne wo Wura Nyankopͻn, Tumi ne Animuonyam Wura ne no (Ne ho te sen) sεdeε wͻsusu no no.",
37,181,وَسَلَٰمٌ عَلَى ٱلۡمُرۡسَلِينَ,Asomdwoeε wͻ asomafoͻ no so.,
37,182,وَٱلۡحَمۡدُ لِلَّهِ رَبِّ ٱلۡعَٰلَمِينَ,"Aseda no wͻ Nyankopͻn, abͻdeε nyinaa Wura no.",
