surah,ayah,arabic_text,translation,footnotes
1,1,بِسۡمِ ٱللَّهِ ٱلرَّحۡمَٰنِ ٱلرَّحِيمِ,በአላህ ስም እጅግ በጣም ሩኅሩህ በጣም አዛኝ በኾነው፡፡{1},"{1} የመክፈቻይቱ ምእራፍ የቁርኣን በላጭ ሱራ ነች። ነቢዩ ሰ.ዐ.ወ. ለአቢ ሰዒድ እንዲህ አሉ፡- “ከቁርኣን ሱራዎች ውስጥ በላጩን አሳውቅሃለሁ እርሱም አልሃምዱ ሊላሂ ረቢል ዓላሚን- ነው።"" {ቡኻሪ ዘግበውታል}።"
1,2,ٱلۡحَمۡدُ لِلَّهِ رَبِّ ٱلۡعَٰلَمِينَ,ምስጋና ለአላህ ይገባው የዓለማት ጌታ ለኾነው፤,
1,3,ٱلرَّحۡمَٰنِ ٱلرَّحِيمِ,እጅግ በጣም ርኅሩህ በጣም አዛኝ,
1,4,مَٰلِكِ يَوۡمِ ٱلدِّينِ,የፍርዱ ቀን ባለቤት ለኾነው፡፡,
1,5,إِيَّاكَ نَعۡبُدُ وَإِيَّاكَ نَسۡتَعِينُ,አንተን ብቻ እንግገዛለን፤ አንተንም ብቻ እርዳታን እንለምናለን፡፡,
1,6,ٱهۡدِنَا ٱلصِّرَٰطَ ٱلۡمُسۡتَقِيمَ,ቀጥተኛውን መንገድ ምራን፡፡,
1,7,صِرَٰطَ ٱلَّذِينَ أَنۡعَمۡتَ عَلَيۡهِمۡ غَيۡرِ ٱلۡمَغۡضُوبِ عَلَيۡهِمۡ وَلَا ٱلضَّآلِّينَ,የእነዚያን በነርሱ ላይ በጎ የዋልክላቸውን በነሱ ላይ ያልተቆጣህባቸውንና ያልተሳሳቱትንም ሰዎች መንገድ (ምራን፤ በሉ)፡፡ {1},{1} ኣሚን የምትል ቃል በሶላት ውስጥ እዚህ ትባላለች፤ እንደውም ድምጽ ከፍ በምደረግበት ሶላት ውስጥ ጀማኣው በአንድነት ድምጽ ከፍ ተደርጎ ማለት ያስፈልጋል። ግን እሷ ከፋትሃ አይደለችም።
