surah,ayah,arabic_text,translation,footnotes
71,1,إِنَّآ أَرۡسَلۡنَا نُوحًا إِلَىٰ قَوۡمِهِۦٓ أَنۡ أَنذِرۡ قَوۡمَكَ مِن قَبۡلِ أَن يَأۡتِيَهُمۡ عَذَابٌ أَلِيمٞ,"Wir sandten ja Nuh zu seinem Volk: Warne dein Volk, bevor schmerzhafte Strafe über sie kommt.",
71,2,قَالَ يَٰقَوۡمِ إِنِّي لَكُمۡ نَذِيرٞ مُّبِينٌ,"Er sagte: O mein Volk, ich bin euch ja ein deutlicher Warner,",
71,3,أَنِ ٱعۡبُدُواْ ٱللَّهَ وَٱتَّقُوهُ وَأَطِيعُونِ,"(euch zu mahnen:) Dient Allah und fürchtet Ihn, und gehorcht mir,",
71,4,يَغۡفِرۡ لَكُم مِّن ذُنُوبِكُمۡ وَيُؤَخِّرۡكُمۡ إِلَىٰٓ أَجَلٖ مُّسَمًّىۚ إِنَّ أَجَلَ ٱللَّهِ إِذَا جَآءَ لَا يُؤَخَّرُۚ لَوۡ كُنتُمۡ تَعۡلَمُونَ,"so wird Er euch (etwas) von euren Sünden vergeben und euch auf eine festgesetzte Frist zurückstellen. Gewiß, Allahs Frist, wenn sie kommt, kann nicht zurückgestellt werden, wenn ihr nur wüßtet!",
71,5,قَالَ رَبِّ إِنِّي دَعَوۡتُ قَوۡمِي لَيۡلٗا وَنَهَارٗا,"Er sagte: Mein Herr, ich habe mein Volk bei Nacht und bei Tag aufgerufen.",
71,6,فَلَمۡ يَزِدۡهُمۡ دُعَآءِيٓ إِلَّا فِرَارٗا,Aber mein Rufen hat sie nur in ihrer Flucht bestärkt.,
71,7,وَإِنِّي كُلَّمَا دَعَوۡتُهُمۡ لِتَغۡفِرَ لَهُمۡ جَعَلُوٓاْ أَصَٰبِعَهُمۡ فِيٓ ءَاذَانِهِمۡ وَٱسۡتَغۡشَوۡاْ ثِيَابَهُمۡ وَأَصَرُّواْ وَٱسۡتَكۡبَرُواْ ٱسۡتِكۡبَارٗا,"Gewiß, jedesmal, wenn ich sie aufrief, damit Du ihnen vergibst, steckten sie ihre Finger in ihre Ohren, überdeckten sich mit ihren Gewändern, verharrten (im Irrtum) und verhielten sich sehr hochmütig.",
71,8,ثُمَّ إِنِّي دَعَوۡتُهُمۡ جِهَارٗا,Hierauf richtete ich an sie den Ruf dann öffentlich.,
71,9,ثُمَّ إِنِّيٓ أَعۡلَنتُ لَهُمۡ وَأَسۡرَرۡتُ لَهُمۡ إِسۡرَارٗا,Hierauf sprach ich zu ihnen offen und ganz im geheimen.,
71,10,فَقُلۡتُ ٱسۡتَغۡفِرُواْ رَبَّكُمۡ إِنَّهُۥ كَانَ غَفَّارٗا,"Ich sagte: .Bittet euren Herrn um Vergebung - Er ist ja Allvergebend -,",
71,11,يُرۡسِلِ ٱلسَّمَآءَ عَلَيۡكُم مِّدۡرَارٗا,so wird Er den Regen auf euch ergiebig (herab)senden,
71,12,وَيُمۡدِدۡكُم بِأَمۡوَٰلٖ وَبَنِينَ وَيَجۡعَل لَّكُمۡ جَنَّٰتٖ وَيَجۡعَل لَّكُمۡ أَنۡهَٰرٗا,und euch mit Besitz und Söhnen unterstützen und für euch Gärten machen und für euch Bäche machen.,
71,13,مَّا لَكُمۡ لَا تَرۡجُونَ لِلَّهِ وَقَارٗا,"Was ist mit euch, daß ihr nicht glaubt, von Allah würdevoll behandelt zu werden,",
71,14,وَقَدۡ خَلَقَكُمۡ أَطۡوَارًا,wo Er euch doch in Entwicklungsabschnitten erschaffen hat?,
71,15,أَلَمۡ تَرَوۡاْ كَيۡفَ خَلَقَ ٱللَّهُ سَبۡعَ سَمَٰوَٰتٖ طِبَاقٗا,"Seht ihr nicht, wie Allah sieben Himmel in Schichten (übereinander) erschaffen hat,",
71,16,وَجَعَلَ ٱلۡقَمَرَ فِيهِنَّ نُورٗا وَجَعَلَ ٱلشَّمۡسَ سِرَاجٗا,den Mond darin zu einem Licht gemacht und die Sonne zu einem Leuchtkörper gemacht hat?,
71,17,وَٱللَّهُ أَنۢبَتَكُم مِّنَ ٱلۡأَرۡضِ نَبَاتٗا,Und Allah hat euch aus der Erde heranwachsen lassen.,
71,18,ثُمَّ يُعِيدُكُمۡ فِيهَا وَيُخۡرِجُكُمۡ إِخۡرَاجٗا,Hierauf wird Er euch in sie zurückbringen und gewiß (wieder aus ihr) hervorbringen.,
71,19,وَٱللَّهُ جَعَلَ لَكُمُ ٱلۡأَرۡضَ بِسَاطٗا,"Und Allah hat euch die Erde zu einer ausgebreiteten Unterlage gemacht,",
71,20,لِّتَسۡلُكُواْ مِنۡهَا سُبُلٗا فِجَاجٗا,damit ihr auf ihr dahinziehen könnt - auf Wegen als breiten Durchgängen’.,
71,21,قَالَ نُوحٞ رَّبِّ إِنَّهُمۡ عَصَوۡنِي وَٱتَّبَعُواْ مَن لَّمۡ يَزِدۡهُ مَالُهُۥ وَوَلَدُهُۥٓ إِلَّا خَسَارٗا,"Nuh sagte: Mein Herr, sie haben sich mir widersetzt und sind jemandem gefolgt, dem sein Besitz und seine Kinder nur den Verlust mehren.",
71,22,وَمَكَرُواْ مَكۡرٗا كُبَّارٗا,Und sie haben ungeheure Ränke geschmiedet.,
71,23,وَقَالُواْ لَا تَذَرُنَّ ءَالِهَتَكُمۡ وَلَا تَذَرُنَّ وَدّٗا وَلَا سُوَاعٗا وَلَا يَغُوثَ وَيَعُوقَ وَنَسۡرٗا,"Und sie haben gesagt: .Verlaßt doch nicht eure Götter; verlaßt doch nicht Wadd, noch Suwa, noch Yagut,Ya’uq und Nasr.’",
71,24,وَقَدۡ أَضَلُّواْ كَثِيرٗاۖ وَلَا تَزِدِ ٱلظَّٰلِمِينَ إِلَّا ضَلَٰلٗا,Sie haben ja viele in die Irre geführt. So lasse die Ungerechten nur noch tiefer in die Irre gehen.,
71,25,مِّمَّا خَطِيٓـَٰٔتِهِمۡ أُغۡرِقُواْ فَأُدۡخِلُواْ نَارٗا فَلَمۡ يَجِدُواْ لَهُم مِّن دُونِ ٱللَّهِ أَنصَارٗا,Wegen ihrer Verfehlungen wurden sie ertränkt und dann in ein (Höllen)feuer hineingebracht. Und da fanden sie für sich außer Allah keine Helfer.,
71,26,وَقَالَ نُوحٞ رَّبِّ لَا تَذَرۡ عَلَى ٱلۡأَرۡضِ مِنَ ٱلۡكَٰفِرِينَ دَيَّارًا,"Und Nuh sagte: Mein Herr, lasse auf der Erde von den Ungläubigen nicht einen einzigen Bewohner.",
71,27,إِنَّكَ إِن تَذَرۡهُمۡ يُضِلُّواْ عِبَادَكَ وَلَا يَلِدُوٓاْ إِلَّا فَاجِرٗا كَفَّارٗا,"Denn, gewiß, wenn Du sie (leben) läßt, führen sie Deine Diener in die Irre und zeugen nur Sittenlose und sehr beharrliche Ungläubige.",
71,28,رَّبِّ ٱغۡفِرۡ لِي وَلِوَٰلِدَيَّ وَلِمَن دَخَلَ بَيۡتِيَ مُؤۡمِنٗا وَلِلۡمُؤۡمِنِينَ وَٱلۡمُؤۡمِنَٰتِۖ وَلَا تَزِدِ ٱلظَّٰلِمِينَ إِلَّا تَبَارَۢا,"Mein Herr, vergib mir und meinen Eltern und demjenigen, der als Gläubiger mein Haus betritt, und den gläubigen Männern und den gläubigen Frauen. Und stürze die Ungerechten nur noch tiefer ins Verderben.",
