surah,ayah,arabic_text,translation,footnotes
77,1,وَٱلۡمُرۡسَلَٰتِ عُرۡفٗا,"Bei den Entsandten, die wie eine Mähne aufeinanderfolgen,",
77,2,فَٱلۡعَٰصِفَٰتِ عَصۡفٗا,den einen Sturm Entfesselnden,
77,3,وَٱلنَّٰشِرَٰتِ نَشۡرٗا,"und den alles Ausbreitenden,",
77,4,فَٱلۡفَٰرِقَٰتِ فَرۡقٗا,"den klar Trennenden,",
77,5,فَٱلۡمُلۡقِيَٰتِ ذِكۡرًا,den Ermahnung Überbringenden,
77,6,عُذۡرًا أَوۡ نُذۡرًا,zur Pflichterfüllung oder zur Warnung!,
77,7,إِنَّمَا تُوعَدُونَ لَوَٰقِعٞ,"Gewiß, was euch versprochen wird, wird sicher hereinbrechen.",
77,8,فَإِذَا ٱلنُّجُومُ طُمِسَتۡ,Wenn dann die Sterne ausgelöscht werden,
77,9,وَإِذَا ٱلسَّمَآءُ فُرِجَتۡ,und wenn der Himmel gespalten wird,
77,10,وَإِذَا ٱلۡجِبَالُ نُسِفَتۡ,und wenn die Berge zersprengt werden,
77,11,وَإِذَا ٱلرُّسُلُ أُقِّتَتۡ,und wenn für die Gesandten ihre Zeit gesetzt wird.,
77,12,لِأَيِّ يَوۡمٍ أُجِّلَتۡ,Auf weichen Tag ist ihre Frist festgelegt worden?,
77,13,لِيَوۡمِ ٱلۡفَصۡلِ,Auf den Tag der Entscheidung.,
77,14,وَمَآ أَدۡرَىٰكَ مَا يَوۡمُ ٱلۡفَصۡلِ,"Und was läßt dich wissen, was der Tag der Entscheidung ist?",
77,15,وَيۡلٞ يَوۡمَئِذٖ لِّلۡمُكَذِّبِينَ,Wehe an jenem Tag den Leugnern!,
77,16,أَلَمۡ نُهۡلِكِ ٱلۡأَوَّلِينَ,Haben Wir nicht die Früheren vernichtet?,
77,17,ثُمَّ نُتۡبِعُهُمُ ٱلۡأٓخِرِينَ,Hierauf lassen Wir ihnen die Späteren folgen.,
77,18,كَذَٰلِكَ نَفۡعَلُ بِٱلۡمُجۡرِمِينَ,So verfahren Wir mit den Übeltätern.,
77,19,وَيۡلٞ يَوۡمَئِذٖ لِّلۡمُكَذِّبِينَ,Wehe an jenem Tag den Leugnern!,
77,20,أَلَمۡ نَخۡلُقكُّم مِّن مَّآءٖ مَّهِينٖ,"Haben Wir euch nicht aus verächtlichem Wasser erschaffen,",
77,21,فَجَعَلۡنَٰهُ فِي قَرَارٖ مَّكِينٍ,"das Wir dann in einem festen Aufenthaltsort haben sein lassen,",
77,22,إِلَىٰ قَدَرٖ مَّعۡلُومٖ,bis zu einem bekannten Zeitpunkt?,
77,23,فَقَدَرۡنَا فَنِعۡمَ ٱلۡقَٰدِرُونَ,So haben Wir bemessen. Welch trefflicher Bemesser sind Wir!,
77,24,وَيۡلٞ يَوۡمَئِذٖ لِّلۡمُكَذِّبِينَ,Wehe an jenem Tag den Leugnern!,
77,25,أَلَمۡ نَجۡعَلِ ٱلۡأَرۡضَ كِفَاتًا,Haben Wir nicht die Erde zu einem Ort der Aufbewahrung gemacht,
77,26,أَحۡيَآءٗ وَأَمۡوَٰتٗا,- für die Lebenden und die Toten -,
77,27,وَجَعَلۡنَا فِيهَا رَوَٰسِيَ شَٰمِخَٰتٖ وَأَسۡقَيۡنَٰكُم مَّآءٗ فُرَاتٗا,"und auf ihr festgegründete, hoch aufragende Berge gemacht und euch frisches Wasser zu trinken gegeben?",
77,28,وَيۡلٞ يَوۡمَئِذٖ لِّلۡمُكَذِّبِينَ,Wehe an jenem Tag den Leugnern!,
77,29,ٱنطَلِقُوٓاْ إِلَىٰ مَا كُنتُم بِهِۦ تُكَذِّبُونَ,"- Zieht los zu dem, was ihr stets für Lüge erklärt habt,",
77,30,ٱنطَلِقُوٓاْ إِلَىٰ ظِلّٖ ذِي ثَلَٰثِ شُعَبٖ,"zieht los zu einem Schatten mit drei Verzweigungen,",
77,31,لَّا ظَلِيلٖ وَلَا يُغۡنِي مِنَ ٱللَّهَبِ,der kein (wirklicher) Schattenspender ist und nicht (als Schutz) gegen die Flammen nützt.,
77,32,إِنَّهَا تَرۡمِي بِشَرَرٖ كَٱلۡقَصۡرِ,"Sie wirft mit Funken wie Schlösser,",
77,33,كَأَنَّهُۥ جِمَٰلَتٞ صُفۡرٞ,als wären sie gelbe Kamele.,
77,34,وَيۡلٞ يَوۡمَئِذٖ لِّلۡمُكَذِّبِينَ,Wehe an jenem Tag den Leugnern!,
77,35,هَٰذَا يَوۡمُ لَا يَنطِقُونَ,"Das ist der Tag, an dem sie nicht reden werden",
77,36,وَلَا يُؤۡذَنُ لَهُمۡ فَيَعۡتَذِرُونَ,"und (es) ihnen nicht erlaubt wird, daß sie sich entschuldigen.",
77,37,وَيۡلٞ يَوۡمَئِذٖ لِّلۡمُكَذِّبِينَ,Wehe an jenem Tag den Leugnern!,
77,38,هَٰذَا يَوۡمُ ٱلۡفَصۡلِۖ جَمَعۡنَٰكُمۡ وَٱلۡأَوَّلِينَ,- Das ist der Tag der Entscheidung; Wir haben euch mit den Früheren versammelt.,
77,39,فَإِن كَانَ لَكُمۡ كَيۡدٞ فَكِيدُونِ,"Wenn ihr also eine List habt, so führt sie gegen Mich aus.",
77,40,وَيۡلٞ يَوۡمَئِذٖ لِّلۡمُكَذِّبِينَ,Wehe an jenem Tag den Leugnern!,
77,41,إِنَّ ٱلۡمُتَّقِينَ فِي ظِلَٰلٖ وَعُيُونٖ,"Gewiß, die Gottesfürchtigen werden sich in Schatten und an Quellen befinden",
77,42,وَفَوَٰكِهَ مِمَّا يَشۡتَهُونَ,"und bei Früchten von dem, was sie begehren.",
77,43,كُلُواْ وَٱشۡرَبُواْ هَنِيٓـَٔۢا بِمَا كُنتُمۡ تَعۡمَلُونَ,"Eßt und trinkt als wohlbekömmlich für das, was ihr zu tun pflegtet.",
77,44,إِنَّا كَذَٰلِكَ نَجۡزِي ٱلۡمُحۡسِنِينَ,"Gewiß, so vergelten Wir den Rechtschaffenen.",
77,45,وَيۡلٞ يَوۡمَئِذٖ لِّلۡمُكَذِّبِينَ,Wehe an jenem Tag den Leugnern!,
77,46,كُلُواْ وَتَمَتَّعُواْ قَلِيلًا إِنَّكُم مُّجۡرِمُونَ,"Eßt und genießt ein wenig, ihr seid ja Übeltäter.",
77,47,وَيۡلٞ يَوۡمَئِذٖ لِّلۡمُكَذِّبِينَ,Wehe an jenem Tag den Leugnern!,
77,48,وَإِذَا قِيلَ لَهُمُ ٱرۡكَعُواْ لَا يَرۡكَعُونَ,"Und wenn zu ihnen gesagt wird: Verbeugt euch!, verbeugen sie sich nicht.",
77,49,وَيۡلٞ يَوۡمَئِذٖ لِّلۡمُكَذِّبِينَ,Wehe an jenem Tag den Leugnern!,
77,50,فَبِأَيِّ حَدِيثِۭ بَعۡدَهُۥ يُؤۡمِنُونَ,An welche Aussage nach dieser wollen sie denn glauben?,
