surah,ayah,arabic_text,translation,footnotes
95,1,وَٱلتِّينِ وَٱلزَّيۡتُونِ,"Jewe Allah, Ndarahiye kuri “Tiini” na “Zayituuni[1]” (vyahezagiwe)!","[1] Tiini na Zayituuni, ni ubwoko bw'ivyamwa."
95,2,وَطُورِ سِينِينَ,"No ku musozi wa Sinayi, ari na ho Intumwa Musa (nyakugira amahoro y’Imana Allah), yavuganiye n’Imana Allah ukuri kwamye!",
95,3,وَهَٰذَا ٱلۡبَلَدِ ٱلۡأَمِينِ,No kuri iki gisagara ca Makka gitekanye!,
95,4,لَقَدۡ خَلَقۡنَا ٱلۡإِنسَٰنَ فِيٓ أَحۡسَنِ تَقۡوِيمٖ,"Ni ukuri Twebwe Allah, Twaremye umuntu mw’ishusho ryiza cane;",
95,5,ثُمَّ رَدَدۡنَٰهُ أَسۡفَلَ سَٰفِلِينَ,"Hanyuma Tumusubiza mu muriro udahera, mu gihe atokwumvira Imana Allah agakurikira n’Intumwa zayo.",
95,6,إِلَّا ٱلَّذِينَ ءَامَنُواْ وَعَمِلُواْ ٱلصَّٰلِحَٰتِ فَلَهُمۡ أَجۡرٌ غَيۡرُ مَمۡنُونٖ,"Ariko rero abemeye Imana Allah n’Intumwa bakanakora n'ivyiza bitegetswe, barategekanirijwe impembo itagabanijwe, idahera.",
95,7,فَمَا يُكَذِّبُكَ بَعۡدُ بِٱلدِّينِ,"Muntu! None ni igiki gituma inyuma y’ivyo vyose, uhakana wivuye inyuma umusi w’impera!",
95,8,أَلَيۡسَ ٱللَّهُ بِأَحۡكَمِ ٱلۡحَٰكِمِينَ,"Mbega burya Imana Allah, Yategekanije umusi wo gutunganiriza ibiremwa, si Yo Nyene kugira ubutungane bubereye ku biremwa vyayo gusumba abacamanza bose! Yobuzwa n’iki! Ego cane, ni Yo!",
