surah,ayah,arabic_text,translation,footnotes
36,1,يسٓ,Yaa Siin[1].,[1] Raba insiguro y’indome zitangura mu ntango y’igisomwa Al-Baqara.
36,2,وَٱلۡقُرۡءَانِ ٱلۡحَكِيمِ,"Jewe Allah, Ndarahiye kuri iyo Qor’ani itomora neza imvo n’imvano z’ingingo n’amabwirizwa;",
36,3,إِنَّكَ لَمِنَ ٱلۡمُرۡسَلِينَ,"Ndarahiye mu vy’ukuri, ko wewe Muhamadi uri Intumwa mu Ntumwa z’Imana zahishuriwe zikarungikwa kurongora ibiremwa;",
36,4,عَلَىٰ صِرَٰطٖ مُّسۡتَقِيمٖ,Uri mu nzira y’Imana Allah igororotse y’ubwislamu;,
36,5,تَنزِيلَ ٱلۡعَزِيزِ ٱلرَّحِيمِ,"Qor’ani yamanuwe n’Imana Allah, Nyenintsinzi-Mutaneshwa, Nyenimbabazi ku batoni bayo!",
36,6,لِتُنذِرَ قَوۡمٗا مَّآ أُنذِرَ ءَابَآؤُهُمۡ فَهُمۡ غَٰفِلُونَ,"Ntumwa y’Imana! Warungikanwe Qor’ani, kugira ugabishe ku bihano vy’Imana Allah, abantu ba se babo batagabishijwe igihe kirekire, baraheza rero baragotwa ntibemera[2];","[2] Iyi Aayah, ihimiriza abamenyi mw’idini, ko bategerezwa kwama bibutsa abantu, kugira ntibagotwe ku mabwirizwa y’Imana Allah."
36,7,لَقَدۡ حَقَّ ٱلۡقَوۡلُ عَلَىٰٓ أَكۡثَرِهِمۡ فَهُمۡ لَا يُؤۡمِنُونَ,"Ni ukuri abenshi muri bo, bakwiye guhanwa ku kurendegera mw’ibangikanyamana, mu gihe bagabishijwe bagahakana, ntibemera Imana Allah n’Intumwa yayo ngo bakore n'ivyiza bitegetswe;",
36,8,إِنَّا جَعَلۡنَا فِيٓ أَعۡنَٰقِهِمۡ أَغۡلَٰلٗا فَهِيَ إِلَى ٱلۡأَذۡقَانِ فَهُم مُّقۡمَحُونَ,"Mu vy’ukuri, abo bagarariji mu kutemera kwabo, ni nk’abo Twebwe Allah Twabohesheje iminyororo mw’izosi rikomanye n’amaboko, baraheza bararika umutwe baraba hejuru, ntibashobora kubona iciza n’inzira y’ukuri ngo bayikurikire.",
36,9,وَجَعَلۡنَا مِنۢ بَيۡنِ أَيۡدِيهِمۡ سَدّٗا وَمِنۡ خَلۡفِهِمۡ سَدّٗا فَأَغۡشَيۡنَٰهُمۡ فَهُمۡ لَا يُبۡصِرُونَ,"Imbere yabo n’inyuma yabo hose, Twebwe Allah Twarahakingiriye baraheza baba nk’uwugariwe inzira imbere n’inyuma yiwe, maze Duhumya n’amaso yabo, ntibashobora kubona n’inzira ibarongora ku kuri, kubera amanyama n’ubugarariji vyabo[3];","[3] Ukudashobozwa kubona ukuri ngo ugukurikire, ni co gihano c’uwo wese agira amanyama mu kugarariza ukuri."
36,10,وَسَوَآءٌ عَلَيۡهِمۡ ءَأَنذَرۡتَهُمۡ أَمۡ لَمۡ تُنذِرۡهُمۡ لَا يُؤۡمِنُونَ,"Kuburira abagarariji rero no kutababurira, vyose ni co kimwe. Ntibazokwigera bemera.",
36,11,إِنَّمَا تُنذِرُ مَنِ ٱتَّبَعَ ٱلذِّكۡرَ وَخَشِيَ ٱلرَّحۡمَٰنَ بِٱلۡغَيۡبِۖ فَبَشِّرۡهُ بِمَغۡفِرَةٖ وَأَجۡرٖ كَرِيمٍ,"Ntumwa y’Imana! Wewe mu vy’ukuri, igabisha ryawe ryungura uwemera Qor’ani akubahiriza n’amabwirizwa yayo, akanatinya ibihano vya Nyenimpuhwe Allah mu gihe ari ahiherereye. Uyo rero, mushikirize inkuru nziza ihumuriza, ko azogumirizwa akabanga ku vyaha vyiwe, aheze ababarirwe mu buzima bw’inyuma yo gupfa, azonaronka n’impano zubashwe kandi zamaho mu Bwami bw’ijuru.",
36,12,إِنَّا نَحۡنُ نُحۡيِ ٱلۡمَوۡتَىٰ وَنَكۡتُبُ مَا قَدَّمُواْ وَءَاثَٰرَهُمۡۚ وَكُلَّ شَيۡءٍ أَحۡصَيۡنَٰهُ فِيٓ إِمَامٖ مُّبِينٖ,"Mu vy’ukuri, ni Twebwe Allah Tuzosubiza ubuzima abapfuye, maze bakazuka ku musi w’izuka, Turanandika n’ivyo bakoze vyose, vyaba ivyiza canke ibibi, Tukandika n’ivyo babaye imvo yuko bibandanya gukorwa kw’isi baramaze gupfa, vyaba ivyiza[4] canke ibibi[5], kandi rero ikintu ico ari co cose bakoze, Twarakibungabunze mu Gitabu nyezina canditswemwo ivyagezwe n’ishirwa mu ngiro ryavyo “Lawhu Mahfuudhw”.","[4] Nk’umwana basize, ubumenyi bwungura abantu n’imperezwa ifise indishi zibandanya. [5] Nk’ibangikanyamana canke ibicumuro babaye imvo yuko bibandanya gukorwa kw’isi kandi baramaze gupfa."
36,13,وَٱضۡرِبۡ لَهُم مَّثَلًا أَصۡحَٰبَ ٱلۡقَرۡيَةِ إِذۡ جَآءَهَا ٱلۡمُرۡسَلُونَ,"Ntumwa y’Imana! Ababangikanyamana baguhakana, bacire agace k’abantu bigeze kuba mu gacimbiri kari aho, igihe bashikirwa n’Intumwa;",
36,14,إِذۡ أَرۡسَلۡنَآ إِلَيۡهِمُ ٱثۡنَيۡنِ فَكَذَّبُوهُمَا فَعَزَّزۡنَا بِثَالِثٖ فَقَالُوٓاْ إِنَّآ إِلَيۡكُم مُّرۡسَلُونَ,"Igihe Twebwe Allah Tubarungikiye Intumwa zibiri, kugira zibararikire isengwa ry’Imana Imwe Rudende Allah bakazihakana bivuye inyuma, Duca Tuzitera intege mu kurungikwa kw’Intumwa igira gatatu, nya Ntumwa uko ari zitatu zikavuga ziti: “Mu vy’ukuri, twebwe turi Intumwa zarungitswe kuri mwebwe”.",
36,15,قَالُواْ مَآ أَنتُمۡ إِلَّا بَشَرٞ مِّثۡلُنَا وَمَآ أَنزَلَ ٱلرَّحۡمَٰنُ مِن شَيۡءٍ إِنۡ أَنتُمۡ إِلَّا تَكۡذِبُونَ,"Ba bantu bo mu gacimbiri, baraheza bazishura bati: “Mwebwe nta kindi muri, kiretse ko muri abantu nkatwe, kandi Nyenimpuhwe Allah ntiyabahishuriye na kimwe, mwebwe nta co muri kiretse ko mubesha”.",
36,16,قَالُواْ رَبُّنَا يَعۡلَمُ إِنَّآ إِلَيۡكُمۡ لَمُرۡسَلُونَ,"Nya Ntumwa ziraheza zishura zishimitse ziti: “Imana yacu Rurema Allah, Irazi neza ko mu vy’ukuri twarungitswe kuri mwebwe;",
36,17,وَمَا عَلَيۡنَآ إِلَّا ٱلۡبَلَٰغُ ٱلۡمُبِينُ,"Kandi twebwe nta co tujejwe, atari ukubashikiriza gusa ubutumwa butomoye. Ntitujejwe kubahatira ukwemera”.",
36,18,قَالُوٓاْ إِنَّا تَطَيَّرۡنَا بِكُمۡۖ لَئِن لَّمۡ تَنتَهُواْ لَنَرۡجُمَنَّكُمۡ وَلَيَمَسَّنَّكُم مِّنَّا عَذَابٌ أَلِيمٞ,"Ba bantu bo mu gacimbiri, baraheza bavuga bati: “Mu vy’ukuri, mwaduteye umwaku, nimutavavanura no kuturarikira isengwa ry’Imana Imwe Rudende Allah, ni ukuri tuzobicisha amabuye, kandi ni ukuri tuzobaha ibihano bibabaza”.",
36,19,قَالُواْ طَٰٓئِرُكُم مَّعَكُمۡ أَئِن ذُكِّرۡتُمۚ بَلۡ أَنتُمۡ قَوۡمٞ مُّسۡرِفُونَ,"Za Ntumwa ziraheza zishura ziti: “Umwaku nyabuna, muwuterwa n’ibangikanyamana hamwe n’ibikorwa vyanyu bibi. Mbega none kwibutswa ku neza yanyu, ni co cotuma tubatera umwaku mukanadutera ubwoba bwo kwicishwa amabuye no guhanwa! Ahubwo rero, mwebwe muri abantu bimonogoje mu bugarariji”.",
36,20,وَجَآءَ مِنۡ أَقۡصَا ٱلۡمَدِينَةِ رَجُلٞ يَسۡعَىٰ قَالَ يَٰقَوۡمِ ٱتَّبِعُواْ ٱلۡمُرۡسَلِينَ,"Ni ho rero hirya y’igisagara, hava umuntu aje anyaragasa, inyuma y’aho yumviye ko hari umugambi wo kwica nya Ntumwa canke kuzihana, araheza abwira ba bantu bo mu gacimbiri abinginga ati: “Emwe bantu banje! Enda nyabuna rero, nimukurikire Intumwa mwarungikiwe n’Imana Allah;",
36,21,ٱتَّبِعُواْ مَن لَّا يَسۡـَٔلُكُمۡ أَجۡرٗا وَهُم مُّهۡتَدُونَ,"Nimukurikire Intumwa zitigera zibasaba impembo kw’ishikirizabutumwa ryazo; kanatsinda, izo Ntumwa ni n’abagororotsi mu vyo zibararikira;",
36,22,وَمَالِيَ لَآ أَعۡبُدُ ٱلَّذِي فَطَرَنِي وَإِلَيۡهِ تُرۡجَعُونَ,"Mbega nobuzwa n’iki gusenga Imana Allah Yandemye, hakaba ari no kuri Yo jewe na mwe tuzosubira!",
36,23,ءَأَتَّخِذُ مِن دُونِهِۦٓ ءَالِهَةً إِن يُرِدۡنِ ٱلرَّحۡمَٰنُ بِضُرّٖ لَّا تُغۡنِ عَنِّي شَفَٰعَتُهُمۡ شَيۡـٔٗا وَلَا يُنقِذُونِ,"Vyoshoboka gute ko nsenga mu gishingo cayo ibigirwamana ata na kimwe bimaze, mu gihe Nyenimpuhwe Allah Yoshaka ko nshikirwa n’inabi, nya bigirwamana bidashobora kunkingira canke ngo bintabare;",
36,24,إِنِّيٓ إِذٗا لَّفِي ضَلَٰلٖ مُّبِينٍ,"Mu vy’ukuri, mu gihe nohirahira nkabangikanya Imana Allah, ni ukuri noba ndi mu buhuvyi bugaragara;",
36,25,إِنِّيٓ ءَامَنتُ بِرَبِّكُمۡ فَٱسۡمَعُونِ,"Mu vy’ukuri, jewe nemera Imana yanyu Rurema Allah. Kubera ivyo rero, nimwumve impanuro ndabahaye muheze mwemere”. Ni ho rero, ba bantu bo mu gacimbiri baca bamusimbirako baramwica;",
36,26,قِيلَ ٱدۡخُلِ ٱلۡجَنَّةَۖ قَالَ يَٰلَيۡتَ قَوۡمِي يَعۡلَمُونَ,"Maze yakirwa mu Bwami bw’ijuru abwirwa ati: “Kaze, niwinjire mu Bwami bw’ijuru”. Araheza avuga ari mu nema zo mu Bwami bw’ijuru ati: “Ese iyo abantu banje bamenya iherezo ryanje ryiza;",
36,27,بِمَا غَفَرَ لِي رَبِّي وَجَعَلَنِي مِنَ ٱلۡمُكۡرَمِينَ,"Ese iyo bamenya ukuntu Imana yanje Rurema Allah Yambabariye ivyaha vyanje, Ikanantera iteka ryo kwinjira mu Bwami bw’ijuru, na bo bagaheza bakayemera maze Ikabinjiza mu Bwami bw’ijuru!”.",
36,28,۞ وَمَآ أَنزَلۡنَا عَلَىٰ قَوۡمِهِۦ مِنۢ بَعۡدِهِۦ مِن جُندٖ مِّنَ ٱلسَّمَآءِ وَمَا كُنَّا مُنزِلِينَ,"Mu nyuma y’aho abantu biwe biciye umuhanuzi yaje kwamama ko batohirahira ngo bice Intumwa, bakanazihakana bivuye inyuma, ntitwashotse Tubamanurira ingabo mu kubahana, eka ntivyari binakenewe kubamanurira abamalayika bavuye mw’ijuru ngo babahane, ariko Twabarungikiye ibihano birabahonya.",
36,29,إِن كَانَتۡ إِلَّا صَيۡحَةٗ وَٰحِدَةٗ فَإِذَا هُمۡ خَٰمِدُونَ,"Ihonywa ryabo rero ntiryabaye ukundi, kiretse ivuzwa rimwe gusa ry’akaruru gahonya, ubwo nyene bose bapfira rimwe, basigara ari ibiziga vyibereye ng’aho.",
36,30,يَٰحَسۡرَةً عَلَى ٱلۡعِبَادِۚ مَا يَأۡتِيهِم مِّن رَّسُولٍ إِلَّا كَانُواْ بِهِۦ يَسۡتَهۡزِءُونَ,"Ese agahombo n’ukwicuza vy’akataraboneka bizoshikira abagararije ku musi w’izuka, igihe biboneye ibihano ukuri kwamye! Ntibashikirwa n’Intumwa n’imwe irungitswe n’Imana Allah, kiretse ko bayiteburako bakayisuzugura.",
36,31,أَلَمۡ يَرَوۡاْ كَمۡ أَهۡلَكۡنَا قَبۡلَهُم مِّنَ ٱلۡقُرُونِ أَنَّهُمۡ إِلَيۡهِمۡ لَا يَرۡجِعُونَ,"Mbega abatebura ku Ntumwa bakazihakana, ntibabona ko Twebwe Allah, Twahoneje imigwi myinshi y’abahakanye Intumwa hambere yabo, n’uko nya migwi itazogenda igarutse kandi kw’isi mu nyuma y’ihonywa ryayo!",
36,32,وَإِن كُلّٞ لَّمَّا جَمِيعٞ لَّدَيۡنَا مُحۡضَرُونَ,"Nta n’umwe rero mu bantu, yaba mu migwi Twahoneje canke mu yo Tutahoneje, kiretse ko iyo migwi yose izokwegeranirizwa iwacu Twebwe Allah, ku musi w’izuka kugira iharurirwe, iheze ihemberwe ivyo yakoze.",
36,33,وَءَايَةٞ لَّهُمُ ٱلۡأَرۡضُ ٱلۡمَيۡتَةُ أَحۡيَيۡنَٰهَا وَأَخۡرَجۡنَا مِنۡهَا حَبّٗا فَمِنۡهُ يَأۡكُلُونَ,"Icemezo cereka ababangikanyamana ko Imana Allah Ishoboye kuzura abapfuye, ni isi yagadutse igacika ubukumbagare, aho Twebwe Allah, Dutuma hagwa imvura ivuye mu bicu izananye mu kirere, Tugaheza Tukayitotahaza, maze Tukayinagishako n’ibiterwa mbumbarugo vy’ubwoko butandukanye, hakoreshejwe amazi ya nya mvura, abantu bagaheza bakabifungurako, bo hamwe n’ibitungwa vyabo;",
36,34,وَجَعَلۡنَا فِيهَا جَنَّٰتٖ مِّن نَّخِيلٖ وَأَعۡنَٰبٖ وَفَجَّرۡنَا فِيهَا مِنَ ٱلۡعُيُونِ,"Maze Tukagira n’imirima y’itende n’iy’imizabibu, Tugaca n’amariba y’amazi atemba kw’isi, kugira bavomere nya mirima.",
36,35,لِيَأۡكُلُواْ مِن ثَمَرِهِۦ وَمَا عَمِلَتۡهُ أَيۡدِيهِمۡۚ أَفَلَا يَشۡكُرُونَ,"Ivyo vyose rero, Tubigira kugira abantu bafungure ku vyamwa vy’iyo mirima itanaga ngo itotahare ku bw’inguvu n’ubuhinga vyabo. Ubwo none ntiboshimira Imana Allah ku nema zayo z'umurengera!",
36,36,سُبۡحَٰنَ ٱلَّذِي خَلَقَ ٱلۡأَزۡوَٰجَ كُلَّهَا مِمَّا تُنۢبِتُ ٱلۡأَرۡضُ وَمِنۡ أَنفُسِهِمۡ وَمِمَّا لَا يَعۡلَمُونَ,"Nihaninahazwe rero Imana Allah Yaremye amoko yose y’ibiterwa n’ivyimeza kw’isi, Ikarema igitsina-gabo n’igitsina-gore no mu bantu nyene, no mu bindi biremwa rero batazi[6].","[6] Imana Allah rero, Yaremye ivyo vyose ata we Yifashishije, ntikwiye kubangikanywa na kimwe mu biremwa vyayo mu gusengwa."
36,37,وَءَايَةٞ لَّهُمُ ٱلَّيۡلُ نَسۡلَخُ مِنۡهُ ٱلنَّهَارَ فَإِذَا هُم مُّظۡلِمُونَ,"Biri no mu vyemezo vyereka ababangikanyamana, ko Imana Allah ari Imwe mu bumana no mu bubasha bwayo; ijoro Twebwe Allah Dukurako umuco w’umurango, maze aho baherereye bagaca baja mu muzimagiza waryo;",
36,38,وَٱلشَّمۡسُ تَجۡرِي لِمُسۡتَقَرّٖ لَّهَاۚ ذَٰلِكَ تَقۡدِيرُ ٱلۡعَزِيزِ ٱلۡعَلِيمِ,"N’izuba rigendera aho ryagenewe n’Imana Allah, ntirirenga canke ngo riseruke hataragera. Iyo rero, ni yo nteguro y’Imana Allah Nyenintsinzi-Mutananirwa, Nyenubumenyikurivyose;",
36,39,وَٱلۡقَمَرَ قَدَّرۡنَٰهُ مَنَازِلَ حَتَّىٰ عَادَ كَٱلۡعُرۡجُونِ ٱلۡقَدِيمِ,"N’ukwezi nyene, Twebwe Allah, Twakugeneye ibituro vyakwo buri joro, aho mu mboneko zakwo kuba ari guto, kukagenda kurakura gushika n’aho kwiburungushura mu mfato, hanyuma kugatangura kugabanuka bukebuke mu mpito, gushika n’aho kungana n’agati k’itende kumye, kagahishira kakigonda.",
36,40,لَا ٱلشَّمۡسُ يَنۢبَغِي لَهَآ أَن تُدۡرِكَ ٱلۡقَمَرَ وَلَا ٱلَّيۡلُ سَابِقُ ٱلنَّهَارِۚ وَكُلّٞ فِي فَلَكٖ يَسۡبَحُونَ,"Izuba rero, ntirishobora guta inzira yaryo ngo riseruke mw’ijoro, riheze rizimanganye umuco w’ukwezi; eka n’ijoro nyene, ntirishobora kwijima imbere yuko umurango urengana. Burya rero izuba, ukwezi n’izindi nyenyeri, kimwe cose kirafise inzira-ntasobwa yaco gicamwo.",
36,41,وَءَايَةٞ لَّهُمۡ أَنَّا حَمَلۡنَا ذُرِّيَّتَهُمۡ فِي ٱلۡفُلۡكِ ٱلۡمَشۡحُونِ,"Hari n’ikindi cemezo cereka ababangikanyamana ko Imana Allah Ikwiye gusengwa ari Imwe Rudende Itabangikanywa, ni uko Twebwe Allah, Twarokoye mw’isegenya bamwe mu ruvyaro bakomokako rwa Adamu, maze Tubarerura mu bwato bwa Nuhu bwari burimwo amoko atandukanye y’ibiremwa vyose vy’igitsina-gabo n’igitsina-gore, ivyo bikaba ari na vyo vyahavuye biba intango y’ukurondoka bushasha;",
36,42,وَخَلَقۡنَا لَهُم مِّن مِّثۡلِهِۦ مَا يَرۡكَبُونَ,"Twaranaremeye abo babangikanyamana n’abandi, ibindi bibunguruza nk’ubwato bwa Nuhu[7].",[7] Haba mu kwiyunguruza imusozi canke mu mazi.
36,43,وَإِن نَّشَأۡ نُغۡرِقۡهُمۡ فَلَا صَرِيخَ لَهُمۡ وَلَا هُمۡ يُنقَذُونَ,"Mu gihe Twoshaka rero, Twobasomesha nturi bari mw’ibahari, nta n’uwobatabara muri ico gihe, eka na bo nyene ntiborokotse;",
36,44,إِلَّا رَحۡمَةٗ مِّنَّا وَمَتَٰعًا إِلَىٰ حِينٖ,"Kiretse mu gihe Twobagirira impuhwe Tukabarokora, maze Tukabaha kuryoherwa gato mu buzima bw’isi gushika kw’isango rizwi kugira bikebuke.",
36,45,وَإِذَا قِيلَ لَهُمُ ٱتَّقُواْ مَا بَيۡنَ أَيۡدِيكُمۡ وَمَا خَلۡفَكُمۡ لَعَلَّكُمۡ تُرۡحَمُونَ,"Ababangikanyamana iyo babwiwe bati: “Nimwiyubare intureka zo mu buzima bw’inyuma yo gupfa n’ivyago vyo mu buzima bwo kw’isi, kugira mugirirwe impuhwe n’Imana Allah”, baraheza bakavyirengagiza bakigira ba sindabibazwa.",
36,46,وَمَا تَأۡتِيهِم مِّنۡ ءَايَةٖ مِّنۡ ءَايَٰتِ رَبِّهِمۡ إِلَّا كَانُواْ عَنۡهَا مُعۡرِضِينَ,"Ababangikanyamana, ntibashikirwa n’icemezo mu vyemezo vy’Imana yabo Rurema Allah, kugira kibarongore mu nzira y’ukuri, kiretse ko bacirengagiza bakirabira hirya, maze kikababera impfagusa.",
36,47,وَإِذَا قِيلَ لَهُمۡ أَنفِقُواْ مِمَّا رَزَقَكُمُ ٱللَّهُ قَالَ ٱلَّذِينَ كَفَرُواْ لِلَّذِينَ ءَامَنُوٓاْ أَنُطۡعِمُ مَن لَّوۡ يَشَآءُ ٱللَّهُ أَطۡعَمَهُۥٓ إِنۡ أَنتُمۡ إِلَّا فِي ضَلَٰلٖ مُّبِينٖ,"Abagarariji na bo, iyo babwiwe bati: “Nimutange mu matungo, Imana Allah Yabaronkeje”; baca bigovyora babwira abemeramana bati: “Vyoshoboka gute ko dufungurira umuntu, Imana Allah Ishatse Yari kumufungurira! Bemeramana! Mwebwe nta co muri, kiretse ko muri mu muzimagiza uri kure cane y’ukuri”.",
36,48,وَيَقُولُونَ مَتَىٰ هَٰذَا ٱلۡوَعۡدُ إِن كُنتُمۡ صَٰدِقِينَ,"Abagarariji, barinamuye mu guhakana bivuye inyuma izurwa ry’ibiremwa bati: “Muhama! Mbega ubona iryo sango ryo guhanirwako ku musi w’izuka, rizoshika ryari nimwaba wewe n’abemeramana muri kumwe, muri imvugakuri?”.",
36,49,مَا يَنظُرُونَ إِلَّا صَيۡحَةٗ وَٰحِدَةٗ تَأۡخُذُهُمۡ وَهُمۡ يَخِصِّمُونَ,"Abagarariji bihutira gusaba ibihano, nta n’ikindi barindiriye kugira bahanwe, kiretse ivuzwa ry’inzamba y’umuhero w’isi, uzobashikira giturumbuka ata n’uwo bari biteze, ukabasanga bari mu mpari bahazana mu vy’isi;",
36,50,فَلَا يَسۡتَطِيعُونَ تَوۡصِيَةٗ وَلَآ إِلَىٰٓ أَهۡلِهِمۡ يَرۡجِعُونَ,"Ico gihe rero, ntibazoshobora no kugira uwo baraga n’ikintu na kimwe, eka ntibazoshobora no kugaruka mu miryango yabo, bazopfira aho bazoba bari;",
36,51,وَنُفِخَ فِي ٱلصُّورِ فَإِذَا هُم مِّنَ ٱلۡأَجۡدَاثِ إِلَىٰ رَبِّهِمۡ يَنسِلُونَ,"Inzamba igira kabiri izoheza ivuzwe, ibiremwa bice bisubizwa ubuzima, ubwo nyene bive mu kuzimu, maze bigende binyaragasa ku Mana yavyo Rurema Allah;",
36,52,قَالُواْ يَٰوَيۡلَنَا مَنۢ بَعَثَنَا مِن مَّرۡقَدِنَاۜۗ هَٰذَا مَا وَعَدَ ٱلرَّحۡمَٰنُ وَصَدَقَ ٱلۡمُرۡسَلُونَ,"Abahakanye bivuye inyuma izurwa ry’ibiremwa, bace bavuga bicuza bati: “Amagorwa arama yemwe! Ni nde ga ntuze atuzuye akadukura aho twari twibereye!”; ubwo nyene bace bishurwa bati: “Iri, ni rya sango mwasezeranirwa na Nyenimpuhwe Allah, mugashikirizwa n’Intumwa zayo ko ari iry’ukuri”.",
36,53,إِن كَانَتۡ إِلَّا صَيۡحَةٗ وَٰحِدَةٗ فَإِذَا هُمۡ جَمِيعٞ لَّدَيۡنَا مُحۡضَرُونَ,"Izurwa ry’ibiremwa rero, nta n’ico risaba atari ivuzwa ry’inzamba igira kabiri, maze ibiremwa vyose bigaca vyegeranirizwa iwacu Twebwe Allah, kugira biharurirwe biheze bihemberwe ivyo vyakoze.",
36,54,فَٱلۡيَوۡمَ لَا تُظۡلَمُ نَفۡسٞ شَيۡـٔٗا وَلَا تُجۡزَوۡنَ إِلَّا مَا كُنتُمۡ تَعۡمَلُونَ,"Kuri uwo musi w’izuka rero, ibiremwa bizotunganirizwa vy’ukuri, nta muntu azorenganywa n’akantu inzatsa, mu kugabanyirizwa ivyiza canke mu kurengerezwa ku vyaha. Eka ntimuzonahemberwa, kiretse ku vyo mwari mwarakoze kw’isi.",
36,55,إِنَّ أَصۡحَٰبَ ٱلۡجَنَّةِ ٱلۡيَوۡمَ فِي شُغُلٖ فَٰكِهُونَ,"Mu vy’ukuri, kuri uyo musi abantu bo mu Bwami bw’ijuru, bazoba baryohewe n’inema z’ubwoko bwose, akamwemwe kabasya;",
36,56,هُمۡ وَأَزۡوَٰجُهُمۡ فِي ظِلَٰلٍ عَلَى ٱلۡأَرَآئِكِ مُتَّكِـُٔونَ,"Bo hamwe n’abakenyezi babo, bicaye ku bitanda vy'iteka bisharije, basharamye mu gatutu katarenga;",
36,57,لَهُمۡ فِيهَا فَٰكِهَةٞ وَلَهُم مَّا يَدَّعُونَ,"Muri nya Bwami, bazoronswa amoko yose y’ivyamwa biryoshe, bazoronswa n’ivyo vyose bipfuza biryoshe;",
36,58,سَلَٰمٞ قَوۡلٗا مِّن رَّبّٖ رَّحِيمٖ,"Bazoronka n’iyindi nema ihambaye kuruta zose, indamutso y’amahoro bazoramutswa n’Imana yabo Rurema Nyenimbabazi[8].","[8] Ukuramutswa kwabo n’Imana Nyenimbabazi, kizoba ari co kimenyetso c’uko bari mu mahoro, iteka n’itekane vyamaho."
36,59,وَٱمۡتَٰزُواْ ٱلۡيَوۡمَ أَيُّهَا ٱلۡمُجۡرِمُونَ,"Abagarariji kuri uyo musi, bazobwirwa bati: “Emwe banyavyaha! Kuri uno musi, nimwitandukanye n’abemeramana, muheze muje ukwanyu”;",
36,60,۞ أَلَمۡ أَعۡهَدۡ إِلَيۡكُمۡ يَٰبَنِيٓ ءَادَمَ أَن لَّا تَعۡبُدُواْ ٱلشَّيۡطَٰنَۖ إِنَّهُۥ لَكُمۡ عَدُوّٞ مُّبِينٞ,"Maze Imana Allah Iheze Ibabwire n’agashinyaguro n’akantu Iti: “Mbega bagarariji muri Bene Adamu! Sinabahaye amabwirizwa yanje Ndayacishije ku Ntumwa Nabarungikiye, ko mutosenga shetani ngo muyumvire, n’uko mu vy’ukuri shetani kuri mwebwe, ari umwansi agaragara;",
36,61,وَأَنِ ٱعۡبُدُونِيۚ هَٰذَا صِرَٰطٞ مُّسۡتَقِيمٞ,"Nkababwiriza n’uko munyiyegereza mu vyo mukora vyose mukanansenga mutambangikanya na kimwe mu biremwa, kuko iryo ari ryo dini rigororotse Nzobahembera Ubwami bw’ijuru!",
36,62,وَلَقَدۡ أَضَلَّ مِنكُمۡ جِبِلّٗا كَثِيرًاۖ أَفَلَمۡ تَكُونُواْ تَعۡقِلُونَ,"Ni ukuri, shetani yarahubishije inzira yanje ibiremwa vyinshi muri mwebwe. Mbega babangikanyamana! Ntimwagira akenge ngo mutahure urwanko shetani ibafitiye ngo muheze muyirinde!",
36,63,هَٰذِهِۦ جَهَنَّمُ ٱلَّتِي كُنتُمۡ تُوعَدُونَ,"Uwu rero, ni wo muriro wa Jahannamu mwahora musezeranirwa mukiri kw’isi, ko muzowinjira nimwagarariza;",
36,64,ٱصۡلَوۡهَا ٱلۡيَوۡمَ بِمَا كُنتُمۡ تَكۡفُرُونَ,"Nimuwinjire rero kuri uno musi, maze muwote ku kuntu mwagarariza;",
36,65,ٱلۡيَوۡمَ نَخۡتِمُ عَلَىٰٓ أَفۡوَٰهِهِمۡ وَتُكَلِّمُنَآ أَيۡدِيهِمۡ وَتَشۡهَدُ أَرۡجُلُهُم بِمَا كَانُواْ يَكۡسِبُونَ,"Kuri uno musi rero, Twebwe Allah, Turazivya iminwa y’ababangikanyamana ntibashobore kurikura mu kanwa ngo bavuge, Duheze Tuvugishe amaboko yabo, maze avuge ibibi yakoze, amaguru yabo na yo abagirize ku bibi vyose baja gukora”.",
36,66,وَلَوۡ نَشَآءُ لَطَمَسۡنَا عَلَىٰٓ أَعۡيُنِهِمۡ فَٱسۡتَبَقُواْ ٱلصِّرَٰطَ فَأَنَّىٰ يُبۡصِرُونَ,"Mu gihe Twoshaka rero, ni ukuri Twobahumya n’amaso nk’uko Twazibije iminwa yabo, bagaheza bakitanganiza kuja kurengana ku kiraro gitambitse hejuru y’umuriro. None vyoshoboka gute kukirenganako, kandi barahumye amaso, batabona n’iyo baja!",
36,67,وَلَوۡ نَشَآءُ لَمَسَخۡنَٰهُمۡ عَلَىٰ مَكَانَتِهِمۡ فَمَا ٱسۡتَطَٰعُواْ مُضِيّٗا وَلَا يَرۡجِعُونَ,"No mu gihe Twoshaka, ni ukuri Twobahinduye indemo bakaguma aho bari batanyagaza; muri ico gihe, ntiboshoboye gutera intambwe n’imwe imbere canke ngo basubire inyuma.",
36,68,وَمَن نُّعَمِّرۡهُ نُنَكِّسۡهُ فِي ٱلۡخَلۡقِۚ أَفَلَا يَعۡقِلُونَ,"Uwo Duhaye kuramba bigashika akagera mu za bukuru, Turamutitura mu ndemo agasubira ibwana mu nyifato n’intege nke. Mbega abagarariji ntibogarura akenge ngo batahure ko Imana Allah Ishoboye kugira ivyo vyose, Ishoboye no kubazura!",
36,69,وَمَا عَلَّمۡنَٰهُ ٱلشِّعۡرَ وَمَا يَنۢبَغِي لَهُۥٓۚ إِنۡ هُوَ إِلَّا ذِكۡرٞ وَقُرۡءَانٞ مُّبِينٞ,"Twebwe Allah, ntitwigeze Twigisha Intumwa Muhamadi kwivuga amazina, eka ntivyari binayikwiye namba ko iba umwivuzi w’amazina. Iki Gitabu yabazaniye, si ikindi kiretse ko ari urwibutso n’inyigisho ku wushaka kwikebuka; kikaba na Qor’ani itomoye neza, mu nsiguro, mu ngingo z’ibirekuwe n’ibizira, ikaba inatomoye neza kandi no mu burongozi bwayo;",
36,70,لِّيُنذِرَ مَن كَانَ حَيّٗا وَيَحِقَّ ٱلۡقَوۡلُ عَلَى ٱلۡكَٰفِرِينَ,"Kugira igabishe ku bihano vy’Imana Allah, uwo wese afise umushaha utegera ugakurikira ukuri, maze ibihano vyagire abagarariji inyuma y’aho bashikiwe na Qor’ani, bakayihakana bivuye inyuma.",
36,71,أَوَلَمۡ يَرَوۡاْ أَنَّا خَلَقۡنَا لَهُم مِّمَّا عَمِلَتۡ أَيۡدِينَآ أَنۡعَٰمٗا فَهُمۡ لَهَا مَٰلِكُونَ,"Mbega abantu ntibabona ko Twebwe Allah, Twabaremeye ibitungwa ku neza yabo, Tubaha kubigaba no kubiganza;",
36,72,وَذَلَّلۡنَٰهَا لَهُمۡ فَمِنۡهَا رَكُوبُهُمۡ وَمِنۡهَا يَأۡكُلُونَ,"Tubashoboza no kuvyikorako! Muri vyo rero; harimwo ivyo bikorako mu ngendo z’uruja n’uruza, no mu kwunguruza ivyankenerwa, harimwo n’ivyo baheza bagafungura.",
