surah,ayah,arabic_text,translation,footnotes
51,1,وَٱلذَّٰرِيَٰتِ ذَرۡوٗا,سوێند بەو بایانەی کە زۆر شت پرژو بڵاودەکەنەوە بە بڵاوکردنەوە ,
51,2,فَٱلۡحَٰمِلَٰتِ وِقۡرٗا,ئەمجا سوێند بەو ھەورانەی کە ھەڵگری بارانن ,
51,3,فَٱلۡجَٰرِيَٰتِ يُسۡرٗا,ئەمجا سوێند بەو کەشتیانەی کە بەئاسانی دەگەڕێن (لە ناو دەریادا) ,
51,4,فَٱلۡمُقَسِّمَٰتِ أَمۡرًا,ئەمجا سوێند بەو فریشتانەی کار دابەشکەرن ,
51,5,إِنَّمَا تُوعَدُونَ لَصَادِقٞ,بێگومان ھەر بەڵێنێك کە پێتان دەدرێ ڕاستە ,
51,6,وَإِنَّ ٱلدِّينَ لَوَٰقِعٞ,وە بەڕاستی (ڕۆژی) پاداشت وتۆڵە ڕوودەدات ,
51,7,وَٱلسَّمَآءِ ذَاتِ ٱلۡحُبُكِ,وەسوێند بەئاسمانی خاوەن ڕێگای زۆر (خاوەن جوانی وڕێك وپێکی) ,
51,8,إِنَّكُمۡ لَفِي قَوۡلٖ مُّخۡتَلِفٖ,بێگومان ئێوە لەقسە وگوفتاری جیاوازدان ,
51,9,يُؤۡفَكُ عَنۡهُ مَنۡ أُفِكَ,ئەو کەسە لادەدرێت لەئیمان کەلادراوە (چونکە خۆی گومڕایە) ,
51,10,قُتِلَ ٱلۡخَرَّٰصُونَ,دەک بەکوشت چن ئەو درۆزنانە(و نەفرەتیان لێ بێت) ,
51,11,ٱلَّذِينَ هُمۡ فِي غَمۡرَةٖ سَاهُونَ,ئەوانە کەسانێکن لەگێژاوی نەزانیدا بێ ئاگان (لەھەموو شت) ,
51,12,يَسۡـَٔلُونَ أَيَّانَ يَوۡمُ ٱلدِّينِ,(بەگاڵتەوە) دەپرسن کەی ڕۆژی دوایی دێت ,
51,13,يَوۡمَ هُمۡ عَلَى ٱلنَّارِ يُفۡتَنُونَ,ڕۆژێك (سزا دەدرێن) کەئەوان بەئاگری دۆزەخ دەسوتێنرێن ,
51,14,ذُوقُواْ فِتۡنَتَكُمۡ هَٰذَا ٱلَّذِي كُنتُم بِهِۦ تَسۡتَعۡجِلُونَ,(پێیان دەووترێت) سزاکەتان بچەژن، ئەمە ئەو (سزایە) (بەگاڵتەوە) بە پەلە داواتان دەکرد ,
51,15,إِنَّ ٱلۡمُتَّقِينَ فِي جَنَّٰتٖ وَعُيُونٍ,بێگومان پارێزکاران و لەخواترسان وان لە باخات وکەناری سەرچەشمەی ڕەواندا ,
51,16,ءَاخِذِينَ مَآ ءَاتَىٰهُمۡ رَبُّهُمۡۚ إِنَّهُمۡ كَانُواْ قَبۡلَ ذَٰلِكَ مُحۡسِنِينَ,ئەوەی خوا پێی داوون وەریدەگرن (چونکە) بێگومان ئەوان لەوەو پێش چاکەکار بوون ,
51,17,كَانُواْ قَلِيلٗا مِّنَ ٱلَّيۡلِ مَا يَهۡجَعُونَ,ئەوانە کەمێك لەشەودا دەخەوتن (ئەوی تری شەو نوێژیان دەکرد) ,
51,18,وَبِٱلۡأَسۡحَارِ هُمۡ يَسۡتَغۡفِرُونَ,وە لەبەرەبەیاناندا داوای لێخۆشبوونیان دەکرد ,
51,19,وَفِيٓ أَمۡوَٰلِهِمۡ حَقّٞ لِّلسَّآئِلِ وَٱلۡمَحۡرُومِ,وە لە ماڵ و داراییاندا بۆ (ھەژاری) داواکەر وداوانەکەر مافی خۆیان ھەبوو ,
51,20,وَفِي ٱلۡأَرۡضِ ءَايَٰتٞ لِّلۡمُوقِنِينَ,وەلەزەویدا بەڵگە ونیشانە ھەیە بۆ باوەڕداران ,
51,21,وَفِيٓ أَنفُسِكُمۡۚ أَفَلَا تُبۡصِرُونَ,وە لەخودی خۆشتاندا (بەڵگەی زۆر ھەیە) دەی ئایا بۆ وورد نابنەوە وسەرنج نادەن ,
51,22,وَفِي ٱلسَّمَآءِ رِزۡقُكُمۡ وَمَا تُوعَدُونَ,وە ڕزق وڕۆزی ئێوە و ئەو بەڵێنانەی پێتان دەدرێت لەئاسمانە ,
51,23,فَوَرَبِّ ٱلسَّمَآءِ وَٱلۡأَرۡضِ إِنَّهُۥ لَحَقّٞ مِّثۡلَ مَآ أَنَّكُمۡ تَنطِقُونَ,جا سوێند بەپەوەردگاری ئاسمان وزەوی بێگومان ئەوە(ی باسکرا) ھەق وڕاستە بەوێنەی ئەو قسانەی خۆتان دەیکەن ,
51,24,هَلۡ أَتَىٰكَ حَدِيثُ ضَيۡفِ إِبۡرَٰهِيمَ ٱلۡمُكۡرَمِينَ,ئایا پێت گەشتووە بەسەر ھاتی میوانە ڕێزدارەکانی ئیبراھیم ,
51,25,إِذۡ دَخَلُواْ عَلَيۡهِ فَقَالُواْ سَلَٰمٗاۖ قَالَ سَلَٰمٞ قَوۡمٞ مُّنكَرُونَ,کاتێ چوونە لای ئیبراھیم و ووتیان سڵاو (ئەویش) ووتی سڵاو لەخۆتان (ئێوە) کەسانێکی نەناسراوون ,
51,26,فَرَاغَ إِلَىٰٓ أَهۡلِهِۦ فَجَآءَ بِعِجۡلٖ سَمِينٖ,جا خێرا چوو بۆلای خێزانەکەی ئەمجا گوێرەکەیەکی قەڵەوی (بەبرژاوی بۆ) ھێنان ,
51,27,فَقَرَّبَهُۥٓ إِلَيۡهِمۡ قَالَ أَلَا تَأۡكُلُونَ,وەنزیکی کردەوە لێیان (بەڵام نەیان خوارد) ووتی ئەوە ناخۆن؟ ,
51,28,فَأَوۡجَسَ مِنۡهُمۡ خِيفَةٗۖ قَالُواْ لَا تَخَفۡۖ وَبَشَّرُوهُ بِغُلَٰمٍ عَلِيمٖ,ئەوسا لێیان ترسا ووتیان مەترسە (ئێمە نێردراوی خواین) وە مزگێنیان پێ دا بەکوڕێکی دانا (کەئیسحاقە) ,
51,29,فَأَقۡبَلَتِ ٱمۡرَأَتُهُۥ فِي صَرَّةٖ فَصَكَّتۡ وَجۡهَهَا وَقَالَتۡ عَجُوزٌ عَقِيمٞ,جاژنەکەی قریوەیەکی کرد وھات وە دای بەڕوومەتی خۆیدا (وەك باووی ژنان) وە ووتی پیرەژنێکی نەزۆك (چۆن منداڵی دەبێت) ,
51,30,قَالُواْ كَذَٰلِكِ قَالَ رَبُّكِۖ إِنَّهُۥ هُوَ ٱلۡحَكِيمُ ٱلۡعَلِيمُ,(فریشتەکان) ووتیان پەروەردگارت وای فەرمووە بێگومان ھەر خوا کار بەجێ وزانایە ,
51,31,۞ قَالَ فَمَا خَطۡبُكُمۡ أَيُّهَا ٱلۡمُرۡسَلُونَ,(ئیبراھیم) ووتی: چیتان پێ سپێردراوە ئەی نێرراوانی خوا ,
51,32,قَالُوٓاْ إِنَّآ أُرۡسِلۡنَآ إِلَىٰ قَوۡمٖ مُّجۡرِمِينَ,ووتیان بێگومان ئێمە نێرراوین بۆ سەر گەلی تاوانباران ,
51,33,لِنُرۡسِلَ عَلَيۡهِمۡ حِجَارَةٗ مِّن طِينٖ,بۆ ئەوەی ببارێنین بە سەریاندا بەرد لە گڵی سورەوە کراوی ,
51,34,مُّسَوَّمَةً عِندَ رَبِّكَ لِلۡمُسۡرِفِينَ,نیشانە کراو لەلایەن پەروەردگارتەوە بۆ لە سنوور دەرچوان ,
51,35,فَأَخۡرَجۡنَا مَن كَانَ فِيهَا مِنَ ٱلۡمُؤۡمِنِينَ,ئەمجا ھەرچی بوو لەو (شارەی لوط) دا لە بڕواداران دەرمان کردن ,
51,36,فَمَا وَجَدۡنَا فِيهَا غَيۡرَ بَيۡتٖ مِّنَ ٱلۡمُسۡلِمِينَ,وە نەماندی تێیدا بێجگە لەیەك ماڵی موسڵمان نەبێت (ئەویش ماڵی لوط بوو) ,
51,37,وَتَرَكۡنَا فِيهَآ ءَايَةٗ لِّلَّذِينَ يَخَافُونَ ٱلۡعَذَابَ ٱلۡأَلِيمَ,وەپەند ونیشانەیەکمان تێدا بەجێ ھێشت بۆ ئەوانەی کە لە سزای بە ئازار دەترسن ,
51,38,وَفِي مُوسَىٰٓ إِذۡ أَرۡسَلۡنَٰهُ إِلَىٰ فِرۡعَوۡنَ بِسُلۡطَٰنٖ مُّبِينٖ,ھەروەھا لەبەسەر ھاتی موسادا (چەند بەڵگە وپەند ھەیە) کاتێك کەناردمان بۆ لای فیرعەون بە بەڵگەی ڕوون وئاشکراوە ,
51,39,فَتَوَلَّىٰ بِرُكۡنِهِۦ وَقَالَ سَٰحِرٌ أَوۡ مَجۡنُونٞ,فیرعەونیش ڕوی وەرگێڕا وسەرپێچی کرد بەھۆی دەسەڵاتەکەیەوە وە ووتی: (موسا) جادووگـەرە یان شێتە ,
51,40,فَأَخَذۡنَٰهُ وَجُنُودَهُۥ فَنَبَذۡنَٰهُمۡ فِي ٱلۡيَمِّ وَهُوَ مُلِيمٞ,ئێمەش خۆی ولەشکرەکەیمان گرت وفڕێمان دانە ناو دەریاوە کە ئەو شیاوی لۆمە کردن بوو ,
51,41,وَفِي عَادٍ إِذۡ أَرۡسَلۡنَا عَلَيۡهِمُ ٱلرِّيحَ ٱلۡعَقِيمَ,وە لەگەلی عاددا بەڵگەو پەند ھەیە، کاتێ کە ناردمانە سەریان بای (گەرمی توندی) بێ خێر ,
51,42,مَا تَذَرُ مِن شَيۡءٍ أَتَتۡ عَلَيۡهِ إِلَّا جَعَلَتۡهُ كَٱلرَّمِيمِ,بەسەر ھەر شتێکدا بڕۆیشتایە وازی لێ نەدەھێنا ھەتا وەك ڕزیوی لێ ئەکرد ,
51,43,وَفِي ثَمُودَ إِذۡ قِيلَ لَهُمۡ تَمَتَّعُواْ حَتَّىٰ حِينٖ,وە لە گەلی سەموددا (پەند وئامۆژگاری ھەیە) کاتێك کە پێیان ووترا ڕابوێرن تا کاتی خۆی دێت ,
51,44,فَعَتَوۡاْ عَنۡ أَمۡرِ رَبِّهِمۡ فَأَخَذَتۡهُمُ ٱلصَّٰعِقَةُ وَهُمۡ يَنظُرُونَ,جا ئەوان سەرکەشیان کرد لەفەرمانی پەروەردگاریان، ئەمجا ھەورە بروسکە لێیدان لەکاتێکدا ئەوان (تیاچوونی خۆیانیان) بەچاو دەبینی ,
51,45,فَمَا ٱسۡتَطَٰعُواْ مِن قِيَامٖ وَمَا كَانُواْ مُنتَصِرِينَ,ئیتر نەیانتوانی ھەستنەوە وە سەرکەوتوویش نەبوون ,
51,46,وَقَوۡمَ نُوحٖ مِّن قَبۡلُۖ إِنَّهُمۡ كَانُواْ قَوۡمٗا فَٰسِقِينَ,وە گەلی نووحیش لەپێش ئەماندا بوو کە بەڕاستی گەلێکی بەدکارو لەسنوور دەرچوو بوون ,
51,47,وَٱلسَّمَآءَ بَنَيۡنَٰهَا بِأَيۡيْدٖ وَإِنَّا لَمُوسِعُونَ,وە ئاسمانمان بەھێز وتوانایەکی گەورە دروست کردووە وە ئێمە بەڕاستی فراوانکەری (ئاسمانین) بە بەردەوامی ,
51,48,وَٱلۡأَرۡضَ فَرَشۡنَٰهَا فَنِعۡمَ ٱلۡمَٰهِدُونَ,وە زەویمان ڕاخستووە ئای چ ڕاخەرێکی چاکین ئێمە ,
51,49,وَمِن كُلِّ شَيۡءٍ خَلَقۡنَا زَوۡجَيۡنِ لَعَلَّكُمۡ تَذَكَّرُونَ,وە لە ھەموو شتێك جووتێك (نێر و مێ) مان دروست کردووە، بۆ ئەوەی بیربکەنەوە وپەندی لێ وەربگرن ,
51,50,فَفِرُّوٓاْ إِلَى ٱللَّهِۖ إِنِّي لَكُم مِّنۡهُ نَذِيرٞ مُّبِينٞ,ئەمجا بەپەلە بەرەو لای خوا بڕۆن بەڕاستی من لەلایەن خواوە ترسێنەرێکی ئاشکراو ڕوونم بۆ ئێوە ,
51,51,وَلَا تَجۡعَلُواْ مَعَ ٱللَّهِ إِلَٰهًا ءَاخَرَۖ إِنِّي لَكُم مِّنۡهُ نَذِيرٞ مُّبِينٞ,وە لەگەڵ خوادا پەرستراوی تر دامەنێن، بەڕاستی من لەلایەن خواوە ترسێنەرێکی ئاشکراو ڕوونم بۆ ئێوە ,
51,52,كَذَٰلِكَ مَآ أَتَى ٱلَّذِينَ مِن قَبۡلِهِم مِّن رَّسُولٍ إِلَّا قَالُواْ سَاحِرٌ أَوۡ مَجۡنُونٌ,ھەر بەم شێوەیە ھیچ پێغەمبەرێك نەھاتووە بۆ لای ئوممەتانی پێش ئەمان مەگەر ووتوویانە(بەو پێغەمبەرە) جادوگەرە یان شێتە ,
51,53,أَتَوَاصَوۡاْ بِهِۦۚ بَلۡ هُمۡ قَوۡمٞ طَاغُونَ,ئایا(ئەمان وئەوان) ڕاسپاردەیان بۆیەکتری کردووە؟ (نەخێر) بەڵکو ئەمان گەلێکی سەرکەش ویاخین ,
51,54,فَتَوَلَّ عَنۡهُمۡ فَمَآ أَنتَ بِمَلُومٖ,تۆ (ئەی موحەممەد ﷺ) ڕوویان لێ وەرگێڕە چونکە تۆ لۆمەکراو نیت ,
51,55,وَذَكِّرۡ فَإِنَّ ٱلذِّكۡرَىٰ تَنفَعُ ٱلۡمُؤۡمِنِينَ,وە ئامۆژگاریان بکەو بیریان بخەرەوە چونکە بەڕاستی ئامۆژگاری (ئەگەر سوودی بۆ بێ بڕوایان نەبێت) سوود ئەگەیەنێت بەبڕواداران ,
51,56,وَمَا خَلَقۡتُ ٱلۡجِنَّ وَٱلۡإِنسَ إِلَّا لِيَعۡبُدُونِ,وە من جنۆکە وئادەمیزادم تەنھا بۆ ئەوە دروست کردووە کەبەندایەتی من بکەن ,
51,57,مَآ أُرِيدُ مِنۡهُم مِّن رِّزۡقٖ وَمَآ أُرِيدُ أَن يُطۡعِمُونِ,من ھیچ ڕۆزییەکم ناوێ لێیان، ناشمەوێت خواردنم بدەنێ ,
51,58,إِنَّ ٱللَّهَ هُوَ ٱلرَّزَّاقُ ذُو ٱلۡقُوَّةِ ٱلۡمَتِينُ,بەڕاستی تەنھا خوا خۆی ڕۆزی دەرە کە خاوەن دەسەڵاتی زۆر بەھێزە ,
51,59,فَإِنَّ لِلَّذِينَ ظَلَمُواْ ذَنُوبٗا مِّثۡلَ ذَنُوبِ أَصۡحَٰبِهِمۡ فَلَا يَسۡتَعۡجِلُونِ,ئەمجا بێگومان بۆ ئەوانەی ستەمیان کردووە، سزای زۆرمان بۆ ئامادەکردوون ھەروەک چۆن بۆ ھاوەڵ وھاوبیرەکانیان ئامادەمانکردووە دەی با ئیتر پەلە نەکەن (لە داواکردنی سزا) ,
51,60,فَوَيۡلٞ لِّلَّذِينَ كَفَرُواْ مِن يَوۡمِهِمُ ٱلَّذِي يُوعَدُونَ,سا ھاوار بۆ ئەوانەی بێ باوەڕ بوون لەو ڕۆژەی کە ھەڕەشەیان پێ لێکراوە ,
