surah,ayah,arabic_text,translation,footnotes
80,1,عَبَسَ وَتَوَلَّىٰٓ,(Intumwa Muhamadi) yazinze umunya inatera umugongo.,
80,2,أَن جَآءَهُ ٱلۡأَعۡمَىٰ,Ubwo umuntu utabona (Abdullah bin Umm-Maktum) yari aje ayisanga (igihe yigishaga bamwe mu bikomerezwa by’Abakurayishi).,
80,3,وَمَا يُدۡرِيكَ لَعَلَّهُۥ يَزَّكَّىٰٓ,Ese wabibwirwa n’iki? Wenda arashaka kwiyeza?,
80,4,أَوۡ يَذَّكَّرُ فَتَنفَعَهُ ٱلذِّكۡرَىٰٓ,"Cyangwa akakira urwibutso, hanyuma urwibutso rukamugirira akamaro?",
80,5,أَمَّا مَنِ ٱسۡتَغۡنَىٰ,"Naho wa wundi wirata yumva ko adakeneye (kuyoboka),",
80,6,فَأَنتَ لَهُۥ تَصَدَّىٰ,"Ni we witaho,",
80,7,وَمَا عَلَيۡكَ أَلَّا يَزَّكَّىٰ,"Kandi nta cyo wabazwa aramutse atiyejeje (ngo ave mu buhakanyi, kuko wowe icyo ushinzwe ari ugusohoza ubutumwa bwa Allah gusa).",
80,8,وَأَمَّا مَن جَآءَكَ يَسۡعَىٰ,"Ariko wa wundi uje akugana yihuta,",
80,9,وَهُوَ يَخۡشَىٰ,"Kandi akaba atinya (Allah n’ibihano bye),",
80,10,فَأَنتَ عَنۡهُ تَلَهَّىٰ,"Uramwirengagiza (ukita ku bandi),",
80,11,كَلَّآ إِنَّهَا تَذۡكِرَةٞ,Oya ntibikwiye! Mu by’ukuri (iyi Qur’an) ni urwibutso.,
80,12,فَمَن شَآءَ ذَكَرَهُۥ,"Bityo, ubishaka nayizirikane.",
80,13,فِي صُحُفٖ مُّكَرَّمَةٖ,"(Iri) mu nyandiko zirinzwe mu cyubahiro (Lawuhul Mahfudh),",
80,14,مَّرۡفُوعَةٖ مُّطَهَّرَةِۭ,"Zubahitse kandi zejejwe,",
80,15,بِأَيۡدِي سَفَرَةٖ,"Ziri mu maboko y’abanditsi (abamalayika bajyana ubutumwa ku bantu),",
80,16,كِرَامِۭ بَرَرَةٖ,B’abanyacyubahiro kandi b’inyangamugayo.,
80,17,قُتِلَ ٱلۡإِنسَٰنُ مَآ أَكۡفَرَهُۥ,Umuntu (w’umuhakanyi) navumwe! Mbega ukuntu ari umuhakanyi (w’indashima)!,
80,18,مِنۡ أَيِّ شَيۡءٍ خَلَقَهُۥ,Ese (Allah) yamuremye mu ki?,
80,19,مِن نُّطۡفَةٍ خَلَقَهُۥ فَقَدَّرَهُۥ,"Yamuremye mu ntanga, arangije amugenera uko azabaho,",
80,20,ثُمَّ ٱلسَّبِيلَ يَسَّرَهُۥ,Nuko amworohereza inzira (y’imibereho ye).,
80,21,ثُمَّ أَمَاتَهُۥ فَأَقۡبَرَهُۥ,"Nyuma amugenera urupfu no gushyingurwa,",
80,22,ثُمَّ إِذَا شَآءَ أَنشَرَهُۥ,Kandi igihe azabishakira azamuzura.,
80,23,كَلَّا لَمَّا يَقۡضِ مَآ أَمَرَهُۥ,Oya! Nyamara (umuntu) ntarakora ibyo yamutegetse.,
80,24,فَلۡيَنظُرِ ٱلۡإِنسَٰنُ إِلَىٰ طَعَامِهِۦٓ,Ngaho umuntu niyitegereze amafunguro ye;,
80,25,أَنَّا صَبَبۡنَا ٱلۡمَآءَ صَبّٗا,"Uko tumanura amazi (mu kirere) yisuka ari menshi,",
80,26,ثُمَّ شَقَقۡنَا ٱلۡأَرۡضَ شَقّٗا,"Nuko tugasatura ubutaka uko bikwiye (kugira ngo amazi abashe kubwinjiramo n’imbuto zimere),",
80,27,فَأَنۢبَتۡنَا فِيهَا حَبّٗا,"Maze tukabumezamo impeke,",
80,28,وَعِنَبٗا وَقَضۡبٗا,"N’imizabibu n’imboga,",
80,29,وَزَيۡتُونٗا وَنَخۡلٗا,"N’imizeti n’imitende,",
80,30,وَحَدَآئِقَ غُلۡبٗا,"N’imirima igizwe n’ibiti by’inzitane,",
80,31,وَفَٰكِهَةٗ وَأَبّٗا,"N’imbuto n’ubwatsi,",
80,32,مَّتَٰعٗا لَّكُمۡ وَلِأَنۡعَٰمِكُمۡ,"Kugira ngo bibagirire akamaro, mwe n’amatungo yanyu.",
80,33,فَإِذَا جَآءَتِ ٱلصَّآخَّةُ,"Ariko ubwo urusaku ruziba amatwi (impanda y’imperuka) ruzaza,",
80,34,يَوۡمَ يَفِرُّ ٱلۡمَرۡءُ مِنۡ أَخِيهِ,"Uwo munsi umuntu azahunga umuvandimwe we,",
80,35,وَأُمِّهِۦ وَأَبِيهِ,"(Ahunge) nyina na se,",
80,36,وَصَٰحِبَتِهِۦ وَبَنِيهِ,"N’umugore we n’abana be,",
80,37,لِكُلِّ ٱمۡرِيٕٖ مِّنۡهُمۡ يَوۡمَئِذٖ شَأۡنٞ يُغۡنِيهِ,"Kuri uwo munsi, buri muntu azaba afite ibimuhangayikishije (bituma atita ku bandi).",
80,38,وُجُوهٞ يَوۡمَئِذٖ مُّسۡفِرَةٞ,"Kuri uwo munsi, uburanga (bw’abemeramana) buzaba bwererana,",
80,39,ضَاحِكَةٞ مُّسۡتَبۡشِرَةٞ,"Bamwenyura, bishimiye inkuru nziza bahawe (y’Ijuru).",
80,40,وَوُجُوهٞ يَوۡمَئِذٍ عَلَيۡهَا غَبَرَةٞ,"Naho uburanga (bw’abahakanyi) kuri uwo munsi buzaba bwuzuye umukungugu,",
80,41,تَرۡهَقُهَا قَتَرَةٌ,Bwarenzwe n’umwijima.,
80,42,أُوْلَٰٓئِكَ هُمُ ٱلۡكَفَرَةُ ٱلۡفَجَرَةُ,Abo ni bo bahakanyi b’inkozi z’ibibi.,
