surah,ayah,arabic_text,translation,footnotes
37,1,وَٱلصَّٰٓفَّٰتِ صَفّٗا,அணி அணியாக அணிவகுப்பவர்கள் (-வானவர்கள்) மீது சத்தியமாக!,
37,2,فَٱلزَّٰجِرَٰتِ زَجۡرٗا,கடுமையாக விரட்டுகின்ற (வான)வர்கள் மீது சத்தியமாக!,
37,3,فَٱلتَّٰلِيَٰتِ ذِكۡرًا,வேதத்தை ஓதுபவர்கள் மீது சத்தியமாக!,
37,4,إِنَّ إِلَٰهَكُمۡ لَوَٰحِدٞ,நிச்சயமாக உங்கள் கடவுள் ஒருவன்தான்.,
37,5,رَّبُّ ٱلسَّمَٰوَٰتِ وَٱلۡأَرۡضِ وَمَا بَيۡنَهُمَا وَرَبُّ ٱلۡمَشَٰرِقِ,"(அவன்தான்) வானங்கள், பூமி, இன்னும் அவை இரண்டுக்கும் இடையில் உள்ளவற்றின் இறைவன் (-அதிபதி) ஆவான். இன்னும் (அவன்) சூரியன் உதிக்கும் இடங்களையும் (அது மறையும் இடங்களையும் அந்த சூரியனையும்) நிர்வகிப்பவன் ஆவான்.",
37,6,إِنَّا زَيَّنَّا ٱلسَّمَآءَ ٱلدُّنۡيَا بِزِينَةٍ ٱلۡكَوَاكِبِ,நிச்சயமாக நாம் கீழுள்ள வானத்தை நட்சத்திரங்களின் அலங்காரத்தால் அலங்கரித்துள்ளோம்.,
37,7,وَحِفۡظٗا مِّن كُلِّ شَيۡطَٰنٖ مَّارِدٖ,"இன்னும், (இறைவனுக்கு) அடங்காத எல்லா ஷைத்தான்களிடமிருந்து பாதுகாப்பதற்காகவும் (நட்சத்திரங்களால் வானத்தை அலங்கரித்தோம்).",
37,8,لَّا يَسَّمَّعُونَ إِلَى ٱلۡمَلَإِ ٱلۡأَعۡلَىٰ وَيُقۡذَفُونَ مِن كُلِّ جَانِبٖ,மிக உயர்ந்த (வானவக்) கூட்டத்தினரின் பக்கம் (அவர்களின் பேச்சை) அவர்களால் செவியுற முடியாது. எல்லா பக்கங்களில் இருந்தும் (அந்த ஷைத்தான்கள் வால் நட்சத்திரங்களால்) எறியப்படுவார்கள்.,
37,9,دُحُورٗاۖ وَلَهُمۡ عَذَابٞ وَاصِبٌ,"(வானத்தை விட்டு) தடுக்கப்படுவதற்காக (அவர்கள் மீது நட்சத்திரங்கள் எறியப்படும்). இன்னும், அவர்களுக்கு (மறுமையில்) நிரந்தரமான தண்டனை உண்டு.",
37,10,إِلَّا مَنۡ خَطِفَ ٱلۡخَطۡفَةَ فَأَتۡبَعَهُۥ شِهَابٞ ثَاقِبٞ,"எனினும், (வானவர்களின் பேச்சை) யார் திருட்டுத்தனமாக திருடுகிறாரோ (கள்ளத்தனமாக ஒட்டுக்கேட்க முயற்சிக்கிறாரோ) எரிக்கின்ற நெருப்புக் கங்கு அவரை பின்தொடர்ந்து (அவரை எரித்து)விடும்.",
37,11,فَٱسۡتَفۡتِهِمۡ أَهُمۡ أَشَدُّ خَلۡقًا أَم مَّنۡ خَلَقۡنَآۚ إِنَّا خَلَقۡنَٰهُم مِّن طِينٖ لَّازِبِۭ,"ஆக, (மறுமையை மறுக்கின்ற) அவர்கள்  படைப்பால் பலமிக்கவர்களா? அல்லது, (வானம் பூமி, வானவர்கள் போன்ற) நமது படைப்புகளா? என்று அவர்களிடம் விளக்கம் கேட்பீராக! நிச்சயமாக நாம் அவர்களை (-மனிதர்களை) பிசுபிசுப்பான (ஒட்டிக்கொள்கின்ற நல்ல) மண்ணிலிருந்து படைத்தோம்.",
37,12,بَلۡ عَجِبۡتَ وَيَسۡخَرُونَ,"அன்றி, (நபியே! இந்த குர்ஆன் உமக்கு கொடுக்கப்பட்டபோது) நீர் ஆச்சரியப்பட்டீர். இன்னும் அவர்கள் (உம்மையும் இந்த வேதத்தையும்) கேலி செய்தனர்.",
37,13,وَإِذَا ذُكِّرُواْ لَا يَذۡكُرُونَ,அவர்களுக்கு அறிவுரை கூறப்பட்டால் அறிவுரை பெறமாட்டார்கள்.,
37,14,وَإِذَا رَأَوۡاْ ءَايَةٗ يَسۡتَسۡخِرُونَ,அவர்கள் (நபியிடம்) ஓர் அத்தாட்சியைப் பார்த்தால் (தாங்களும் அதை) ஏளனம் கேலி செய்(து அதை கேலி செய்யும்படி பிறரிடமும் கூறு)கிறார்கள்.,
37,15,وَقَالُوٓاْ إِنۡ هَٰذَآ إِلَّا سِحۡرٞ مُّبِينٌ,"இன்னும், “தெளிவான சூனியமாகவே தவிர இது இல்லை” என்று கூறுகிறார்கள்.",
37,16,أَءِذَا مِتۡنَا وَكُنَّا تُرَابٗا وَعِظَٰمًا أَءِنَّا لَمَبۡعُوثُونَ,"“நாங்கள் இறந்து, எலும்புகளாகவும், (எங்கள் சதைகள்) மண்ணாகவும் மாறிவிட்டால் நிச்சயமாக நாங்கள் (மீண்டும் உயிர் கொடுக்கப்பட்டு) எழுப்பப்படுவோமா?”",
37,17,أَوَءَابَآؤُنَا ٱلۡأَوَّلُونَ,"“இன்னும், எங்கள் முந்திய முன்னோர்களுமா (எழுப்பப்படுவார்கள்)?” (என்று அவர்கள் கேட்கிறார்கள்.)",
37,18,قُلۡ نَعَمۡ وَأَنتُمۡ دَٰخِرُونَ,"“ஆம், (நீங்கள் அனைவரும் எழுப்பப்படுவீர்கள். அப்போது) நீங்கள் மிகவும் சிறுமைப்பட்டவர்களாக இருப்பீர்கள்” என்று கூறுவீராக!",
37,19,فَإِنَّمَا هِيَ زَجۡرَةٞ وَٰحِدَةٞ فَإِذَا هُمۡ يَنظُرُونَ,"ஆக, (மறுமை நிகழ்வு) அதுவெல்லாம் ஒரே ஒரு பலமான சத்தம்தான். அப்போது அவர்கள் (மறுமையின் காட்சிகளை கண்கூடாகப்) பார்ப்பார்கள்.",
37,20,وَقَالُواْ يَٰوَيۡلَنَا هَٰذَا يَوۡمُ ٱلدِّينِ,"இன்னும், எங்கள் நாசமே! என்று அவர்கள் கூறுவார்கள். (அப்போது அவர்களுக்குக் கூறப்படும்:) “இதுதான் கூலி கொடுக்கப்படும் நாள்.”",
37,21,هَٰذَا يَوۡمُ ٱلۡفَصۡلِ ٱلَّذِي كُنتُم بِهِۦ تُكَذِّبُونَ,“இதுதான் தீர்ப்பு நாள் ஆகும். இதை நீங்கள் பொய்ப்பிப்பவர்களாக இருந்தீர்கள்.”,
37,22,۞ ٱحۡشُرُواْ ٱلَّذِينَ ظَلَمُواْ وَأَزۡوَٰجَهُمۡ وَمَا كَانُواْ يَعۡبُدُونَ,"அநியாயம் செய்தவர்களையும் அவர்களின் இனத்தவர்களையும் (அவர்களைப் பின்பற்றியவர்களையும் அவர்களைப் போன்று நிராகரித்த மற்றவர்களையும்) இன்னும், அவர்கள் வணங்கி வந்தவர்களையும் ஒன்று திரட்டுங்கள்!",
37,23,مِن دُونِ ٱللَّهِ فَٱهۡدُوهُمۡ إِلَىٰ صِرَٰطِ ٱلۡجَحِيمِ,"அல்லாஹ்வை அன்றி (அவர்கள் வணங்கியவர்களை கொண்டுவாருங்கள்)! ஆக, அவர்களுக்கு நரகத்தின் பாதையின் பக்கம் வழிகாட்டுங்கள்.",
37,24,وَقِفُوهُمۡۖ إِنَّهُم مَّسۡـُٔولُونَ,"இன்னும், அவர்களை நிறுத்துங்கள்! நிச்சயமாக அவர்கள் (நிந்திக்கப்படுவதற்காக) விசாரிக்கப்படுவார்கள்.",
37,25,مَا لَكُمۡ لَا تَنَاصَرُونَ,"(இன்னும், அவர்களை நோக்கி நிந்தனையாக கூறப்படும்:) “உங்களுக்கு என்ன நேர்ந்தது நீங்கள் உங்களுக்குள் ஒருவர் மற்றவருக்கு உதவி செய்யாமல் இருக்கிறீர்கள்?”",
37,26,بَلۡ هُمُ ٱلۡيَوۡمَ مُسۡتَسۡلِمُونَ,"மாறாக, அவர்கள் இன்று (அல்லாஹ்வின் கட்டளைக்கு) முற்றிலும் கீழ்ப்படிந்து விடுவார்கள்.",
37,27,وَأَقۡبَلَ بَعۡضُهُمۡ عَلَىٰ بَعۡضٖ يَتَسَآءَلُونَ,"இன்னும், அவர்களில் சிலர், சிலரை முன்னோக்கி (தங்களது இறுதி தங்குமிடத்தைப் பற்றி) விசாரித்துக் கொள்வார்கள்.",
37,28,قَالُوٓاْ إِنَّكُمۡ كُنتُمۡ تَأۡتُونَنَا عَنِ ٱلۡيَمِينِ,(வழிகெட்டவர்கள் தங்களை வழிகெடுத்த தலைவர்களை நோக்கி) கூறுவார்கள்: “நன்மையை விட்டும் (எங்களை) தடுக்க நீங்கள் எங்களிடம் தொடர்ந்து வந்தீர்கள்.”,
37,29,قَالُواْ بَل لَّمۡ تَكُونُواْ مُؤۡمِنِينَ,"(வழிகெடுத்தவர்கள்) கூறுவார்கள்: “(நீங்கள் சொல்வது பொய்!) மாறாக, நீங்கள் நம்பிக்கையாளர்களாக இருக்கவில்லை.”",
37,30,وَمَا كَانَ لَنَا عَلَيۡكُم مِّن سُلۡطَٰنِۭۖ بَلۡ كُنتُمۡ قَوۡمٗا طَٰغِينَ,"“(உங்களை வழிகெடுக்க) எங்களுக்கு உங்கள் மீது எவ்வித அதிகாரமும் இருக்கவில்லை. மாறாக, நீங்கள் அளவு கடந்து பாவம் செய்யும் மக்களாக இருந்தீர்கள்.”",
37,31,فَحَقَّ عَلَيۡنَا قَوۡلُ رَبِّنَآۖ إِنَّا لَذَآئِقُونَ,"“ஆகவே, நம் மீது நமது இறைவனுடைய (தண்டனையின்) வாக்கு உறுதியாகி விட்டது. நிச்சயமாக நாம் (தண்டனையை) சுவைப்பவர்கள்தான்.”",
37,32,فَأَغۡوَيۡنَٰكُمۡ إِنَّا كُنَّا غَٰوِينَ,"“ஆக, நாங்கள் உங்களை வழிகெடுத்தோம். நிச்சயமாக நாங்கள் வழி கெட்டவர்களாகவே இருந்தோம்.”",
37,33,فَإِنَّهُمۡ يَوۡمَئِذٖ فِي ٱلۡعَذَابِ مُشۡتَرِكُونَ,"ஆக, நிச்சயமாக அவர்கள் (வழிகெடுத்தவர்களும் வழிகெட்டவர்களும்) அந்நாளில் தண்டனையில் (ஒன்றாக) கூட்டாகிவிடுவார்கள்.",
37,34,إِنَّا كَذَٰلِكَ نَفۡعَلُ بِٱلۡمُجۡرِمِينَ,நிச்சயமாக நாம் இப்படித்தான் குற்றவாளிகளுடன் நடந்து கொள்வோம்.,
37,35,إِنَّهُمۡ كَانُوٓاْ إِذَا قِيلَ لَهُمۡ لَآ إِلَٰهَ إِلَّا ٱللَّهُ يَسۡتَكۡبِرُونَ,“அல்லாஹ்வைத் தவிர (உண்மையில் வணங்கத்தகுதியான) இறைவன் அறவே இல்லை” என்று அவர்களுக்கு கூறப்பட்டால் நிச்சயமாக அவர்கள் (அதை ஏற்றுக் கொள்ளாமல்) பெருமை அடி(த்து புறக்கணி)ப்பவர்களாக இருந்தனர்.,
37,36,وَيَقُولُونَ أَئِنَّا لَتَارِكُوٓاْ ءَالِهَتِنَا لِشَاعِرٖ مَّجۡنُونِۭ,"இன்னும், “பைத்தியக்காரரான ஒரு கவிஞருக்காக எங்கள் தெய்வங்களை நிச்சயமாக நாங்கள் விட்டுவிடுவோமா?” என்று அவர்கள் கூறுகிறார்கள்.",
37,37,بَلۡ جَآءَ بِٱلۡحَقِّ وَصَدَّقَ ٱلۡمُرۡسَلِينَ,"(அவர்கள் கூறுவது போன்றல்ல.) மாறாக, அவர் சத்தியத்தைக் கொண்டு வந்தார். இன்னும், (முன்னர் வந்த) தூதர்களை உண்மைப்படுத்தினார்.",
37,38,إِنَّكُمۡ لَذَآئِقُواْ ٱلۡعَذَابِ ٱلۡأَلِيمِ,(இணைவைப்பாளர்களே!) நிச்சயமாக நீங்கள் துன்புறுத்தும் தண்டனையை சுவைப்பீர்கள்.,
37,39,وَمَا تُجۡزَوۡنَ إِلَّا مَا كُنتُمۡ تَعۡمَلُونَ,நீங்கள் எதை செய்துகொண்டிருந்தீர்களோ அதற்கே தவிர நீங்கள் கூலி கொடுக்கப்படமாட்டீர்கள்.,
37,40,إِلَّا عِبَادَ ٱللَّهِ ٱلۡمُخۡلَصِينَ,அல்லாஹ்வின் பரிசுத்தமான அடியார்களைத் தவிர. (அவர்கள் தண்டனையை விட்டும் பாதுகாக்கப்படுவார்கள்.),
37,41,أُوْلَٰٓئِكَ لَهُمۡ رِزۡقٞ مَّعۡلُومٞ,(ருசியும் மணமும்) அறியப்பட்ட (சிறப்பான) உணவு அவர்களுக்கு உண்டு.,
37,42,فَوَٰكِهُ وَهُم مُّكۡرَمُونَ,"பழங்கள் (அவர்களுக்கு உண்டு). இன்னும், அவர்கள் (சொர்க்கத்தில் பலவிதமான சிறப்புகளைக் கொண்டு) கண்ணியப்படுத்தப்படுவார்கள்.",
37,43,فِي جَنَّٰتِ ٱلنَّعِيمِ,இன்பமிகு சொர்க்கங்களில் (இருப்பார்கள்).,
37,44,عَلَىٰ سُرُرٖ مُّتَقَٰبِلِينَ,கட்டில்கள் மீது ஒருவரை ஒருவர் நேருக்கு நேர் பார்த்தவர்களாக இருப்பார்கள்.,
37,45,يُطَافُ عَلَيۡهِم بِكَأۡسٖ مِّن مَّعِينِۭ,மதுரமான தெளிவான நீரைப் போன்ற மதுவினால் நிரம்பிய கிண்ணங்களுடன் அவர்களை சுற்றிவரப்படும்.,
37,46,بَيۡضَآءَ لَذَّةٖ لِّلشَّٰرِبِينَ,அந்த மது வெண்மையாக அருந்துபவர்களுக்கு மிக இன்பமானதாக இருக்கும்.,
37,47,لَا فِيهَا غَوۡلٞ وَلَا هُمۡ عَنۡهَا يُنزَفُونَ,"அதில் (அறிவைப் போக்கக்கூடிய) போதையும் இருக்காது (தலைவலி, வயிற்று வலி இருக்காது.) இன்னும், அவர்கள் அதனால் மயக்கமுற மாட்டார்கள்.",
37,48,وَعِندَهُمۡ قَٰصِرَٰتُ ٱلطَّرۡفِ عِينٞ,பார்வைகளை தாழ்த்திய கண்ணழகிகள் அவர்களிடம் இருப்பார்கள்.,
37,49,كَأَنَّهُنَّ بَيۡضٞ مَّكۡنُونٞ,அவர்கள் பாதுகாக்கப்பட்ட (-மறைக்கப்பட்ட தீக்கோழியின்) முட்டையைப் போன்று (-அதன் நிறத்தில்) இருப்பார்கள்.,
37,50,فَأَقۡبَلَ بَعۡضُهُمۡ عَلَىٰ بَعۡضٖ يَتَسَآءَلُونَ,"ஆக, அவர்களில் சிலர் சிலரை முன்னோக்கி (நரகவாசிகளைப் பற்றி) விசாரிப்பார்கள்.",
37,51,قَالَ قَآئِلٞ مِّنۡهُمۡ إِنِّي كَانَ لِي قَرِينٞ,“நிச்சயமாக எனக்கு ஒரு நண்பன் இருந்தான்” என்று அவர்களில் பேசிய ஒருவர் கூறுவார்.,
37,52,يَقُولُ أَءِنَّكَ لَمِنَ ٱلۡمُصَدِّقِينَ,“நிச்சயமாக நீ (தூதர்களை) உண்மைப்படுத்துபவர்களில் உள்ளவனா?” என்று (உலகில் வாழும்போது என்னிடம்) கூறுவான்.,
37,53,أَءِذَا مِتۡنَا وَكُنَّا تُرَابٗا وَعِظَٰمًا أَءِنَّا لَمَدِينُونَ,"“நாம் இறந்துவிட்டால் (பின்னர்) எலும்புகளாகவும் மண்ணாகவும் மாறி விட்டால், நிச்சயமாக நாம் (நமது செயல்களுக்கு) கூலி கொடுக்கப்படு(வதற்காக எழுப்பப்படு)வோமா?” (என்றும் அவன் கூறுவான்)",
37,54,قَالَ هَلۡ أَنتُم مُّطَّلِعُونَ,(அந்த நம்பிக்கையாளர்) கூறுவார்: “(நரகத்தில் உள்ளவர்களை) நீங்கள் எட்டிப்பார்க்க முடியுமா?” என்று கூறுவார்.,
37,55,فَٱطَّلَعَ فَرَءَاهُ فِي سَوَآءِ ٱلۡجَحِيمِ,"ஆக, (அந்த நம்பிக்கையாளர் நரகத்தில்) எட்டிப்பார்ப்பார். அவர் அவனை நரகத்தின் நடுவில் பார்ப்பார்.",
37,56,قَالَ تَٱللَّهِ إِن كِدتَّ لَتُرۡدِينِ,(அந்த நம்பிக்கையாளர்) கூறுவார்: “அல்லாஹ்வின் மீது ஆணையாக நிச்சயமாக நீ என்னை (வழிகேட்டில் தள்ளி) நாசமாக்கி இருப்பாய்.”,
37,57,وَلَوۡلَا نِعۡمَةُ رَبِّي لَكُنتُ مِنَ ٱلۡمُحۡضَرِينَ,“என் இறைவனின் (நேர்வழி எனும்) அருட்கொடை (என்னுடன்) இல்லாதிருந்தால் நானும் (நரகத்தில் தண்டனைக்காக) கொண்டுவரப்பட்டவர்களில் ஆகி இருப்பேன்.”,
37,58,أَفَمَا نَحۡنُ بِمَيِّتِينَ,"“ஆக, (இந்த சொர்க்க வாழ்க்கையில்) நாங்கள் மரணிப்பவர்களாக இல்லையே!”",
37,59,إِلَّا مَوۡتَتَنَا ٱلۡأُولَىٰ وَمَا نَحۡنُ بِمُعَذَّبِينَ,“எங்கள் முதல் மரணத்தைத் தவிர (வேறு மரணம் எங்களுக்கு இல்லை). இன்னும் நாங்கள் தண்டனை செய்யப்படுபவர்களாக இல்லை.”,
37,60,إِنَّ هَٰذَا لَهُوَ ٱلۡفَوۡزُ ٱلۡعَظِيمُ,நிச்சயமாக இதுதான் மகத்தான வெற்றியாகும்.,
37,61,لِمِثۡلِ هَٰذَا فَلۡيَعۡمَلِ ٱلۡعَٰمِلُونَ,(உலக வாழ்க்கையில்) அமல் செய்பவர்கள் இது போன்ற (சொர்க்க பாக்கியத்தை மறுமையில் அடைவ)தற்காக அமல் செய்யட்டும்.,
37,62,أَذَٰلِكَ خَيۡرٞ نُّزُلًا أَمۡ شَجَرَةُ ٱلزَّقُّومِ,"அது (-மேற்கூறப்பட்ட சொர்க்க இன்பங்கள் இறைவனின்) விருந்தோம்பலால் மிகச் சிறந்ததா? அல்லது, ஸக்கூம் என்ற கள்ளி மரமா?",
37,63,إِنَّا جَعَلۡنَٰهَا فِتۡنَةٗ لِّلظَّٰلِمِينَ,நிச்சயமாக நாம் அதை இணைவைப்பவர்களுக்கு ஒரு சோதனையாக (தண்டனையாக) ஆக்கி இருக்கிறோம்.,
37,64,إِنَّهَا شَجَرَةٞ تَخۡرُجُ فِيٓ أَصۡلِ ٱلۡجَحِيمِ,நிச்சயமாக அது நரகத்தின் அடியில் முளைக்கின்ற ஒரு மரமாகும்.,
37,65,طَلۡعُهَا كَأَنَّهُۥ رُءُوسُ ٱلشَّيَٰطِينِ,அதன் கனிகள் ஷைத்தான்களின் தலைகளைப் போல் (மிக விகாரமாக) இருக்கும்.,
37,66,فَإِنَّهُمۡ لَأٓكِلُونَ مِنۡهَا فَمَالِـُٔونَ مِنۡهَا ٱلۡبُطُونَ,"ஆக, நிச்சயமாக அவர்கள் அதிலிருந்து சாப்பிடுவார்கள். இன்னும், அதிலிருந்து (தங்கள்) வயிறுகளை நிரப்புவார்கள்.",
37,67,ثُمَّ إِنَّ لَهُمۡ عَلَيۡهَا لَشَوۡبٗا مِّنۡ حَمِيمٖ,"பிறகு, நிச்சயமாக அவர்களுக்கு அதற்கு மேல் கொதி நீர் கலக்கப்பட்ட (அருவருக்கத்தக்க) பானமும் உண்டு.",
37,68,ثُمَّ إِنَّ مَرۡجِعَهُمۡ لَإِلَى ٱلۡجَحِيمِ,"பிறகு, நிச்சயமாக அவர்களின் மீளுமிடம் நரக நெருப்பின் பக்கம்தான் இருக்கும்.",
