surah,ayah,arabic_text,translation,footnotes
37,69,إِنَّهُمۡ أَلۡفَوۡاْ ءَابَآءَهُمۡ ضَآلِّينَ,நிச்சயமாக இ(ந்த இணைவைப்ப)வர்கள் தங்கள் மூதாதைகளை வழிகெட்டவர்களாக பெற்றார்கள்.,
37,70,فَهُمۡ عَلَىٰٓ ءَاثَٰرِهِمۡ يُهۡرَعُونَ,"ஆக, அவர்களின் அடிச்சுவடுகளில் (கண்மூடித்தனமாக அவர்களை பின்பற்றுவதற்கு) இவர்கள் விரைகிறார்கள்.",
37,71,وَلَقَدۡ ضَلَّ قَبۡلَهُمۡ أَكۡثَرُ ٱلۡأَوَّلِينَ,இவர்களுக்கு முன் முன்னோரில் அதிகமானவர்கள் திட்டவட்டமாக வழி கெட்டுள்ளனர்.,
37,72,وَلَقَدۡ أَرۡسَلۡنَا فِيهِم مُّنذِرِينَ,திட்டவட்டமாக அவர்களில் அச்சமூட்டி எச்சரிப்பவர்க(ளாகிய நமது தூதர்)ளை நாம் அனுப்பினோம்.,
37,73,فَٱنظُرۡ كَيۡفَ كَانَ عَٰقِبَةُ ٱلۡمُنذَرِينَ,"ஆகவே, எச்சரிக்கப்பட்டவர்களின் முடிவு எப்படி இருந்தது என்று (நபியே) நீர் பார்ப்பீராக!",
37,74,إِلَّا عِبَادَ ٱللَّهِ ٱلۡمُخۡلَصِينَ,"எனினும், அல்லாஹ்வின் பரிசுத்தமான அடியார்கள் (தண்டனையில் இருந்து) பாதுகாக்கப்படுவார்கள்.",
37,75,وَلَقَدۡ نَادَىٰنَا نُوحٞ فَلَنِعۡمَ ٱلۡمُجِيبُونَ,"திட்டவட்டமாக (நபி) நூஹ் நம்மை அழைத்தார். ஆக, பதில் தருபவர்களில் நாம் மிகச் சிறந்தவர்கள்.",
37,76,وَنَجَّيۡنَٰهُ وَأَهۡلَهُۥ مِنَ ٱلۡكَرۡبِ ٱلۡعَظِيمِ,"இன்னும், மிகப் பெரிய துக்கத்தில் இருந்து அவரையும் அவரது குடும்பத்தாரையும் பாதுகாத்தோம்.",
37,77,وَجَعَلۡنَا ذُرِّيَّتَهُۥ هُمُ ٱلۡبَاقِينَ,"இன்னும், அவரது சந்ததிகளைத்தான் (உலகில்) மீதமானவர்களாக நாம் ஆக்கினோம்.",
37,78,وَتَرَكۡنَا عَلَيۡهِ فِي ٱلۡأٓخِرِينَ,"இன்னும், பிற்காலத்தில் வருபவர்களில் அவரைப் பற்றிய நற்பெயரை நாம் ஏற்படுத்தினோம்.",
37,79,سَلَٰمٌ عَلَىٰ نُوحٖ فِي ٱلۡعَٰلَمِينَ,உலகத்தார்களில் (யாரும் அவரை பழித்துப் பேசாதவாறு) நூஹுக்கு ஸலாம் உண்டாகட்டும்.,
37,80,إِنَّا كَذَٰلِكَ نَجۡزِي ٱلۡمُحۡسِنِينَ,நிச்சயமாக நாம் இவ்வாறுதான் நல்லவர்களுக்கு கூலி கொடுப்போம்.,
37,81,إِنَّهُۥ مِنۡ عِبَادِنَا ٱلۡمُؤۡمِنِينَ,நிச்சயமாக அவர் நம்பிக்கையாளர்களான நமது அடியார்களில் உள்ளவர் ஆவார்.,
37,82,ثُمَّ أَغۡرَقۡنَا ٱلۡأٓخَرِينَ,"பிறகு, மற்றவர்களை நாம் மூழ்கடித்தோம்.",
37,83,۞ وَإِنَّ مِن شِيعَتِهِۦ لَإِبۡرَٰهِيمَ,நிச்சயமாக அவரது கொள்கையை சேர்ந்தவர்களில் உள்ளவர்தான் இப்ராஹீம்.,
37,84,إِذۡ جَآءَ رَبَّهُۥ بِقَلۡبٖ سَلِيمٍ,அவர் தனது இறைவனிடம் ஈடேற்றம் பெற்ற உள்ளத்துடன் வந்த சமயத்தை நினைவு கூர்வீராக!,
37,85,إِذۡ قَالَ لِأَبِيهِ وَقَوۡمِهِۦ مَاذَا تَعۡبُدُونَ,"தனது தந்தை இன்னும் தனது மக்களை நோக்கி, எதை நீங்கள் வணங்குகிறீர்கள் என்று அவர் கூறிய சமயத்தை நினைவு கூர்வீராக!",
37,86,أَئِفۡكًا ءَالِهَةٗ دُونَ ٱللَّهِ تُرِيدُونَ,அல்லாஹ்வை அன்றி பல பொய்யான தெய்வங்களையா (உங்கள் தேவைகளுக்கும் வழிபாடுகளுக்கும்) நீங்கள் நாடுகிறீர்கள்?,
37,87,فَمَا ظَنُّكُم بِرَبِّ ٱلۡعَٰلَمِينَ,"ஆக, அகிலங்களின் இறைவனைப் பற்றி உங்கள் எண்ணம் என்ன? (அவன் ஒருவனை மட்டும் வணங்காமல் ஏன் கற்பனையாக பல தெய்வங்களை உருவாக்கினீர்கள்?)",
37,88,فَنَظَرَ نَظۡرَةٗ فِي ٱلنُّجُومِ,"ஆக, அவர் நட்சத்திரங்களின் பக்கம் ஒரு பார்வை பார்த்தார்.",
37,89,فَقَالَ إِنِّي سَقِيمٞ,"தொடர்ந்து அவர் கூறினார், “நிச்சயமாக நான் ஒரு நோயாளி ஆவேன்”.",
37,90,فَتَوَلَّوۡاْ عَنۡهُ مُدۡبِرِينَ,"ஆகவே, அவர்கள் முகம் திரும்பியவர்களாக அவரை விட்டு விலகிச் சென்றனர்.",
37,91,فَرَاغَ إِلَىٰٓ ءَالِهَتِهِمۡ فَقَالَ أَلَا تَأۡكُلُونَ,"ஆக, அவர்களின் தெய்வங்கள் பக்கம் (இப்ராஹீம்) விரைந்தார். ஆக, அவர் (அந்த சிலைகளை நோக்கி) கூறினார்: “நீங்கள் சாப்பிட மாட்டீர்களா?”",
37,92,مَا لَكُمۡ لَا تَنطِقُونَ,“உங்களுக்கு என்ன ஏற்பட்டது? நீங்கள் ஏன் பேசுவதில்லை?”,
37,93,فَرَاغَ عَلَيۡهِمۡ ضَرۡبَۢا بِٱلۡيَمِينِ,"ஆக, வலக்கரத்தால் அவற்றை அடி(த்து உடை)ப்பதற்காக அவற்றின் மீது பாய்ந்தார்.",
37,94,فَأَقۡبَلُوٓاْ إِلَيۡهِ يَزِفُّونَ,"ஆக, அவர்கள் விரைந்தவர்களாக அவர் பக்கம் முன்னோக்கி வந்தனர்.",
37,95,قَالَ أَتَعۡبُدُونَ مَا تَنۡحِتُونَ,அவர் கூறினார்: “நீங்கள் (கற்களிலும் கட்டைகளிலும்) எதை செதுக்கி உருவாக்குகிறீர்களோ அதை வணங்குகிறீர்களா?”,
37,96,وَٱللَّهُ خَلَقَكُمۡ وَمَا تَعۡمَلُونَ,“அல்லாஹ்தான் உங்களையும் உங்கள் செயல்களையும் படைக்கிறான்.”,
37,97,قَالُواْ ٱبۡنُواْ لَهُۥ بُنۡيَٰنٗا فَأَلۡقُوهُ فِي ٱلۡجَحِيمِ,"அவர்கள் கூறினார்கள்: “அவருக்கு ஒரு கட்டடத்தைக் கட்டுங்கள். (அதில் விறகுகளை போட்டு நெருப்பு எரியுங்கள்!) ஆக, அந்த எரியும் நெருப்பில் அவரை எறிந்து விடுங்கள்!”",
37,98,فَأَرَادُواْ بِهِۦ كَيۡدٗا فَجَعَلۡنَٰهُمُ ٱلۡأَسۡفَلِينَ,"ஆக, அவர்கள் அவருக்கு ஒரு சூழ்ச்சியை நாடினர். ஆக, நாம் அவர்களைத்தான் மிகத் தாழ்ந்தவர்களாக ஆக்கினோம்.",
37,99,وَقَالَ إِنِّي ذَاهِبٌ إِلَىٰ رَبِّي سَيَهۡدِينِ,"இன்னும், அவர் கூறினார்: “நிச்சயமாக நான் என் இறைவனின் பக்கம் செல்கிறேன். அவன் எனக்கு நேர்வழி காட்டுவான்.”",
37,100,رَبِّ هَبۡ لِي مِنَ ٱلصَّٰلِحِينَ,“என் இறைவா! எனக்கு நல்லவர்களில் ஒருவராக இருக்கும் ஒரு குழந்தையைத் தா!”,
37,101,فَبَشَّرۡنَٰهُ بِغُلَٰمٍ حَلِيمٖ,"ஆகவே, மிக சகிப்பாளரான ஒரு குழந்தையைக் கொண்டு நாம் அவருக்கு நற்செய்தி கூறினோம்.",
37,102,فَلَمَّا بَلَغَ مَعَهُ ٱلسَّعۡيَ قَالَ يَٰبُنَيَّ إِنِّيٓ أَرَىٰ فِي ٱلۡمَنَامِ أَنِّيٓ أَذۡبَحُكَ فَٱنظُرۡ مَاذَا تَرَىٰۚ قَالَ يَٰٓأَبَتِ ٱفۡعَلۡ مَا تُؤۡمَرُۖ سَتَجِدُنِيٓ إِن شَآءَ ٱللَّهُ مِنَ ٱلصَّٰبِرِينَ,"ஆக, (அந்த குழந்தை) அவருடன் உழைக்கின்ற பருவத்தை அடைந்தபோது அவர் கூறினார்: “என் மகனே! நிச்சயமாக நான் உன்னை பலியிடுவதாக கனவில் பார்க்கிறேன். ஆகவே, நீ என்ன கருதுகிறாய் என்று நீ யோசி(த்து சொல்)!” (மகனார்) கூறினார்: “என் தந்தையே! உமக்கு எது ஏவப்படுகிறதோ அதை நீர் நிறைவேற்றுவீராக! இன் ஷா அல்லாஹ் (-அல்லாஹ் நாடினால் அல்லாஹ்வின் தீர்ப்பின் மீது) பொறுமையாக இருப்பவர்களில் ஒருவராக என்னை நீர் காண்பீர்.”",
37,103,فَلَمَّآ أَسۡلَمَا وَتَلَّهُۥ لِلۡجَبِينِ,"ஆக, அப்போது அவர்கள் இருவரும் (இறைவனின் கட்டளைக்கு) முற்றிலும் பணிந்தனர். அவர் அவரை (அவருடைய) கன்னத்தின் மீது கீழே சாய்த்தார்.",
37,104,وَنَٰدَيۡنَٰهُ أَن يَٰٓإِبۡرَٰهِيمُ,"இன்னும், “இப்ராஹீமே!” என்று நாம் அவரை அழைத்தோம்.",
37,105,قَدۡ صَدَّقۡتَ ٱلرُّءۡيَآۚ إِنَّا كَذَٰلِكَ نَجۡزِي ٱلۡمُحۡسِنِينَ,“திட்டமாக நீர் கனவை உண்மைப்படுத்தினீர். நிச்சயமாக நாம் நல்லவர்களுக்கு இவ்வாறுதான் கூலி கொடுப்போம்.”,
37,106,إِنَّ هَٰذَا لَهُوَ ٱلۡبَلَٰٓؤُاْ ٱلۡمُبِينُ,நிச்சயமாக இதுதான் தெளிவான சோதனையாகும்.,
37,107,وَفَدَيۡنَٰهُ بِذِبۡحٍ عَظِيمٖ,"இன்னும், மகத்தான ஒரு பலிப்பிராணியைக் கொண்டு அவரை விடுதலை செய்தோம்.",
37,108,وَتَرَكۡنَا عَلَيۡهِ فِي ٱلۡأٓخِرِينَ,"இன்னும், பின்னோரில் அவரைப் பற்றி அழகிய பெயரை ஏற்படுத்தினோம்.",
37,109,سَلَٰمٌ عَلَىٰٓ إِبۡرَٰهِيمَ,இப்ராஹீமுக்கு ஸலாம் உண்டாகட்டும்.,
37,110,كَذَٰلِكَ نَجۡزِي ٱلۡمُحۡسِنِينَ,இப்படித்தான் நல்லவர்களுக்கு நாம் கூலி கொடுப்போம்.,
37,111,إِنَّهُۥ مِنۡ عِبَادِنَا ٱلۡمُؤۡمِنِينَ,நிச்சயமாக அவர் நம்பிக்கையாளர்களான நமது அடியார்களில் உள்ளவர்.,
37,112,وَبَشَّرۡنَٰهُ بِإِسۡحَٰقَ نَبِيّٗا مِّنَ ٱلصَّٰلِحِينَ,"இன்னும், நல்லவர்களில் ஒருவராகவும் நபியாகவும் இருக்கப்போகின்ற இஸ்ஹாக்கைக் கொண்டு நாம் அவருக்கு நற்செய்தி கூறினோம்.",
37,113,وَبَٰرَكۡنَا عَلَيۡهِ وَعَلَىٰٓ إِسۡحَٰقَۚ وَمِن ذُرِّيَّتِهِمَا مُحۡسِنٞ وَظَالِمٞ لِّنَفۡسِهِۦ مُبِينٞ,"அவருக்கும் இஸ்ஹாக்கிற்கும் அருள் வளம் புரிந்தோம். இன்னும், அவ்விருவரின் சந்ததியில் நல்லவரும் இருக்கிறார். தனக்கு தெளிவாக தீங்கிழைத்தவரும் இருக்கிறார்.",
37,114,وَلَقَدۡ مَنَنَّا عَلَىٰ مُوسَىٰ وَهَٰرُونَ,திட்டவட்டமாக மூஸாவிற்கும் ஹாரூனுக்கும் அருள்புரிந்தோம்.,
37,115,وَنَجَّيۡنَٰهُمَا وَقَوۡمَهُمَا مِنَ ٱلۡكَرۡبِ ٱلۡعَظِيمِ,அவ்விருவரையும் அவ்விருவரின் மக்களையும் பெரிய துக்கத்தில் இருந்து பாதுகாத்தோம்.,
37,116,وَنَصَرۡنَٰهُمۡ فَكَانُواْ هُمُ ٱلۡغَٰلِبِينَ,"இன்னும், அவர்களுக்கு உதவினோம். ஆகவே, அவர்கள்தான் வெற்றியாளர்களாக ஆகிவிட்டார்கள்.",
37,117,وَءَاتَيۡنَٰهُمَا ٱلۡكِتَٰبَ ٱلۡمُسۡتَبِينَ,"இன்னும், அவ்விருவருக்கும் தெளிவான வேதத்தை கொடுத்தோம்.",
37,118,وَهَدَيۡنَٰهُمَا ٱلصِّرَٰطَ ٱلۡمُسۡتَقِيمَ,"இன்னும், அவ்விருவரையும் நேரான பாதையில் நேர்வழி நடத்தினோம்.",
37,119,وَتَرَكۡنَا عَلَيۡهِمَا فِي ٱلۡأٓخِرِينَ,"இன்னும், பிற்காலத்தில் வருவோரில் அவ்விருவருக்கும் நற்பெயரை ஏற்படுத்தினோம்.",
37,120,سَلَٰمٌ عَلَىٰ مُوسَىٰ وَهَٰرُونَ,மூஸாவிற்கும் ஹாரூனுக்கும் ஸலாம் உண்டாகட்டும்.,
37,121,إِنَّا كَذَٰلِكَ نَجۡزِي ٱلۡمُحۡسِنِينَ,நிச்சயமாக நாம் நல்லவர்களுக்கு இவ்வாறுதான் கூலி கொடுப்போம்.,
37,122,إِنَّهُمَا مِنۡ عِبَادِنَا ٱلۡمُؤۡمِنِينَ,நிச்சயமாக அவ்விருவரும் நம்பிக்கையாளர்களான நமது அடியார்களில் உள்ளவர்கள்.,
37,123,وَإِنَّ إِلۡيَاسَ لَمِنَ ٱلۡمُرۡسَلِينَ,நிச்சயமாக இல்யாஸ் (நமது) தூதர்களில் உள்ளவர்.,
37,124,إِذۡ قَالَ لِقَوۡمِهِۦٓ أَلَا تَتَّقُونَ,"அவர் தனது மக்களுக்கு, “நீங்கள் (அல்லாஹ்வை) அஞ்ச மாட்டீர்களா?” என்று கூறிய சமயத்தை நினைவு கூர்வீராக!",
37,125,أَتَدۡعُونَ بَعۡلٗا وَتَذَرُونَ أَحۡسَنَ ٱلۡخَٰلِقِينَ,‘பஅல்’ சிலையை நீங்கள் வணங்குகிறீர்களா? மிக அழகிய படைப்பாளனை (வணங்குவதை) விட்டுவிடுகிறீர்களா?,
37,126,ٱللَّهَ رَبَّكُمۡ وَرَبَّ ءَابَآئِكُمُ ٱلۡأَوَّلِينَ,"உங்கள் இறைவனான, இன்னும் முன்னோர்களான உங்கள் மூதாதைகளின் இறைவனுமான அல்லாஹ்வை (வணங்குவதை) விட்டுவிடுகிறீர்களா?",
37,127,فَكَذَّبُوهُ فَإِنَّهُمۡ لَمُحۡضَرُونَ,"ஆக, அவர்கள் அவரை பொய்ப்பித்தனர். ஆகவே, நிச்சயமாக அவர்கள் (நரகத்தில் தண்டனை அனுபவிக்க) கொண்டுவரப்படுவார்கள்.",
37,128,إِلَّا عِبَادَ ٱللَّهِ ٱلۡمُخۡلَصِينَ,"(எனினும்,) அல்லாஹ்வின் பரிசுத்தமான (இணைவைக்காத) அடியார்களைத் தவிர. (அவர்கள் தண்டனையிலிருந்து பாதுகாக்கப்படுவார்கள்).",
37,129,وَتَرَكۡنَا عَلَيۡهِ فِي ٱلۡأٓخِرِينَ,"இன்னும், பிற்காலத்தில் வருவோரில் அவருக்கு நற்பெயரை ஏற்படுத்தினோம்.",
37,130,سَلَٰمٌ عَلَىٰٓ إِلۡ يَاسِينَ,இல்யாஸுக்கு(ம் அவரது மக்களில் அவரை பின்பற்றியவர்களுக்கும்) ஸலாம் உண்டாகட்டும்.,
37,131,إِنَّا كَذَٰلِكَ نَجۡزِي ٱلۡمُحۡسِنِينَ,நிச்சயமாக நல்லவர்களுக்கு நாம் இப்படித்தான் கூலி கொடுப்போம்.,
37,132,إِنَّهُۥ مِنۡ عِبَادِنَا ٱلۡمُؤۡمِنِينَ,நிச்சயமாக அவர் நம்பிக்கையாளர்களான நமது அடியார்களில் உள்ளவர்.,
37,133,وَإِنَّ لُوطٗا لَّمِنَ ٱلۡمُرۡسَلِينَ,"நிச்சயமாக லூத், (நமது) தூதர்களில் ஒருவர்தான்.",
37,134,إِذۡ نَجَّيۡنَٰهُ وَأَهۡلَهُۥٓ أَجۡمَعِينَ,அவரையும் அவரது குடும்பத்தார் அனைவரையும் நாம் காப்பாற்றிய சமயத்தை நினைவு கூர்வீராக!,
37,135,إِلَّا عَجُوزٗا فِي ٱلۡغَٰبِرِينَ,(தண்டனையில்) தங்கி விடுபவர்களில் (ஒருவராக இருந்த அவரது குடும்பத்தைச் சேர்ந்த) ஒரு மூதாட்டியைத் தவிர.,
37,136,ثُمَّ دَمَّرۡنَا ٱلۡأٓخَرِينَ,"(அவரையும் முஃமின்களையும் பாதுகாத்த) பிறகு, மற்றவர்களை நாம் அழித்தோம்.",
37,137,وَإِنَّكُمۡ لَتَمُرُّونَ عَلَيۡهِم مُّصۡبِحِينَ,"இன்னும், நிச்சயமாக நீங்கள் காலையில் அவர்களை கடந்து செல்கிறீர்கள்.",
37,138,وَبِٱلَّيۡلِۚ أَفَلَا تَعۡقِلُونَ,இரவிலும் (அவர்களை கடந்து செல்கிறீர்கள்). (நபியை நிராகரிப்பவர்களே!) நீங்கள் (இந்த வரலாறுகளை) சிந்தித்து புரியமாட்டீர்களா?,
37,139,وَإِنَّ يُونُسَ لَمِنَ ٱلۡمُرۡسَلِينَ,"நிச்சயமாக யூனுஸ், (நமது) தூதர்களில் உள்ளவர்தான்.",
37,140,إِذۡ أَبَقَ إِلَى ٱلۡفُلۡكِ ٱلۡمَشۡحُونِ,(பொருள்களால்) நிரம்பிய கப்பலை நோக்கி அவர் ஓடிய சமயத்தை நினைவு கூர்வீராக!,
37,141,فَسَاهَمَ فَكَانَ مِنَ ٱلۡمُدۡحَضِينَ,"ஆக, (அவர் சென்ற கப்பல் நின்றுவிடவே) அவர் சீட்டு குலுக்கிப் போட்டார். ஆக, குலுக்கலில் பெயர் எடுக்கப்பட்டவர்களில் அவர் ஆகிவிட்டார். (அவரது பெயர் எழுதப்பட்ட சீட்டு வந்தது.)",
37,142,فَٱلۡتَقَمَهُ ٱلۡحُوتُ وَهُوَ مُلِيمٞ,"ஆக, (அவர் தன்னை கடலில் எறியவே) அவரை திமிங்கலம் விழுங்கியது. அவர் (தனது இறைவனின் கட்டளை இன்றி கடலுக்கு சென்றதால்) பழிப்புக்குரிய செயலை செய்தவர் ஆவார்.",
37,143,فَلَوۡلَآ أَنَّهُۥ كَانَ مِنَ ٱلۡمُسَبِّحِينَ,"ஆக, நிச்சயமாக அவர் அல்லாஹ்வை அதிகம் (தொழுது) துதிப்பவர்களில் இருந்திருக்கவில்லை என்றால்,",
37,144,لَلَبِثَ فِي بَطۡنِهِۦٓ إِلَىٰ يَوۡمِ يُبۡعَثُونَ,அதனுடைய வயிற்றில் (மக்கள் மறுமையில்) எழுப்பப்படுகின்ற நாள் வரை தங்கி இருந்திருப்பார்.,
37,145,۞ فَنَبَذۡنَٰهُ بِٱلۡعَرَآءِ وَهُوَ سَقِيمٞ,"ஆக, (அருகிலிருந்த) பெருவெளியில் அவரை எறிந்தோம். அவர் நோயுற்றவராக இருந்தார்.",
37,146,وَأَنۢبَتۡنَا عَلَيۡهِ شَجَرَةٗ مِّن يَقۡطِينٖ,"இன்னும், அவருக்கு அருகில் ஒரு சுரைக்காய் செடியை முளைக்க வைத்தோம்.",
37,147,وَأَرۡسَلۡنَٰهُ إِلَىٰ مِاْئَةِ أَلۡفٍ أَوۡ يَزِيدُونَ,"இன்னும், ஒரு இலட்சம் அல்லது அதை விட அதிகமானவர்களுக்கு (தூதராக) அவரை அனுப்பினோம்.",
37,148,فَـَٔامَنُواْ فَمَتَّعۡنَٰهُمۡ إِلَىٰ حِينٖ,"ஆக, அவர்கள் நம்பிக்கை கொண்டனர். ஆகவே, நாம் அவர்களுக்கு ஒரு காலம் வரை சுகமளித்தோம்.",
